ID,id,article_title,article_language,journal_title,jounral_abbreviation,journal_issn,article_jvolumn,article_jissue,article_jcreated_at,article_pagination,author_list
710,265969.0,osteoarthritis of the thumb carpometacarpal joint in women and occupational risk factors: a ca$se-control study,eng,j hand surg am,the journal of hand surgery,0363-5023,32.0,4.0,1/7/01,459-65,{j. m. clai??ses. neelp. catilinal. fontana#s. ughetto}
711,820508.0,a comparative outcome study of body awareness therapy feldenkrais and conventional physiotherapy for patients with nonspecific musculoskeletal disorders: changes in psychological symptoms pain and self-image,english,physiotherapy theory and practice,physiother. theory pract.,09593985 (issn),17.0,2.0,1/1/01,77-95,{e.-b. malmgren-olssonk. armeliusb.-. armelius}
712,446026.0,use of implantable cardioverter-defibrillators for primary prevention in older patients: a systematic literature review and meta-analysis.,4.936392422017943,3.555387623201737,4.240067506736971,4.030052022391779,0.0,0.0,1/1/98,4.884338177331462,{null}
713,84941.0,incidence of and risk factors for motor neurone disease in uk women: a prospective study.,eng,bmc neurology,bmc neurol,1471-2377,68.39893914394622,-1.0,1/12/01,25,{anna brownjane greenvalerie beralgillian reevespat doyle}
714,558766.0,burkholderia cepacia complex infection in a case of sinonasal polyposis recurrence without cystic fibrosis,eng,international medicine & health guidance news [guo ji yi yao wei sheng dao bao],4.2658938683093055,0210-0??010??,195.9587127097996,3.0,1/8/01,414-??6,{a. pavina. staffierig. marionig. bresciar. rinaldi}
715,428909.0,pilot randomized controlled trial of web-based acceptance and commitment therapy for smoking cessation.,#eng#lish,nicotine & tobacco research,nicotine & tobacco research : official journal of the society for research on nicotine and tobacco,1462-2203,15.0,10.0,1/13/10,1756@@-1764,{jaimee l. heffnerjonathan brickerbryan comstockchristopher wyszynski}
716,110453.0,anti-hypertensive medicines prescribing for medical outpatients in a premier teaching hospital in nigeria: a probable shift of paradigm.,eng,pharmacy practice,%pharm pra??ct (granada),1885-642x,12.0,2.0,#1/14/0$4,419,{kazeem b yusuffunyime i eshiet}
717,3694201.907517891,agitation aggression and disinhibition syndromes after traumatic brain injury,$jp%n,neurorehabilitation,neurorehabilitation,1053-8135,70.07581773928618,4.0,1/2/01,297-310,{e. kim}
718,82695.0,the effect of lymphatico-venous anastomosis for an intractable ulcer at the lower leg in a marked obese patient.,eng,microsurgery,microsurgery,1098-2752,34.0,1.0,1/14/01,jul-64,{hisako harayukio sekinoriyuki muraiisao koshimatakuya iidamakoto miharatakeshi todokoro}
719,820059.0,effects of multifunctional fabrics on cardiac autonomic tone and psychological state,english,international j%ournal of neuroscience,int.j.neurosci.,0020-%7454,114.0,8.0,1/4/01,923-931,{k.-w. parkj. songh.-j. kims.-r. moonm.s. lee}
720,771288.0,manual versus electric vacuum aspiration for first-trimester abortion: a systematic review,eng,bjog,bjog : an int@@ernational# journal of obstetrics and gynaecology,1470-0328 (print) 1470-0328,115.0,1.0,1/8/01,13-m%ay,{f. dengj. wenq. y. caiy. p. li}
721,54202.0,behaviour research and therapy outcome predictors in guided and unguided self-help for social anxiety disorder,$engl%ish,behaviour research and therapy,neuropsychologia,0036-8148 0036-8148,50.0,1.0,1/12/01,13-21 do  - 10.1016/j.brat.2011.10.009,{o e havikp carlbringl g _stt nordgreeng anderssont furmark}
722,888477.0,probiotics for the treatment of upper and lower respiratory-tract infections in children: systematic review based on randomized clinical trials,eng,j pediatr (rio j),jornal de pediatria,0021-7557,91.0,5.0,1@@/15/$01,413-27,{m. h. de oliveira juniore. s. sarinhog. v. de araujod. m. peixoto}
723,741279.0,bradykinin is a mediator but unlikely a trigger of antiarrhythmic effects of ischemic preconditioning,$engl%ish,journal of cardiovascular electrophysiology,j. cardiovasc. electrophysiol.,1540-8167,18.0,1.0,1/7/01,93-99 7p,{s. v. driamovs. butzp. t. buserc. e. zauggm. bellahcene}
724,64430.0,the nadph oxidase-mediated production of hydrogen peroxide (h(2)o(2)) and resistance to oxidative stress in the necrotrophic pathogen alternaria alternata of citrus.,eng,molecular plant pathology,mol. plant pathol.,1364-3703,48.19161047022252,8.0,1/12/10,900-14,{siwy ling yangkuang-ren chung}
725,461657.0,review of epidemiology and management of atrial fibrillation in developing countries.,4.936392422017943,3.555387623201737,4.240067506736971,4.030052022391779,0.0,0.0,1/1/98,4.884338177331462,{null}
726,240949.0,william h. taft high school project hola 1985-1986. oea evaluation report.,%@@eng,4.986940738002149,jama,0301-5149,0.0,0.0,1/1/86,20-4 st  - preferences and practices of americans and their physicians in antihypertensive therapy-,{brooklyn. office of educational assessment. new york city board of education}
727,453909.0,the lung cancer management guidelines 2012.,4.936392422017943,3.555387623201737,4.240067506736971,4.030052022391779,0.0,0.0,1/1/98,4.884338177331462,{null}
728,222452.0,special problems in the prosthetic rehabilitation of deep bite,3.0917865410548266,johns hopkins medical journal,johns hopkins med. j.,0266-7681 (print) 0266-7681,30.0,2.0,1/1/75,170-5,{r. voss}
729,163839.0,the potential impact of bias in studies of residential exposure to magnetic fields and childhood leukemia,3.016709118872358,bioelectromagnetics,bioelectromagnetics,1521-186x,0.0,9.0,1/1/01,s32-47,{%nu#ll}
730,696132.0,changes of interaction during the development of a mathematical learning environment.,3.5393777833661146,journal of mathematics teacher education,curr drug targets,1386-4416 1386-4416,14.0,5.0,1/11/10,393-411??,{dirk.hoek@ou.nl hoek dirk1koeno2 gravemeijer}
731,257990.0,an internet-based program to enhance motivation to change in females with symptoms of an eating disorder: a randomized controlled trial,3.016709118872358,5.325912766118693,5.588695488040236,0340-2592,44.0,0.0,1/14/01,1947-1963,{hotzel kr von brachelkosfelder jhechler tvocks srieger eschulte dschmidt u}
732,332032.0,air pollution and risk of urinary bladder cancer in a case-control study in spain,$engl%ish,#occupational and environmental me@@dicine,occup environ med,1470-7926,65.0,1.0,1/8/01,56-60,{nuria malatsalfredo carratomanolis kogevinasnathaniel rothmanconsol serrareina garcia-closasdebra silvermanadonina tardonkenneth p. cantormustafa dosemecigemma castano-vinyalsroel vermeulen}
733,1979423.3150671355,remission rates following antidepressant therapy with bupropion or selective serotonin reuptake inhibitors: a meta-analysis of original data from 7 randomized controlled trials.,eng,j. clin. psychiatry,kekkaku,0160-6689,66.0,8.0,1/5/08,974-81,{michael e thaseyounghua wangapril e harriettmelinda mittoncarol b rockettbarbara r haightjack g modellnathalie richardsusan vanmeter}
734,2296128.197126627,ad@@aptive convex combination approach for the identification of improper quaternion processes,eng,journal of psychopharmacology,4.936821102124343,3.491721898945338,25.0,1.0,1/14/01,172-82,{c. jahanchahic. c. tookb. c. ujangd. p. mandic}
735,660499.0,inappropriate use of emergency services: a systematic review of prevalence and associated factors.,#eng,violencia contra a crianca: revelando o perfil dos atendimentos em servicos de emergencia brasil 2006 e 2007.,4.731130366591406,1678-4464,25.0,1.0,1/9/01,28-jul,{marlos rodrigues dominguesana claudia gastal fassamaria laura vidal carret}
736,355078.0,use of episiotomy in the united states,eng,birth,neurorehabilitation,1523-536x,29.0,1.0,1/2/01,jun-74,{m. c. klein}
737,696985.0,the diversion of ultram ultracet and generic tramadol hcl.??,eng,journal of addictive diseases,j addict dis,15$45-@@0848,25.0,2.0,1/6/01,53-58,{george e. woodyanne gelleredgar h. adamstheodore j. ciceroalvaro munozedward c. senayjames a. inciardi}
738,826471.0,aberrances in autonomic cardiovascular regulation in fibromyalgia syndrome and their relevance for clinical pain reports,eng,psychosomat$i@@c medicine,psychosom med,0033-3174,72.0,26.81059622657807,1/10/01,462-70,{sergio garridoangeles pulgarstefan duschekmar_a mart_n-vzquezgustavo a reyes del paso}
739,807737.0,sorafenib and pegylated interferon-alpha-2b in advanced metastatic melanoma: a multicenter phase ii decog trial,german,j. clin. oncol.,j. clin. oncol.,0732-183x,154.12338228251835,15.0,nan,nan,{ugurel s.schadendorf d.garbe c.trefzer u.egberts f.hassel j.weichenthal m.hauschild a.mauch c.gutzmer r.}
740,875781.0,dispersal of methicillin-resistant staphylococcus epidermidis by staff in an operating suite for thoracic and cardiovascular surgery: relation to skin carriage and clothing,eng,j hosp infect,the journal of hospital infection,0195-6701 (print) 0195-6701,44.0,2.0,1/1/00,119-26,{p. domicela. tammeline. stahlea. hambraeus}
741,322953.0,psychometric validation of the growth and empowerment measure (gem) applied with indigenous australians,en??glish,australian and new zealand journal of psychiatry,4.811074221229092,apr-74,44.0,9.0,1/10/01,791-799,{komla tseymelissa r haswelllyndon reillydavid kavanaghchris doranarlene laliberteandrew wilsonyvonne cadet-james}
742,632688.9562505141,alveolar soft part sarcoma of the uterine corpus. report of two cases and review of the literature,eng,4.8873641178357214,3.3204860886499814,1353-3452 (print)     1353-3452,194.0,1.0,1/1/98,59-63,{k. radiga. roessnerp. buhtz}
743,180588.0,it's time practitioners help families clear the air of secondhand smoke: a commentary on pyle et al. (2005),4.519058635494829,5.2832778163163425,5.062448528745811,0305-1862,23.0,0.0,1/5/01,25-29,{geoffrey c. williamsbai brownson difranza gehrman glantz law mokdad ory panagiotakos pechacek pyle sargent sweda whincup whitlock arcavi}
744,440684.0,hemostatic resuscitation for massive bleeding: the paradigm of plasma and platelets - a review of the current literature.,4.936392422017943,3.555387623201737,4.240067506736971,4.030052022391779,0.0,0.0,1/1/98,4.884338177331462,{null}
745,758629.0,studies on the biological activity of two strains of bcg: influence of production conditions.,eng,dev. biol. stand.,jama,0301-5149,58.0,-1.0,1/1/86,105-18,{m chouchkovaa engibarov}
746,964184.0,myocardial fibrosis by t1 mapping is an early indicator of severe cardiac allograft vasculopathy,#eng#lish,circulation,circu@@l??ation,22-sep,128.0,22.0,1/13/01,$$2826-34,{n. harcourts. c. masrim. colving. raveendran}
747,265490.0,follistatin-like protein 1 regulates chondrocyte proliferation and chondrogenic differentiation of mesenchymal stem cells,eng,??ann rheum d??is,annals of the rheumatic diseases,mar-67,0.0,0.0,1/14/01,1296-304,{s. m. smitha. d. marinovr. hirschd. s. bushnellb. t. campfieldh. c. blairy. chaly}
748,463556.0,structural brain changes associated with antipsychotic treatment in schizophrenia      as revealed by voxel-based morphometric mri: an activation likelihood estimation       meta-analysis.,%@@eng,3.555387623201737,5.419805694877359,4.030052022391779,0.0,0.0,1/1/98,4.884338177331462,{null}
749,749844.0,insights in public health: taxing sugar sweetened beverages to improve publi%c health: policy action in hawai'i. d@@octoral health policy seminar spring 2013,engl#ish,hawaii j med public health,hawai'i journal of medicine & public health : a journal of asia pacific medicine & public health,2165-8242,72.0,8.0,1/13/01,286-91,{t. sentellt. usagawam. hagiwarat. peacockh. hee heom. g. pearcel. choym. r. dela cruz}
750,300057.0,[evidence-based therapy guideline of the german working group on obesity in childhood and adolescence].,ger,bundesgesundheitsblatt gesundheitsforschung gesundheitsschutz,bundesgesundheitsblatt gesundheitsforschung gesundheitsschutz,1437-1588,54.0,5.0,1/11/05,584-90,{m wabitscha mossd kunze}
751,166521.0,the cost of national service frameworks,eng,5.975682294113428,clin cardiol,1470-2738,65.0,0.0,1/4/01,68-9 st  - the cost of national service frameworks-,{r. cn  - pubmed da  - feb dp  - nlm et  - 2004/03/05 boyle}
752,292018.0,simple steps to fitness. secrets of strength. strength training is as important to weight loss and fitness as aerobic exercise is but many people ignore it. here's how to get started.,eng,diabetes forecast,diabetes forecast,0095-8301,55.0,8.0,1/2/08,98--100,{shauna s roberts}
753,181456.0,homeplace and housing in the lives of low-income urban african american families,%@@eng,5.2832778163163425,5.062448528745811,3.2311424032013587,0.0,0.0,1/5/01,166-188,{linda m. burtonaltman bullard burton burton burton burton burton clark conley dilworth-williams fischer foucault franklin gieryn gilbert goering hooks howard kidder lahiri lawson clark lawson clark lawson clark low massey oliver perkins rosenbaum rosenbaum sanders stack allansherri lawson clark}
754,668772.0,lack of association between the connexin 37 c1019t gene polymorphism and coronary artery di%sease in a chinese population: meta-analysis of 2206 subjects.,eng,biomedical reports,biomed rep,2049-9434,1.0,3.0,#1/13/05#,464-468,{yan-yan liyun qianchuan-wei zhou}
755,276001.0,[effects of tobacco advertising regulations in various countries],jpn,nihon koshu eisei zasshi,[nihon koshu eisei zasshi] japanese journal of public health,0546-1766 (print) 0546-1766,172.81397653529936,12.0,1/1/95,1017-28,{t. sone}
756,788507.0,intensive glucose control in the management of diabetes mellitus and inpatient hyperglycemia,eng,am j health syst pharm,american journal of health-system pharmacy : ajhp : official journal of the american society of health-system pharmacists,1079-2082 (print) 1079-2082,67.0,10.0,1/10/01,798-805,{s. b. levya. o. shogbon}
757,620483.0,the value of breast self-examination: meta-analysis of the research literature.,eng,oncology nursing forum,oncol nurs forum,0190-535x,28.0,5.0,1/1/06,815-22,{y l ku}
758,433039.0,palliative sedation therapy in the last weeks of life: a literature review and r#ecommendations for standards.,4.936392422017943,3.555387623201737,4.240067506736971,4.030052022391779,0.0,0.0,1/1/98,4.884338177331462,{null}
759,737167.0,understanding depression in palliative and end-of-life care,en,nurs stand,nursing standard (royal college of nursing (great britain) :% @@1987),0029-6570 (print) 0029-6570,23.0,66.50754175685141,1/5/01??,48-57; quiz 58 60,{s. ashelfordv. taylor}
760,744601.0,inhaled anticholinergics and risk for acute urinary retention: a case-crossover and case-time-control study,4.52909313086916,value health,am j infect control,1098-3015,17.0,7.0,4/1/89,a776,{dilokthornsakul p.joo m.j.lee t.a.pickard?? a.s.lin f$.j.}
761,856471.0,compartmentalization of fas and fas ligand may prevent auto- or paracrine apoptosis in epithelial cells,eng,ex%perimental cell research,american journal of critical care : an official publication american association of critical-care nurses,4.691745412942367,974.3723144521439,2.0,1/3/01,283-90,{w. hunzikerk. h. tan}
762,570704.0,rituximab-related viral infections in lymphoma patients.,eng,leukemia & lymphoma,j s#ports sci,1042-8194,48.0,39.868959895904155,1/7/07,1307-12,{saadettin kilickapomer dizdarsercan aksoyibrahim baristahakan harputluoglukadri altundagdidem sener dede}
763,520153.0,fetal lung volume measurements: determination with mr imaging--effect of various factors.,eng,radiology,radiology,0033-8419,240.0,1.0,1/6/07,187-93,{carol e barnewolthiroto hatabumizuki nishinodeborah levinehenry a feldmanjudy a estroffvalerie l ward}
764,259267.0,intra-operative change of gastric ph during laparotomic cholecystectomy under general anaesthesia: a prospective case-control study,%@@eng,acta cytologica,4.125574317451099,3.566001035214283,56.0,0.0,1/12/01,40-43,{s. deyp. bhattacharyyab. k. biswasb. bhattaraip. bhakta}
765,24381.0,the care guidelines: consensus-based clinical case reporting guideline development.,eng,headache,headache,1526-4610,53.0,10.0,1/13/11,1541-7,{[collective name] care groupjoel j gagnierdavid moherdouglas g altmangunver kienledavid rileyharold sox}
766,827921.0,effect of a creative-bonding int@@ervention on taiwanese nursing students' self-transcendence and attitudes toward elders.,eng,res nurs he%alth,scand. cardiovasc. j.,1098-240x,32.0,2.0,1/9/04,204-16,{sandra m walshshiue chen}
767,461204.0,fc receptor-like 3 (fcrl3) -169 c/t polymorphism and systemic lupus erythematosus: a meta-analysis.,4.936392422017943,3.555387623201737,4.240067506736971,4.030052022391779,0.0,0.0,1/1/98,4.884338177331462,{null}
768,482860.0,[indirect anastomoses for moyamoya disease].,jpn,no shinkei geka. neurological surgery,5.213585010706444,0301-2603,26.0,9.0,9/1/98,769-86,{y matsushima}
769,18298.0,ulcer healing after peripheral intervention.,eng,circulation journal : official journal of the japanese circulation society,circ. j.,1347-4820,-1.0,-1.0,4/14/0??7,4.180180434558312,{daiki uchidayukihiro saitohisashi uchidaatsuhiro koyanobuyoshi azuma}
770,365654.0,measuring the bright side of being blue: a new tool for assessing analytical rumination in depression.,@@e%ng,plos one,plos one,1932-6203,9.0,11.0,1/14/01,e112077,{skye p barbicpaul w andrewszachary durisko}
771,625306.0,[mammographic density: a valid risk factor for breast cancer?].,fre,prvention de l'insuffisance rnale induite par les produits de contrnste iodes,sleep,0221-0363,89.0,9.0,1/8/09,1140-50,{g boutet}
772,572343.0,high-dose sequential (hds) chemotherapy for high-risk non-hodgkin's lymphoma: long-term analysis and future developments.,eng,ann. hematol.,5.247829673049752,0939-5555,80.0,-1.0,1/1/01,b123-6,{m ladettod caracciolog rossic marinonel berguia cutticaa salomonem boccadoroi riccac tarellam paganof zalliop gavarottia pileria de crescenzo}
773,88262.0,core symptom measures in cancer clinical trials.,eng,journal of the national cancer institute,j. natl. cancer inst.,1460-2105,106.0,7.0,1/14/07,1078-87,{carolyn gotay}
774,3155316.9266096307,human papillomavirus infection and increased risk of hiv acquisition. a systematic review and meta-analysis.,eng,aids (london england),aids,1473-5571,26.0,17.0,11/13/12,2211-22,{chunhui wangrichard hayeslouise kuhnstephen shiboskijennifer s smithnatasha l larkedeborah watson-jonescatherine f houlihanpatti e gravittkaren k smith-mccune}
775,718292.0,prevalence of different morphologic forms of the human tongue in young finns.,eng,oral surgery oral medicine and oral pathology,oral surg. oral med. oral @%@pathol.,0030-4220,53.0,2.0,2/1/82,152-6,{m mikkonenr kotilainena kullaa-mikkonen}
776,245200.0,osteoporosis in men,eng,arch intern med,archives of internal medicine,0003-9926 (print) 0003-9926,158.0,2.0,1/1/98,194,{m. galus}
777,307302.0,neurolymphatische bahnen: neue wissenschaftliche nachweise untermauern die perrin-technik,3.0917865410548266,international medicine & health guidance news [guo ji yi yao wei sheng dao bao],4.369898923850038,0961-5423,14.0,2.0,1/13/06,15-o#ct,{raymond n. perrin}
778,217418.0,long term follow-up of conservative treatment of severe??ly traumatized maxillary inciso$rs,$jp%n,wiener medizinische wochens$chrift,3.0690797688349623,1088-3371,56.73566206883854,4.0,1/1/97,190-192,{z. hirschfeldi. brina. fuksm. guelmann}
779,413717.0,magnetic resonance imaging evaluation of bone marrow changes in obstructive sleep apnoea syndrome in adults,english     italian,european journal of endocrinology,annales francaises d'anesthesie et de reanimation,87567555,111.0,4.0,1/6/01,572-84,{a. r. aleandrid. mancinit. cosentinir. le donnen. colavita}
780,62246.0,pulpal response to a fluoride-releasing all-in-one resin bonding system.,eng,operative dentistry,oper dent,0361-7734,27.0,3.0,1/2/05,271-7,{masayuki otsukimakoto arakawahidekazu sonodayasutaka sasafuchiyuichi kitasakojunji tagami}
781,945021.0,impr%ovement of action tremor by chronic cortical stimulation,eng,mov disord,movement disorders : official journal of the movement disord#er society,0885-3185,13.0,1.0,1/1/98,aug-84,{b. pollinc. genyj. p. nguyenp. c??esaroa. ??feve}
782,649817.0,validity of rorschach inkblot scores for discriminating psychopaths from non-psychopaths in forensic populations: a meta-analysis.,eng,psychological assessment,psychol assess,1939%-$134x,22.0,2.0,1/10/06,3?%?36-49,{scott o lilienfeldkeli holloway allenhoward n garbjessica l wildermuthm teresa nezworskijames m wood}
783,934327.0,use of a brief phone call after ed discharge,%@@eng,3.555387623201737,4.240067506736971,3.246284591011187,0.0,0.0,1/1/74,-,{nct01893931 }
784,546484.0,the effects of pre-reading and sharing mechanisms on learning with the use of annotations,4.654820177192422,turkish online journal of educational technology - tojet,catheter cardiovasc@@ interv,1303-6521,10.0,8.137554367884995,1/11/04,234-249,{wu-yuin hwangguo-liang hsu}
785,917231.0,[occupational exposure to sevoflurane in pediatric operating rooms: the multi-point sampling method for risk assessment].,ita,patologie asbesto correlate in congiunti di lavoratori del settore cemento-amianto.,eur. heart j.,1592-7830,34.0,3.0,1/12/07,266-8,{v cerabonam wachockau moscatov camisam g tuccis zaffinav montaldia poscia}
786,3702422.6157770767,impact of crizotinib on patient-reported symptoms and global quality of life (qol) compared with chemotherapy in a phase iii study of advanced alk-positive non-small cell lung cancer (nsclc),3.016709118872358,european journal of cancer,appl radiat isot,3.6872371745360817,49.0,0.0,1%/13/01,-,{v. hirshj.y. hanf. blackhalls. iyerd.w. kima. shawa. reismank. wilnerh. nokiharab. besse}
787,724055.0,a systematic review and meta-analysis of trials of treatment of depression from india,english,indian journal of psychiatry,4.125574317451099,3.566001035214283,56.0,0.0,1$/14/01,29-38,{s. sarkars. grover}
788,63738.0,[the use of ethonium paste in the treatment of deep dental caries].,rus,stomatologiia,stomatologiia (mosk),0039-1735,50.0,2.0,3/1/71,79-80,{p k shestakov}
789,422739.0,reporting methods in studies developing prognostic models in cancer: a review.,eng,bmc medicine,bmc med,1741-7015,8.0,0.0,1/10/01,20-20,{patrick roystonrachel waterssusan mallett$douglas g altmansusan dutton}
790,97795.0,hospital discharge after ambulatory knee arthroscopy: a comparison of epidural 2-chloroprocaine versus lidocaine,$engl%ish,aids (london england),5.213585010706444,5.469122774429658,26.0,1.0,1/1/%#01,35-40,{j. m. neald. j. kopaczm. a. lewisj. j. deck}
791,155127.0,p16(ink4) expression is not associated with human papillomavirus in oral lichen planus.,eng,oral surgery oral medicine oral pathology and oral radiology,oral surg oral med oral pathol oral radiol,2212-4411,118.0,6.0,1/14/12,#694-@@702,{lucio montebugnoliluca morandiluca scapoliannalisa palmieridavide b gissimaria pia foschiniilaria manelli}
792,100986.0,association of bleeding mortality and sex in acute corona#ry syndromes: the missing triangle.,eng,journal of cardiovascular medicine (hagerstown md.),j cardiovasc med (hagerstown),1558-2035,-1.0,-1.0,9/23/14,447-55,{rossana de palmapaolo ortolanicaterina caminitiemilia solinaspiera angelica merlinidiego ardissinogiorgia paolimaria francesca notarangelopaolo guastarobaantonio marzocchiluigi vignaliroxana mehranantonio manari}
793,166179.0,[severe exposure to environmental lead in a child population in antofagasta chile],4.13874348251404,exposicion severa a plomo ambiental en una poblacion infantil de antofagasta chile.,circu@@l??ation,0034-9887,128.0,2.0,1/1/00,221-32,{i. delgadoj. vega}
794,740811.0,tracheostomy care and complications in the intensive care unit,@@e#ng,critical care nurse,clin psychol rev,-32698.47974702889,33.0,5.0,1/13/01,18-31 14p,{linda l. morrisandrea whitmererik mcintosh}
795,379577.0,monitoring of fluid changes in hospitalized malnourished guatemalan children using bioelectrical impedance spectroscopy (bis).,eng##,applied radiation and isotopes : including data instrumentation and methods for use in agriculture industry and medicine,appl radiat isot,0969-8043,49.0,5.0,5/1/98,615-7,{c pithanm mazariegosn w solomonsp f_rst}
796,658981.0,preliminary state of development of prediction models for primary care physical therapy: a systematic review.,eng,journal of clinical epidemiology,j clin epidemiol,1878-5921,65.0,12.0,1/12/12,1257-66,{martijn w heymanstobias van den berghan j r anemalieke van oortbart w koesarianne p verhagenriekie h c w de vet}
797,215650.0,bruxismo em crian_as bruxism in children,pt,expert opin drug metab toxicol,4.369898923850038,-14400,3.0,2.0,1/8??/01@@,aug-91,{ronaldo fazziana estela haddadmaria salete nahs pires corr_a}
798,521132.0,a cadaver model to evaluate the accuracy and reproducibility of plain radiograph step and gap measurements for intra-articular fracture of the distal radius.,eng,j hand surg am,the journal of hand surgery,0363-5023,29.0,5.0,1$??/4/09,841-7,{jeff knightjeffery m smiththomas e trumblewren v mccallister}
799,892609.0,13th ieee/acm symposium on distributed simulation and real-time applications ds-rt 2009,%@@eng,3.555387623201737,4.240067506736971,4.030052022391779,0.0,0.0,1/1/98,4.884338177331462,{null}
800,366275.0,a systematic review on the application of cardiovascular risk prediction models in pharmacoeconomics with a focus on primary prevention.,eng,european journal of preventive cardiology,eur j prev card??iol,2047-4881,19.0,7.596840607242152,1/12/08,42-53,{maarten j postmapetros pechlivanogloujelena stevanovic}
801,513630.0,pan-canadian study of mammography screening and mortality from breast cancer.,eng,journal of the national cancer institute,j. natl. cancer inst.,1460-2105,106.0,11.0,1/14/11,1605-11,{jennifer paynerukshanda ahmadgregory doylenorm phillipsanna m chiarellichristine wilsonkathleen deckerandrew coldmanbin zhangjacques brisson}
