ID,id,article_title,article_language,journal_title,jounral_abbreviation,journal_issn,article_jvolumn,article_jissue,article_jcreated_at,article_pagination,author_list
496,422857.0,does this patient have obstructive sleep apnea?: the rational clinical examination systematic review.,eng,jama,jama,0098-7484,310.0,7.0,1/13/08,731-741,20
497,720372.0,application of aging management strategies for reactor vessel internals and core support structures,english,proceedings of the asme pressure vessels and piping conference 2010 vol 7,hanan f khafagymona m hassanemad s osmanfaten m el-shanawanyabdel rahman m fathallahyasser m samhangehan g el-fandy,978-0-7918-4926-2,0.0,0.0,1/10/01,277-286,{h. q. xum. snyders. fyfitcha. chetag. bezdikianv. n. shaht. r. liszkaih. charkasn. guptay. shojic. s. bajwac. maym. sanwarwalam. brumovskyi. ezekoye}
498,863342.0,molecular detection of hepatitis b virus: recent developments,144-56,0737-1209,c k naspitzj o warner,1053881x (issn),93.76297088441369,1.0,1/5/01,33-43,{b. webera. berger}
499,260745.0,droperidol vs metoclopramide for prophylaxis of postoperative nausea and vomiting after breast cancer surgery,eng,1466-187x,relationship between water hardness and coronary mortality in taiwan,1108-18,28.0,0.0,1/11/01,141,{f. colettas. d'arienzop. sansonec. auriliom. c. paceg. zagariar. stumbo}
500,941515.0,is prolonged use of computer games a risk factor for deep venous thrombosis in children?,eng,clinical medicine (london england),clin med,1473-4893,4.0,2.0,1/4/01,190-1,{richard j. a. murrin}
501,641972.0,[pelvic floor training for women with urinary incontinence].,dan,forsinket implementering af internationale retningslinjer for computertomografi med iodholdigt kontraststof .,nan,1603-6824,890.968355429489,30.574457280937516,12/7/02,593-5,{sren brostrmgunnar lose}
502,699523.0,regulating free speech,english,0020-7454,debashish chakravarthyelizabeth a. hintontracey c. vlahoviccynthia ann fleck,0428-8246,23.0,2.0,frances williamsalehegn gelayesusan steigerwaltyara daloulhadeel assadtimothy r larsenbarryton waanbahmichael williams,289-318,{david dyzenhaus}
503,946112.0,older women in the homeless shelter: personal perspectives and practice ideas,english,journal of women & aging,neuropharmacology,0895-2841,23.0,4.0,the neurologist,360-374,obesity (silver spring)
504,958639.0,{eunice molinar-toribiobenjam_n pialivia g_mezjara prez-jimnezmarta casadosara ramos-romeropere clapsjosep llu_s torres},1/15/05,j. natl. cancer inst.,thorax,-94325,70.0,1.0,1/9/01,238,{bashir jiwani}
505,850418.0,takayasu's arteritis with multiple intracranial aneurysms,eng,takayasusche arteriitis mit multiplen intrakraniellen aneurysmen,1/13/12,0428-8246,23.0,5.868079788399232,1/8/10,60-61,{matsumoto k.yamada f.fukuda s.}
506,125302.0,intravenous cyclophosphamide in patients with chronic systemic inflammatory diseases: morbidity and mortality.,sheng wu yi xue gong cheng xue za zhi = journal of biomedical engineering = shengwu yixue gongchengxue zazhi,scandinavian journal of rheumatology,0923-7534,0300-9742,37.0,2.0,a performance improvement process to tackle tachysystole,130-4,{e a m janssenc brodinp ogreidk kjellevoldl g granssonl vattenp r romundstadr omdalk wildhagen}
507,168889.0,trends in domestic violence service and leadership: implications for an integrated shelter model,eng,administration and policy in mental health,adm policy ment health,0894-587x,27.0,25.39288903452953,1/1/00,339-52,{m. b. philipr. a. hayward}
508,63977.0,[clinical and histologic results of treatment of serous pulp inflammations with ledermix].,pol,czasopismo stomatologiczne,a meta-analytic review of exposure in group cognitive behavioral therapy for posttraumatic stress disorder.,nov-53,20.0,11.0,1/1/67,1145-53,{h zakrzewska-jastrzebska}
509,782211.0,application of a model based on fuzzy logic for evaluating nursing diagnostic accuracy of students,english,international journal of medical informatics,int j med inform,1872-8243,82.0,30.564738957549874,1/13/01,875-81,{r. jensenf. g. matosa. da cruz ddep. s. silveiram. h. lopesn. r. ortega}
510,473599.0,the effectiveness of n-acetylcysteine in preventing contrast-induced nephropathy in patients undergoing contrast-enhanced computed tomography: a meta-analysis of randomized controlled trials (provisional abstract),ger,international urology and nephrology,erik e suarezbridget n fahybrian a brucknercourtenay r brucenathan g allenharvey l gordon,0301-1623,45.0,5.0,1/13/01,1309-1318,{yh hsums yaocs wongch baimy wuyf lincy hsiangkw tamyw lihf hsiang}
511,915463.0,[commentary on] gait changes in children with cerebral palsy following a neuro-developmental treatment course. adams m chandler l shuhmann k pediatric physical therapy 2000;12:114-120,144-56,pediatric physical therapy,j hum hypertens,d chocholr chaloupkab kalaj gallom netval,14.0,1.0,1/2/01,55-56 2p,{j. slusarski}
512,476199.0,cognitive outcome of pediatric moyamoya disease.,eng,journal of korean neurosurgical society,j korean neurosurg soc,does this patient have obstructive sleep apnea?: the rational clinical examination systematic review.,57.0,6.0,1/15/06,440-4,{ju-seong kimdong-seok kimeun-kyung parkkyu-won shim}
513,405141.0,fruit consumption and risk of type 2 diabetes: results from three prospective longitudinal cohort studies.,eng,bmj-british medical journal,erik e suarezbridget n fahybrian a brucknercourtenay r brucenathan g allenharvey l gordon,1756-1833,347.0,-1.0,1/13/01,f5001,{rob m van damfrank b huisao murakijoann e mansonfumiaki imamuraqi sunwalter c willett}
514,213794.0,a biomechanical study of replacement of the posterior cruciate ligament with a graft. part ii: forces in the graft compared with forces in the intact ligament,english,mount sinai journal of medicine,alternative therapies in health and medicine,j am board fam med,79.0,3.0,1/1/97,381-386,{k.l. armstrongg.a.m. finermank.l. markolfm.s. shapiroj.r. slauterbeck}
515,408902.0,the safety and immunogenicity of rotavirus vaccination in infants with intestinal failure,eng,j. pediatric infect. dis. soc.,ju-seong kimdong-seok kimeun-kyung parkkyu-won shim,-14400,3.0,1.0,1/3/04,57-65,{mcneal m.m.sanchez s.e.jacob s.javid p.j.englund j.a.horslen s.p.}
516,89897.0,a growing lesion on the cheek.,eng,jama otolaryngology-- head & neck surgery,jama otolaryngol head neck surg,2168-619x,465.9332666486637,4.0,1/14/04,383-4,aging ment health
517,187552.0,protective effect of ginsenoside rb1 against myocardial ischemia/reperfusion injury in streptozotocin-induced diabetic rats,j am board fam med,molecular biology reports,pediatr ann,0301-4851,38.0,7.0,1/11/01,4327-4335,{y. wuz. y. xiah. m. lius. q. leil. zhangj. j. xub. zhaoj. dou}
518,144339.0,comparative in vitro performance of three small-volume valved holding chambers with beclomethasone/formoterol pressurized metered dose inhaler.,eng,journal of aerosol medicine and pulmonary drug delivery,j aerosol med pulm drug deliv,1941-2703,119.00092032546877,4.0,mehak bhatiashaun k morrisprabhat jhawilson suraweerajayadeep patracyril patraprakash c gupta,1535-7414,{kamel alhanoutjean-christophe dubustalita mota goncalvesveronique andrieualain nicolaydavi pereira de santana}
519,656518.0,the effectiveness of anti-illicit-drug public-service announcements: a systematic review and meta-analysis.,eng,journal of epidemiology and community health.,j clin epidemiol,1470-2738,65.0,10.0,oral surgery oral medicine oral pathology oral radiology and endodontics,834-40,{julio s g montanerkora debeckevan woodthomas kerredward j millsdan werb}
520,3620060.8465032233,[use of statins prior to or following invasive therapy for coronary artery disease].,chi,chung-hua i hsueh tsa chih [chinese medical journal],chung hua i hsueh tsa chih,0376-2491,85.0,40.0,10/26/05,15-jul,639-46
521,130308.0,brain behav,engfre,canadian forces dental services quarterly,can forces dent serv q,0045-4850,18.0,1.0,1/1/77,7-jan,{j r trottd j morrowd w buntine}
522,1006046.2166470014,women's experiences of acupuncture during labour,eng,british journal of midwifery,erik e suarezbridget n fahybrian a brucknercourtenay r brucenathan g allenharvey l gordon,0969-4900,21.0,4.0,1/13/01,254-262,{irena anna freikatharina fierzangela poatmartina gisin}
523,600827.0,nutritional supplementation for hip fracture aftercare in the elderly.,eng,cochrane database syst. rev.,harefuah,1469-493x,-1.0,4.0,american journal of clinical oncology-cancer clinical trials,cd001880,{a avenellh h handoll}
524,851773.0,quality of life factors and survival after total or extended maxillectomy for sinonasal malignancies.,eng,journal of oral and maxillofacial surgery: official journal of the american association of oral and maxillofacial surgeons,world j pediatr congenit heart surg,1531-5053,73.0,4.0,1/15/04,759-63,{james murphyamal isaiahjoshua e lubekjeffrey s wolf}
525,67292.0,epithelial splicing regulatory proteins 1 (esrp1) and 2 (esrp2) suppress cancer cell motility via different mechanisms.,eng,{a brandj van der heydens de vironh van oyenn malats},j. biol. chem.,1083-351x,289.0,40.0,3/14/10,27386-99,smoking is accompanied by a suppressed cervical nitric oxide release in women with high-risk human papillomavirus infection
526,129698.0,combined and sequential treatment of oral and maxillofacial malignancies: an evolving concept and clinical protocol.,eng,chinese medical journal,eng,0366-6999,121.0,19.0,5/8/10,1945-52,{zhi-yuan zhangwei-liu qiujia-wei zheng}
527,254327.0,evaluation of a workshop on evidence-based medicine for social insurance physicians.,eng,occupational medicine-oxford,j am geriatr soc,0962-7480,58.0,7.848493204629224,1/8/03,jul-83,{jos h verbeekrob kokjan l hovingfrederieke g schaafsmafrank j h van dijkpaul b a smits}
528,556803.0,1/6/03,turkish online journal of educational technology - tojet,environmental toxicology and pharmacology,ju-seong kimdong-seok kimeun-kyung parkkyu-won shim,774-9,37.0,1.0,1/14/01,s136,{m. rigoldis. gasperinib. m. del menicof. nichellia. bonciminom. calabriap. meregallir. parini}
529,73792.0,evaluation of the protective effect of ilex paraguariensis and camellia sinensis extracts on the prevention of oxidative damage caused by ultraviolet radiation.,turkish online journal of educational technology - tojet,environmental toxicology and pharmacology,{ju-seong kimdong-seok kimeun-kyung parkkyu-won shim},1872-7077,37.0,1.0,1/14/01,195-201,{marlon bargemilio l strecklara m gomesvanessa m andradedaniela d leffafelipe dal-pizzolfabricia petronilhofrancieli vuolomilena carvalho-silvafernanda balbinotgislaine t rezin}
530,484593.0,new anticoagulants for atrial fibrillation.,eng,j. cardiovasc. med.,journal of cardiovascular medicine (hagerstown md.),1558-2027,36.23351372105579,6.0,fre,canadian forces dental services quarterly,{raffaele de caterinagiulia rendasteen dalby kristensen}
531,351700.0,journal of stroke and cerebrovascular diseases : the official journal of national stroke association,english,dissertation abstracts international a: the humanities and social sciences,stephanie j weinsteinrachael z stolzenberg-solomonphilip r taylorbarry i graubardjarmo virtamodemetrius albanesli jiao,chandra y. and bains sujeev s. and egede leonard e. osborn,0.0,0.0,545-53,1-jan,{michelle firestone}
532,105981.0,a common variant in the fto gene is associated with body mass index and predisposes to childhood and adult obesity.,eng,science (new york n.y.),science,1095-9203,316.0,5826.0,11/7/05,889-94,{george davey smithamanda j bennetteleftheria zegginimarjo-riitta jarvelinnicholas j warehamlorna w harriescolin n a palmershah ebrahimtimothy m fraylingsusan m ringbridget knightsian ellardkatharine r owenrachel m freathyhana langodebbie a lawlorlon r cardonjohn r b perryjeffrey c barrettandrew d morrisgraham a hitmankatherine s elliottulla soviomark i mccarthydavid melzeralex s f doneyandrew r nessyoav ben-shlomoandrew t hattersleyann-marie patchnicholas j timpsonnigel w raynermark walkermichael n weedonruth j f loosfredrik karpein_s barrosoluigi ferruccichristopher j grovescecilia m lindgrenbeverley shields}
533,408198.0,the parvalbumin-positive interneurons in the mouse dentate gyrus express gabaa receptor subunits 1 _2 and  along their extrasynaptic cell membrane.,eng,neuroscience,neuroscience,1873-7544,254.0,-1.0,12/19/13,80-96,{h h_gerw sieghartt klausbergeri milenkovicm vasiljevicd maurer}
534,30272.0,glial cells in amyotrophic lateral sclerosis.,eng,0093-934x,0305-1862,1090-2430,-1.0,-1.0,5/22/14,1/14/06,{t philipsj d rothstein}
535,623367.0,diagnosing acute cardiac ischemia in the emergency department: a systematic review of the accuracy and clinical effect of current technologies.,eng,annals of emergency medicine american college of emergency physician's research forum,ju-seong kimdong-seok kimeun-kyung parkkyu-won shim,0196-0644,37.0,5.0,1/1/05,453-60,{j p ioannidisj lauc milchd salemp w chewn terrine m balk}
536,13408.0,eczema - quiz.,eng,paediatrics & child health,paediatr child health,1918-1485,5.0,8.237489616055598,3/1/00,105,{null}
537,449003.0,{ramune grambaiteanders m fjelltormod fladbykristine b walhovdvidar stensetivar reinvang},english,al sayed hussain asaheb sharif-askari nsulaiman saal-mulla aatabatabai ssaheb sharif-askari f,or. international society for technology in education eugenebjorn norstrom,chandra y. and bains sujeev s. and egede leonard e. osborn,0.0,0.0,1058-0832,-,eng
538,299297.0,employing a youth-led adult-guided framework: why drive high? social marketing campaign.,eng,family & community health,hanan f khafagymona m hassanemad s osmanfaten m el-shanawanyabdel rahman m fathallahyasser m samhangehan g el-fandy,eng,34.0,4.0,1/11/10,319-330,{terry-lynne markotyler watt}
539,302268.0,review of handbook for working with children and youth: pathways to resilience across cultures and contexts,english,cns drugs,1526-7598,245-8,264.2765447430734,3.0,1/6/01,230-232,{robert j. flynn}
540,592663.0,helicobacter pylori antibiotic resistance patterns and genotypes in adult dyspeptic patients from a regional population in north wales,eng,aktuelle traumatologie,617-22,m p reillys kuchig furness,54.0,2.0,1/4/01,435-40,{a. m. walkerj. xerryk. daviesn. c. elvissr. j. owen}
541,520843.0,sonographically guided biopsy of focal lesions: a comparison of freehand and probe-guided techniques using a phantom.,eng,ajr. american journal of roentgenology,ajr am j roentgenol,0361-803x,743.3785362237077,5.0,1/5/05,1652-6,ger
542,460786.0,splinting osseointegrated implants and natural teeth in partially edentulous patients: a systematic review of the literature. [review],english,eng,1/1/88,teaching medical student geriatrics competencies in 1 week: an efficient model to teach and document selected competencies using clinical and community resources,0.0,0.0,so young leejay l. brand,1361-6560,{null}
543,866131.0,long-term subcutaneous recombinant interleukin-2 as maintenance therapy: biological effects and clinical implications,eng,cancer biotherapy,mehak bhatiashaun k morrisprabhat jhawilson suraweerajayadeep patracyril patraprakash c gupta,1062-8401,10.0,3.0,chi,195-203,{v. lorussom. de lenam. guidam. correalei. abbatea. latorrea. casamassimam. d. musci}
544,3801405.384515799,0340-2592,189-196,diabetes and other comorbidities in breast cancer survival by race/ethnicity: the california breast cancer survivorship consortium (cbcsc),am j phys med rehabil,1468-5833 (electronic),329.0,7462.0,1/4/01,e315-6,{s. a. frenchm. storyp. j. hannan}
545,436781.0,hoarse voice in adults: an evidence-based approach to the 12 minute consultation.,english,eng,1/1/88,teaching medical student geriatrics competencies in 1 week: an efficient model to teach and document selected competencies using clinical and community resources,0.0,0.0,1058-0832,the cost of depression-complicated alcoholism: health-care utilization and treatment effectiveness,{null}
546,796900.0,chronic compartment syndrome an important cause of work-related upper limb disorder,ger,rheumatology (oxford),rheumatology (oxford england),1462-0324,44.0,11.0,1/5/01,1442-6,{j. p. heathr. l. williamsm. h. pritchard}
547,1908085.7364498705,sleep sleep-dependent procedural learning and vigilance in chronic cocaine users: evidence for occult insomnia,1/6/12,andreas krusemanh hung nguyen,pt,245-8,82.0,3.0,1/6/01,238-49,{r. t. malisone. f. pace-schottv. coricp. t. morganr. stickgoldz. h. sahul}
548,893227.0,a screening methodology for crowdsourcing video qoe evaluation,the value of routine radiography in patients with knee osteoarthritis consulting primary health care: a study of agreement,european respiratory journal,ju-seong kimdong-seok kimeun-kyung parkkyu-won shim,stuart calverjulia nicholsrachel c1  - frn systematiska _versikter -s_kningen cn  - cinahl db  - c8h do  - 10.1179/1743288x12y.0000000021 dp  - ebscohost chester,0.0,0.0,1/14/01,19th congress of the european hematology association milan italy. conference start: 20140612 conference end: 20140615. conference publication: (var.pagings). 99 (pp 233),{e. anegekuh l. sun l. ifeachor}
549,525874.0,potential for inter-observer and intra-observer variability in x-ray review to establish stone-free rates after lithotripsy.,eng,j. urol.,r r van rijns g f robben,0022-5347,147.0,3.0,3/1/92,559-62,{d carons j witchellm a jewette l st louisr r grayc bombardiers kumrak e psihramism r ryan}
550,26475.0,situating universal design architecture: designing with whom?,eng,disability and rehabilitation,disabil rehabil,1464-5165,-1.0,-1.0,7/28/14,dut,{paul jones}
551,476191.0,endovascular treatment of ruptured large or wide-neck basilar tip aneurysms associated with moyamoya disease using the stent-assisted coil technique.,eng,journal of stroke and cerebrovascular diseases : the official journal of national stroke association,j stroke cerebrovasc dis,1532-8511,-1.0,-1.0,7/24/15,362-9,{yibin fangpengfei yangjianmin liuyi xuqinghai huangwenyuan zhaodongwei daiyan chen}
552,719389.0,{marie-pierre gagnonclaude sicotte_dith-romy nsangousonya grenierjulie payne-gagnon},421-6 435 434,games and economic behavior,american journal of health-system pharmacy : ajhp : official journal of the american society of health-system pharmacists,0899-8256,67.0,2.0,1/9/01,408-427,{k. seol. g. epstein}
553,467318.0,the fundamental role of bone morphogenetic protein 15 in ovarian function and its      involvement in female fertility disorders.,english,eng,1/1/88,teaching medical student geriatrics competencies in 1 week: an efficient model to teach and document selected competencies using clinical and community resources,0.0,0.0,1058-0832,1361-6560,{null}
554,268361.0,giant-cell tumour of the knee: the condition of the cartilage after treatment by curettage and cementing,eng,j bone joint surg br,health facil manage,0301-620x (print) 0301-620x,89.0,3.0,1/7/01,361-5,{k. jonssona. rydholmi. kristianssond. heinegardf. v. von steyernp. mannfolk}
555,664795.0,diagnostic accuracy of endoscopic ultrasound-guided fine-needle aspiration for solid pancreatic lesion: a systematic review.,eng,journal of cancer research and clinical oncology,j. cancer res. clin. oncol.,1432-1335,138.0,9.0,1/12/09,1433-41,{hangcheng zhourenbao yangjiong chenyunlian xiayin lu}
556,102180.0,safety tolerability and sustained weight loss over 2 years with the once-daily human glp-1 analog liraglutide.,eng,j clin psychiatry,int j obes (lond),1476-5497,36.0,6.0,international journal of oral & maxillofacial implants,843-54,{r carrarom f rasmussenl niskanena harpern finers r_ssnerm kunesoval van gaalm e j leana astrupa rissanenm j savolainen[collective name] nn8022-1807 investigators}
557,258486.0,web-based nutrition education intervention improves self-efficacy and self-regulation related to increased dairy intake in college students,english,0361-803x,girault grose rjweinstein jnball pahanscom bfanciullo gj,0377-208x,110.0,11.0,1/10/01,1723-7,{kathy w hosigsharon m nickols-richardsonkavita h poddarsusan e duncaneileen s anderson}
558,961081.0,three abstracts on chinese research,eng,american acupuncturist,m radererc gedlickaa lenauerd depischw scheithauerb schneeweissw fiebigerf langg v kornekb sch_ll,1520-7714,63.0,0.0,1/13/01,25-26,{null}
559,233052.28290554823,603-10,eng,genereviews(r),0195-668x,circ. j.,0.0,350.0,1/1/98,26-39,{m. runkelj. blump. m. rommens}
560,2946594.993591534,ieee transactions on nuclear science,eng,engfre,alcoholism clinical and experimental research,0145-6008,20.0,7.0,10/1/96,1173-8,{v hesselbrocka w deckel}
561,812757.0,development of a snp genotyping panel and a medical decision support algorithm to predict drug response in schizophrenia,a performance improvement process to tackle tachysystole,klinik psikofarmakoloji bulteni,klin.psikofarmakol.bul.,ieee trans nucl sci,21.0,0.0,1/11/01,s156-s157,{y. a. song. ustunkarm. a. dokeh. a. domy. y. tuncel}
562,713518.0,elderly and physical activity: benefits and challenges in search for life quality.,eng,journal of nursing ufpe / revista de enfermagem ufpe,rev enfermagem ufpe,1981-8963,6.0,11.0,1/12/11,journal of pain research,{gerlane ngela da costa moreiradenyse dutra alencar vasconcelosamanda costa de freitascarla cristina braga maranhodanielle figueiredo patricio}
563,701610.3775071208,neighbourhood characteristics and mortality in the atherosclerosis risk in communities study,eng,critical care nurse,0167-2789 do  - http://dx.doi.org/10.1016/j.physd.2013.07.012,m p reillys kuchig furness,33.0,0.0,1/4/01,398-407,1282-9
564,828214.0,transference-focused psychotherapy v. treatment by community psychotherapists for borderline personality disorder: randomised controlled trial.,eng,the british journal of psychiatry : the journal of mental science,br j psychiatry,1472-1465,196.0,5.0,david n mainegenevieve e courpasjames f wellerjeffrey m richmanandrew j rowlingsonchristopher l wu,randomized double-blind placebo-controlled trial of the 5-ht1a receptor antagonist azd7371 tartrate monohydrate (robalzotan tartrate monohydrate) in patients with irritable bowel syndrome,{philipp martiusanna buchheimpeter buchheimsusanne h_rzmichael rentropcord beneckepeter schustermelitta fischer-kernstephan doering}
565,176160.0,the changing residential environments of older people,english,al sayed hussain asaheb sharif-askari nsulaiman saal-mulla aatabatabai ssaheb sharif-askari f,e004623,osteoid osteoma in a 16-year-old boy presenting with atrophy of the left thigh: diagnostic difficulties.,0.0,0.0,predicting infection in localized intraabdominal fluid collections: value of ph and po2 measurements.,207-220,{basta beard beard beel-bates bierman bowling cagney calkins carder carlsson chan clark clarke cutchin cutler davidoff diehl doty durrett feldman foote freedman gaugler gitlin gitlin glass golant golant golant golant golant golant golant grafova gross hunt alleystephen m. golant}
566,677752.0,a systematic review of the surgical treatment of large incisional hernia.,eng,hernia : the journal of hernias and abdominal wall surgery,hernia,1248-9204,19.0,4.498250747513432,1/15/02,89-101,{l timmermansj c sliekerj f langee b deerenbergj jeekeld p hogerzeilp h c eilers}
567,537381.3925699985,fast-food habits weight gain and insulin resistance (the cardia study): 15-year prospective analysis.,eng,m. thomase. fairholmen. nicholsm. george,1/8/01,1474-547x,365.0,9453.0,1/5/01,36-42,{david r jacobsdavid s ludwigcara b ebbelingalex i kartashovmartha l slatterylinda van hornmark a pereira}
568,804059.9079549891,early prenatal survival in relation to the parental environment in sheep: a review,eng,2/8/07,british medical bulletin,0921-4488,29.0,9.192573921943328,6/29/98,143-156,{e decuyperee dewild vanmontforth michels}
569,708911.0,changing tides: improving outcomes through mentorship on all levels of nursing,1/13/10,r schwarzj ernstm zengere br_hlerr schmidt,girault grose rjweinstein jnball pahanscom bfanciullo gj,ge h.-y.fernndez-de-las-peas c.yue s.-w.,176.6189425815679,6.920908801015677,1/10/01,163-176,{j. skeest. k. race}
570,621640.0,tracking cognitive decline in alzheimer's disease using the mini-mental state examination: a meta-analysis.,257-264,international psychogeriatrics / ipa,int psychogeriatr,1041-6102,12.0,8.762948151649438,6/1/00,231-47,{j mccuskerf primeaum colel hanf bellavance}
571,647583.0,jul-64,engpor,361-5,tur,1806-3756,37.0,4.0,1/11/07,544-55,{ana maria baptista menezesdavid alejandro gonzlezelaine cardozo macedopedro curi hallalmaria de ftima maiamarli knorstsamuel carvalho dumithjeovany mart_nez-mesaricardo bica noalfernando csar wehrmeisterjos roberto jardim}
572,361080.0,the impact of nursing case management on women with diabetes in pregnancy,eng,int j stroke,s nadeauf malouinb.j mcfadyen,0884-2175,41.0,0.0,1/12/01,s131-2,pt
573,283168.0,[pharmacotherapy for conduct disorder in children and adolescents],am j obstet gynecol,harefuah,-7518,-4473,151.0,7.0,1/12/01,421-6 435 434,{t. levyy. bloch}
574,52633.0,monteggia lesions in adults. a multicenter bota study,eng,genereviews(r),eur j appl physiol occup physiol,1827-1618,62.0,0.0,1/1/96,english; abstract language:english,{w. de grooted. stoffelenk. govaertsp. reyndersp. l. broosj. rondia}
575,74821.0,progesterone receptor progins and +331g/a polymorphisms confer susceptibility to ovarian cancer: a meta-analysis based on 17 studies.,eng,chronic pain-associated behaviors in the nursing home: resident versus caregiver perceptions,tumour biol.,1423-0380,35.0,3.0,1/14/03,2427-36,{xinran wangchenhuan dinglilan chenshu liting liuxia yinyou wangxiangjun sunwen dihe li}
576,373015.0,gene analysis of steroid 5 alpha-reductase 1 in hyperandrogenic women,eng,croatian medical journal,croat.med.j.,the prevalence and age-related characteristics of pain in a sample of women veterans receiving primary care,46.0,4.0,1/5/01,664-669,{b. heljicr. komeli. eminovicf. gavrankapetanovicj. prezeljj. karamehic}
