ID,id,article_title,article_language,journal_title,jounral_abbreviation,journal_issn,article_jvolumn,article_jissue,article_jcreated_at,article_pagination,author_list
720,771288.0,manual versus electric vacuum aspiration for first-trimester abortion: a systematic review,eng,bjog,bjog : an international journal of obstetrics and gynaecology,1470-0328 (print) 1470-0328,115.0,1.0,1/8/01,13-may,{f. dengj. wenq. y. caiy. p. li}
721,54202.0,behaviour research and therapy outcome predictors in guided and unguided self-help for social anxiety disorder,e??ng,pediatrics,acta cytol.,0036-8148 0036-8148,50.0,1.0,1/12/01,13-21 do  - 10.1#016/j.brat.2011.10.009,{o e havikp carlbringl g _stt nordgreeng anderssont furmark}
722,888477.0,probiotics for the treatment of upper and lower respiratory-tract infections in children: systematic review based on randomized clinical trials,en%g,j pediatr (rio j),jornal de pediatria,1537-7385,91.0,5.0,1/15/01,413-27,{m. h. de oliveira juniore. s. sarinhog. v. de araujod. m. peixoto}
723,741279.0,#bradykinin is a mediator but unlikely a trigger of antiarrhythmic effects of ischemic pr%econditioning,3.1338317310260075,journal of cardiovascular electrophysiology,j. cardiovasc. electrophysiol.,4.423802072433887,18.0,1.0,1/7/01,93-99 7p,{s. v. driamovs. butzp. t. buserc. e. zauggm. bellahcene}
724,64430.0,the nadph oxidase-mediated production of hydrogen peroxide (h(2)o(2)) and resistance to oxidative stress in the necrotrophic pathogen alternaria alternata of citrus.,eng,critical reviews in oncology/hematology,mol. plant pathol.,1364-3703,66.07120214564472,8.0,1/12/10,900-14,{siwy ling yangkuang-ren chung}
725,461657.0,review of epidemiology and management of atrial fibrillation in developing countries.,4.501125315427946,3.7892214420447843,4.791116378696318,3.126855503550444,0.0,0.0,5.761941767219031,10-10 st  - csm2004 best platform-,{null}
726,240949.0,william h. taft high school project hola 1985-1986. oea evaluation report.,en#g,clin obstet gynecol,jama,0098-7484,nan,0.0,1/1/86,105-18,{brooklyn. office of educational assessment. new york city board of education}
727,453909.0,the lung cancer management guidelines 2012.,4.501125315427946,3.7892214420447843,4.791116378696318,3.126855503550444,0.0,0.0,5.761941767219031,10-10 st  - csm2004 best platform-,{null}
728,222452.0,special problems in the prosthetic rehabilitation of deep bite,4.876412102046271,nan,5.809593625510875,nan,nan,2.0,1/1/75,170-5,{r. voss}
729,163839.0,the potential impact of bias in studies of residential exposure to magnetic fields and childhood leukemia,5.387567846928951,bioelectromagnetics,bioelectromagnetics,1521-186x,0.0,9.0,1/1/01,s32-47,{null}
730,696132.0,changes of interaction during the development of a mathematical learning environment.,3.806242048574163,journal of mathematics teacher education,4.300132872919115,1386-4416 1386-4416,nan,5.0,1/11/10,393-411,{dirk.hoek@ou.nl hoek dirk1koeno2 gravemeijer}
731,875781.0,[new aspects in hernia surgery].,en#g,journal of consulting and clinical psychology,vet clin pathol,apr-74,44.0,0.0,1/14/01,1947-1963,ann j. turnerdavid h. l. olsoncarole y. schornagelmary halsdorfelaine a. blechman
732,332032.0,air pollution and risk of urinary bladder cancer in a case-control study in spain,3.1338317310260075,occupational and environmental medicine,occup environ med,1470-7926,65.0,1.0,1/8/01,1257-66,{nuria malatsalfredo carratomanolis kogevinasnathaniel rothmanconsol serrareina garcia-closasdebra silvermanadonina tardonkenneth p. cantormustafa dosemecigemma castano-vinyalsroel vermeulen}
733,617801.0,remission rates following antidepressant therapy with bupropion or selective serotonin reuptake inhibitors: a meta-analysis of original data from 7 randomized controlled trials.,english,j. clin. psychiatry,kekkaku,0160-6689,66.0,8.0,1/5/08,974-81,e h choyd l scottp a scottg h kingsleyc m smith
734,480030.0,pathophysiology of paradoxical embolism: evaluation of the role of interatrial septum anatomy based on the intracardiac echocardiography assessment of patients with right-to-left shunting.,eng,neurol res,jrsm open,1423-0356,25.0,1.0,1/14/01,172-82,{c. jahanchahic. c. tookb. c. ujangd. p. mandic}
735,660499.0,pathophysiology of paradoxical embolism: evaluation of the role of interatrial septum anatomy based on the intracardiac echocardiography assessment of patients with right-to-left shunting.,eng,violencia contra a crianca: revelando o perfil dos atendimentos em servicos de emergencia brasil 2006 e 2007.,pediatr ann,1678-4464,25.0,1.0,1/9/01,28-jul,{marlos rodrigues dominguesana claudia gastal fassamaria laura vidal carret}
736,355078.0,effect of a cooling hood on physiological responses to work in a hot environment,eng,birth,4.881855145274935,1523-536x,29.0,1.0,1/1/70,jun-74,{m. c. klein}
737,696985.0,the diversion of ultram ultracet and generic tramadol hcl.,4.876412102046271,journal of addictive diseases,j addict dis,1545-0848,25.0,2.0,1/6/01,1127-33,h. oshimak. kobayashit. yamamotom. kasaic. fukayay. katayama
738,826471.0,aberrances in autonomic cardiovascular regulation in fibromyalgia syndrome and their relevance for clinical pain reports,3.806242048574163,psychosomatic medicine,psychosom med,0033-3174,72.0,5.0,1/10/01,462-70,{sergio garridoangeles pulgarstefan duschekmar_a mart_n-vzquezgustavo a reyes del paso}
739,807737.0,sorafenib and pegylated interferon-alpha-2b in advanced metastatic melanoma: a multicenter phase ii decog trial,german,j. clin. oncol.,j. clin. oncol.,0732-183x,108.36303985352603,15.0,nan,nan,{ugurel s.schadendorf d.garbe c.trefzer u.egberts f.hassel j.weichenthal m.hauschild a.mauch c.gutzmer r.}
740,875781.0,dispersal of methicillin-resistant staphylococcus epidermidis by staff in an operating suite for thoracic and cardiovascular surgery: relation to skin carriage and clothing,eng,annals of medicine,the journal of hospital infection,0195-6701 (print) 0195-6701,44.0,2.0,1/#1@@0/01,119-26,{p. domicela. tammeline. stahlea. hambraeus}
741,322953.0,psychometric validation of the growth and empowerment measure (gem) applied with indigenous australians,4.891871826399603,mycoses,the journal of hospital infection,apr-74,44.0,9.0,1/#1@@0/01,791-799,{komla tseymelissa r haswelllyndon reillydavid kavanaghchris doranarlene laliberteandrew wilsonyvonne cadet-james}
742,123731.0,alveolar soft part sarcoma of the uterine corpus. report of two cases and review of the literature,eng,nan,jrsm open,nan,194.0,1.0,nan,59-63,{k. radiga. roessnerp. buhtz}
743,180588.0,it's time practitioners help families clear the air of secondhand smoke: a commentary on pyle et al. (2005),@@englis%h,nephrology dialysis transplantation : official publication of the european dialysis and transplant association - european renal association,pediatrics,1433-3023,23.0,0.0,1/5/01,275-287,{geoffrey c. williamsbai brownson difranza gehrman glantz law mokdad ory panagiotakos pechacek pyle sargent sweda whincup whitlock arcavi}
744,440684.0,hemostatic resuscitation for massive bleeding: the paradigm of plasma and platelets - a review of the current literature.,5.387567846928951,3.7892214420447843,4.367463521245488,3.126855503550444,0.0,10.0,5.761941767219031,10-10 st  - csm2004 best platform-,{null}
745,758629.0,studies on the biological activity of two strains of bcg: influence of production conditions.,eng,dev. biol. stand.,jama,0301-51??49,58.0,-1.0,1/1/86,105-18,{m chouchkovaa engibarov}
746,964184.0,myocardial fibrosis by t1 mapping is an early indicator of severe cardiac allograft vasculopathy,#engli%sh,circulation,circulation,22-sep,128.0,22.0,1/13/01,2826-34,{n. harcourts. c. masrim. colving. raveendran}
747,265490.0,follistatin-like protein 1 regulates chondrocyte proliferation and chondrogenic differentiation of mesenchymal stem cells,4.472073455700364,ann rheum dis,annals of the rheumatic diseases,mar-67,66.0,0.0,nan,3.364328043322405,{s. m. smitha. d. marinovr. hirschd. s. bushnellb. t. campfieldh. c. blairy. chaly}
748,463556.0,a literature review on chronic pain: the daily overcoming of a complex problem.,4.501125315427946,3.7892214420447843,4.791116378696318,3.126855503550444,0.0,0.0,5.761941767219031,10-10 st  - csm2004 best platform-,{null}
749,749844.0,insights in public health: taxing sugar sweetened beverages to improve public health: policy action in hawai'i. doctoral health policy seminar spring 2013,english,hawaii j med public health,hawai'i journal of medicine & public health : a journal of asia pacific medicine & public health,2165-8242,72.0,8.0,1/1/00,286-91,{t. sentellt. usagawam. hagiwarat. peacockh. hee heom. g. pearcel. choym. r. dela cruz}
750,300057.0,[evidence-based therapy guideline of the german working group on obesity in childhood and adolescence].,ger,bundesgesundheitsblatt gesundheitsforschung gesundheitsschutz,bund@@esgesundheits$blatt gesundheitsforschung gesundheitsschutz,0301-4738,54.0,5.0,1/13/08,584-90,{m wabitscha mossd kunze}
751,166521.0,neighbourhood characteristics and mortality in the atherosclerosis risk in communities study,eng,5.300526151791504,5.749025541993366,0019-5499,nan,0.0,1/4/01,10-10 st  - csm2004 best platform-,{r. cn  - pubmed da  - feb dp  - nlm et  - 2004/03/05 boyle}
752,292018.0,simple steps to fitness. secrets of strength. strength training is as important to weight loss and fitness as aerobic exercise is but many people ignore it. here's how to get started.,eng,diabetes forecast,diabetes forecast,0095-8301,55.0,8.0,1/2/08,98--100,{shauna s roberts}
753,181456.0,homeplace and housing in the lives of low-income urban african american families,@@englis%h,4.218992148958063,4.791116378696318,4.263067770861669,0.0,0.0,1/5/01,166-188,{linda m. burtonaltman bullard burton burton burton burton burton clark conley dilworth-williams fischer foucault franklin gieryn gilbert goering hooks howard kidder lahiri lawson clark lawson clark lawson clark low massey oliver perkins rosenbaum rosenbaum sanders stack allansherri lawson clark}
754,668772.0,pharmacological treatments for obsessive-compulsive disorder in children and adolescents: a qualitative review.,eng,biomedical reports,@@actas @@esp psiquiatr,2049-9434,1.0,3.0,1/13/05,464-468,{yan-yan liyun qianchuan-wei zhou}
755,276001.0,[@@effects of tobacco advertising regul#ations in various countries],3.4999363613280146,nihon koshu eisei zasshi,[nihon koshu eisei zasshi] japanese journal of public health,0546-1766 (print) 0546-1766,42.0,12.0,1/1/95,1017-28,{t. sone}
756,788507.0,intensive glucose control in the management of diabetes mellitus and inpatient hyperglycemia,#engli%sh,am j health syst pharm,american journal of health-system pharmacy : ajhp : official journal of the american society of health-system pharmacists,1079-2082 (print) 1079-2082,67.0,10.0,1/6/11,798-805,{s. b. levya. o. shogbon}
757,620483.0,primary cutaneous large b-cell lymphoma of the legs: a distinct clinical pathologic entity treated with cd20 monoclonal antibody (rituximab).,english,oncology nursing forum,blood rev.,0190-535x,28.0,26.17538989821812,1/1/06,815-22,d m aboulafia
758,433039.0,palliative sedation therapy in the last weeks of life: a literature review and recommendations for standards.,4.501125315427946,3.7892214420447843,4.791116378696318,3.126855503550444,0.0,0.0,5.761941767219031,10-10 st  - csm2004 best platform-,{null}
759,737167.0,understanding depression in palliative and end-of-life care,3.4999363613280146,nurs stand,nursing standard (royal college of nursing (great britain) : 1987),1433-3023,23.0,12.0,1/8/10,1763-9,{s. ashelfordv. taylor}
760,744601.0,inhaled anticholinergics and risk for acute urinary retention: a case-crossover and case-time-control study,korean,value health,physiother. theory pract.,09#593985 (issn),17.0,7.0,1/1/01,a776,{dilokthornsakul p.joo m.j.lee t.a.pickard a.s.lin f.j.}
761,856471.0,compartmentalization of fas and fas ligand may prevent auto- or paracrine apoptosis in epithelial cells,eng,neurol res,neurological research,1062-3264 (print)     1062-3264,284.0,6.0,1/3/01,283-90,{w. hunzikerk. h. tan}
762,570704.0,rituximab-related viral infections in lymphoma patients.,eng,leukemia & lymphoma,j sports sci,1042-8194,48.0,7.0,1/7/07,1307-12,{saadettin kilickapomer dizdarsercan aksoyibrahim baristahakan harputluoglukadri altundagdidem sener dede}
763,520153.0,fetal lung volume measurements: determination with mr @@imaging--e??ffect of various factors.,eng,radiology,radiology,0033-????8419,240.0,1.0,1/6/07,187-93,{carol e barnewolthiroto hatabumizuki nishinodeborah levinehenry a feldmanjudy a estroffvalerie l ward}
764,259267.0,intra-operative change of gastric ph during laparotomic cholecystectomy under general anaesthesia: a prospective case-control study,en#g,indian journal of psychiatry,acta cytol.,978-1-2673-2110-7,56.0,0.0,1/12/01,40%-4#3,{s. deyp. bhatt%acharyyab. k.?? biswasb. bhattaraip. bhakta}
765,24381.0,the care guidelines: consensus-based clinical case reporting guideline development.,eng,applied nursing research : anr,headache,1526-4610,53.0,9.0,1/13/11,1541-7,{[collective name] care groupjoel j gagnierdavid moherdouglas g altmangunver kienledavid rileyharold sox}
766,509496.25435198506,effect of a creative-bonding intervention on taiwanese nursing students' self-transcendence and attitudes toward elders.,eng,res nurs health,scand. cardiovasc. j.,1651-2006,118.22731875037793,10.269028126178563,1/9/04,204-16,{sandra m walshshiue chen}
767,2081657.6238448918,fc receptor-like 3 (fcrl3) -169 c/t polymorphism and systemic lupus erythematosus: a meta-analysis.,en#g,3.7892214420447843,4.588688260483328,3.1824097833541924,0.0,0.0,1/1/78,10-10 st  - csm2004 best platform-,{null}
768,482860.0,[indirect anastomoses for moyamoya disease].,jpn,no shinkei geka. neurological surgery,aids,0301-2603,26.0,9.0,$11/13/12,1219-1220,{y matsushima}
769,18298.0,ulcer healing after peripheral intervention.,eng,experimental neurology,cathete#r cardiovasc interv,1347-4820,-1.0,-1.0,4/14/07,6-jan,{daiki uchidayukihiro saitohisashi uchidaatsuhiro koyanobuyoshi azuma}
770,365654.0,measuring the bright side of being blue: a new tool for assessing analytical rumination in depression.,eng,plos one,plos one,1932-6203,9.0,11.0,1/14/01,e112077,{skye p barbicpaul w andrewszachary durisko}
771,625306.0,[mammographic density: a valid risk factor for breast cancer?].,fre,prvention de l'insuffisance rnale induite par les produits de contrnste iodes,the journal of bone and joint surgery. british volume,0221-03?#?63,89.0,9.0,1/7/01,#1140-50,{g boutet}
772,2402820.0980893457,high-dose sequential (hds) chemotherapy for high-risk non-hodgkin's lymphoma: long-term analysis and future developments.,e%n??g,ann. hematol.,neurosurg,093$9-55#55,334.3791986298136,-1.0,1/1/01,b123-6,{m ladettod caracciolog rossic marinonel berguia cutticaa salomonem boccadoroi riccac tarellam paganof zalliop gavarottia pileria de crescenzo}
773,513630.0,core symptom measures in cancer clinical trials.,eng,journal of the national cancer institute,j. natl. cancer inst.,1460-2105,106.0,7.0,1/1#4/07??,1078-87,{carolyn gotay}
774,663339.0,human papillomavirus infection and increased risk of hiv acquisition. a systematic review and meta-analysis.,eng,aids (london england),aids,1473-5571,26.0,17.0,$11/13/12,2211-22,{chunhui wangrichard hayeslouise kuhnstephen shiboskijennifer s smithnatasha l larkedeborah watson-jonescatherine f houlihanpatti e gravittkaren k smith-mccune}
775,718292.0,prevalence of different morphologic forms of the human tongue in young finns.,3.806242048574163,oral surgery oral medicine and oral pathology,oral surg. oral med. oral pathol.,0030-4220,53.0,7.0,2/1/82,152-6,{m mikkonenr kotilainena kullaa-mikkonen}
776,245200.0,osteoporosis in men,eng,arch intern med,movement disorders : official journal of the movement disorder society,0003-9926 (print) 0003-9926,158.0,350.0,1/1/98,194,{m. galus}
777,307302.0,neurolymphatische bahnen: neue wissenschaftliche nachweise untermauern die perrin-technik,4.876412102046271,feminist legal studies,5.809593625510875,1873-5592,14.0,2.0,1/13/06,15-oct,c. corettic. napolig. loverom. t. montagnag. caggianog. scarafileo. de giglio
778,217418.0,reproduction of excursive tooth contact in an articulator with computerized axiography data,%eng,wiener medizinische wochenschrift,j. hypertens.,0929-693x,13.0,4.0,1/1/97,190-192,{z. hirschfeldi. brina. fuksm. guelmann}
779,413717.0,magnetic resonance imaging evaluation of bone marrow changes in obstructive sleep apnoea syndrome in adults,english     italian,mcneill mathematics program,j. hypertens.,0929-693x,346.9712104446051,4.0,1/6/01,572-84,{a. r. aleandrid. mancinit. cosentinir. le donnen. colavita}
780,62246.0,pulpal response to a fluoride-releasing all-in-one resin bonding system.,eng,operative dentistry,j. clin. oncol.,0361-7734,27.0,3.0,1/2/05,271-7,{masayuki otsukimakoto arakawahidekazu sonodayasutaka sasafuchiyuichi kitasakojunji tagami}
781,945021.0,improvement of action tremor by chronic cortical stimulation,eng,mov disord,movement disorders : official journal of the movement disorder society,0885-3185,13.0,1.0,1/1/98,aug-84,{b. pollinc. genyj. p. nguyenp. cesaroa. feve}
782,649817.0,validity of rorschach inkblot scores for discriminating psychopaths from non-psychopaths in forensic populations: a meta-analysis.,4.876412102046271,psychological assessment,psychol assess,1939-134x,22.0,2.0,1/10/0??6,156-9,{scott o lilienfeldkeli holloway allenhoward n garbjessica l wildermuthm teresa nezworskijames m wood}
783,934327.0,[case management for moderate-need patients and recovery: what can we learn from experimental and quasi-experimental studies?]. [review] [french],4.501125315427946,3.7892214420447843,4.791116378696318,5.194901227996846,0.0,0.0,3.1497061383299556,-,{nct01893931 }
784,2416339.8062343104,the effects of pre-reading and sharing mechanisms on learning with the use of annotations,4.876412102046271,turkish online journal of educational technology - tojet,emerg radiol,@@1303-6521,45.79714188916266,2.0,1/11/04,2$3$4-249,{wu-yuin hwangguo-liang hsu}
785,917231.0,cognitive impairment and risk of cardiovascular events and mortality.,ita,patologie asbesto correlate @@in congiunti di lavorator%i del settore cemento-amianto.,endocrinology,1592-7830,34.0,3.0,1/12/07,266-8,hanan f khafagymona m hassanemad s osmanfaten m el-shanawanyabdel rahman m fathallahyasser m samhangehan g el-fandy
786,887418.0,impact of crizotinib on patient-reported symptoms and global quality of life (qol) compared with chemotherapy in a phase iii study of advanced alk-positive non-small cell lung cancer (nsclc),#engli%sh,european journal of cancer,physiol res,0098-4108 (print)     0098-4108 (linking),49.0,0.0,1/13/01,544-7 st  - recurrent distal 16q duplication and terminal 22q deletion: prenatal diagnosis and genetic counseling-,{v. hirshj.y. hanf. blackhalls. iyerd.w. kima. shawa. reismank. wilnerh. nokiharab. besse}
787,2503250.3058211617,a systematic review and meta-analysis of trials of treatment of depression from india,english,indian journal of psychiatry,acta cytol.,0954-3007,56.0,0.0,1/2/07,29-38,{s. sarkars. grover}
788,63738.0,[the use of ethonium paste in the treatment of deep dental caries].,4.876412102046271,stomatologiia,stomatologiia (mosk),0039-1735,50.0,2.0,3/1/71,13-21 do  - 10.1#016/j.brat.2011.10.009,{p k shestakov}
789,519287.0,reporting methods in studies developing prognostic models in cancer: a review.,en#g,bmc medicine,bmc med,1741-7015,8.0,0.0,1/10/01,20-20,{patrick roystonrachel waterssusan mallettdouglas g altmansusan dutton}
790,97795.0,hospital discharge after ambulatory knee arthroscopy: a comparison of epidural 2-chloroprocaine versus lidocaine,e??ng,applied nursing research : anr,neurosurg,0033-8389 do  - http://dx.doi.org/10.1016/j.rcl.2010.07.015,26.0,1.0,1/1/01,35-40,ana paula de lima ferreiramarcelo de souza figueiroabrbara bernardo rinaldo da silvaktia roberta rapso sales lacerda
791,155127.0,p16(ink4) expression is not associated with human papillomavirus in oral lichen planus.,e$ng,oral surgery oral medicine oral pathology and oral radiology,oral surg oral med oral pathol oral radiol,2212-4411,118.0,22.748979388644063,1/14/12,39-44,{lucio montebugnoliluca morandiluca scapoliannalisa palmieridavide b gissimaria pia foschiniilaria manelli}
792,100986.0,association of bleeding mortality and sex in acute coronary syndromes: the missing triangle.,eng,journal of cardiovascular medicine (hagerstown md.),j cardiovasc med (hagerstown),1558-2035,nan,nan,9/23/14,447-55,{rossana de palmapaolo ortolanicaterina caminitiemilia solinaspi$era angelica merlinidiego ardissinogiorgia paolimaria francesca notarangelopaolo guastarobaantonio marzocchiluigi vignaliroxana mehranantonio manari}
793,166179.0,[severe exposure to environmental lead in a child population in antofagasta chile],4.876412102046271,exposicion severa a plomo ambiental en una poblacion infantil de antofagasta chile.,5.809593625510875,0034-9887,752.5756177959202,2.0,1/1/00,221-32,{i. delgadoj. vega}
794,740811.0,thoracic aortic aneurysm: reading the enemy's playbook,#engli%sh,critical care nurse,front hum neurosci,-10475,33.0,5.0,1/13/01,203-277,elefteriades j.a.
795,nan,monitoring of fluid changes in hospitalized malnourished guatemalan children using bioelectrical impedance spectroscopy (bis).,eng,applied radiation and isotopes : including data instrumentation and methods for use in agriculture industry and medicine,appl radiat isot,0969-8043,266.6341478950815,5.0,5/1/98,nan,{c pithanm mazariegosn w solomonsp f_rst}
796,658981.0,preliminary state of development of prediction models for primary care physical therapy: a systematic review.,eng,journal of epidemiology and community health.,j clin epidemiol,1878-5921,65.0,12.0,1/12/12,1257-66,{martijn w heymanstobias van den berghan j r anemalieke van oortbart w koesarianne p verhagenriekie h c w de vet}
797,215650.0,bruxismo em crian_as bruxism in children,pt,current opinion in pharmacology,5.809593625510875,-14400,3.0,2.0,1/1/95,182-195,{ronaldo fazziana estela haddadmaria salete nahs pires corr_a}
798,521132.0,a cadaver model to evaluate the accuracy and reproducibility of plain radiograph step and gap measurements for intra-articular fracture of the distal radius.,eng,j hand surg am,the journal of hand surgery,0363-5023,113.55682822390202,5.0,1/4/09,841-7,{jeff knightjeffery m smiththomas e trumblewren v mccallister}
799,nan,13th ieee/acm symposium on distributed simulation and real-time applications ds-rt 2009,en#g,nan,4.47330905729938,nan,nan,0.0,nan,nan,nan
800,366275.0,early and late mortality in hospitalised patients with raised cardiac troponin t.,eng,european journal of preventive cardiology,eur j prev cardiol,2047-4881,19.0,1042.0,1/12/08,42-53,{maarten j postmapetros pechlivanogloujelena stevanovic}
801,513630.0,pan-canadian study of mammography screening and mortality from breast cancer.,eng,journal of the national cancer institute,j. natl. cancer inst.,1460-2105,476.941318299913,11.0,1/14/11,1078-87,{jennifer paynerukshanda ahmadgregory doylenorm phillipsanna m chiarellichristine wilsonkathleen deckerandrew coldmanbin zhangjacques brisson}
802,605423.0,alcohol-related morbidity and mortality.,3.1338317310260075,alcohol research & health,4.761951185274798,1535-7414,27.0,1.0,1/3/01,39-51,{j%_rgen rehmgerhard gmelmaurizio trevisanchristopher t sempos}
803,495319.0,clinical outcome following icd removal. the bilitch registry group,eng,journal of neurocytology,the journal of th??e oklahoma state med??ical association,4.263067770861669,16.0,0.0,1/1/93,138-52 st  - the cost of depression-complicated alcoholism: health-care utilization and treatment effectiveness-,{s. furmand. t. kawanishis. l. song}
804,733752.0,eliciting relative preferences for two methods of colorectal cancer screening,@@englis%h,european journal of cancer care,prevent$ive medicine,0961-5423,nan,2.0,1/5/01,124-31,{e. j. frewj. l. wolstenholmed. k. whynes}
805,252118.0,bilingual speech: bilateral control?,3.1338317310260075,brain and language,chin.j.evid.-based med.,0093-934x,15.0,1.0,1/1/82,125-142,{h.m. sus@@smanp. franklint. simon}
806,903817.0,tiao-she nursing of traditional chinese medicine for mild cognitive disorder: an assessment of clinical evidence,%eng,chin. j. evid.-based med.,chin.j.evid.-based med.,1672-2531,15.0,10.269028126178563,1/8/06,346-352,{li x.-h.li g.-c.xie y.-l.shang h.-c.chi k.-l.jin y.-h.}
807,24381.0,one-pot semisynthesis of exon 1 of the huntingtin protein: new tools for elucidating the role of posttranslational modifications in the pathogenesis of huntington's disease.,eng,angewandte chemie (international ed. in english),angew. chem. int. ed. engl.,1521-3773,53.0,7.0,10/14/02,1928-33,{annalisa ansa$lonijae sun jeongfrancesco simone ruggerigiovanni dietlerzhe-ming wanghila@@l a lashuel}
808,385163.0,pathophysiology of paradoxical embolism: evaluation of the role of interatrial septum anatomy based on the intracardiac echocardiography assessment of patients with right-to-left shunting.,eng,cardiology in the young,cardiol young,1467-1107,25.0,1.0,1/15%/01,47-55,{gianl@@uca rigatellipaolo cardaiolimassimo giordanashesh buchlaura olivadobrin vassilievaravinda nanjiundappafabio dell'avvocataramesh daggubatidario adami}
809,645061.0,impact of physical abuse on adulthood depressive symptoms among women.,eng,issues ment health nurs,4.881855145274935,1096-4673,29.0,3.0,1/8/03,130-4,{hanan al-modallalann pedendebra anderson}
810,164721.0,food allergy in children,#engli%sh,das mikorklima der wohnungen und seine hygienische normierung.,endod dent traumatol,0049-8610,13.0,10.0,10/2/06,756-60,e. bidat
811,730721.0,prediction study of complications after severe trauma,4.501125315427946,pediatrics,acta cytol.,978-1-2673-2110-7,0.0,0.0,1/12/01,25,{nct01713205 }
