ID,id,article_title,article_language,journal_title,jounral_abbreviation,journal_issn,article_jvolumn,article_jissue,article_jcreated_at,article_pagination,author_list
539,302268.0,review of handbook for working with children and youth: pathways to resilience across cultures and contexts,english,scandinavian journal of gastroenterology,5.588695488040236,0301-4215,47.0,3.0,1/6/01,230-232,{@@robert j. flynn%}
540,592663.0,helicobacter pylori antibiotic resistance patterns and genotypes in adult dyspeptic patients from a regional population in north wales,??en@@g,aktuelle traumatologie,bundesgesundheitsblatt gesundheitsforschung gesundheitsschutz,0301-4738,54.0,2.0,1/4/01,435-40,{a. m. walkerj. xerryk. daviesn. c. elvissr. j. owen}
541,520843.0,sonographically guided biopsy of focal lesions: a comparison of freehand and probe-guided techniques using a phantom.,eng,ajr. american journal of roentgenology,ajr am j roentgenol,0361-803??x,184.0,5.0,1/5/05,1652-6,{duncan m brookspramit m phalrory wolfe}
542,460786.0,splinting osseointegrated implants and natural teeth in partially edentulous patients: a systematic review of the literature. [review],4.936392422017943,3.555387623201737,4.240067506736971,4.030052022391779,0.0,0.0,1/1/98,4.884338177331462,{null}
543,866131.0,long-term subcutaneous recombinant interleukin-2 as maintenance therapy: biological effects and clinical implications,4.215306854415128,cancer biotherapy,br j clin pharmacol,1062-8401,10.0,3.0,1/1/95,195-203,{v. lorussom. de lenam. guidam. correalei. abbatea. latorrea. casamassimam. d. musci}
544,751811.0,school soft drink intervention study,5.642169045922457,bmj,clin cardiol,1468-58%33 (electronic),329.0,7462.0,1/4/01,e315-6,{s. a. frenchm. storyp. j. hannan}
545,436781.0,hoarse voice in adults: an evidence-based approach to the 12 minute consultation.,4.936392422017943,3.555387623201737,4.240067506736971,4.030052022391779,0.0,0.0,1/1/98,4.884338177331462,{null}
546,796900.0,chronic compartment syndrome an important cause of work-related upper limb disorder,3.4844308116822496,rheum$$atology (oxford),rheumatology (oxford england),1462-0324,44.0,11.0,1/5/01,1442-6,{j. p. heathr. l.?? williamsm. h. pritchard}
547,491837.0,sleep sleep-dependent procedural learning and vigilance in chronic cocaine users: evidence for occult insomnia,english,european journal of endocrinology,eur j radiol,-4928,82.0,16.27288643476703,1/6/01,238-49,{r. t. malisone. f. pace-schottv. coricp. t. morganr. stickgoldz. h. sahul}
548,893227.0,a screening methodology for crowdsourcing video qoe evaluation,%@@eng,3.555387623201737,3.0690797688349623,3.2760903094688096,0.0,0.0,@@1/14/01,5.451196253126643,{e. anegekuh l. sun l. ifeachor}
549,525874.0,potential for inter-observer and intra-observer variability in x-ray review to establish stone-free rates after lithotripsy.,eng,j. urol.,acta cytol.,0022-5347,147.0,3.0,3/1/92,559-62,{d carons j witchellm a jewette l st louisr r grayc bombardiers kumrak e psihramism r ryan}
550,26475.0,situating universal design architecture: designing with whom?,eng,disability and rehabilitation,disabil reha%b#il,1464-5165,-1.0,-3.3002806325713583,7/28/14,6-jan,{paul jones}
551,476191.0,endovascular treatment of ruptured large or wide-neck basilar tip aneurysms associated with moyamoya disease using the stent-assisted coil technique.,eng,journal of stroke and cerebrovascular diseases : the official journal of national stroke association,j stroke cerebrovasc dis,1532-8511,-1.0,-1.0,7/24/15,362-9,{yibin fangpengfei yangjianmin liuyi xuqinghai huangwenyuan zhaodongwei daiyan chen}
552,719389.0,subjective states: a more robust model,3.0917865410548266,games and economic behavior,american journal of health-system pharmacy : ajhp : official journal of the american society of health-system pharmacists,0899-8256,67.0,2.0,1/9/01,408-427,{k. seol. %g. epstein}
553,467318.0,the fundamental role of bone morphogenetic protein 15 in ovarian function and its      involvement in female fertility disorders.,4.936392422017943,5.635223177792644,4.240067506736971,4.030052022391779,0.0,0.0,1/1/98,4.884338177331462,{null}
554,268361.0,giant-cell tumour of the knee: the condition of the cartil@@age after treatment by curettage and cementing,en%g,j bone joint surg br,the journal of bone and joint surgery. british volume,0301-620x (print) 0301-620x,89.0,3.0,1/7/01,361-5,{k. jonssona. rydholm%i. kristianssond. heinegardf. v. von steyernp. mannfolk}
555,664795.0,diagnostic accuracy of endoscopic ultrasound-guided fine-needle aspiration for solid pancreatic lesion: a systematic review.,en%g,journa@@l of cancer research and clinical o$ncology,j. cancer res. clin. oncol.,1432-1335,138.0,9.0,1/12/09,1433-41,{hangcheng zhourenbao yangjiong chenyunlian xiayin lu}
556,102180.0,safety tolerability and sustained weight loss over 2 years with the once-daily human glp-1 analog liraglutide.,eng,inter#national journal of obesity (2005),int j obes (lond),1476-5497,36.0,6.0,1/12/06,843-54,{r carrarom f rasmussenl niskanena harpern finers r_ssnerm kunesoval van gaalm e j leana astrupa rissanenm j savolainen[collective name] nn8022-1807 investigators}
557,258486.0,web-based nutrition education intervention improves self-efficacy and self-regulation related to increased dairy intake in college students,english,focus on alternative and complementary therapies,4.75075082081165,3.6872371745360817,110.0,11.0,1/10/01,1723-7,{kathy w hosigsharon m nickols-richardsonkavita h poddarsusan e duncaneileen s anderson}
558,961081.0,three abstracts on chinese research,%@@eng,american acupuncturist,cancer immunol. immunother.,1520-7714,63.0,0.0,1/13/01,25-26,{null}
559,52681.0,retrograde nailing of humeral shaft fractures,eng,5.6075224753440915,3.3204860886499814,3.2311424032013587,0.0,350.0,1/1/98,26-39,{m. runkelj. blump. m. rommens}
560,828156.0,behavioral and cognitive measurements predict scores on the mast: a 3-year prospective study.,e%n#g,alcohol clin exp res,alcoholism clinical and experimental research,0145-6008,20.0,7.0,10/1/96,@@11??73-8,{v hesselbrocka w deckel}
561,812757.0,development of a snp genotyping panel and a medical decision support algorithm to predict drug response in schizophrenia,%@@eng,klinik psikofarmakoloji bulteni,klin.psikofarmakol.bul.,1017-7833,21.0,0.0,1/11/01,s156-s157,{y. a. song. ustunkarm. a. dokeh. a. domy. y. tuncel}
562,713518.0,elderly and physical activity: benefits and challenges in search for life quality.,3.4844308116822496,journal of nursing ufpe / revista de enfermagem ufpe,rev enfermagem ufpe,1981-8963,6.0,11.0,1/12/11,2761-2769 9p,{gerlane ngela da costa moreiradenyse dutra alencar vasconcelosamanda costa de freitascarla cristina braga maranhodanielle figueiredo patricio}
563,180977.0,neighbourhood characteristics and mortality in the atherosclerosis risk in communities study,%@@eng,5.975682294113428,3.1210255201718633,0019#-5%499,166.19596527868225,0.0,1/4/01,398-407,{l. n. borrellk. roseb. l. clarkd. catelliera. v. d. roux}
564,828214.0,transference-focused psychotherapy v. treatment by community psychotherapists for borderline personality disorder: randomised controlled trial.,eng,the british journal of psychiatry : the journal of mental science,br j psychiatry,1472-1465,196.0,21.04918775580738,1/10/05,389-95,{philipp martiusanna buchheimpeter buchheimsusanne h_rzmichael rentropcord beneckepete@@r schustermelitta fischer-kernstephan doeri@@ng}
565,176160.0,the changing residential environments of older people,%@@eng,health technology assessment database,4.369898923850038,3.2311424032013587,0.0,0.0,1/11/01,207-220,{basta beard beard beel-bates bierman bowling cagney calkins carder carlsson ??chan clark clarke cutc@@hin cutler davidoff diehl doty durrett feldman foote freedman gaugler gitlin gitlin glass golant golant golant golant golant golant golant grafova gross hunt alleystephen m. golant}
566,3070762.736209635,a systematic review of the surgical treatment of large incisional hernia.,eng,hernia : the journal of hernias and abdominal wall surgery,hernia,1248-9204,19.0,1.0,1/15/@@02,89-101,{l timmermansj c sliekerj f langee b deerenbergj jeekeld p hogerzeilp h c eilers}
567,107417.0,fast-food habits weight gain and insulin resistance (the cardia study): 15-year prospective analysi$s.,eng,lancet,lancet,1@@474-547%x,365.0,9453.0,1/5/01,36-42,{david r jacobsdavid s ludwigcara b ebbelingalex i kartashovmartha l slatterylinda van hornmark a pereira}
568,141282.0,early prenatal survival in relation to the parental environment in sheep: a review,3.444503323183033,small ruminant research,j anesth,0921-4488,29.0,2.0,6/29/98,143-156,{e decuyperee dewild vanmontforth michels}
569,708911.0,changing tides: improving outcomes through mentorship on all levels of nursing,3.0917865410548266,critical care nurse,4.75075082081165,3.6872371745360817,33.0,2.0,1/10/01,163-176,{j. skeest. k. race}
570,621640.0,tracking cognitive decline in alzheimer's disease using the mini-mental state examination: a meta-analysis.,eng,international psychogeriatrics / ipa,int psychogeriatr,1041-6102,12.0,9.201944050139938,6/1/00,231-47,{j mccuskerf primeaum colel hanf bellavance}
571,647583.0,pulmonary rehabilitation programs for patients with copd.,engpor,jornal brasileiro de pneumologia : publicacao oficial da sociedade brasileira de pneumologia e tisilogia,rev bras ter intensiva,1806-3756,37.0,4.0,1/11/07,544-55,{ana maria baptista menezesdavid alejandro gonzlezelaine cardozo macedopedro curi hallalmaria de ftima maiamarli knorstsamuel carvalho dumithjeovany mart_nez-mesaricardo bica noalfernando csar wehrmeisterjos roberto jardim}
572,361080.0,the impact of nursing case management on women with diabetes in pregnancy,4.666393469244249,jognn: journal of obstetric gynecologic & neonatal nursing,actas esp psiquiatr,0884-2175,41.0,0.0,1/12/01,s131-2,{corinn taylor}
573,283168.0,[pharmacotherapy for conduct disorder in children and adolescents],heb,harefuah,environ monit assess,1573-2959,151.0,7.0,1/12/01,421-6 435 434,{t. levyy. bloch}
574,189213.71747021526,monteggia lesions in adults. a multicenter bota study,eng,basic rights: subsistence affluence and u.s. foreign policy,eur j appl physiol occup physiol,1827-1618,62.0,0.0,1/1/96,78-83,{w. de grooted. stoffelenk. govaertsp. reyndersp. l. broosj. rondia}
575,74821.0,progesterone receptor progins and +331g/a polymorphisms confer susceptibility to ovarian cancer: a meta-analysis based on 17 studies.,eng,tumour biology : the journal of the international society for oncodevelopmental biology and medicine,tumour biol.,1423-0380,35.0,3.0,1/14/03,2427-36,{xinran wangchenhuan dinglilan chenshu liting liuxia yinyou wangxiangjun sunwen dihe li}
576,373015.0,gene analysis of steroid 5 alpha-reductase 1 in hyperandrogenic women,$jp%n,croat%ian medical# journal,croat.med.j.,0353-9504,46.0,4.0,1/5/01,664-669,{b. heljicr. komeli. eminovicf. gavrankapetanovicj. prezeljj. karamehic}
577,2277235.502494511,intravenous insulin treatment in acute stroke: a systematic review and meta-analysis of randomized controlled trials.,eng,international journal of stroke : official journal of the international stroke society,int j stroke,1747-4949,9.0,4.0,1/14/06,489-93,{p michelv papavasileioug ntaiosa bargiotak makaritsis}
578,574242.0,hospitalized heart failure patients with preserved vs. reduced     ejection fraction in dubai united arab emirates: a prospective     study,english,european journal of heart failu#re,eur. j. heart fail.,1879-0844,16.0,4.0,1#/1@@4/01,454-460,{al sayed hussain asaheb sharif-askari nsulaiman saal-mulla aatabatabai ssaheb sharif-askari f}
579,4500544.068063224,multiple endocrine neoplasia type 1 with multiple leiomyomas linked to a novel mutation in the men1 gene,english,yonsei medical journal,yonsei med.j.,1976-2437,49.0,4.0,1/8/01,655-661,{h. choie. s. kangs. k. lims. y. jeongh. c. leeh. j. kims. kimy. rheey. h. leej. h. moonk. r. kimc. w. ahnb. s. chae. j. lee}
580,919014.0,[anesthetic gases exposure: findings from a 13 year environmental and biological monitoring in a hospital company].,ita,patologie asbesto correlate in congiunti di lavoratori del settore cemento-amianto.,j s#ports sci,1592-7830,29.0,3.0,1/7/07,411-3,{m a sanchezs ritzuv capellip boccalong arcangeli}
581,494428.0,out-of-hospital cardiac arrests occurring in southern ontario health care clinics: bystander cardiopulmonary resuscitation and automated external defibrillator use.,eng,canadian family physician medecin de famille canadien,can fam physician,1715-5258,56.0,26.229266939671703,1/10/06,e213-8,{karen k???? lamsteven c brookslaurie j morrison}
582,55809.0,diffusion tensor imaging of deep gray matter in children treated for brain malignancies.,eng,child's nervous system : chns : official journal of the international society for pediatric neurosurgery,childs nerv syst,1433-0350,30.0,4.0,1/14/04,631-8,{anna nideckersiamak ardekanie mark mahonefirouzeh tannazijarunee intrapiro$mkulmoody wharamlarry j brantalena horsk}
583,368651.0,a randomized controlled trial of paracetamol versus morphine for the treatment of acute painful crisis of sickle cell disease,3.5393777833661146,american indian and alaska native mental health research: the journal of the national center,5.333219630946499,4.843525634494215,20.0,5.0,1/13/01,#s%149,{r. rehmani}
584,423691.0,puberty suppression in adolescents with gender identity disorder: a prospective follow-up study,english,journal of sexual medicine,3.004357918601092,0899-6210,8.0,8.0,1/11/01,2276-83,{t. a. doreleijersp. t. cohen-kettenisa. l. de vriest. d. steensma}
585,1803915.550241328,a meta-analysis of clinical trials comparing mirtazapine with selective serotonin reuptake inhibitors for the treatment of major depressive disorder.,%@@eng,3.555387623201737,4.240067506736971,4.030052022391779,0.0,0.0,5.576078403082564,4.884338177331462,{null}
586,407245.0,group physiotherapy provides similar outcomes for participants after joint replacement surgery as 1-to-1 physiotherapy: a sequential cohort study.,eng,archives of physical medicine and rehabilitation,arch phys med rehabil,1532-821x,506.18290981662034,10.0,1/9/10,1727-33,{corinne l coulterjennie m scarvelljeanie m weber}
587,918698.0,sevoflurane postconditioning converts persistent ventricular fibrillation into regular rhythm.,eng,european journal of anaesthesiology,eur j anaesthesiol,1365-2346,26.0,9.0,1/9/09,766-71,{fengjiang zhanggang chenmin yancongcong chen}
588,209138.0,frontal and sagittal plane analyses of the stair climbing task in healthy adults aged over 40 years: what are the challenges compared to level walking?,#eng#lish,clinical biomechanics,3.159289387227015,0268-0033 do  - http://dx.doi.org/10.1016/j.clinbiomech.2015.03.009,18.0,10.0,1/3/12,950-959,{s nadeauf malouinb.j mcfadyen}
589,862844.0,dpyd ivs14+1g>a and 2846a>t genotyping for the prediction of severe fluoropyrimidine-related toxic#ity: a meta-analysis,3.4844308116822496,pharmacogenomi#cs,pharmacogenomics,1462-%#2416,14.0,11.0,1/13/01,1255-1272,{r. danesis. terrazzinop. l. canonicoa. a. genazzanis. cargninm. del re}
590,3879940.0151987425,[methicillin-resistant staphylococcus aureus forming the fried egg appearance colonies isolated from a patient with septicemia],jpn,rinsho byori,rinsho byori. the japanese journal of clinical pathology,0047-$1860 (print)     0047-1@@860,43.0,10.0,1/1/95,1061-5,{k. iij??imaa$. tanimotoy. kitagakim. hiurah. fujiwaras. ikawa}
591,587683.0,support for nutrition from the older americans ac$t programs: a clarification on its 40th anniversary,eng,j nutr gerontol geriatr,journal of nutrition in gerontology and geriatrics,1088-0224,154.61498151149476,1.0,1/13/01,mar-81,{j. l. lloyd}
592,927711.0,measures of exposure to the well london phase-1 intervention and their association with health well-being and social outcomes,%@@eng,journal of epidemiology & community health,3.384573107435167,0143-005x,68.0,22.66851564670883,1/14/01,597-605,{c. bottomleyk. locks. laisa. clowg. yur. lyncha. rentong. phillipsm. petticrewa. draperp. tobie. schmidtr. hayesd. moore}
593,313584.0,the effects of cognitive coaching and nonverbal classroom management on teacher efficacy and perceptions of school culture.,english,5.6075224753440915,3.3204860886499814,3.2311424032013587,0.0,0.0,1/1/98,53,{jennifer l. edwardscherie a. lyonsmarcia e. swordsmary s. rogerskathy e. green}
594,161847.0,changes in glucose tolerance over% time in women with polycy??stic ovary syndrome: a controlled study,e??ng,int. j. radiat??. oncol. biol. phys.,4.560625571128496,0360-3016,90.0,0.0,1/5/01,3236-42 st  - changes in glucose tolerance over time in women with polycystic ovary syndrome: a controlled study-,{a. da  - jun do  - jc.2004-1843 [pii] 10.1210/jc.2004-1843 [doi] dp  - nlm et  - 2005/03/31 dunaifa. r. kunselmanr. s. legroc. l. gnatuk}
595,543292.0,effects of test administrator characteristics on achievement test scores,%@@eng,online submission,3.0690797688349623,978-957-41-6666-4,0.0,0.0,1/5/04,-,{maria papapolydoroutaslima rahmanwilliam d. schaferlori parker}
596,248064.0,distal radius fracture arthroscopic intraarticular displacement measurement after open reduction and internal fixation from a volar approach,eng,j orthop sci,journal of orthopaedic science : official journal of the japanese orthopaedic association,0949-2658 (print) 0949-2658,15.0,4.0,1/10/01,502-8,{t. katayamak. furutam. akahaneh. onor. fujitani}
597,887041.0,age-related driving disorders: screening in hospitals and outpatients settings.,eng,geriatr gerontol int,ge??riatrics & gerontology international,1447-0594,10.0,16.07916860671066,1/#10/10,288-94,{kevin patrickjill rybarlinda hillsara bairdraul coimbrasusanna concha-garcia}
598,314737.0,[effect of a dialysis solution with icodextrin on ultrafiltration and selected metabolic parameters in patients treated with peritoneal dialysis],en??glish,3.0331685541294418,neurorehabilitation,1523-536x,141.0,9.0,1/2/01,281-5,{s. opatrnap. stehlikj. racekjr. opatrny k.v. senftf. sefrnao. topolcan}
599,709094.0,evidence based practice and advanced competencies in a mhs-cls program,en#g$,3.5349301780168387,3.004357918601092,5.00107724302775,24.0,12.304748934756988,1/11/01,4-47-53,{l. pretlowa. ranneb. kraje. k. leibachb. russell}
600,327157.0,effect of qva149 on lung volumes and exercise tolerance in copd patients: the bright study,$jp%n,respiratory medicine,epilepsy res.,0033-@@35#49,108.0,4.0,1/14/01,584-92,{jutta beierpeter d'andreamichelle henleystephanie kornkai-michael beehdonald banerjidalal jadayel}
601,793206.0,disseminated lymphoma with large granular lymphocyte morphology diagnosed in a horse via abdominal fluid and transtracheal wash cytology.,eng,veterinary clinical pathology / american society for veterinary clinical pathology,vet clin pathol,1939-165x,44.0,3.0,1/15/09,437-41,{fernanda cesaranne a wooldridgecinzia mastrorillipete w christophersonkellye joiner}
602,361682.0,outcome of patients with severe ph due to lung disease with     and without targeted therapy,english,cardiovascular therapeutics,photomed laser surg,1557-8550,32.0,5.0,1/14/01,202-208,{seiler ibaron marzt mpfeifer mlange tj}
603,732256.0,a comprehensive assessment of maternal deaths in argentina: translating multicentre collaborative research into action.,engl#ish,bulletin of the world health organization,bull.who,0042-9686,85.0,8.0,1/7/08,615-622 8p,{romero mmercer rramos skarolinski a}
604,636937.0,human african trypanosomiasis diagnosis in first-line health services of endemic countries a systematic review.,e$ng#,plos neglected tropical diseases,4.369898923850038,1935-2735,6.0,11.0,1/12/01,??e19@@19,{victor kandeepco haskerveerle lejonjean-jacques muyembepatrick mitashimarleen boelaertpascal lutumba}
605,743394.0,overlap of food addiction and substance use disorders definitions: analysis of animal and human studies.,eng,neuropharmacology,neuropharmacology,1873-7064,85.0,-1.0,1/14/10,81-90,{antoine hone-blanchetshirley fecteau}
606,592201.0,efficacy of prolonged administration of intravenous erythromycin in an ambulatory setting as treatment of severe gastroparesis: one center's experience,eng,int j gynaecol obstet,international journal of gynaecology and obstetrics: the official organ of the international federation of gynaecology and obstetrics,5.845546034390029,28.0,2.0,1/1/99,131-4,{e. m. quigleyj. k. dibaise}
607,914007.0,bound for success: a systematic review of constraint-induced movement therapy in children with cerebral palsy supports improved arm and hand use (structured abstract),4.815499589408784,physical therapy,phys ther,0031-9023,447.42549204480434,11.0,1/9/01,1126-1141,{h. h. huangj. halel. fettersa. mcbride}
608,208824.0,optical turbulence: weak turbulence condensates and collapsing filaments in the nonlinear schr_dinger equation,$engl%ish,physica d: nonlinear phenomena,3.2879320664997804,0167-2789 do  - http://dx.doi.org/10.1016/j.physd.2013.07.012,57.0,1.0,6/15/92,96-160,{v.e. zakharovs. dyachenkoa.c. newella. pushkarev}
609,759501.0,[progress in joint international research of demographic and geographic distribution of insignificant middle and high-grade tuberculin skin sensitivity].,ger,zeitschrift fr erkrankungen der atmungsorgane mit folia bronchologica,z erkr atmungsorgane folia bronchol,0044-2631,133.0,5.049550187296166,12/1/70,99-$106,{m a bleiker}
610,506162.0,efficacy of class 1 elastic compression stockings in the early stages of chronic venous disease. a comparative study.,eng,int. angiol.,atheroscler suppl,0392-9590,22.0,4.0,1/3/12,383-92,{f vinf a allaertj p benignis sadoun}
611,372697.0,the future of jak inhibition in myelofibrosis and beyond,3.5393777833661146,blood reviews,blo@@od rev.%,0268-960x,28.0,5.0,1/14/09,189-196,{r.a. mesan.c.p. crossj.o. mascarenhas}
612,609245.0,reinventing the wheel? or the emperor's new clothes.,eng,j altern complement med,journal of alternative and comple#mentary medicine (new york n.y.),1075-5535,9.0,5.0,1/3/10,613-5,{george vithoulkasmenachem oberbaumshepherd singerrobbert van haselen}
613,584706.0,a study of out-of-hospital cardiac arrests in northeastern minnesota,eng,jama,jama,0098-7484,256.0,4.0,1/1/86,477-83,{g. s. mcdonaldj. w. bachmanp. c. o'brien}
614,822897.0,the chinese medicine construct stagnation in mind-body connection mediates the effects of mindfulness training on depression and anxiety,5.360768843755093,complementary therapies in medicine,5.333219630946499,0969-4900,21.0,4.0,1/13/01,348-357,{k. f. lams. m. ngb. h. p. lauh. h. m. loc. l. w. chan}
615,145770.0,outcomes from patients with multi-vessel disease following primary pci: staged pci imparts very low mortality.,eng,catheterization and cardiovascular interventions : official journal of the society for cardiac angiography & interventions,catheter cardiovasc@@ interv,1522-726x,77.0,5.0,1/11/04,617-22,{gilles mo#ntalescotgordon fitzgeraldkurt g barringhaus[collective name] grace investigatorsfrans van de werfjoel m goredavid d mcmanusjos l_pez-send_nphilippe gabriel stegkay lee park}
616,24026.0,modelling the effects of subjective and objective decision making in scientific peer review.,eng,nature,nature,1476-4687,506.0,7486.0,6/14/02,jun-93,{marcus r munaf_mike w peaceyin-uck park}
617,44484.0,exercise-induced flow limitation dynamic hyperinflation and exercise capacity in patients with bronchial as??thma.,eng,the european respiratory journal,eur. respir. j.,0903-1936,24.0,3.0,1/4/09,378-84,{a polychronakich roussosa koutsoukoui dimitroulisj milic-emilin g koulouriss retsoue n kosmasm gaga}
618,379988.0,the combined role of serotonin and interleukin-6 as biomarker for autism,3.016709118872358,nan,3.1210255201718633,nan,284.0,0.0,1/22/15,290-296,{y.-j. dux.-m. zhub. sangc.-j. yangc.-l. liu}
619,333862.0,general ??public's and physicians' perception of health risk associated with radon exposure in the state of azad jammu and kashmir,4.604427677262659,public health nursing (boston mass.),pub$li$c health nurs,0737-1209,25.0,4.0,1/8/01,327-35,{muhammad rafiquem. ikram shahzadshahida jabeen}
620,779555.0,cost-effectiveness of statins for primary prevention in patients newly diagnosed with type 2 diabetes in the netherlands,engli%sh,value in health,public health nutr,0196-6553,17.0,2.0,1/14/01,223-230,{s. t. visserm. j. postmap. denigf. m. de vriese. hak}
621,323860.0,women's sexuality in the south african constitutional court,english,feminist legal studies,annales francaises d'anesthesie et de reanimation,09663622 (issn),14.0,3.0,1/6/01,391-406,{e. bonthuys}
622,646572.0,[medical and psychosocial care needs of cancer patients: a systematic review comparing urban and rural provisions].,ger,impfstoffe: akzeptanz und sicherheit.,nan,1439-4413,135.0,31.0,1/10/08,15#31-7,{r schwarzj ernstm zengere br_hlerr schmidt}
623,128182.0,a randomized double-blind placebo controlled triphosphate in study of oral adenosine subacute low back pain,eng,cardiovascular therapeutics,5.062448528745811,1098-240x,32.0,0.0,1/5/01,1114-7 st  - a randomized double-blind placebo controlled triphosphate in study of oral adenosine subacute low back pain-,{m. rossignolf. a. allaertb. bannwarthj. p. c1  - frn rct-s_kningen cn  - pubmed da  - jun dp  - nlm et  - 2005/06/09 valats. rozenbergb. avouac}
624,1308641.1279967944,efficacy and safety of nmda receptor antagonists augmentation therapy for schizophrenia: an updated meta-analysis of randomized placebo-controlled trials,4.52909313086916,journal of psychiatric research,5.333219630946499,0022-3956,204.8165099255203,12.0,1/13/01,2018-2020,{yuki matsudataro kishinakao iwata}
625,231933.0,taste olfactory and food texture reward processing in the brain and obesity,$jp%n,international journal of obesity,4.369898923850038,$0893-133x,35.0,4.0,1/11/01,550-561,{e. t. rolls}
