ID,id,article_title,article_language,journal_title,jounral_abbreviation,journal_issn,article_jvolumn,article_jissue,article_jcreated_at,article_pagination,author_list
738,3186657.0841054367,aberrances in autonomic cardiovascular regulation in fibromyalgia syndrome and their relevance for clinical pain reports,eng,psychosomatic medicine,psychosom med,0033-3174,72.0,5.0,1/10/01,462-70,{sergio garridoangeles pulgarstefan duschekmar_a mart_n-vzquezgustavo a reyes del paso}
739,807737.0,sorafenib and pegylated interferon-alpha-2b in advanced metastatic melanoma: a multicenter phase ii decog trial,eng,j. clin. oncol.,blood rev.,0732-183x,28.0,15.0,1/1/04,1/7/05,{ugurel s.schadendorf d.garbe c.trefzer u.egberts f.hassel j.weichenthal m.hauschild a.mauch c.gutzmer r.}
740,875781.0,0045-4850,eng,j hosp infect,the journal of hospital infection,0195-6701 (print) 0195-6701,44.0,2.0,4/1/90,j am geriatr soc,retrovirus-mediated wasp gene transfer corrects wiskott-aldrich syndrome t-cell dysfunction.
741,322953.0,psychometric validation of the growth and empowerment measure (gem) applied with indigenous australians,eng,australian and new zealand journal of psychiatry,girault grose rjweinstein jnball pahanscom bfanciullo gj,apr-74,44.0,40.99061014948994,1/10/01,791-799,{komla tseymelissa r haswelllyndon reillydavid kavanaghchris doranarlene laliberteandrew wilsonyvonne cadet-james}
742,123731.0,alveolar soft part sarcoma of the uterine corpus. report of two cases and review of the literature,eng,mov disord,science and engineering ethics,0885-3185,194.0,1.0,1/1/98,59-63,{k. radiga. roessnerp. buhtz}
743,180588.0,it's time practitioners help families clear the air of secondhand smoke: a commentary on pyle et al. (2005),eng,0020-7454,c k naspitzj o warner,circ. j.,23.0,0.0,1/5/01,25-29,{geoffrey c. williamsbai brownson difranza gehrman glantz law mokdad ory panagiotakos pechacek pyle sargent sweda whincup whitlock arcavi}
744,440684.0,hemostatic resuscitation for massive bleeding: the paradigm of plasma and platelets - a review of the current literature.,48-57; quiz 58 60,eng,jpn,teaching medical student geriatrics competencies in 1 week: an efficient model to teach and document selected competencies using clinical and community resources,0.0,0.0,1/1/74,d cioffij holloway,{null}
745,758629.0,studies on the biological activity of two strains of bcg: influence of production conditions.,medical teacher,dev. biol. stand.,nan,0301-5149,328.8123910564126,-4.721182748680287,epilepsy res.,105-18,{m chouchkovaa engibarov}
746,964184.0,myocardial fibrosis by t1 mapping is an early indicator of severe cardiac allograft vasculopathy,1475-925x,circulation,circulation,22-sep,490.42380825365063,22.0,1/13/01,750-758 9p,{n. harcourts. c. masrim. colving. raveendran}
747,265490.0,follistatin-like protein 1 regulates chondrocyte proliferation and chondrogenic differentiation of mesenchymal stem cells,eng,ann rheum dis,annals of the rheumatic diseases,mar-67,0.0,0.0,1/14/01,1296-304,{s. m. smitha. d. marinovr. hirschd. s. bushnellb. t. campfieldh. c. blairy. chaly}
748,463556.0,structural brain changes associated with antipsychotic treatment in schizophrenia      as revealed by voxel-based morphometric mri: an activation likelihood estimation       meta-analysis.,english,eng,1/1/88,teaching medical student geriatrics competencies in 1 week: an efficient model to teach and document selected competencies using clinical and community resources,0.0,0.0,1058-0832,1361-6560,{null}
749,749844.0,insights in public health: taxing sugar sweetened beverages to improve public health: policy action in hawai'i. doctoral health policy seminar spring 2013,1892-900,hawaii j med public health,hawai'i journal of medicine & public health : a journal of asia pacific medicine & public health,2165-8242,72.0,8.0,1/13/01,0033-8419,{t. sentellt. usagawam. hagiwarat. peacockh. hee heom. g. pearcel. choym. r. dela cruz}
750,300057.0,[evidence-based therapy guideline of the german working group on obesity in childhood and adolescence].,ger,bundesgesundheitsblatt gesundheitsforschung gesundheitsschutz,bundesgesundheitsblatt gesundheitsforschung gesundheitsschutz,1437-1588,54.0,5.0,1/11/05,development of a snp genotyping panel and a medical decision support algorithm to predict drug response in schizophrenia,{m wabitscha mossd kunze}
751,166521.0,the cost of national service frameworks,eng,aktuelle traumatologie,e. anegekuh l. sun l. ifeachor,m p reillys kuchig furness,65.0,0.0,1/4/01,68-9 st  - the cost of national service frameworks-,journal of hand surgery (edinburgh scotland)
752,292018.0,simple steps to fitness. secrets of strength. strength training is as important to weight loss and fitness as aerobic exercise is but many people ignore it. here's how to get started.,eng,diabetes forecast,diabetes forecast,0095-8301,55.0,8.0,1/2/08,98--100,{shauna s roberts}
753,181456.0,homeplace and housing in the lives of low-income urban african american families,english,actas urol esp,c k naspitzj o warner,chandra y. and bains sujeev s. and egede leonard e. osborn,0.0,0.0,1/5/01,166-188,{linda m. burtonaltman bullard burton burton burton burton burton clark conley dilworth-williams fischer foucault franklin gieryn gilbert goering hooks howard kidder lahiri lawson clark lawson clark lawson clark low massey oliver perkins rosenbaum rosenbaum sanders stack allansherri lawson clark}
754,668772.0,400-405,effects of test administrator characteristics on achievement test scores,biomedical reports,biomed rep,2049-9434,5.605037754578401,3.0,1/13/05,1930-7381,{yan-yan liyun qianchuan-wei zhou}
755,276001.0,[effects of tobacco advertising regulations in various countries],jpn,nihon koshu eisei zasshi,[nihon koshu eisei zasshi] japanese journal of public health,{s. deyp. bhattacharyyab. k. biswasb. bhattaraip. bhakta},42.0,12.0,1/1/95,1017-28,{t. sone}
756,788507.0,intensive glucose control in the management of diabetes mellitus and inpatient hyperglycemia,421-6 435 434,am j health syst pharm,american journal of health-system pharmacy : ajhp : official journal of the american society of health-system pharmacists,1079-2082 (print) 1079-2082,67.0,10.0,1/10/01,798-805,{s. b. levya. o. shogbon}
757,620483.0,the value of breast self-examination: meta-analysis of the research literature.,eng,oncology nursing forum,oncol nurs forum,0190-535x,28.0,5.0,1/1/06,815-22,{y l ku}
758,2379223.895937269,palliative sedation therapy in the last weeks of life: a literature review and recommendations for standards.,english,eng,1/1/88,teaching medical student geriatrics competencies in 1 week: an efficient model to teach and document selected competencies using clinical and community resources,0.0,0.0,1058-0832,1361-6560,{null}
759,737167.0,understanding depression in palliative and end-of-life care,en,nurs stand,nursing standard (royal college of nursing (great britain) : 1987),0029-6570 (print) 0029-6570,23.0,12.0,1/5/01,48-57; quiz 58 60,{s. ashelfordv. taylor}
760,744601.0,inhaled anticholinergics and risk for acute urinary retention: a case-crossover and case-time-control study,english,1051-0443,am j infect control,1098-3015,17.0,7.0,4/1/89,a776,1475-925x
761,856471.0,compartmentalization of fas and fas ligand may prevent auto- or paracrine apoptosis in epithelial cells,eng,experimental cell research,exp. cell res.,1090-2422,284.0,2.0,1/3/01,283-90,{w. hunzikerk. h. tan}
762,570704.0,rituximab-related viral infections in lymphoma patients.,eng,leukemia & lymphoma,rus,1042-8194,48.0,7.0,j toxicol environ health,1307-12,{saadettin kilickapomer dizdarsercan aksoyibrahim baristahakan harputluoglukadri altundagdidem sener dede}
763,520153.0,fetal lung volume measurements: determination with mr imaging--effect of various factors.,eng,radiology,radiology,0033-8419,240.0,1.0,1/6/07,187-93,{carol e barnewolthiroto hatabumizuki nishinodeborah levinehenry a feldmanjudy a estroffvalerie l ward}
764,259267.0,intra-operative change of gastric ph during laparotomic cholecystectomy under general anaesthesia: a prospective case-control study,eng,behaviour research and therapy,o. callenderj. cravenc. martin,stuart calverjulia nicholsrachel c1  - frn systematiska _versikter -s_kningen cn  - cinahl db  - c8h do  - 10.1179/1743288x12y.0000000021 dp  - ebscohost chester,56.0,0.0,1/12/01,40-43,{s. deyp. bhattacharyyab. k. biswasb. bhattaraip. bhakta}
765,24381.0,the care guidelines: consensus-based clinical case reporting guideline development.,eng,headache,headache,1526-4610,53.0,10.0,1/13/11,1541-7,{[collective name] care groupjoel j gagnierdavid moherdouglas g altmangunver kienledavid rileyharold sox}
766,827921.0,effect of a creative-bonding intervention on taiwanese nursing students' self-transcendence and attitudes toward elders.,eng,{p. domicela. tammeline. stahlea. hambraeus},prevalence and antibacterial susceptibility of mef(a)-positive macrolide-resistant streptococcus pneumoniae over 4 years (2000 to 2004) of the protekt us study,1098-240x,32.0,2.0,1/9/04,204-16,{sandra m walshshiue chen}
767,461204.0,fc receptor-like 3 (fcrl3) -169 c/t polymorphism and systemic lupus erythematosus: a meta-analysis.,english,surgical infections,surg infect (larchmt),1557-8674,0.0,0.0,1058-0832,513-6,{catherine maysrajesh ramanathandale harveygregory stockslagertherese m duanepatricia leavell}
768,482860.0,[indirect anastomoses for moyamoya disease].,jpn,no shinkei geka. neurological surgery,aids,headache,26.0,9.0,9/1/98,769-86,{y matsushima}
769,18298.0,ulcer healing after peripheral intervention.,eng,circulation journal : official journal of the japanese circulation society,circ. j.,1347-4820,-1.0,-1.0,4/14/07,1/14/06,{daiki uchidayukihiro saitohisashi uchidaatsuhiro koyanobuyoshi azuma}
770,365654.0,measuring the bright side of being blue: a new tool for assessing analytical rumination in depression.,eng,plos one,plos one,1932-6203,9.0,11.0,1/14/01,e112077,{skye p barbicpaul w andrewszachary durisko}
771,625306.0,[mammographic density: a valid risk factor for breast cancer?].,fre,prvention de l'insuffisance rnale induite par les produits de contrnste iodes,1872-6844,0221-0363,89.0,9.0,1/8/09,1140-50,{g boutet}
772,572343.0,high-dose sequential (hds) chemotherapy for high-risk non-hodgkin's lymphoma: long-term analysis and future developments.,eng,ann. hematol.,neurosurg,0939-5555,80.0,-1.0,1/1/01,b123-6,plant kunitz proteinase inhibitor attenuates inflammation oxidative stress and remodeling induced by elastase in mice
773,88262.0,core symptom measures in cancer clinical trials.,eng,journal of the national cancer institute,j. natl. cancer inst.,1460-2105,106.0,40.077385954574446,1/14/07,0366-6999,{carolyn gotay}
774,663339.0,human papillomavirus infection and increased risk of hiv acquisition. a systematic review and meta-analysis.,eng,aids (london england),aids,1473-5571,26.0,17.0,s. sarkars. grover,2211-22,{chunhui wangrichard hayeslouise kuhnstephen shiboskijennifer s smithnatasha l larkedeborah watson-jonescatherine f houlihanpatti e gravittkaren k smith-mccune}
775,718292.0,prevalence of different morphologic forms of the human tongue in young finns.,eng,brain bdnf levels elevation induced by physical training is reduced after unilateral common carotid artery occlusion in rats.,oral surg. oral med. oral pathol.,0030-4220,53.0,2.0,2/1/82,152-6,{m mikkonenr kotilainena kullaa-mikkonen}
776,245200.0,osteoporosis in men,eng,arch intern med,the link between smoking and impotence: two decades of evidence.,0003-9926 (print) 0003-9926,158.0,2.0,1/1/98,194,{m. galus}
777,307302.0,1/1/02,english,international medicine & health guidance news [guo ji yi yao wei sheng dao bao],m radererc gedlickaa lenauerd depischw scheithauerb schneeweissw fiebigerf langg v kornekb sch_ll,0961-5423,14.0,2.0,1/13/06,1/1/93,{raymond n. perrin}
778,217418.0,long term follow-up of conservative treatment of severely traumatized maxillary incisors,260-87,wiener medizinische wochenschrift,alternative therapies in health and medicine,0175-3851,13.0,4.0,1/1/97,190-192,{z. hirschfeldi. brina. fuksm. guelmann}
779,413717.0,magnetic resonance imaging evaluation of bone marrow changes in obstructive sleep apnoea syndrome in adults,english     italian,andreas krusemanh hung nguyen,1526-7598,245-8,372.8213667741145,16.142718981421943,1/6/01,572-84,{a. r. aleandrid. mancinit. cosentinir. le donnen. colavita}
780,62246.0,pulpal response to a fluoride-releasing all-in-one resin bonding system.,eng,operative dentistry,oper dent,0361-7734,27.0,3.0,1/2/05,271-7,interact cardiovasc thorac surg
781,945021.0,improvement of action tremor by chronic cortical stimulation,eng,mov disord,movement disorders : official journal of the movement disorder society,0885-3185,74.10680429311958,1.0,1/1/98,aug-84,{b. pollinc. genyj. p. nguyenp. cesaroa. feve}
782,649817.0,validity of rorschach inkblot scores for discriminating psychopaths from non-psychopaths in forensic populations: a meta-analysis.,eng,quality of life factors and survival after total or extended maxillectomy for sinonasal malignancies.,psychol assess,1939-134x,22.0,2.0,1/10/06,336-49,{scott o lilienfeldkeli holloway allenhoward n garbjessica l wildermuthm teresa nezworskijames m wood}
783,934327.0,use of a brief phone call after ed discharge,english,al sayed hussain asaheb sharif-askari nsulaiman saal-mulla aatabatabai ssaheb sharif-askari f,0195-668x,german,0.0,0.0,1058-0832,-,{nct01893931 }
784,546484.0,the effects of pre-reading and sharing mechanisms on learning with the use of annotations,eng,turkish online journal of educational technology - tojet,emerg radiol,r tellok kandarpar f mundens hootonr pugatch,10.0,2.0,1/11/04,234-249,eur arch otorhinolaryngol
785,917231.0,[occupational exposure to sevoflurane in pediatric operating rooms: the multi-point sampling method for risk assessment].,ita,patologie asbesto correlate in congiunti di lavoratori del settore cemento-amianto.,mehak bhatiashaun k morrisprabhat jhawilson suraweerajayadeep patracyril patraprakash c gupta,1592-7830,34.0,3.0,surg infect (larchmt),266-8,{v cerabonam wachockau moscatov camisam g tuccis zaffinav montaldia poscia}
786,887418.0,impact of crizotinib on patient-reported symptoms and global quality of life (qol) compared with chemotherapy in a phase iii study of advanced alk-positive non-small cell lung cancer (nsclc),1475-925x,european journal of cancer,m radererc gedlickaa lenauerd depischw scheithauerb schneeweissw fiebigerf langg v kornekb sch_ll,1520-7714,265.4338994101889,0.0,1/13/01,-,{v. hirshj.y. hanf. blackhalls. iyerd.w. kima. shawa. reismank. wilnerh. nokiharab. besse}
787,3393980.1009399267,a systematic review and meta-analysis of trials of treatment of depression from india,english,indian journal of psychiatry,ju-seong kimdong-seok kimeun-kyung parkkyu-won shim,stuart calverjulia nicholsrachel c1  - frn systematiska _versikter -s_kningen cn  - cinahl db  - c8h do  - 10.1179/1743288x12y.0000000021 dp  - ebscohost chester,56.0,0.0,1/14/01,29-38,{s. sarkars. grover}
788,63738.0,[the use of ethonium paste in the treatment of deep dental caries].,rus,stomatologiia,stomatologiia (mosk),0039-1735,50.0,2.0,3/1/71,79-80,{p k shestakov}
789,422739.0,reporting methods in studies developing prognostic models in cancer: a review.,eng,bmc medicine,girault grose rjweinstein jnball pahanscom bfanciullo gj,1741-7015,8.0,0.0,1/10/01,20-20,{patrick roystonrachel waterssusan mallettdouglas g altmansusan dutton}
790,97795.0,therapeutic advances in respiratory disease,jpn,current opinion in ophthalmology,neurosurg,enie akhtar bt nawawiahlam m al-kharabshehtsia-shu lo,26.0,1.0,1/1/01,35-40,{j. m. neald. j. kopaczm. a. lewisj. j. deck}
791,155127.0,p16(ink4) expression is not associated with human papillomavirus in oral lichen planus.,eng,oral surgery oral medicine oral pathology and oral radiology,oral surg oral med oral pathol oral radiol,2212-4411,118.0,6.0,1/14/12,694-702,{lucio montebugnoliluca morandiluca scapoliannalisa palmieridavide b gissimaria pia foschiniilaria manelli}
792,100986.0,association of bleeding mortality and sex in acute coronary syndromes: the missing triangle.,eng,journal of cardiovascular medicine (hagerstown md.),j cardiovasc med (hagerstown),1558-2035,-1.0,-1.0,9/23/14,1/14/06,{rossana de palmapaolo ortolanicaterina caminitiemilia solinaspiera angelica merlinidiego ardissinogiorgia paolimaria francesca notarangelopaolo guastarobaantonio marzocchiluigi vignaliroxana mehranantonio manari}
793,166179.0,[severe exposure to environmental lead in a child population in antofagasta chile],1/15/05,exposicion severa a plomo ambiental en una poblacion infantil de antofagasta chile.,adm policy ment health,0034-9887,128.0,2.0,1/1/00,221-32,{i. delgadoj. vega}
794,3863688.6170513183,tracheostomy care and complications in the intensive care unit,eng,critical care nurse,erik e suarezbridget n fahybrian a brucknercourtenay r brucenathan g allenharvey l gordon,-10475,33.0,5.0,1/13/01,18-31 14p,{linda l. morrisandrea whitmererik mcintosh}
795,379577.0,monitoring of fluid changes in hospitalized malnourished guatemalan children using bioelectrical impedance spectroscopy (bis).,eng,applied radiation and isotopes : including data instrumentation and methods for use in agriculture industry and medicine,appl radiat isot,0969-8043,49.0,5.0,5/1/98,615-7,{c pithanm mazariegosn w solomonsp f_rst}
796,2107650.1307672355,preliminary state of development of prediction models for primary care physical therapy: a systematic review.,eng,-7518,j clin epidemiol,1878-5921,65.0,12.0,1/12/12,1257-66,{martijn w heymanstobias van den berghan j r anemalieke van oortbart w koesarianne p verhagenriekie h c w de vet}
797,215650.0,bruxismo em crian_as bruxism in children,pt,nan,debashish chakravarthyelizabeth a. hintontracey c. vlahoviccynthia ann fleck,nan,13.4669586148447,2.0,nan,aug-91,{ronaldo fazziana estela haddadmaria salete nahs pires corr_a}
798,521132.0,curr. opin. pediatr.,eng,j hand surg am,the journal of hand surgery,0363-5023,29.0,5.0,journal of hand surgery (edinburgh scotland),841-7,{jeff knightjeffery m smiththomas e trumblewren v mccallister}
799,892609.0,13th ieee/acm symposium on distributed simulation and real-time applications ds-rt 2009,english,eng,1/1/88,teaching medical student geriatrics competencies in 1 week: an efficient model to teach and document selected competencies using clinical and community resources,0.0,0.0,1058-0832,1361-6560,{null}
800,366275.0,a systematic review on the application of cardiovascular risk prediction models in pharmacoeconomics with a focus on primary prevention.,eng,european journal of preventive cardiology,eur j prev cardiol,2047-4881,19.0,2.0,1/12/08,42-53,{maarten j postmapetros pechlivanogloujelena stevanovic}
801,513630.0,581-91,eng,journal of the national cancer institute,j. natl. cancer inst.,1460-2105,106.0,11.0,1/14/11,0366-6999,{jennifer paynerukshanda ahmadgregory doylenorm phillipsanna m chiarellichristine wilsonkathleen deckerandrew coldmanbin zhangjacques brisson}
802,605423.0,alcohol-related morbidity and mortality.,eng,alcohol research & health,or. international society for technology in education eugenebjorn norstrom,1535-7414,27.0,1.0,1/3/01,anna brownjane greenvalerie beralgillian reevespat doyle,{j_rgen rehmgerhard gmelmaurizio trevisanchristopher t sempos}
803,495319.0,clinical outcome following icd removal. the bilitch registry group,eng,j hosp infect,the journal of hospital infection,0195-6701 (print) 0195-6701,16.0,0.0,1/1/93,186-192,{s. furmand. t. kawanishis. l. song}
804,733752.0,eliciting relative preferences for two methods of colorectal cancer screening,english,european journal of cancer care,c k naspitzj o warner,0961-5423,14.0,2.0,1/5/01,124-31,j am med inform assoc
805,252118.0,bilingual speech: bilateral control?,eng,brain and language,hanan f khafagymona m hassanemad s osmanfaten m el-shanawanyabdel rahman m fathallahyasser m samhangehan g el-fandy,0093-934x,15.0,5.443722325234045,1/1/82,j health care poor underserved,{h.m. sussmanp. franklint. simon}
806,903817.0,tiao-she nursing of traditional chinese medicine for mild cognitive disorder: an assessment of clinical evidence,eng,chin. j. evid.-based med.,chin.j.evid.-based med.,1672-2531,15.0,3.0,1/14/10,346-352,{li x.-h.li g.-c.xie y.-l.shang h.-c.chi k.-l.jin y.-h.}
807,80799.0,one-pot semisynthesis of exon 1 of the huntingtin protein: new tools for elucidating the role of posttranslational modifications in the pathogenesis of huntington's disease.,eng,angewandte chemie (international ed. in english),angew. chem. int. ed. engl.,1521-3773,53.0,35.81447848831634,10/14/02,1928-33,{annalisa ansalonijae sun jeongfrancesco simone ruggerigiovanni dietlerzhe-ming wanghilal a lashuel}
808,385163.0,pathophysiology of paradoxical embolism: evaluation of the role of interatrial septum anatomy based on the intracardiac echocardiography assessment of patients with right-to-left shunting.,eng,cardiology in the young,cardiol young,1467-1107,25.0,1.0,1/15/01,47-55,{gianluca rigatellipaolo cardaiolimassimo giordanashesh buchlaura olivadobrin vassilievaravinda nanjiundappafabio dell'avvocataramesh daggubatidario adami}
809,645061.0,66,eng,issues ment health nurs,r r van rijns g f robben,1096-4673,29.0,3.0,1/8/03,299-314,{hanan al-modallalann pedendebra anderson}
810,164721.0,[the microclimate of apartments and its hygienic norms],eng,das mikorklima der wohnungen und seine hygienische normierung.,a meta-analytic review of exposure in group cognitive behavioral therapy for posttraumatic stress disorder.,0049-8610,13.0,10.0,1/1/67,756-60,{m. s. goromossow}
811,730721.0,prediction study of complications after severe trauma,english,behaviour research and therapy,o. callenderj. cravenc. martin,eur j gen pract,0.0,0.0,1/12/01,25,{nct01713205 }
812,439302.0,3/1/71,english,critical care medicine,crit. care med.,1530-0293,0.0,0.0,1058-0832,eur. j. heart fail.,{null}
813,410748.0,preliminary validity and reliability of a thai berlin questionnaire in stroke patients,english,plos one [electronic resource],1/6/03,stuart calverjulia nicholsrachel c1  - frn systematiska _versikter -s_kningen cn  - cinahl db  - c8h do  - 10.1179/1743288x12y.0000000021 dp  - ebscohost chester,7.0,0.0,1/14/01,348,{j. saengsuwank. sawanyawisuthn. ungtrakulj. saengsuwan}
814,133777.0,spectrum and frequency of illness presenting to a pediatric emergency department.,eng,acta clinica belgica,acta clin belg,1784-3286,61.0,4.0,1/6/07,161-5,{p grardj montesantip lepagem m massin}
815,4520905.359915753,organization of ribosomes and nucleoids in escherichia coli cells during growth and in quiescence,english,a qualitative exploration of the cancer experience among long-term survivors: comparisons by cancer type ethnicity gender and age.,j. biol. chem.,0021-9258,289.0,16.0,1/14/01,11342-11352,{k. peiskerb. singhs. sanyalq. chaix. gen. metzendorfs. dasgupta}
816,497593.0,j. chin. integr. med.,eng,allergy: european journal of allergy and clinical immunology,ju-seong kimdong-seok kimeun-kyung parkkyu-won shim,kamel alhanoutjean-christophe dubustalita mota goncalvesveronique andrieualain nicolaydavi pereira de santana,64.0,0.0,1/14/01,119-125,{n. a. mark estesscott mcnittwojciech zarebabronislava polonskydouglas laidlawmark s. linkfrank marcuskathleen gear}
817,899060.0,maxillofacial metastases: a retrospective review of one institution's 15-year experience,english,journal of oral & maxillofacial surgery,e315-6,127-31 st  - premature androgenic alopecia and insulin resistance. male equivalent of polycystic ovary syndrome?-,71.0,1.0,1/13/01,178-88,{r. a. orda. salamar. movaheds. a. mcclure}
818,424254.0,precocious and delayed sexual development in children,english,acta endocrinologica. supplementum,insulin detemir lowers the risk of hypoglycaemia and provides more consistent plasma glucose levels compared with nph insulin in type 1 diabetes.,0300-9750,288.0,0.0,1/1/88,66-76,{b. t. rudd}
819,161290.0,premature androgenic alopecia and insulin resistance. male equivalent of polycystic ovary syndrome?,eng,katherine a yeagersusan bauer-wu,e. anegekuh l. sun l. ifeachor,circ. j.,39.0,0.0,1/5/01,jpn,{l. starkaj. vrbikovam. da  - dec dp  - nlm et  - 2006/03/24 hillm. duskovai. cermakova}
820,4427548.842065217,231-5-,eng,crit. care med.,s nadeauf malouinb.j mcfadyen,0090-3493,41.0,12.0,1/13/05,a326,{cayetano k.ghannam d.rawat n.}
821,191138.0,mold contamination in a controlled hospital environment: a 3-year surveillance in southern italy,english,international medicine & health guidance news [guo ji yi yao wei sheng dao bao],m radererc gedlickaa lenauerd depischw scheithauerb schneeweissw fiebigerf langg v kornekb sch_ll,stuart calverjulia nicholsrachel c1  - frn systematiska _versikter -s_kningen cn  - cinahl db  - c8h do  - 10.1179/1743288x12y.0000000021 dp  - ebscohost chester,14.0,0.0,1/14/01,66,{c. corettic. napolig. loverom. t. montagnag. caggianog. scarafileo. de giglio}
822,743819.0,effect of (d)-fagomine on excreted enterobacteria and weight gain in rats fed a high-fat high-sucrose diet.,eng,obesity (silver spring md.),obesity (silver spring),1930-739x,71.76687784795021,4.0,1/14/04,976-9,{eunice molinar-toribiobenjam_n pialivia g_mezjara prez-jimnezmarta casadosara ramos-romeropere clapsjosep llu_s torres}
823,193292.0,917-920,eng,eng,1/1/88,teaching medical student geriatrics competencies in 1 week: an efficient model to teach and document selected competencies using clinical and community resources,4.0,0.0,1/4/01,10-10 st  - csm2004 best platform-,{null}
824,91852.0,the importance and important limitations of ultrasound imaging for evaluating thyroid nodules.,eng,jama internal medicine,jama intern med,2168-6114,173.0,19.0,10/28/13,1796-7,{david coopererik k alexander}
825,663526.0,blood 25-hydroxyvitamin d concentration and hypertension: a meta-analysis.,eng,journal of hypertension,j. hypertens.,1473-5598,29.0,4.0,1/11/04,636-45,jul-64
