ID,id,article_title,article_language,journal_title,jounral_abbreviation,journal_issn,article_jvolumn,article_jissue,article_jcreated_at,article_pagination,author_list
714,1858472.2946557654,burkholderia cepacia complex infection in a case of sinonasal polyposis recurrence without cystic fibrosis,$e@@ng,nan,4.304008281794673,002%2$-2194,165.07847549362705,3.0,nan,414-6,{a. pavina. staffierig. marionig. bresciar. rinaldi}
715,428909.0,pilot randomized controlled trial of web-based acceptance and commitment therapy for smoking cessation.,3.826595960890639,nicotine & tobacco research,4.728680143606239,1462-2203#@@,15.0,10.0,1/13/10,1756-1764,{jaimee l. heffnerjonathan brickerbryan comstockchristopher wyszynski}
716,110453.0,anti-hypertensive medicines prescribing for medical outpatients in a premier teaching hospital in nigeria: a probable shift of paradigm.,en#@@g,pharmacy practice,pharm pract (granada),1885-642x,12.0,-1.0,1/14/04,419,{kazeem b yusuffunyime i eshiet}
717,4971165.240515328,agitation aggression and disinhibition syndromes after traumatic brain injury,%$eng,neurorehabilitation,neurorehabilitation,1053-8135,14.0,4.0,1/2/01,297-310,{e. kim}
718,82695.0,brain bdnf levels elevation induced by physical training is reduced after unilateral common carotid artery occlusion in rats.,eng,mi#crosurger@@y,microsurgery,1098-2752,34.0,1.0,1/14/01,jul-64,{hisako harayukio sekinoriyuki muraiisao koshimatakuya iidamakoto miharatakeshi todokoro}
719,4899192.479028272,effects of multifu??$nctional fabrics on cardiac autonomic tone and psychological state,english,international journal of neuroscience,int@@.j.neurosci%.,0020-7454,7.0,8.0,1/4/01,923-931,{k.-w. parkj. songh.-j. kims.-r. moonm.s. lee}
720,2475077.4782732553,manual versus electric vacuum aspiration for first-trimester abortion: a systematic review,eng,bjog,bjog : an international journal of obstetrics and gynaecology,1470-0328 (pr@@int) 1%470-0328,115.0,1.0,1/8/01,13-may,{f. dengj. wenq. y. caiy. p. li}
721,54202.0,behaviour research and therapy outcome predictors in guided and unguided self-help for social anxiety disorder,rus??#,behaviour research and therapy,3.5921349212788796,$00#39-1735,50.0,1.0,1/12/01,13-21 do  - 10.1016/j.brat.2011.10.009,{o e havikp carlbringl g _stt nordgreeng anderssont furmark}
722,888477.0,probiotics for the treatment of upper and lower respiratory-tract infections in children: systematic review based on randomized clinical trials,%eng,j pedi@$@atr (rio j),jornal de pediatria,0021-7557,nan,5.0,1/15/01#,413-27,{#m. h. de oliveira juniore. s. sari#nhog. v. de araujod. m. peixoto}
723,741279.0,bradykinin is a mediator but unlikely a trigger of antiarrhythmic effects of ischemic preconditioning,4.398719721734498,journal of cardiovascular electrophysiology,j. cardiovasc. electrophysiol.,1540-8167,18.0,3.412937621490741,1%/7/0??1,#93-9??9 7p,{s. v. driamovs. butzp. t. buserc. e. zauggm. bellahcene}
724,64430.0,the nadph oxidase-mediated production of hydrogen peroxide (h(2)o(2)) and resistance to oxidative stress in the necrotrophic pathogen alternaria alternata of citrus.,eng,molecular plant pathology,mol. plant pathol.,1364-3703,13.0,8.0,1/12/10,9%$00-14,{siwy ling yangkuang-ren chung}
725,461657.0,review of epidemiology and management of atrial fibrillation in developing countries.,$e@@nglish,pain practice,3.849526063527997,3.2696922705682026,0.0,0.0,1/10/10,-$@@,null
726,240949.0,william h. taft high school project hola 1985-1986. oea evaluation report.,$e@@nglish,5.65565876274752,3.849526063527997,3.6377149304266987,0.0,0.0,1/1/96,-$@@,{brooklyn. office of educational assessment. new york city board of education}
727,453909.0,%a literature review on chronic pain: the daily ov#ercoming of a complex problem.,5.469320114737926,3.302132228186795,3.2852412699992155,3.2696922705682026,0.0,0.0,1/11/01,3.553647265908068,{null}
728,222452.0,special problems in the prosthetic rehabilitation of deep bite,5.321273409049062,johns hopkins medical journal,johns hopkins med. j.,1433-0350,30.0,2.0,1/1/75,170-5,c.#p. richterl.h. riley jr.
729,163839.0,the potential impact of bias in studies of r@@esidential exposure to magnetic fields and childhood leukemia,$e@@nglish,bioelectromagnetics,bioelectromagnetics,1521-186x,0.0,13.343747158574999,1/1/01,$s32-47,t. dovanr. r. neutrad. a. savitzr. i. kavet
730,696132.0,cha$nges @@of interaction during the development of a mathematical learning environment.,4.01125477964943,journal of mathematics teacher education,3.3525856005612944,0160-6379,14.0,5.0,1/11/10,393-411,{dirk.hoek@ou.nl hoek dirk1koeno2 gravemeijer}
731,1154077.631149944,an internet-based program to enhance motivation to change in females with symptoms of an eating disorder: a randomized controlled trial,eng%??,australian and new zealand journal of psychiatry,3.3525856005612944,0195-6701 (print) 0195-6701,44.0,0.0,1/??1/$76,1947-1963,{hotzel kr von brachelkosfelder jhechler tvocks srieger eschulte dschmidt u}
732,332032.0,air pollution and risk of urinary bladder cancer in a case-control study in spain,eng#,international archives of occupational and environmental health,j clin epidemiol,1470-7926@@,65.0,25.898436257225747,1/8/01,56-60,{nuria malatsalfredo carratomanolis kogevinasnathaniel rothmanconsol serrareina garcia-closasdebra silvermanadonina tardonkenneth p. cantormustafa dosemecigemma castano-vinyalsroel vermeulen}
733,617801.0,remission rates following antidepressant therapy with #bupropion or selective serotonin reuptake inhibitors: a meta-analysis of original data from 7$ randomized controlled trials.,eng,j. clin. psychiatry,4.7932118110954605,0020-7454,66.0,8.0,1/5/08,9#74-81,{michael e thaseyounghua wangapril e harriettmelinda mittoncarol b rockettbarbara r haightjack g modellnathalie richardsusan vanmeter}
734,480030.0,adaptive convex combination approach for the identification of improper quaternion processes,eng,value in health,4.052700351571347,1612-4782     1612-4790,76.090726790503,1.0,1/14/01,6-may,{c. jahanchahic. c. tookb. c. ujangd. p. mandic}
735,660499.0,inappropriate use %of emergency services: a systemat#ic review of prevalence and associated factors.,eng,violencia contra a crianca: revelando o perfil dos atendimentos em servicos de emergencia brasil 2006 e 2007.,4.959421387547137,1678-4464,10.0,1.0,1/9/01,28-jul,{mar#los rodrigues dominguesana claudia gastal fassamaria l#aura vidal carret}
736,355078.0,use of episiotomy in the united states,eng,birth,3.5498704379424586,1523-536x,29.0,3.778946432345302,1/2/01,jun-74,{m. c.@@% klein}
737,696985.0,the diversion of ultram ultracet and generic tramadol hcl.,en$g,journal of addictive diseases,j $addict dis,1545-0848,25.0,2.0,1/6/01,53-58,f. bolandardm. bonninp. dubandj. e. bazinj. p. mission
738,826471.0,aberrances in autonomic cardiovascular regulation in fibromyalgia syndrome and their relevance for clinical pain reports,eng,psychosomatic medicine,psychos%om %med,0033-3174,72.0,5.0,1/10/01,462-70,{sergio garridoangeles pulgarstefan duschekmar_a mart_n-vzquez@@gustavo a reyes del paso}
739,807737.0,sorafenib and pegylated interferon-alpha-2b in advanced metastatic melanoma: a multicenter phase ii decog trial,3.216489513717863,j. clin. oncol.,color%ectal dis,0732-183x,125.8460191815588,15.0,nan,3.336377664755387,{ugurel s.schadendorf d.garbe c.trefzer u.egberts f.hassel j.weichenthal m.hauschild a.mauch c.gutzmer r.}
740,875781.0,dispersal of methicillin-resistant staphylococcus epidermidis by staff in an operating suite for thoracic and cardiovascular surgery: relation to skin carriage and clothing,eng%??,australian and new zealand journal of psychiatry,3.2353523003830174,0195-6701 (print) 0195-6701,44.0,9.0,1/1/00,119-26,{p.@@ domicela. tammeline.@@ stahlea. hambraeus}
741,322953.0,psychometric validation of the growth and empowerment measure (gem) applied with indigenous australians,eng%??,australian and new zealand journal of psychiatry,3.919980990514408,0933-7407,44.0,9.0,1/10/01,791-799,{komla tseymelissa r haswelllyndon reillydavid kavanaghchris doranarlene laliberteandrew wilsonyvonne cadet-james}
742,123731.0,alveolar soft part sarcoma of the uterine corpus. report of two cases and review of the literature,eng@@,nan,nan,3.5478778743392083,194.0,nan,%1/1/98#,59-63,{k. radiga. roessnerp. buhtz}
743,180588.0,value of intravenous cholangiography prior to laparoscopic cholecystectomy,5.694362051349227,psycho-oncology,3.3525856005612944,0305-1862,23.0,0.0,1/$2/01,693-6; discussion 697 st  - value of intravenous cholangiography prior to laparoscopic cholecystectomy-,{geoffrey c. williamsbai brownson difranza gehrman glantz law mokdad ory panagiotakos pechacek pyle sargent sweda whincup whitlock arcavi}
744,440684.0,hemostatic resuscitation for massive bleeding: the paradigm of plasma and platelets - a review of the current literature.,3.0520392135913763,3.302132228186795,4.166519922940166,3.2696922705682026,0.0,0.0,4.586126329909226,3.553647265908068,{null}
745,758629.0,studies on the biological activity of two strains of bcg: influence of production conditions.,eng,dev. biol. stand.,j am geriat%r soc??,0301-5149,58.0,-1.0,1/8/03,105-18,{m chouchkovaa@@ engi??barov}
746,964184.0,myocardial fibrosis by t1 mapping is an early indicator of severe cardiac allograft vasculopathy,3.6677640130588918,circulation,ci#rculation,22-sep,563.3277001614745,24.0,1/13/01,2826@@-34#,{n. harcourts. c. masrim. colving. raveendran}
747,265490.0,follistatin-lik%e protein 1 regulates chondrocyte @@proliferation and chondrogenic differentiation of mesenchymal stem cells,eng,an@@n rheum dis,3.849526063527997,mar-67,0.0,0.0,1/1/74,-$@@,{s. m. smitha. d. marinovr. hirschd. s. bushnellb. t. campfieldh. c. blair??y. chaly}
748,463556.0,%a literature review on chronic pain: the daily ov#ercoming of a complex problem.,$e@@nglish,3.302132228186795,5.593099327061783,3.2696922705682026,0.0,0.0,4.586126329909226,3.553647265908068,{null}
749,749844.0,insights in public health: taxing sugar sweetened beverages to impr%ove public health: policy action in hawai'i. doctoral health policy seminar spring 2013,3.0325311317626413,hawaii j med public health,hawai'i journal of medicine & public health : a journal of asia pacific medicine & public health,2#165-@@8242,387.68056805315496,8.0,1/13/01,286-91,{t. sentellt. usagawam. hagiwarat. peacockh. hee heom. g. pearcel. choym. r. dela cruz}
750,300057.0,[evidence-based therapy guideline of the german working group on obesity in childhood and adolescence].,ger,bundesgesundheitsblatt gesundheitsforschung gesundheitsschutz,indian j ophthalmol,1437-1588,54.0,27.569106972494115,1/11/05,584-90#,{m wabitscha mossd kunze}
751,166521.0,the cost of national service frameworks,eng,journal of epidemiology and community health.,hemato%??l. j.,%1878-592#1,65.0,0.0,1/4/01,68-9 st  - the cost of national service frameworks-,{r. cn  - pubmed da  - feb dp  - nlm et  - 2004/03/05 boyle}
752,nan,simple steps to fitness. secrets of strength. strength training is as important to weight loss and fitness as aerobic exercise is but many people ignore it. here's how to get started.,eng,diabetes forecast,diabetes forecast,009#5-8301,316.573742683969,8.0,1/2/0@@8,98%--100,nan
753,181456.0,homeplace and housing in t#he lives of low-income urban african american families,$e@@nglish,3.6916734391372414,3.766977189393842,1553-9318 1553-9318,0.0,0.0,1/5/01,166-188,{linda m. burtonaltman bullard burton burton burton burton burton clark conley dilworth-williams fischer foucault franklin gieryn gilbert goeri??ng hooks howard kidder lahiri laws#on clark lawson clark lawson clark low massey oliver perkins rosenbaum rosenbaum sanders stack allansherri lawson clark}
754,734870.0,lack of association between the connexin 37 c1019t gene polymorphism and coronary artery disease in a chinese population: meta-analysis of 2206 subjects.,eng,biomedical reports,biomed rep,2049-9434,1.0,10.291297743117697,1/13%$/05,464-468,{yan-yan liyun qianchuan-wei zhou}
755,276001.0,[effects of tobacco advertising regulations in various countries],jpn,nihon koshu eisei zasshi,[nihon koshu eisei zasshi] japanese journal of public health,0546-1766 (print) 0546-17@@66,42.0,12.0,1/1/95,$1017-28,{t. so%ne#}
756,788507.0,intensiv$e glucose control in the m@@anagement of diabetes mellitus and inpatient hyperglycemia,eng,am j health syst pharm,american journal of health-system pharmacy : ajhp : official journal of the american society of health-system pharmacists,1079-2082 (print) 1079-2082,67.0,10.0,1/10/01,798-805,{s. b. levya. o. shogbon}
757,620483.0,the value of breast self-examination: meta-analysis of the research literature.,eng,oncology nursing forum,oncol nurs forum,0190-535x,28.0,5.0,1/1/06,815-22,{y l ku}
758,978471.0,palliative sedation therapy in the last weeks of life: a literature review and recommendations for standards.,3.0520392135913763,4.885126487351389,3.849526063527997,0-8077-4913-3,0.0,0.0,1/1/74,-$@@,null
759,737167.0,understanding depression in palliative and end-of-life care,en,nu%rs st$and,nursing standard (royal college of nursing (great britain) : 1987),0029-6570 (print) 0029-6570,nan,67.61630764161586,nan,48-57; quiz 58 60,{s. ashelfordv. taylor}
760,744601.0,inhaled anticholinergics and risk for acute urinary retention: a case-crossover and case-time-control study,$eng,nan,endocrinology,0036-8148 0036-8148,nan,7.0,nan,nan,{dilokthornsakul p.joo m.j.lee t.a.pickard a.s.lin f.j.}
761,4998170.076577449,compartmentalization of fas and fas ligand may prevent auto- or paracrine apoptosis in epithelial cells,eng,experimental cell research,exp. cell res.,1090-2422,284.0,2.0,1/3/01,2??83-90,{w. hunzikerk. h. tan}
762,570704.0,rituximab-relat%ed viral inf$ections in lymphoma patients.,engl@@is$h,leukemia% & lymphoma,3.919980990514408,0019-#5499,48.0,7.0,1/4/01,1307-1??2,m. martinengod. f. ardenghig. r$ealig. tripodi
763,520153.0,fetal lung volume measurements: determination with mr imaging--effect of various factors.,eng,radiology,radiolo%gy,0033-8419,848.7877854448968,1.0,1/6/07,187-93,qiao-hong huzhi-liang huangxiao-ming fanshuang-xi chenxiang-yang songxiao-ying qiu
764,nan,intra-operative change of gastric ph during laparotomic cholecystectomy under general anaesthesia: a prospective case-control study,nan,nan,nan,4.301855308945454,nan,nan,1/12/01@??@,40-43,{s. deyp. b%hattacharyyab. k. biswasb. bhattara#ip. bhakta}
765,24381.0,the care guidelines: consensus-based clinical case reporting guideline development.,eng,headache,headache,1526-4610,53.0,10.0,1/13/11,15??41-$7,{[collective name] care groupjoel j gagnierdavid moherdouglas g altmangunver kienledavid rileyharold sox}
766,827921.0,effect of a creative-bonding intervention on taiwanese nursing students' self-tran@@scendenc#e and attitudes toward elders.,eng,res nurs health,3.3815838030431524,1098-240x,32.0,2.0,1/#11/01,204-16,{sandra m walshshiue chen}
767,892609.0,%a literature review on chronic pain: the daily ov#ercoming of a complex problem.,3.0520392135913763,3.302132228186795,5.854411959808014,3.2696922705682026,0.0,0.0,4.586126329909226,3.553647265908068,{null}
768,482860.0,[indirect anastomoses for moyamoya disease].,jpn,no shinkei geka. neurological surgery,4.455420254351155,0301-2603,138.87070418974238,9.0,9/1/98,769-86,{y matsushima}
769,64583.32170916384,ulcer healing after @@peri#pheral intervention.,eng,circulation journal : official journal of the japanese circulation society,cir@@#c. j.,1347-4820,-1.0,-1.0,4/14/07,cd%0%01880,{daiki uchidayukihiro saitohisashi uchidaatsuhiro koyanobuyoshi azuma}
770,365654.0,measuring the bright side of being blue: a new tool for assessing analytical rumination in depression.,eng,plos one,plos one,1932-6203,9.0,11.0,1/14/01,e112077,g. rahavg. regev-yochayi. abullaisha. elhamdanyr. malleym. raza. goraly. roytmanb. shainbergm. varona. ziv
771,625306.0,[mammographic density: a valid risk factor for breast cancer?].,fre,prvention de l'insuffisance rnale induite par les produits de contrnste iodes,phys @@ther,0221-0363,89.0,9.0,1/9/01,114??0-50%,{@%@g boutet}
772,704093.0,high-dose sequential (hds) chemotherapy for high-risk non-hodgkin's lymphoma: long-term analysis and future developments.,eng,ann. hematol.,pharmacoeconomics,0939-555$5,80.0,-1.0,1/1/01,b123-6,{m ladettod caracciolog rossic marinonel berguia cutticaa salomonem boccadoroi riccac tarellam paganof zalliop gavarottia pileria de crescenzo}
773,441835.92324190773,core symptom measures in cancer clinical trials.,eng,journal of the national cancer institute,j. nat??l. cancer inst.,1460-2105,106.0,7.0,1/14/07,110-6,jennifer paynerukshanda ahmadgregory doylenorm phillipsanna m chiarellichristine wilsonkathleen deckerandrew coldmanbin zhangjacques brisson
774,663339.0,human papillomavirus infection and increased risk of hiv acquisition. a systematic review and meta-analysis.,eng??#,aids (london england),aids,1473-5571,nan,17.0,11/13/12,2211-22,{chunhui wangrichard hayeslouise kuhnstephen shiboskijennifer s smithnatasha l larkedeborah watson-jonescatherine f houlihanpatti e gravittkaren k smith-mccune}
775,3442813.0428220266,preval%ence of different morphologic forms of the human tongue in young fi%nns.,eng,oral surgery oral medicin@@e and oral pathology,oral surg. oral med. oral pathol.,0022-4707,53.0,10.0,1/13/02,152-6,{m mikkonenr kotilainena kullaa-mikkonen}
776,1418384.1953289981,osteop@@orosis in men,en@@g,arch intern med,archives of internal medicine,0003-9926 (print) 0003-9926,158.0,8.765693276995538,1/1/98,194,{m. galus}
777,307302.0,neurolymphatische bahnen: neue wissenschaftliche nachweise untermauern die perrin-technik,5.321273409049062,4.628237585221689,3.221091791271558,##1527-1315,nan,2.0,1/13/06,15-oc$t%,{raymond n. perrin}
778,1183801.0939897988,long term follow-up of conservative treatment of severely traumatized maxillary incisors,eng,disease management and clinical outcomes,4.922284899124088,0269-2163,13.0,9.0,1/1/97,190-192,{z. hirschfeldi. brina. fuksm. guelmann}
779,636252.6578178009,magnetic re%sonance imagi$ng evaluation of bone marrow changes in obstructive sleep apnoea syndrome in adults,english     italian,nan,nan,3.876818594495927,111.0,18.794524510263635,1/14/01,139,g. mikusn. hohmannd. czock
780,685178.0,pulpal response to a fluoride-releasing all-in-one resin bonding system.,eng,operative dentistry,oper dent,0361-7734,144.10001493259682,17.818843235645865,1/2/05,271-7,{masayuki otsukimakoto arakawahidekazu sonodayasutaka sasafuchiyuichi kitasakojunji tagami}
781,945021.0,alcohol-related road traffic injuries in eldoret kenya,eng??$,mov disord,movement disorders : official journal of the movement disorder society,0885-3185,0.0,1.0,1/1/98,aug-84,{b. pollinc$. genyj. p. nguyenp. cesaroa. feve}
782,649817.0,validity of rorschach inkblot scores for discriminating psychopaths from non-psychopaths in forensic populations: a meta-analysis.,eng%,psychological assessment,psych%ol #assess,1939-134x,nan,2.0,1/10%/0$6,336-49,{scott o lil%ienfeldkeli holloway?? allenhoward n garbjessica l wildermuthm teresa nezworskijames m wood}
783,978471.0,use of# a brief phone call after ed disc$harge,3.0520392135913763,3.5027060444321183,3.849526063527997,0-8077-4913-3,0.0,0.0,1/1/74,-$@@,{nct01893931 }
784,546484.0,the effects of pre-reading and sharing mechanisms on learning with the use of annotations,%en$g,turkish o@@nline journal of educational technology - tojet,e??merg ra??diol,1303-6521,10.0,2.0,1/11/04,234-249,{wu-yuin hwangguo-liang hsu}
785,917231.0,[occupational exposure to sevoflurane in pediatric operating rooms: the multi-point sampling method for risk assessment].,ita,patologie asbesto correlate in congiunti di lavoratori del @@settore cemento-amianto.,korean j.anesth.,1592-7830,34.0,3.0,1/12/07,266-8,{v cerabonam wachockau moscatov camisam g tuccis zaffinav montaldia poscia}
786,887418.0,alkaline phosphatase activity of duodenal enterocytes after neonatal administration of monosodium glutamate to rats.,e$ng,european journal of cancer,3.28538233045871,0$969-8043,49.0,0.0,1/13/01,-,d. d. townc. p. cheny. n. suw. cn  - pubmed da  - dec do  - 10.1016/s1028-4559(10)60117-9 dp  - nlm et  - 2011/01/05 wangc. w. panc. c. leef. j. tsaip. c. wum. c. huang
787,724055.0,a systematic review and meta-analysis of trials of treatment of depression from india,english,indian journal of psychiatry,4.925260220179562,3.0639906389542024,56.0,0.0,1/14/01,29-38,{s. sarkars. grover}
788,63738.0,[the use of ethonium paste in the treatment of deep dental caries].,rus??#,stomatologiia,3.5921349212788796,$00#39-1735,50.0,7.0,3/1/71,79-8#0,akin uz_mc_$gilmeral #top_um fani bozkurtsinem akg_l
789,2353812.17820403,reporting methods in studies developing prognostic models in cancer: a review.,eng,bmc medicine,bm$@@c med,1741-7015,0.0,0.0,1/10/01,20-20,{patrick roystonrachel waterssusan mallettdouglas g altmansusan dutton}
790,97795.0,hospital discharge after ambulatory knee arthroscopy: a comparison of epidural 2-chloroprocaine versus lidocaine,en@@??g,va??cc#ine,pharmacoeconomics,1365-2346,26.0,1.0,1/1/01,35-40,{j. m. neald. j. kopaczm. a. lewisj. j. deck}
791,155127.0,p16(ink4) expression is not associated with human papillomavirus in oral lichen planus.,eng,the jour$nal of headache and pain,oral surg oral med oral patho%l oral ra#diol,2212-4411,118.0,6.0,1/14/12,694-702,{lucio montebugnoliluca morandiluca scapoliannalisa palmieridavide b gissimaria pia foschiniilaria manelli}
792,454449.5474177263,association of bleeding mortality and sex in acute coronary syndromes: the missing triangle.,eng,circulation journal : official journal of the japanese circulation society,j cardiovasc med (hagerstow$n),1558-2035,-1.0,-1.0,9/23/14,447-55,{rossana de palmapaolo ortolanicaterina caminitiemilia solinaspiera angelica merlinidiego ardissinogiorgia paolimaria francesca notarangelopaolo guastarobaantonio marzocchiluigi vignaliroxana mehranantonio manari}
793,166179.0,aerobic fitness testing in patients with chronic low back pain: which test is best?,eng%??,exposicion severa a plomo ambiental en una poblacion infantil de antofagasta chile.,adm policy ment healt$@@h,0034-9887,128.0,6.500222052204965,1/1/00,221-32,{i. delgadoj. vega}
794,740811.0,tracheostomy care and complications in the intensive care unit,??en#g,critical care nurse,3.28538233045871,-10475,33.0,24.658797760227223,1/13/01,18-31 14p,{linda l. morrisandr??ea whitmererik mcintosh}
795,379577.0,monitoring of fluid changes in hospitalized malnourished guatemalan children using bioelectrical# impedance spectroscopy (bis).,e$ng,applied radiation and isotopes : including data instrumentation and methods for use in agriculture industry and medicine,appl radiat isot,0$969-8043,49.0,24.97946270652058,5/1/98,615-7,{c pithanm mazariegosn w solomonsp f_rst}
796,658981.0,preliminary state of development of prediction models for primary care physical therapy: a systematic review.,e@@ng,international urogynecology journal,j clin epidemiol,%1878-592#1,65.0,57.831635502156246,1/12/12,1257-66,{martijn w heymanstobias van den berghan j r anemalieke van oortbart w koesarianne p verhagenriekie h c w de vet}
797,215650.0,bruxismo$ em #crian_as bruxism in children,pt$,multic%ultural education & technology journal??,expert opinion on drug metabolism & toxicology,-71139.26175823007,3.0,10.87020049941642,1/8/01,aug-91,{ronaldo fazziana estela haddadmaria salete nahs pires corr_a}
798,521132.0,osteoarthritis of the thumb carpometacarpal joint in women and occupational risk factors: a case-control study,eng,j hand surg am,the journal @@of hand% surgery,0363-5023,29.0,5.0,1/4/09,459-65,{jeff knightjeffery m smiththomas e trumblewren v mccallister}
799,892609.0,13th ieee/acm symposium on distributed simulation and real-time applications ds-rt 2009,3.0520392135913763,3.302132228186795,4.876947067773512,4.1525192273364135,0.0,0.0,4.586126329909226,4.988262096400298,{null}
800,366275.0,a systematic review on the application of cardiovascular risk prediction models in pharmacoeconomics with a focus on primary prevention.,eng,european journal of preventive cardiology,postgrad med j,2047-4881,66.06923224398732,2.0,1/12/08,437-42,{maarten j postmapetros pechlivanogloujelena stevanovic}
801,513630.0,pan-canadian study of mammography screeni#ng% and mortality from breast cancer.,eng,journal of the national cancer institute,j. natl. cancer inst.,1460-2105,426.612552759749,47.51779647687141,1/14/11,1078-87,{jennifer paynerukshanda ahmadgregory doylenorm phillipsanna m chiarellichristine wilsonkathleen deckerandrew coldmanbin zhangjacques brisson}
802,605423.0,compartmentalization of fas and fas ligand may prevent auto- or paracrine apoptosis in epithelial cells,eng,alcohol research & health,5.522359485186558,153@@#5-7414,40.0,1.0,1/3/01,39-$51,{j_rgen rehmgerhard gmelmaurizio trevisanchristopher t sempos}
803,495319.0,clinical outcome following icd removal. the bilitch registry group,en@@g#,4.092531314201795,public health rep,0033-3549,16.0,0.0,1/1/93,186-192,null
804,733752.0,eliciting relative preferences for two methods of colorectal cancer screening,english,european journal of cancer care,3.766977189393842,1123-6337 (print) 1123-6337,14.0,5.0,1/5/01,124-31,{e. j. frewj. l. wolstenholmed. k. whynes}
805,252118.0,nan,4.868014822420479,brain and language,4.239663705957508,#1432-0711@@,88.89119654759119,1.0,nan,125-142,nan
806,903817.0,tiao-she nursing of traditional chinese medicine for mild cognitive disorder: an assessment of clinical evidence,$eng,chin. j. evid.-based med.,chin.j.evid.-based med.,1672-2531,83.78136727269892,5.0,4.835873762365799,346-352,{li x.-h.li g.-c.xie y.-l.shang h.-c.chi k.-l.jin y.-h.}
