ID,id,article_title,article_language,journal_title,jounral_abbreviation,journal_issn,article_jvolumn,article_jissue,article_jcreated_at,article_pagination,author_list
704,450743.0,meta-analysis of guided bronchoscopy for the evaluation of the pulmonary nodule.,4.232163045508061,4.45401869855446,3.316065476372231,4.655474037405698,0.0,0.0,1/1/90,3.14642651605817,{null}
705,157566.0,bladder cancer and urothelial impairment: the role of trpv1 as potential drug target.,en@@g,biomed research i??nternational,biomed res int,2314-6141,2014.0,-1.0,1/14/01,987149,{paolo dell'oglioalessandro larchernicola fossatinicol_ maria buffialberto abrategiuliana listafrancesco montorsifrancesco mistrettamassimo lazzerigiorgio guazzonigiovanni lughezzani}
706,589465.0,effect of a cooling hood on physiological responses to work in a hot environment,eng,j appl physiol,journal of applied physiology,0021-8987 (print)     0021-8987,132.80328357808426,1.0,1/1/70,sep-36,{e. shvartz}
707,560120.0,a novel approach to control hyperglycemia in type 2 diabetes: sodium glucose co-transport (sglt) inhibitors: systematic review and meta-analysis of randomized trials.,eng,annals of# m@@edicine,ann. med.,1365-2060,44.0,4.0,1/12/06,3??75$-93,{gianfranco paganogiovanni mussomaurizio cassaderroberto gambino}
708,107924.0,obesity weight change and risks for hypertension diabetes and hypercholesterolemia in japanese men.,eng,european journa$l of c$linical nutrition,eur j clin nutr,0954%-??3007,246.45189915222872,7.0,1/2/07,601-7,{k ishikawa-takatat ohtak moritakit gotous inoue}
709,797967.0,delayed costs of suppressed pain.,eng,journal of personality and social psychology,j pers soc psychol,0022-3514,64.0,2.0,2/1/93,274-82,{d cioffij holloway}
710,265969.0,osteoarthritis of the thumb carpometacarpal joint in women and occupational risk factors: a case-control study,e%ng#,j hand surg am,the journal of hand surgery,0363-5023,32.0,4.0,1/7/01,459-65,{j. m. claises. neelp. catilinal. fontanas. ughetto}
711,820508.0,a comparative outcome study of body awareness therapy feldenkrais and conventional physiotherapy for patients with nonspecific musculoskeletal disorders: changes in psychological symptoms pain and self-image,english,physiotherapy theory and practice,physiother. theory pract.,09593985 (issn),17.0,2.0,1/1/01,77-95,{e.-b. malmgren-olssonk. armeliusb.-. armelius}
712,2417548.998162775,use of implantable cardioverter-defibrillators for primary prevention in older patients: a systematic literature review and meta-analysis.,3.810404033986291,4.45401869855446,3.9192708879211433,4.655474037405698,0.0,0.0,5.370917207519488,3.14642651605817,{null}
713,84941.0,incidence of and risk factors for motor neurone disease in uk women: a prospective study.,eng,bmc neurology,bmc neur@@@@ol,1471-2377,12.0,-1.0,1/12/01,25,{anna brownjane greenvalerie beralgillian reevespat doyle}
714,558766.0,burkholderia cepacia complex infection in a case of sinonasal polyposis recurrence without cystic fibrosis,eng,critical care nursing quarterly,clin evid (online),5.297774487840181,35.0,3.0,1/8/01,414-6,{a. pavina. staffierig. marionig. bresciar. rinaldi}
715,428909.0,pilot randomized controlled trial of web-based acceptance and commitment therapy for smoking cessation.,$eng,nicotine & tobacco research,am. j. med.,1%%462-2203,50.42914494719246,10.0,1/13/1$0,1756-1764,{jaimee l. heffnerjonathan brickerbryan comstockchristopher wyszynski}
716,110453.0,anti-hypertensive medicines prescribing for medical outpatients in a premier teaching hospital in nigeria: a probable shift of paradigm.,eng,pharmacy practic@@e,pharm pract (granada),1885-642x,48.02576232368961,6.369492025540543,1/14/04,419,{kazeem b yusuffunyime i eshiet}
717,837546.0,agitation aggression and disinhibition syndromes after traumatic brain injury,english,neurorehabilitation,neurorehabilitation,1053-8135,17.0,4.0,1/2/01,297-310,{e. kim}
718,82695.0,the effect of lymphatico-venous anastomosis for an intractable ulcer at the lower leg in a marked obese patient.,eng,microsurgery,microsurgery,1098-2752,34.0,3.315465619362867,1/14/01,%jul-64@@,{hisako harayukio sekinoriyuki muraiisao koshimatakuya iidamakoto miharatakeshi todokoro}
719,820059.0,effects of multifunctional fabrics on cardiac autonomic tone and psychological state,english,international journal of neuroscience,int.j.neurosci.,0020-7454,114.0,8.0,1/4/01,923-931,{k.-w. parkj. songh.-j. kims.-r. moonm.s. lee}
720,771288.0,manual versus electric vacuum aspiration for first-trimester abortion: a systematic review,e%ng,bjog,bjog : an international journal of obstetrics and gynaecology,1470-0328 (print) 1470-0328,115.0,4.375294881388462,1/8/01,13-may,{f. dengj. wenq. y. caiy. p. li}
721,54202.0,behaviour research and therapy outcome predictors in guided and unguided self-help for social anxiety disorder,eng??%,behaviour res%ea$rch and therapy,4.08789475221317,0036-8148 0036-8148,50.0,1.0,1/1%2/01,13-21 do  - 10.1016/j.brat.2011.10.009,{o e havikp carlbringl g _stt nordgreeng anderssont furmark}
722,888477.0,probiotics for the treatment of upper and lower respiratory-tract infections in children: systematic review based on randomized clinical trials,eng,j pediatr (rio j),jornal de $pediatria,0021-7557,347.9351734115395,5.0,1/15/01,413-27,{m. h. de oliveira juniore. s. sarinhog. v. de araujod. m. peixoto}
723,741279.0,bradykinin is a mediator but unlikely a trigger of antiarrhythmic effects of ischemic preconditioning,e#%ng,journal of cardiovascular electrophysiology,j. cardiovasc. electrophysiol.,1540-8167,18.0,1.0,1/7/01,93-99 7p@@,{s. v. driamovs. butzp. t. buserc. e. zauggm. bellahcene}
724,64430.0,the nadph oxidase-mediated production of hydrogen peroxide (h(2)o(2)) and resistance to oxidative stress in the necrotrophic pathogen alternaria alternata of citrus.,eng,molecular plant pathology,mol. plant pathol.,1364-3703,13.0,8.0,1/12/10,900-14,{siwy ling yangkuang-ren chung}
725,461657.0,review of epidemiology and management of atrial fibrillation in developing countries.,3.810404033986291,4.45401869855446,3.9192708879211433,4.655474037405698,0.0,0.0,$1/1/@@98,4.37416669807057,{null}
726,1176818.0604352884,william h. taft high school project hola 1985-1986. oea evaluation report.,3.810404033986291,metabolism: clinical and experimental,3.6445065953161238,0009-9201 (print) 0009-9201,0.0,0.0,1/1/86,20-4 st  - preferences and practices of americans and their physicians in antihypertensive therapy-,{brooklyn. office of educational assessment. new york city board of education}
727,453909.0,the lung cancer management guidelines 2012.,4.269976607396762,4.45401869855446,5.5622014180295185,3.754775840828586,0.0,0.0,1/14/01,3.14642651605817,{null}
728,796002.2532251059,special problems in the p@@rosthetic rehabilitation of deep bite,en@@g,johns hopkins medical journal,johns hopkins med. j.,0266-7681 (print) 0266-7681,30.0,2.0,1/1/75,1#70-5??,{r. voss}
729,163839.0,the potential impact of bias in studies of residential exposure to magnetic fields and childhood leukemia,3.810404033986291,bioelectromagnetics,bioelectromagnetics,1521-186x,0.0,39.07868530380355,1/1/01,#s32-47,{null}
730,696132.0,changes of interaction during the development of a mathematical learning environment.,e$n??g,journal of mathematics teacher education,4.0278811450579965,1386-4416 1386-4416,14.0,5.0,??1/11#/10,$393-411,{dirk.hoek@ou.nl hoek dirk1koeno2 gravemeijer}
731,257990.0,an in$ternet-based program to enhance motivation to change in females with symptoms of an eating disorder: a randomized controlled trial,ger,4.968813083188042,5.9499722087274804,0195-6701 (print) 0195-6701,44.0,0.0,1/14/01,1$947-1963#,{hotzel kr von brachelkosfelder jhechler tvocks srieger eschulte dschmidt u}
732,332032.0,air pollution and risk of urinary bladder cancer in a case-control study in spain,$eng,occupational and environmental medicine,occup environ med,1470-7926,65.0,5.737323295748897,1/8/01,56-60,{nuria malatsalfredo carratomanolis kogevinasnathaniel rothmanconsol serrareina garcia-closasdebra silvermanadonina tardonkenneth p. cantormustafa dosemecigemma castano-vinyalsroel v@@ermeulen}
733,617801.0,remission rates following antidepressant therapy with bupropion or selective serotonin reuptake inhibitors: a meta-analysis of original data from 7 randomized controlled trials.,eng,j. clin. psychiatry,kekkaku,0160-6689,66.0,8.0,1/5/08,974-81,{michael e thaseyounghua wangapril e harriettmelinda mittoncarol b rockettbarbara r haightjack g modellnathalie richardsusan vanmeter}
734,480030.0,adaptive convex combination approach for the identification of improper quaternion processes,eng,5.581875510413807,3.712541518584958,$1678-4$464,25.0,1.0,1/14/01,172-82,{c. jahanchahic. c. tookb. c. ujangd. p. mandic}
735,2602859.1228216505,inappropriate use of emergency services: a systematic review of prevalence and associated factors.,eng,violencia c$ontra a crianca: revelando o p%erfil dos atendimentos em servicos de emergencia brasil 2006 e 2007.,5.4042603489906496,$1678-4$464,25.0,1.0,1/9/01,28-jul,{marlos rodrigues dominguesana claudia gastal fassamaria laura vidal carret}
736,1222929.348742199,use of episiotomy$ in the united states,eng,bir??th@@,4.968845331887675,1#523-536#x,29.0,1.0,1@@/2/01,jun-74,{m. c. klein}
737,696985.0,the diversion of ultram ultracet and generic tramadol hcl.,eng,#journal of addictive diseases,j addict dis,1545-0848,25.0,2.0,1/6/01,53-58,{george e. woodyanne gelleredgar h. adamstheodore j. ciceroalvaro munozedward c. senayjames a. inciardi}
738,4755816.547549489,aberrances in autonomic cardiovascular regulation in fibromyalgia syndrome and their relevance for clinical pain reports,eng,psychosomatic medicine,psychosom med,0033-3174,309.28635171421394,5.0,1/10/01,462-7%0,{sergio garridoangeles pulgarstefan$ duschekmar_a mart_n-vzquez??gustavo a reyes del paso}
739,3036964.728561347,sorafenib and pegylated interferon-alpha-2b in advanced metastatic melanoma: a multicenter phase ii decog trial,english,j. clin. oncol.,4.821638395758526,0732-183x,28.0,15.0,5.818486775441987,$2077@@-86,{ugurel s.schadendorf d.garbe c.trefzer u.egberts f.hassel j.weichenthal m.hauschild a.mauch c.gutzmer r.}
740,5040377.59109821,dispersal of methicillin-resistant staphylococcus epidermidis by staff in an operating suite for thoracic and cardiovascular surgery: relation to skin carriage and clothing,eng,j hosp infect,the journal of hospital infection,0195-6701 (print) 0195-6701,44.0,11.401082925733599,1/1/00,119-26,{p. domicela. tammeline. stahlea. hambraeus}
741,322953.0,psychometric validation of the growth and empowerment measu#re (gem) applied with indigenous australians,ger,australian and new zealand journal of psychiatry,3.310194182506305,apr-74,44.0,9.0,1/10/01,791-79#9,{komla tseymelissa r haswelllyndon reillydavid kavanaghchris doranarlene laliberteandrew wilsonyvonne cadet-james}
742,123731.0,alveolar soft part sarcoma of the uterine corpus. report of two cases and review of the literature,%e??ng,mov disord,archives of internal medicine,0885-3185,194.0,1.0,1/1/98,59-63,{k. radiga. roessnerp. buhtz}
743,180588.0,it's time practitioners help families clear the air of secondhand smoke: a commentary on pyle et al. (2005),3.972845563444873,5.736206646222841,3.6525435652260674,4.720116897647076,23.0,0.0,1/5/01,25-29,{geoffrey c. williamsbai brownson difranza gehrman glantz law mokdad ory panagiotakos pechacek pyle sargent sweda whincup whitlock arcavi}
744,440684.0,hemostatic resuscitation for massive bleeding: the paradigm of plasma and platelets - a review of the current literature.,3.810404033986291,4.45401869855446,3.316065476372231,4.655474037405698,0.0,0.0,4.309992138093654,3.14642651605817,{null}
745,758629.0,studies on the biological activity of two strains of bcg: influence of production conditions.,eng,dev. biol. stand.,clinical obstetrics and gynecology,030#1-5#149,58.0,-1.0,1/1/86,105-18,{m chouchkovaa engibarov}
746,964184.0,myocardial fibrosis by t1 mapping is an early indicator of severe cardiac allograft vasculopathy,4.009727077687419,circulation,circulation,22-sep,128.0,22.0,1/13/01,2826-34,{n.% harcourts. c. masrim. colving. raveendran}
747,265490.0,follistatin-like protein 1 regulates chondrocyte proliferation and chondrogenic differentiation of mesenchymal stem cells,eng,ann rheum dis,annals of the rheumatic diseases,mar-67,0.0,0.0,1/14/01,4.498126400817863,{s. m. smitha. d. marinovr. hirschd. s. bushnellb. t. campfieldh. c. blairy. chaly}
748,463556.0,structural brain changes associated with antipsychotic treatment in schizophrenia      as revealed by voxel-based morphometric mri: an activation likelihood estimation       meta-analysis.,3.810404033986291,pain practice,3.9192708879211433,4.655474037405698,0.0,0.0,$1/1/@@98,4.369498449995172,{null}??
749,3898535.04171915,insights in public health: taxing sugar sweetened beverages to improve public health: policy action in hawai'i. doctoral health policy seminar spring 2013,5.689216162027864,hawaii j med public health,hawai'i journal of medicine & public health : a journal of asia pacific medicine & public health,2165-8242,72.0,8.0,1/13/01,286-91,{t. sentellt. usagawam. hagiwarat. peacockh. hee heom. g. pearcel. choym. r. dela cruz}
750,300057.0,[evidence-based therapy guideline of the german working group on obesity in childhood and adolescence].,ger,bundesgesundheitsblatt gesundheitsforschung gesundheitsschutz,bundesgesundheitsblatt gesundheitsforschung gesundheitsschutz,$1437-1588,219.4461671106342,5.0,1/11/05,584-90,{m wabitscha mossd kunze}
751,166521.0,the cost of national service frameworks,eng,5.910739049403766,3.03071073312048,5.763443392793163,65.0,0.0,1/4/01,68-9 st  - the cost of nationa@@l service frameworks-,{r. cn  - pubmed da  - feb dp  - nlm et  - 2004/03/05 boyle}
752,292018.0,simple steps to fitness. secrets of strength. strength training is as important to weight loss and fitness as aerobic exercise is but many people ignore it. here's how to get started.,eng,diabetes forecast,diabetes forecast,0095-8301,55.0,8.0,1/2/08,98--100,{shauna s roberts}
753,181456.0,homeplace and housing in the lives of low-income urban african american families,5.917993926868935,5.736206646222841,3.6525435652260674,4.720116897647076,0.0,0.0,1/5/01,166-188,{linda m. burtonaltman bullard burton burton burton burton burton clark conley dilworth-williams fischer foucault franklin gieryn gilbert goering hooks howard kidder lahiri lawson clark lawson clark lawson clark low massey oliver perkins rosenbaum rosenbaum sanders stack allansherri lawson clark}
754,2448145.55108042,lack of association between the connexin 37 c1019t gene polymorphism and coronary artery disease in a chinese population: meta-analysis of 2206 subjects.,eng,biomedical reports,biomed rep,2049-943#4,1.0,3.0,1/13/05,464-468,{yan-yan liyun qianchuan-wei zhou}
755,984331.6534078714,[effects of tobacco advertising regulations in various countries],jpn,nihon koshu eisei zasshi,[nihon koshu eisei zasshi] japanese journal of public health,0546-1766 (print) 0546-1766,42.0,12.0,1/1/95,1017-28,{t. sone}$
756,788507.0,intensive glucose control in the management of diabetes mellitus and inpatient hyperglycemia,eng,am j health syst pharm,american journal of health-system pharmacy : ajhp : official journal of the american society of health-system pharmacists,1079-2082 (print) 1079-2082,67.0,10.0,1/10/01,798-805,{s. b. levya. o. shogbon}
757,3104286.2395202112,the value of breast self-examination: meta-analysis of the research literature.,eng,oncology nursing forum,oncol nurs forum,0190-535x,28.0,5.0,1/1/06,8??1@@5-22,@@{y@@ l ku}
758,433039.0,palliative sedation therapy in the last weeks of life: a literature review and recommendations for standards.,3.810404033986291,pain practice,4.7313022556522935,3.066993742045236,0.0,0.0,5.112107201045753,-,{nu#l$l}
759,737167.0,understanding depression in palliative and end-of-life care,en,nurs stand??,nursing standard (royal college of nursing (great britain) : 1987),0029-6570 (print) 0029-6570,23.0,12.0,1/5/01,48-57; quiz 58 60,{s. ashelfordv. taylor}
760,744601.0,inhaled anticholinergics and risk for acute urinary retention: a case-crossover and case-time-control study,4.643901879246277,value health,neurorehabilitation,1098-3015,17.0,7.0,1/14/12,a776,{dilokthornsakul p.joo m.j.lee t.a.pickard a.s.lin f.j.}
761,856471.0,compartmentalization of fa$s and fas ligand may prevent auto- or paracrine apoptosis in epithelial cells,eng,experimental cell re??sea#rch,4.186797126469046,420980,284.0,2.0,1/3/01,283-90,{w. hunzikerk. h. tan}
762,570704.0,rituximab-related viral infections in lymphoma patients.,e@@n#g,leukemia & lymphoma,j sports sci,1042-8194,48.0,7.0,1/7/07,1307-12,{saadettin kilickapomer dizdarsercan aksoyibrahim baristahakan harputluoglukadri altundagdidem sener dede}
763,520153.0,fetal lung volume measurements: determination with mr imaging--effect of various factors.,eng,radiology,acta clin belg,0033-8419,240.0,1.0,1/6/07,187-93,{carol e barnewolthiroto hatabumizuki nishinodeborah levinehenry a feldmanjudy a estroffvalerie l ward}
764,259267.0,intra-operative change of gastric ph during laparotomic cholecystectomy under general anaesthesia: a prospective case-control study,3.6311204475539847,in??dian journal of ??psychiatry,4.1333193681703415,5.49886700181227,56.0,0.0,1#/%12/01,40-43,{s. deyp. bhattacharyyab. k. biswasb. bhattaraip. bhakta}
765,82013.86015658444,the care guidelines: consensus-based clinical case reporting guideline development.,eng,headache,headache,1526-4610,53.0,10.0,1/13/11,1541-7,{[collective name] care groupjoel j gagnierdavid moherdouglas g altmangunver kienledavid rileyharold sox}
766,827921.0,effect of a creative-bonding intervention on% taiwanese nursing students' self-transcenden??ce and attitudes toward elders.,eng,res nurs health,scand. cardiovasc. j.,1098-240x,32.0,2.0,1/9/04,204-16,{sandra m walshshiue chen}
767,461204.0,fc receptor-like 3 (fcrl3) -169 c/t polymorphism and systemic lupus erythematosus: a meta-analysis.,3.810404033986291,4.45401869855446,3.316065476372231,4.655474037405698,0.0,0.0,4.447582496616284,3.14642651605817,{null}
768,482860.0,[indirect anastomoses for moyamoya disease].,jpn%,no shinkei @@geka. neurolog%ical surgery,3.310194182506305,0301-2603,140.66717748977447,9.0,9/1/98,769-86,{y matsushima}
769,18298.0,ulcer healing after peripheral intervention.,en$g,circulation journal :$ official journal of the japanese# circulation society,circ. j.,1347-4820,-1.0,-1.0,4/14/07,3.833989414286154,{daiki uchidayukihiro saitohisashi uchidaatsuhiro koyanobuyoshi azuma}
770,365654.0,mea%suring the bright side of being blue: a new tool for assessing analy$tical rumination in depression.,eng,plos one,plos one,1932-6203,9.0,11.0,1/14/01,e112077,{skye p barbicpaul w andrewszachary durisko}
771,625306.0,[mammographic density: a valid risk factor for breast cancer?].,fre,prvention de l'insuffisance rnale induite par les produits de contrnste iodes,sleep,0221-0363,89.0,9.0,1/8/09,1140-50,{g ??boutet}
772,572343.0,high-dose sequential (hds) chemotherapy for high-risk non-h??odg$kin's lymphoma: long-term analysis and future developments.,eng,ann. hematol.,neurosurg,0939-5555,287.1758433978011,-1.0,1/1/01,b123-6,{m ladettod caracciolog rossic marinonel berguia cutticaa salomonem boccadoroi riccac tarellam paganof zalliop gavarottia pileria de crescenzo}
773,88262.0,core symptom measures in cancer clinical trials.,eng,journal of the national cancer institute,j. natl. cancer inst.,1460-2105,564.945473916441,7.0,1/14/07,4.44114894713579,{carolyn gotay}
774,663339.0,human papillomavirus infection and increased risk of hiv acquisition. a systematic review and meta-analysis.,eng,aids (london england),aids,1473$-5571,26.0,17.0,11/13/12,2211-22,{chunhui wangrichard hayeslouise kuhnstephen shiboskijennifer s smithnatasha l larkedeborah watson-jonescatherine f houlihanpatti e gravittkaren k smith-mccune}
775,718292.0,prevalence of different morphologic forms of the human tongue in young finns.,eng,oral surgery oral medicine and oral patholo??gy,oral surg. oral med. oral pathol.,#??0030-4220,53.0,2.0,2/1/82,152#-6$,{m mikkonenr kotilainena kullaa-mikkonen}
776,245200.0,osteoporosis in men,eng,arch intern med,archives of internal medicine,0003-9926 (pri??nt) 0003-9926,158.0,2.0,1/1/98,194,{m. galus}
777,307302.0,n$eurolymphatische bahnen: neue wissenschaftliche nachweise untermau??ern die perrin-technik,e$n??g,international medicine & health guidance news [guo ji yi yao wei sheng dao bao],5.492338598449465,0961-5423,14.0,9.994136616696919,1/13/06,15-oct,{raymond n. perrin}
778,217418.0,long term follow-up of conservative treatment of severely traumatized maxillary incisors,$e$ng,3.0118980666292776,5.719206152757008,1088-3371,67.3893022488212,4.0,1/1/97,190-192,{z. hirschfeldi. brina. fuksm. guelmann}
779,413717.0,magnetic resonance imaging evaluation of bone marrow changes in obstructive sleep apnoea syndrome in adults,english     italian,cns drugs,5.978468602561043,4.0472925149398895,560.1980696510765,17.989513139527453,1/6/01,572-84,{a. #r. aleandrid. mancinit. cosentinir. le donnen. colavita}
780,62246.0,pulpal response to a fluoride-releasing all-in-one resin bonding system.,eng,operative dentistry,oper dent,0361-7734,27.0,3.0,1/2/05,271-7,{masayuki otsukimakoto arakawahidekazu sonodayasutaka sasafuchiyuichi kitasakojunji tagami}
781,945021.0,improvement of action tremor by chronic cortical stimulation,eng,mov disord,movement disorders : official journal of the movement disorder society,0885-3185,13.0,1.0,1/1/98,aug-84,{b. pollinc. genyj. p. nguyenp. cesaroa. feve}
782,649817.0,validity of rorschach inkblot scores for discriminating psychopaths from non-psychopaths in forensic populations: a meta-analysis.,eng,psychological assessment,psychol assess,1939-134x,22.0,2.0,1/10/06,336-49,{scott o lilienfeldkeli holloway allenhoward n garbjessica l wildermuthm teresa nezworskijames m wood}
783,934327.0,use of a brief phone call after ed discharge,3.810404033986291,5.046184700888077,3.2500800881702276,039#0-6078,0.0,0.0,$1/1/@@98,-,{nct01893931 }
784,546484.0,the effects of pre-reading and sharing mechanisms on learning with the use of annotations,eng$%,turkish online journal of educational technology - tojet,emerg radiol,1303-65$21,10.0,2.0,1/11/04,234-249,{wu-yuin hwangguo-liang hsu}
785,917231.0,[occupational exposure to sevoflurane in pediatric operating rooms: the multi-point sampling method for risk assessment].,ita,patologie asbesto correlate in congiunti di lavoratori del settore cemento-amianto.,eur. heart j.,1592-7830,146.15166998527235,3.0,1/12/07,26??6-8,{v cerabonam wachockau moscatov camisam g tuccis zaffinav montaldia poscia}
786,887418.0,impact of cr@@izotinib on patient-reported symptoms and global quality of life (qol) compared with chemotherapy in a phase iii study of advanced alk-positive non-small cell lung cancer (nsclc),4.009727077687419,european journal of cancer,5.581535145752012,3.5912374153614177,49.0,0.0,1/13/01,-,{v. hirshj.y. hanf. blackhalls. iyerd.w. kima. shawa. r@@eismank. wilnerh. nokiharab. besse}
787,724055.0,a systematic review and meta-an$alysis of trials of treatment of depression from india,english,in??dian journal of ??psychiatry,4.1333193681703415,171@@5-5258,56.0,0.0,1/14/01@@,29-38,{s. sarkars. grover}
788,353720.6990452141,[the use of ethonium paste in the treatment of deep dental caries].,rus,stomatologiia,stomatologiia (mosk),0039-1735,50.0,2.0,3/1/71,79-80,{p k shestakov}
789,422739.0,reporting methods in studies developing prognostic models in cancer: a review.,eng,bmc medicine,bmc med,1741-7015,8.0,0.0,1/10/01,??20$-20,{patrick roystonrachel waterssusan mallettdouglas g altmansusan dutton}
790,97795.0,hospital discharge after ambulatory knee arthroscopy: a comparison of epidural 2-chloroprocaine versus lidocaine,@@eng,current opinion in ophthalmology,neurosurg,09593985 (issn),26.0,1.0,1/1/01,35-40,{j. m. neald. j. kopaczm. a. lewisj. j. deck}
791,893574.6928512616,p16(ink4) expression is not associated with human papillomavirus in oral lichen planus.,eng,oral surgery oral medicine oral pathology and oral radiology,oral surg oral med oral path#ol% oral radiol,2212-4411,118.0,6.0,1/14/12,694-702,{lucio montebugnoliluca morandiluca scapoliannalisa palmieridavide b gissimaria pia foschiniilaria manelli}
792,100986.0,association of bleeding mortality and sex in acute coronary syndromes: the missing triangle.,eng,journal of cardiovascular medicine (hagerstown md.),j cardiovasc med (hagerstown),1558-2035,-5.844225827860601,-1.0,9/23/14,447-55,{rossana de palmapaolo ortolanicaterina caminitiemilia solinaspiera angelica merlinidiego ardissinogiorgia paolimaria francesca notarangelopaolo guastarobaantonio marzocchiluigi vignaliroxana mehranantonio manari}
793,166179.0,[severe exposure to environmental lead in a child population in antofagasta chile],#en??g,exposicion severa a plomo ambiental en una poblac#ion infantil de antofagasta chile.,adm policy ment health,0034-9887,578.0762003391343,2.0,1/1/00,221-32,{i. delgadoj. vega}
794,3806181.35982045,tracheostomy care and complications in the intensive care unit,4.009727077687419,critical care nurse,journal of nutrition in gerontology and geriatrics,0250-832x,140.90305953284377,5.0,1/13/01,1@@%8-31 14p,{linda l. mo@@rri%sandrea whitmererik mcintosh}
795,379577.0,monitoring of fluid changes in hospitalized malnourished guatemalan children using bioelectrical impedance spectroscopy (bis).,eng,applied radiation and isotopes : including data instrumentation and methods for use in agriculture industry and medicine,appl r%adia$t isot,0969-8043,49.0,5.0,5/1/98,615-7,{c pithanm mazariegosn w solomonsp f_rst}
