ID,id,article_title,article_language,journal_title,jounral_abbreviation,journal_issn,article_jvolumn,article_jissue,article_jcreated_at,article_pagination,author_list
534,111745.54418449718,glial cells in amyotrophic later@@al sclerosis.,eng,experimental neurology,exp. neurol.,1090-2430,-1.0,-1.0,5/22/14,3.833989414286154,{t philipsj d rothstein}
535,623367.0,diagnosing acute cardiac ischemia in the emergency department: a systematic review of the accuracy and clinical effect of current technologies.,eng,annals of emergency medicine american college of emergency physician's research forum,environ. toxicol. pharmacol.,0196-0644,37.0,5.0,1/1/05,453-60,{j p ioannidisj lauc milchd salemp w chewn terrine m balk}
536,13408.0,eczema - quiz.,eng,paediatrics & child health,paediatr child health,1918-14%8%5,5.0,2.0,3/1/00,105,{null}
537,449003.0,stroke in children with posterior fossa brain malformations hemangiomas arterial anomalies coarctation of the aorta and cardiac defects and eye abnormalities (phace) syndrome: a systematic review of the literature.,3.810404033986291,4.45401869855446,3.316065476372231,4.655474037405698,0.0,0.0,3.4657666723192744,3.14642651605817,{null}
538,961705.1799558501,employing a youth-led adult-guided framework: why drive high? social marketing campaign.,$e$ng,family & community health,$j. hyp#ertens.,01??60-6379,124.24082827589075,4.0,1/??11/10,319-330,{terry-lynne markotyler watt}
539,302268.0,review of handbook for working with children and youth: pathways to resilience across cultures and contexts,english,journal of psych@@iatric research,3.901966770079136,3.5811301297105955,47.0,3.0,1/6/0??1,230-232,{robert j. flynn}
540,592663.0,helicobacter pylori antibiotic resistance patterns and genotypes in adult dyspeptic patients from a regional population in north wales,eng,aktuelle traumatologie,j. nucl. med.,5.763443392793163,54.0,2.0,1/4/01,435-40,{a. m. walkerj. xerryk. daviesn. c. elvissr. j. owen}
541,2368120.877542616,sonographically guided biopsy of focal lesions: a comparison of freehand and probe-guided techniques using a phantom.,eng,ajr. american journal of roentgenology,ajr am j roentgenol,0361-803x,184.0,5.0,1/5/05,1652-6,{duncan ??m brookspr$amit m phalrory wolfe}
542,460786.0,splinting osseointegrated implants and natural teeth in partially edentulous patients: a systematic review of the literature. [review],3.810404033986291,4.45401869855446,5.940961548203864,3.754775840828586,0.0,0.0,$1/1/@@98,3.14642651605817,{null}
543,866131.0,long-term subcutaneous recombinant interleukin-2 as maintenance therapy: biological effects and clinical implications,en#g,cance??r# biotherapy,[nihon koshu eisei zasshi] japanese journal of public health,1062-8401,10.0,3.0,1/1/95,195-20@@3,{v. lorussom. de lenam. guidam. correalei. abbatea. latorrea. casamassimam. d. musci}
544,2534937.330182175,school soft drink intervention study,e$ng,bmj,3.03071073312048,1468-5833 (electronic),329.0,7462.0,1/4/01,e315-6,{s. a. frenchm. %storyp. j. h@@annan}
545,436781.0,hoarse voice in adults: an evidence-based approach to the 12 minute consultation.,3.810404033986291,4.45401869855446,3.9192708879211433,3.754775840828586,0.0,0.0,$1/1/@@98,3.977589733863403,{null}
546,796900.0,chronic compartment syndrome an important cause of work-related upper limb disorder,ger,rheumatology (oxford),rheumatology (oxford england),1462-0324,44.0,11.0,1/5/01,1442-6,{j. p. heathr. l. williamsm. h. pritchard}
547,1596235.4193381683,sleep sleep-dependent procedural learning and vigilance in chronic cocaine users: evidence for occult insomnia,english,cns drugs,5.978468602561043,4.0472925149398895,82.0,3.0,1/6/01,2%38-49,{r. t. malisone. f. pace-schottv. coricp. t. morganr. stickgoldz. h. sahul}
548,893227.0,a screening methodology for crowdsourcing video qoe evaluation,3.810404033986291,european respiratory journal,5.9499722087274804,3.152171279402962,0.0,0.0,1/14/01,120 [tp 184],{e. anegekuh l. sun l. ifeachor}
549,525874.0,potential for inter-observer and intra-observer variability in x-ray review to establish stone-free rates after lithotripsy.,eng,j. urol.,3.230432130638648,0022-5347,716.6225810015643,3.0,3%/1/9??2,559-62,{d carons j witchellm a jewette l st louisr r grayc bombardiers kumrak e psihramism r ryan}
550,26475.0,situat%ing universal design architecture: designing with whom?$,eng,disability and rehabilitation,disabil rehabil,1464-516#5,-1.0,-1.0,7/28/14,6??-jan,{paul jones}
551,476191.0,endovascular treatment of ruptured large or wide-neck basilar tip aneurysms associated with moyamoya disease using the stent-assisted coil technique.,eng,journal of stroke and cerebrovascular di#seases ??: the official journal of national stroke association,j stroke cerebrovasc dis,1532-8511,-1.0,-1.0,7/24/15,362-9,{yibin fangpengfei yangjianmin liuyi xuqinghai huangwenyuan zhaodongwei daiyan chen}
552,719389.0,subjective states: a @@more robust model,#en??g,games and economic behavior,american journal of health-system pharmacy : ajhp : official journal of the american society of health-system pharmacists,0899-8256,67.0,2.0,1/9/01,408-427,{k. seol. g. epstein}
553,467318.0,the fundamental role of bone morphogenetic protein 15 in ovarian function and its      involvement in female fertility disorders.,3.810404033986291,4.45401869855446,3.9192708879211433,4.655474037405698,0.0,0.0,$1/1/@@98,3.14642651605817,{null}
554,268361.0,giant-cell tumour of the% knee: the condition of the cartilage after treatment by curettag%e and cementing,eng,j bone joint surg br,the journal of bone and joint surgery. british volume,0301-620x (print) 0301-620x,442.7047079914858,3.0,1/7?%?/01,361-5,{k. jonssona. rydholmi. kristianssond. heinegardf. v. von steyernp. mannfolk}
555,2086602.313301978,diagnostic accuracy of endoscopic ultrasound-guided fine-n??eedle aspiration for solid pancreatic lesion: a systematic review$.,eng,journal of cancer research and clinical oncology,j. cancer res. clin. oncol.,1432-1335,138.0,9.0,1/12/%@@09,1433-41,{hangcheng zhourenbao yangjiong chenyunlian xiayin lu}
556,590945.5089590821,safety tolerability and sustained weight loss over 2 years with the once-daily human glp-1 analog liraglutide.,eng,internati%onal journal of obesity (2005),int j obes (lond),1476-5497,36.0,6.0,1/12/06,843-54,{r carrarom f rasmussenl niskanena harpern finers r_ssnerm kunesoval van gaalm e j leana astrupa rissanenm j savolainen[collective name] nn8022-1807 investigators}
557,258486.0,web-based nutrition education intervention improves self-efficacy and self-regulation related to increased dairy intake in college students,english,5.509600546809207,acta neurolo#gica$ scandinavica,14-jan,110.0,57.90528215849405,1/10/01,1723-7,{kathy w hosigsharon m nickols-richardsonkavita h poddarsusan e duncaneileen s anderson}
558,5048788.141458706,three abstracts on chinese research,3.0469244487548313,american$ acupunctu??rist,j health care poor underserved,1520-7714,338.5764254124379,0.0,1/13/01,25-26,{null}
559,52681.0,retrograde nailing of humeral shaft fractures,eng,5.4145734679475055,3.2500800881702276,039#0-6078,0.0,1739.974472245456,$1/1/@@98,26-39,{m. runkelj. blump. m. rommens}
560,828156.0,behavioral and cognitive measurements predict scores on the mast: a 3-year prospective study.,eng,alcohol clin exp res,alcoholism clinical and experimental research,0145-6008,20.0,7.0,10/1/96,1173-8,{v hesselbrocka w deckel}
561,812757.0,development of a snp genotyping panel and a medical decision support algorithm to predict drug response in schizophrenia,3.0469244487548313,klinik psikofarmakoloji bulteni,klin.psikofarmakol.bul.,1017-7833,84.18237344236951,0.0,#1/11/01,s156-s157,{y. a. song. ustunkarm. a. dokeh. a. domy. y. tuncel}
562,713518.0,elderly and physical activity: benefits and challenges in search for $life quality.,5.961023864224561,journal of nursing ufpe / revista de enfe??rmagem %ufpe,rev enfermagem ufpe,1981-8963,6.0,11.0,1/12/11,#2761-2769 #9p,{gerlane ngela da costa moreiradenyse dutra alencar vasconcelosamanda costa de freitascarla cristina braga maranhodanielle figueiredo patricio}
563,180977.0,neighbourhood characteristics and mortality in the atherosclerosis risk in communities study,3.0469244487548313,int j obes (lond),3.03071073312048,5.763443392793163,33.0,0.0,1/4/01,398-407,{l. n. borrellk. ??ros@@eb. l. clarkd. catelliera. v. d. roux}
564,828214.0,transference-focused psychotherapy v. treatment by community psychotherapists for borderline personality disorder: randomised controlled trial.,eng,the british journal of psychiatry : the journal of mental science,br j psychiatry,1472-1465,196.0,22.81282119354127,1/10/0??5,389#-$95,{philipp martiusanna buchheimpeter buchheimsusanne h_rzmichael rentropcord beneckepeter schustermelitta fischer-kernstephan doering}
565,1047797.7792837602,the changing residential environments of older people,4.772670861806578,journal of sexual medicine,3.316065476372231,4.8211551222409526,0.0,0.0,1/11/01,207-220,{basta beard beard beel-bates bierman bowling cagney calkins carder carlsson chan clark clarke cutchin cutler davidoff diehl doty durrett feldman foote freedman gaugler gitlin gitlin glass golant golant golant golant golant golant golant grafova gross hunt alleystephen m. golant}
566,677752.0,a systematic review of the surgical treatment of large incisional hernia.,eng,hernia : the journal of hernias and abdominal wall surgery,hernia,1248-9204,19.0,1.0,1/15/02,89-101,{l timmermansj c sliekerj f langee b deerenbergj jeekeld p hogerzeilp h c eilers}
567,107417.0,fast-food habits weight gain and insulin resistance (the cardia study): 15-year prospective analysis.,eng,@@la%ncet,lancet,1474-547x,365.0,9453.0,1/5/01,36-42,{david r jacobsdavid s ludwigcara b ebbelingalex i kartashovmartha l slatterylinda van hornmark a pereira}
568,141282.0,early prenatal survival in relation to the parental environment in sheep: a review,#en??g,small ruminant research,3.37312557590688,$092??1-4488,167.57409255533844,2.0,6/2@@9/9%8,143-156,{e decuyperee dewild vanmontforth michels}
569,708911.0,changing tides: improving outcomes through mentorship on all levels of n$ursi%ng,#en??g,learning & leading with technology,5.4648570866113255,5.763443392793163,33.0,2.0,1/10/01,163-176,{j. skeest. k. race}
570,3618429.831384756,tracking cognitive decline in alzheimer's disease using the mini-mental state examination: a meta-analysis.,#eng@@,international psychogeriatrics / ipa,int psychogeriatr,1041-6102,12.0,2.0,6/1/00,231-47#,{j mccuskerf primeaum colel hanf bellavance}
571,647583.0,pulmonary rehabilitatio??n programs for patients with c@@opd.,engpor,jornal brasileiro de pneumologia : publicacao oficial da sociedade brasileira de pneumologia e tisilogia,3.606272955779418,1806-3756,37.0,4.0,1/11/07,544-55,{ana maria baptista menezesdavid alejandro gonzlezelaine cardozo macedopedro curi hallalmaria de ftima maiamarli knorstsamuel carvalho dumithjeovany mart_nez-mesaricardo bica noalfernando csar wehrmeisterjos roberto jardim}
572,361080.0,the impact of nursing case management on women with diabetes in pregnancy,3.0469244487548313,jognn: journal of obstetric gynecologic & neonatal nursing,rheumatology,0884-2175,215.56789740163072,0.0,1/12/01,s131-2,{corinn ta%ylor}
573,283168.0,[pharmacotherapy for conduct disorder in children and adolescents],heb,harefuah,3.601433740818189,0002-9378 (print) 0002-9378,544.1390975476525,7.0,1/12/01,421-6 435 434,{t. levyy. bloch}
574,52633.0,monteggia lesions# in adults. a multicenter b@@ota study,eng,minerva cardioangiologica,eur j appl physiol occup physiol,4.2396381283940485,62.0,0.0,1/1/96,78-83,{w. de grooted. stoffelenk. govaertsp. reyndersp. l. broosj. rondia}
575,74821.0,progesterone receptor progins and +331g/a polymorphisms confer susceptibility to ovarian cancer: a meta-analysis based on 17 studies.,eng,tumour biology : the journal of the international society for oncodevelop??mental biology and medicine,tumour biol.,1423-0380,35.0,3.0,1/14/03,2427-36,{xinran wangchenhuan dinglilan chenshu liting liuxia yinyou wangxiangjun sunwen dihe li}
576,1429613.805800987,gene analysis of steroid 5 alpha-reductase 1 in hyperandrogenic women,$e$ng,croatian medical journal,croat.med.j.,0353-$950$4,194.75022845336665,4.0,1/5/01,664-669,{b. heljicr. komeli. eminovicf. gavrankapetanovicj. prezeljj. karamehic}
577,529562.0,intravenous insulin treatment in acute stroke: a systematic review and meta-analysis of randomized controlled trials.,eng,international journal of stroke : official journal of the international stroke society,int j stroke,1747-4949,9.0,4.0,1/14%/06,489-93,{p michelv papavasileioug ntaiosa bargiotak makaritsis}
578,574242.0,hospitalized heart failure patients with preserved vs. reduced     ejection fraction in dubai united arab emirates: a prospective     study,eng$li$sh,european journal of heart failure,eur. j#. heart fail.,1879-0844,16.0,4.0,1/14/01,454-460,{al sayed hussain asaheb sharif-askari nsulaiman saal-mulla aatabatabai ssaheb sharif-askari f}
579,966388.0,multiple endocrine neoplasia type 1 with multiple leiomyomas linked to a novel mutation in the men1 gene,engl@#@ish,yonsei medical journal,yonsei% med.j#.,1976-24??37,49.0,4.0,1/8/01,655-661,{h. choie. s. kangs. k. lims. y. jeongh. c. leeh. j. kims. kimy. rheey. h. leej. h. moonk. r. kimc. w. ahnb. s. chae. j. lee}
580,4677714.388699696,[anesthetic gases exposure: findings from a 13 year environmental and biological monitoring in a hospital company].,ita,patologie asbesto correlate in congiunti di lavoratori del settore cemento-amianto.,j sports sci,1592-7830,29.0,3.0,1/7/07,411-3,{m a% sanchezs ritzuv capellip boccalong arcangeli}
581,494428.0,out-of-hospital cardiac arrests occurring in southern ontario health care clinics: bystander cardiopulmonary resuscitation and automated external defibrillator use.,eng,canadian family physician medecin de famille canadien,can fam physician,171@@5-5258,56.0,6.0,1/10/06,e213-8,{karen k lamsteven c brookslaurie j morris@@on}
582,55809.0,diffusion tensor imaging of deep gray matter in children treated for brain malignancies.,eng,child's nervous system : chns : official journal of the international society for pediatric neurosurgery,childs nerv syst,1433-0350,30.0,4.0,$1/14/04,631-8,{anna nideckersiamak ardekanie mark mahonefirouzeh tannazijarunee intrapiromkulmoody% wharamlarry j brantalena horsk}
583,368651.0,a randomized controlled trial of paracetamol versus morphine for the treatment of acute painful crisis of sickle cell disease,4.403513153012774,5.798105433763747,3.210990721456994,3.472930790556169,20.0,5.0,1/13/01,s149,{r. rehmani}
584,423691.0,puberty suppression in adolescents with gender identity disorder: a prospective follow#-up study,english,journal of sexual medicine,biomed eng on??line,1547-5271,8.0,8.0,1/11/01,2276-83,{t. a. doreleijersp. t. cohen-kettenisa. l. de vriest. d. steensma}
585,435904.0,a meta-analysis of clinical trials comparing mirtazapine with selecti$ve serotonin reuptake inhibitors for the treatment of major depressive disorder.,4.959674026171765,4.45401869855446,3.1017716222879095,3.754775840828586,0.0,0.0,1/1/90,3.14642651605817,{null}
586,407245.0,group physiotherapy provides similar outcomes for participants after joint replacement surgery as 1-to-1 physiotherapy: a sequential cohort study.,eng,archives of physical medicine and rehabilitation,arch phys med rehabil,1532-821x,90.0,10.0,1#/9/10$,1727-3??3,{corinne l coulterjennie m scarvelljeanie m weber}
587,918698.0,sevoflurane postconditioning converts persistent ventricular fibrillation into regular rhythm.,eng,european journal of anaesthesiology,eur j anaesthesiol,1365-2346,26.0,9.0,1/9/09,766-71,{fengjiang zhanggang chenmin yancongcong chen}
588,209138.0,frontal and sagittal plane analyses of the stair climbing task in healthy adults aged over 40 years: what are the challenges compared to level walking?,e#%ng,clinical biomechanics,can forces dent serv q,0268-0033 do  - http://dx.doi.org/10.1016/j.clinbiomech.2015.03.009,18.0,10.0,1/3/12,950-959,{s nadeauf malouinb.j mcfadyen}
589,862844.0,dpyd ivs14+1g>a and 2846a>t genotyping for the prediction of severe fluoropyrimidine-related toxicity: a meta-analysis,e$n??g,pharmacogenomics,pharmacogenomics,1462-2416,14.0,53.974929426361655,1/13/01,1255-1272,{r. danesis. terrazzinop. l. canonicoa. a. genazzanis. cargninm. del re}
590,875733.0,[methicillin-resistant staphylococcus aureus forming the fried egg appearance colonies isolated from a patient with septicemia],jpn,rinsho byo%ri,rinsho byori. the japanese journal of clinical pathology,0047-1860 (print)     0047-1860,43.0,10.0,1/1/95,1061-5,{k. iijimaa. tanimotoy. kitagakim. hiurah. fujiwaras. ikawa}
591,587683.0,support for nutrition from the older americans act programs: a clarification on its 40th anniversary,en@@g,j nutr ge$rontol geriatr,journal of nutrition in gerontology and geriatrics,0735-1631,32.0,1.0,1/13/01,mar-81,{j. l. lloyd}
592,927711.0,measures of exposure to the well london phase-1 intervention and their association with health well-being and social outcomes,3.9788989006707953,journal of epidemiology & community health,5.9499722087274804,0143-005x,68.0,7.0,1/14/01,597-605,{c. bottomleyk. locks. laisa. clowg. yur. lyncha. rentong. phillipsm. petticrewa. draperp. tobie. schmidtr. hayesd. moore}
593,1210310.6786161528,the effects of cognitive coaching and nonverbal classroom management on teacher efficacy and perceptions of school culture.,english,#dissertation abstracts international a: the humanities and social sciences,3.316065476372231,4.34646395557274,0.0,0.0,1/1/98#,293.4268482396396,{jennifer l. edwardscherie a. lyonsmarcia e. swordsmary s. rogerskathy e. green}
594,161847.0,changes in glucose tolerance over time in women with polycystic ovary syndrome: a controlled study,eng,archives of physical medicine and rehabilitation,arch phys med rehabil,1532-821x,90.0,0.0,1/5/01,3236-42 st  - changes in glucose tolerance over@@ time in w#omen with polycystic ovary syndrome: a controlled study-,{a. da  - jun do  - jc.2004-1843 [pii] 10.1210/jc.2004-1843 [doi] dp  - nlm et  - 2005/03/31 dunaifa. r. kunselmanr. s. legroc. l. gnatuk}
595,543292.0,effects of test administrator characteristics on achievement test scores,3.810404033986291,online submission,3.7586169422135063,978-957-41-6666-4,0.0,0.0,1/5/04,-,{maria papapolydoroutaslima rahmanwilliam d. schaferlori parker}
596,248064.0,distal radius fracture arthroscopic intraarticular displacement measurement after open reduction and internal fixation from a volar approach,eng,j orthop sci,journal of orthopaedic science : officia%l journal of the japanese @@orthopaedic association,0949-2658 (print) 0949-2658,15.0,20.050942558708876,1/10/@@0??1,502-8,{t. katayamak. furutam. akahaneh. onor. fujitani}
597,887041.0,age-related driving disorders: screening in hospitals and outpatients settings.,eng,geriatr gerontol int,geriatrics & gerontology international,$1447-059$4,39.20789157430332,4.0,1/10#/10,288-94,{kevin patrickjill rybarlinda hillsara bairdraul coimbrasusanna concha-garcia}
598,314737.0,[effect of a dialysis solution with icodextrin on ultrafiltration and selected metabolic parameters in patients treated with peritoneal dialysis],english,3.5341002476208474,neurorehabilitation,4.419244610196625,141.0,9.0,1/2/01,281-5,{s. opatrnap. stehlikj. racekjr. opatrny k.v. senftf. sefrnao. topolcan}
599,709094.0,evidence based practice and advanced competencies in a mhs-cls program,eng,international journal of qualitative studies in education (qse),int. j. dev. biol.,4.8211551222409526,24.0,4.0,1/11/01,4-47-53,{l. pretlowa. ranneb. kraje. k. leibachb. russell}
600,1434745.9394195992,effect of qva149 on lung volumes and exercise tolerance in copd patients: the bright study,3.9788989006707953,respiratory medicine,epilepsy res.,0033-3549,108.0,4.0,1/14/01,584-92,{jutta beierpeter d'andreamichelle henleystephanie kornkai-michael beehdonald banerjidalal jadayel}
601,793206.0,disseminated lymphoma with large granular lymphocyte morphology diagnosed in a horse via abdominal fluid and transtracheal wash cytology.,eng,veterinary clinical pathology / american society for veterinary clinical pathology,ve%t$ clin pathol,1939-165x,44.0,3.0,1/15/09,437-4%1,{fernanda cesaranne a wooldridgecinzia mastrorillipete w christophersonkellye joiner}
602,361682.0,outcome of patients with severe ph due to lung disease with     and without targeted therapy,english,cardiovascular therapeutics,journal of nutrition in gerontology and geriatrics,1557-8550,32.0,5.0,1/14/01,202-208,{seiler ibaron marzt mpfeifer mlange tj}
603,732256.0,a comprehensive assessment of maternal deaths in argentina: translating multicentre collaborative research into action.,5.3860966336666545,bulletin of the world health organiz%ation,??bull.who,0042-9686,85.0,8.0,1/7/08,615-622 8p,{romero mmercer rramos skarolinski a}
604,2753929.2509983787,human african trypanosomiasis diagnosis in first-line health services of endemic countries a systematic review.,eng,plos neglected tropical diseases,acta cytol.,1935-2735,6.0,11.0,1/12/01,@@$e1919,{victor kandeepco haskerveerle lejonjean-jacques muyembepatrick mitashimarleen boelaertpascal lutumba}
605,743394.0,overlap of food addiction and substance use disorders definitions: analysis of animal and human studies.,eng,neuropharm??acology,neuro@@p%harmacology,1873-7064,85.0,-1.0,1/14/10,81-90,{antoine hone-blanchetshirley fecteau}
606,592201.0,efficacy of prolonged administration of intravenous erythromycin in an ambulatory setting as treatment of severe gastroparesis: one center's experience,eng,3.486869837808406,4.48524103769689,0020-7292,28.0,2.0,1/1/99,131-4,{e. m. quigleyj. k. dibaise}
607,914007.0,bound for success: a systematic review of constraint-induced movement therapy in children with cerebral palsy supports improved arm and hand use (structured abstract),fre,physical therapy,phys ther,0031-9023,89.0,11.0,1/9/01,1126-1141,{@@h. h. huangj. halel. fettersa. mcbri#de}
608,208824.0,optical turbulence: weak turbulence condensates and collapsing filaments in the nonlinear schr_dinger equation,%e??ng,physica d: nonlinear phenomena,#j ce#ll biol,0167-2789 do  - http://dx.doi.org/10.1016/j.physd.2013.07.012,225.23671359648128,1.0,6/15/92,96-160,{v.e. zakharovs. dyachenkoa.c. newella. pushkarev}
609,759501.0,[progress in joint international research of demographic and geographic distribution of insignificant middle and high-grade tuberculin skin sensitivity].,ger,zeitschrift fr erkrankungen der atmungsorgane mit folia bronchologica,z erkr atmungsorgane folia bronchol,0044-2631,133.0,1.0,12/1/70,99-106,{m a b@@leik$er}
610,506162.0,effic??acy of class 1 elastic compression stockings in the early stages of chronic venous disease. a c??omparative study.,eng,int. angiol.,psychol assess,0392-9590,22.0,4.0,1/3/12,383-92,{f vinf a allaertj p benignis sadoun}
611,372697.0,the future of jak inhibition in myelofibrosis and beyond,5.779013437867473,blood reviews,blood rev.,0268-960x,137.88978123859158,5.0,1/14/09,189-196,{r.a. mesan.c.p. crossj.o. mascarenhas}
612,2565203.5571896154,reinventing the wheel? or the emperor's new clothes.,eng,j altern comple??ment med,journal of alternative and complementary medicine (new york n.y.),1075-5535,9.0,5.0,1/3/10,613-5,{george vithoulkasmenachem oberbaumshepherd singerrobbert van haselen}
613,584706.0,a study of out-of-hospital cardiac arrests in northeastern minnesota,eng,jama,jama,0098-7484,256.0,4.0,1/1/86,477-83,{g. s. mcdonaldj. w. bachmanp. c. o'brien}
614,822897.0,the chinese medicine construct stagnation in mind-body connection mediates the effects of mindfulness training on depression and anxiety,3.325482664744112,co%mplementary therap$ies in medicine,brain behav,5.287982490230859,21.0,4.0,1/13/01,348-357,{k. f. lams. m. ngb. h. p. lauh. h. m. loc. l. w. chan}
615,440038.4136553623,outcomes from patients with multi-vessel disease following primary pci: staged pci imparts very low mortality.,eng,catheterization and cardiovascular interventions : official journal of the society for cardiac angiography & interventions,catheter cardiovasc interv,1522-726x,77.0,21.039632390680314,1/11/04,617-22,{gilles montalescotgordon fitzgeraldkurt g barringhaus[collective name] grace investigatorsfrans van de werfjoel m goredavid d mcmanusjos l_pez-send_nphilippe gabriel stegkay lee park}
616,24026.0,modelling the effects of subjective and objective decision making in scientific peer review.,eng,nature,nature,1476-4687,506.0,7486.0,6/14/02,jun-93,{marcus r munaf_mike w peaceyin-uck park}
617,44484.0,exercise-induced flow limitation dynamic hyperinflation and exercise capacity in patients with bronchial asthma.,eng,the european respiratory journal,eur. respir. j.,0903-193@@6,24.0,3.0,1/4/09,378-84,{a polychronakich roussosa koutsoukoui dimitroulisj milic-emilin g koulouriss retsoue n kosmasm gaga}
618,379988.0,the combined role of serotonin and interleukin-6 as biomarker for autism,3.0469244487548313,experimental cell re??sea#rch,4.186797126469046,nan,284.0,0.0,1/22/15,290-296,{y.-j. dux.-m. zhub. sangc.-j. yangc.-l. liu}
619,333862.0,general public's and physicians' perception of health risk associated with radon exposure in the state of azad jammu and kashmir,e%ng,public health nursing (boston mass.),public health nurs,0737-1209,89.22198401001666,19.116055143530065,1/8/01,327%-35%,{muhammad rafiquem. ikram shahzadshahida jabeen}
620,779555.0,cost-effectiveness of statins for primary prevention in patients newly diagnosed with type 2 diabetes in the netherlands,english,value in health,physiother. theory pract.,09593985 (issn),17.0,2.0,1/14/01,223-230,{s. t. visserm. j. postmap. denigf. m. de vriese. hak}
621,323860.0,women's sexuality in the south african constitutional court,english,femi??n#ist legal studies,4.0278811450579965,09663622 (issn),14.0,16.03352067706016,1/6??/01,391-406,{e. bonthuys}
