ID,id,article_title,article_language,journal_title,jounral_abbreviation,journal_issn,article_jvolumn,article_jissue,article_jcreated_at,article_pagination,author_list
1,849855.2109684717,late repair of injuries of the anal sphincter,eng,proc r soc med,proceedings of the royal society of medicine,0035-9157 (print) 0035-9157,64.0,12.0,1/1/71,1187-9@@,{a. g. parksj. f. mcpartl#in}
2,498345.0,ebola virus gp gene polyadenylation versus rna editing.,eng,the journal of infectious diseases,j. infect. dis.,1537-6613,-1.0,-1.0,2/15/04,4.180180434558312,{valentina a volchkovajaroslav voracphilip lawrencelaurie repiquet-paireviktor e volchkov}
3,789958.0,duane retraction syndrome associated with oculocutaneous albinism: an ocular miswiring.,eng,indian journal of ophthalmology,indian j ophthalmol,0301-4738,54.0,4.0,1/6/12,283-4,{jitendra jethanishashikant shettysucheta parijap vijayalakshmi}
4,169865.0,[noninvasive p@@renatal diagnosis of trisomy 21 18 and 13 using cell-free fetal dna],pol,critical reviews in oncology/hematology,crit. rev. onco@@l. hematol.,3.683534256905337,84.0,0.0,1/13/01,714-9 st  - [noninvasive prenatal diagnosis of trisomy 21 18 and 13 using cell-free fetal dna]-,{g. jakielk. gorzelnikj. g. zimowskit. cn  - pubmed da  - aug dp  - nlm et  - 2013/11/07 roszkowskij. bijok}
5,3145986.7390655726,diagnosis and management of cutaneous b-cell lymphoma.,eng,der??ma#tologic clinics,dermatol clin,1558-0520,33.0,4.0,1/$??15/10,835-40,{lauren c pinter-brown}
6,98234.0,pregabalin celecoxib and their combination for treatment of chronic low-back pain,eng,card$iol young@@,5.062448528745811,1051-0443,10.0,4.0,%1/9/01,185-91,{c. l. romanog. mineoc. bonorad. romano}
7,823730.0,activation and blockade of beta adrenoceptors in common cardiac disorders,eng,br med bull,british medical bulletin,0007-1420,29.0,2.0,1/1/73,163-7,{b n prichardj w black}
8,729712.0,long-term effects of spontaneous breathing during ventilatory support in patients with acute lung injury,english; abstract language:english,american journal of respiratory and critical care medicine,am. j. respir. crit. care med.,$1535-4970,164.0,1.0,1/1/07,43-49,{st_ber fmutz nwrigge hputensen czinserling jzech svon spiegel t}
9,396821.0,awareness of deficits and on-road driving performance,english,clinical neuropsychologist,4.936821102124343,1385-4046,25.0,7.0,1/11%/01,1158-78,{l. j. rapportj. a. griffenl. a. bieliauskasc. burtr. c. bryer}
10,340222.0,a comparative evaluation of two head and neck im??mobilization devices using electronic portal imaging,4.803361043291142,the british journal of radiology,college teachi$n@@g,0929-%693x,241.06354834958054,938.0,1/6/01,158-61,{k. flemingk. donatok. leszczynski}
11,184417.0,disparities in childhood asthma hospitalizations: a spatial analysis of contextual effects,3.5393777833661146,transportation research part d-transport and environment,helicobacter,1361-9209,14.0,5.0,1/9/01,317-325,{j. l. lip. newcomb}
12,729686.0,local anaesthetic wound infiltration used for caesarean section pain relief: a     meta-analysis,english,international journal of clinical and experimental medicine,int j clin exp med,1@@940-??5901,8.0,6.0,1/15/01,10213-@@10224,{yang mli jli yzhou myang hshi xli xyuan h}
13,278396.0,smoking is accompanied by a suppressed cervical nitric oxide release in women with high-risk human papillomavirus infection,eng,acta obstet gynecol scand,acta obstetricia et gynecologica scandinavica,0001-6349 (print) 0001-6349,92.0,6.0,1/13/01,711-5,{t. s. mikkolas. vuorentoo. ylikorkalam. vaisanen-tommiskap. rahkola-soisalo}
14,965082.0,imaging of scar in patients with ventricular arrhythmias of right ventricular origin: cardiac magnetic resonance versus electroanatomic mapping,3.5393777833661146,heart #rhyth$m,bmc med,1547-5271,8.0,5.0,1/#$11/01,s40$,{c. hamilton-craigs. bartolettim. casellaf. pernam. l. narduccip. santangelif. pintusa. natalea. dello russog. pelargoniog. bencardinoj. d. burkhardtf. belloccil. di biase}
15,53321.0,monoaxial versus polyaxial locking systems: a biomechanical analysis of different locking systems for the fixation of proximal humeral fractures,eng,5.13062755264065,3.004357918601092,1071-1007 (print) 1071-1007,35.0,8.0,1/11/01,1245-50,{t. toppc. kuhnes. ruchholtzu. lewana. krugert. mullerr. zettl}
16,13601.0,latex allergy in atopic children.,eng,british journal of dermatology.,jama otolaryngol head neck surg,0007-0963,140.0,5.0,5/1/99,919-21,{r s levers a holme}
17,668310.0,a randomized controlled trial of tai chi for balance sleep quality and cognitive performance in elderly vietnamese.,eng,clinical interventions in aging,clin interv aging,1178-1998,7.0,-1.0,1/12/01,185-90,{andreas krusemanh hung nguyen}
18,282987.0,multisystemic therapy for social emotional and behavioral problems in youth aged 10-17,eng,cochrane database syst rev,cochrane database syst rev%,1469-493x,0.0,4.0,1/5/01,cd004797,{j. h. littellm. popab. forsythe}
19,478292.0,haemodynamic ischaemia in paediatric moyamoya disea%se associated with renovascular hypertension.,eng,acta neurochirurgica,acta cytol.,jan-68,139.0,3.0,1/1/97,257-8,{y takagin hashimotoy goto}
20,43736.0,effect of pedaling technique on mechanical effectiveness and efficiency in cyclists.,eng,medicine and science in sports and exercise,med sci sports exerc,0195-9131,39.0,6.0,1/7/06,991-5,{james c martinian mayhewlee m romerthomas korff}
21,82614.0,lycopene metabolite apo-10'-lycopenoic acid inhibits diethylnitrosamine-initiated high fat diet-promoted hepatic inflammation and tumorigenesis in mice.,eng,cancer prevention research (philadelphia pa.),cancer prev res (phila),1940-6215,6.0,12.0,1/13/12,1304-16,{l??ynne m ausmanmartin s obinxiang-dong wangchun liublanche c ipdonald e smithkang-quan hu}
22,163526.0,a performance improvement process to tackle tachysystole,english,japanese journal of clinical oncology,3.1210255201718633,0901-5027,40.0,0.0,$1/11/01,512-9 st  - a performance improvement process to tackle tachysystole-,{v. e. cn  - medline da  - sep-oct db  - medline do  - http://dx.doi.org/10.1111/j.1552-6909.2011.01275.x dp  - ovid technologies von gruenigena. m. burkettj. doylet. h. kenny}
23,514411.0,osteoid osteoma treated by percutaneous thermal ablation: when do we fail? a systematic review and guidelines for future reporting.,eng,cardiovascular a??nd interventional radiology,cardiovasc intervent radiol,1432-086x,37.0,6.0,1/14/12,1530-9,{luca maria sconfienzaezio lanzagianpaolo cornalbadario poretticatherine cytevalpierre vialafrancesco sardanelliyann thouvenin}
24,569841.0,effects of chemotherapy in aids-associated non-hodgkin's lymphoma on kaposi's sarcoma herpesvirus dna in blood.,eng,journal of clinical oncology : official journal of the american society of clinical oncology,j. clin. oncol.,#1527-7755,27.0,15.0,5/20/09,2496-502,{ariela noylawrence d kaplanyanxing yualexandra m levinerichard f ambindersusan e krownbruce j dezubelan linjeannette y leegary s hayward}
25,6207.0,serum mmps 7-9 and their inhibitors during glucocorticoid and anti-tnf-alpha therapy in pediatric inflammatory bowel disease,@@dan,scandinavian journal of gastroenterology,addict.behav.,0301-4215,47.0,7.0,1/12/01,785-794,{kaija leena kolhohanne rintamakitaina tervahartialatimo sorsalaura makitalo}
26,21910.0,examining waiting placement in hospital: utilization and the lived experience.,eng,global journal of health science,glob j h$ealth sci,1916-9736,6.0,2.0,1/14/03,22-dec,{donna m wilsonjessica a hewittralph magnusjill vihoskaren petersonnancy barnes}
27,378490.0,a prospective observational study of obesity body composition and insulin resistance in 18 women with bipolar disorder and 17 matched control subjects.,eng,the journal of clinical psychiatry,j cli??n psychiatr%y,1555-2101,69.0,12.0,1/8/12,1892-900,{isabella sorecaandrea fagiolinidavid j kupferbret h goodpastersara b fleet-michaliszynamy d ottojohn m jakicic}
28,971878.0,diminished a-cell secretion in the early phase of type i diabetes mellitus,english,metabolism: clinical and experimental,jama,0301-5149,35.0,11.0,1/1/86,1074-1077,{s. srikantao. p. gandar. e. gleason}
29,793918.0,strong stability and host specific bacterial communi$ty in faeces of ponies.,eng,pl??o$s one,plos one,193@@2??-6203,8.0,29.591603950752624,1/13/01,e75079,{tina m blackmorekirsty dougalhilary j worganeric pinlochegemma curtisc jamie newboldneil r mcewansusan e girdwoodpat a harriscaroline mcg argoalex dugdale}
30,819166.0,responses to open peer commentaries on the subjective brain identity and neuroethics,english,america#n journal of bioethics,4.731130366591406,15265161 (issn),9.0,9.0,1/9/01,w1-w4,{g.r. gillett}
31,880881.0,[a case of giant brunner's gland hyperplasia combined with adenomyomatous hyperplasia].,k%$or,the korean journal of gastroenterology = taehan sohwagi hakhoe chi,ko$rean j gastroent??erol,1598-9992,223.95725434515072,6.0,1/8/12,384-8,{seung woo parkjae bock chungsang kyum kimsi young songjoo won chungho keun kimjoo hee seoseungmin bang}
32,629530.0,efficacy and safety of the low-molecular weight heparin enoxaparin compared with unfractionated heparin across the acute coronary syndrome spectrum: a meta-analysis.,e$??ng,eur. heart j.,aids,0195-66$8x,128.4982372154799,17.0,1/7/09,2077-86,{carolyn h mccabeshaun g goodmanfrans van de werfdavid a morrowelliott m antmaneugene braunwaldkenneth w mahaffeymarc cohenian b menownsabina a murphycharles michael gibson}
33,954388.0,optimal starting age for school attendance: fy76 issue analysis,english,business wire,3.1210255201718633,3.2311424032013587,0.0,0.0,1/1/74,138.42192032780116,{marilou madd@@e#n}
34,379737.0,bone density and body composition in young women with chronic fatigue syndrome.,eng,neuroprotective agents,3.8355664073804796,0077-8923,904.0,-1.0,5/1/00,625-7,{f gatesp clifton-blighg fulcherl hoskinr hansen}
35,676042.0,prognostic value of morning blood pressure surge in clinical events: a meta-ana$lys@@is of longitudinal studies.,eng,journal of stroke and cerebrovascular diseases : the official journal of national stroke association,j stro%ke cerebrovas@@c dis,1532-8511,24.0,2.0,1/15/02,362-9,{yan-xin zhaojun-chao xiexue-yuan liuhan yan}
36,353972.0,child sexual abuse as a risk factor for sexual risk behaviours among socially disadvantaged adolescents in ibadan nigeria.,4.215306854415128,vulnerable children and youth studies,4.801044873926272,1745-0128 1745-0136,3.0,3.0,1/8??/01@@,243-248,{b o olley}
37,968125.0,successful treatment of lung cancer by multimodal endobronchial interventions,english,respiration; international review of thoracic diseases,respiration,0025-7931,88.0,2.0,1/1#4/01,144-147,{t. nakajimai. yoshinok. yasufuku??s. yoshiday. s@@akairik. shibuya}
38,660168.0,fat and neurosurgery: does obesity affect outcome after intracranial surgery?,eng,neurosurgery,neurosurgery,1524-4040,64.0,2.0,1/9/02??,316-26; discussion 326-7,{r loch macdonaldfarbod asgarzadie-gadimyeon gyoe jangdaniel j curryrachel n yanowitchkim e schultheissjocelyn tolentinoj_rgen l_ders}
39,732534.0,out of harm's way: curbing violence in the ed,english,health facilities management,health facil manage,0899-6210,8.0,10.0,1/1/95,20-6 ??28,{k. sandrick}
40,473026.0,the incidence of contrast-induced nephropathy in trauma patients.,eng,european journal of emergency medicine : official journal of the european society for emergency medicine,eur j emerg med,147#3-5695,64.92127248605793,3.0,1/8/06,134-9,{rich sinertshoma desaiantonia hippcarmen lopez}
41,372175.0,dosimetric analysis of proton pencil beam scanning radiation therapy versus dose painted intensity modulated radiation therapy for squamous cell carcinoma of the anal canal,$engl%ish,int. j. radiat??. oncol. biol. phys.,4.560625571128496,0360-3016,90.0,1.0,5.482969808043565,s398,{kooy h.hong t.s.symonifka j.depauw n.wo j.y.}
42,110072.0,brain bdnf levels elevation induced by physical training is reduced after unilateral common carotid artery occlusion in rats.,eng,journal of cerebral blood flow and metabolism : official journal of the international society of cerebral blood flow and metabolism,j. cereb. blood flow metab.,1559-7016,34.0,10.0,1/14/10,1681-7,{jacques van hoeckehayat banoujaafarchristine marieclaude m mossiat}
43,330553.0,multiresistance of clinically% relevant gram-positi@@ve cocci,4.52909313086916,intensivmedizin und notfal%lmedizin,4.125574317451099,0175-3851,203.60330804966108,7.0,1/1/97,655-663,{g. petersk. beckerc. von eiff}
44,23215.0,colorectal cancer predicted risk online (crc-pro) calculator using data from the multi-ethnic cohort study.,eng,journal of the american board of family medicine : jabfm,j am board fam med,1557-2625,27.0,1.0,1??/14/01,42-55,{leila j??acksonbrian j wellsgregory s coopersiran koroukianmichael w kattan}
45,719532.0,methodology to estimate building energy consumption using energyplus benchmark models,jpn,energy and buildings,crit. care med.,0378-7788,42.0,12.0,1/10/01,2331-2337,{r. #luck??p. magon. fumo}
46,86421.0,evidence that serum levels of the soluble receptor for advanced glycation end products are inversely associated with pancreatic cancer risk: a prospective study.,eng,cancer research,cancer res.,1538-7445,71.0,10.0,5/15/11,sep-82,{stephanie j weinsteinrachael z stolzenberg-solomonphilip r taylorbarry i graubardjarmo virtamodemetrius albanesli jiao}
47,433667.0,norton waterlow and braden scores: a review of the literature and a comparison b#etween the scores and clinical judgement,4.936392422017943,3.555387623201737,4.240067506736971,4.005573801793784,0.0,0.0,1/1/98,4.810826204359537,@@{null}
48,530323.0,strategies for partner notification for sexually transmitted infections including hiv.,eng,cochrane database syst. rev.,cochrane database syst rev%,1469-493x,10.0,-1.0,1/13/01,cd002843,{catherine mathewsmoleen zunzaadel ferreiranicola lowtaryn young}
49,102893.0,a cohort study of the prevalence and impact of comorbid medical conditions in pediatric bipolar disorder.,e%ng,the journal of clinical psyc@@hiatry,j clin psychiatry,1555-2101,71.0,11.0,1/#10/11,1518-25,{roger s mcintyreavnish tripathijeanette m jerrell}
50,864817.0,are tkis still active in patients treated with tki and everolimus? experience from 36 patients treated in france in the record 1 trial,3.016709118872358,annals of oncology,4.75075082081165,1017-7833,21.0,0.0,1/10/01,viii2%84,{b. escudiera. ravaudf. rollanda. blesiusb. beuzelinks. oudardc. chevreau}
51,1242501.1685315524,use of alendronate in peri-implant defect regeneration,english,dissertation abstracts international: section b: the sciences and engineering,international journal of gynaecology and obstetrics: the official organ of the international federation of gynaecology and obstetrics,5.845546034390029,70.0,2.0,1/1/99,151-#@@158,{p. c. wollans. j. merawc. m. reeve}
52,730822.0,prevention of phantom pain after major lower limb amputation by epidural infusion of diamorphine clonidine and bupivacaine,english; abstract language:english,annals of the royal college of surgeons of england,ann r coll surg engl,0035-8843,76.0,5.0,1/1/94,324-326,{jayatunga apdark chjahangiri mbradley jwp}
53,659297.0,how assistive technology use by individuals with disabilities impacts their caregivers: a systematic review of the research evidence.,eng,american journal of physical medicine & rehabilitation / association of academic physiatrists,am j phys med rehabil,1537-7385,91.0,11.0,1/??12/$11,984-98,{james lenkerw ben mortensonfrank deruyterlouise demersjeffrey w jutaimarcus j fuhrer}
54,42247.0,gender differences in personal social and environmental influences on active travel to and from school for australian adolescents.,eng,journal of science and medicine in sport / sports medicine australia,j sci med sport,1878-1861,13.0,6.0,1/10/11,??5@@97-601,{john w toumbouroueva lesliepeter kremerjoanne w williams}
55,302969.0,adolescent overscheduling: the relationship between levels of participation in scheduled activities and self-reported clinical symptomology,4.215306854415128,review of scientific instruments,4.468613553646597,0301-620x (print) 0301-620x,319.5190523399779,3.0,1/7/01,18-30,{steven g littlek angeleque akin-littleshari melman}
56,158672.0,quantitative analysis of robustness of dynamic response and signal transfer in insulin mediated pi3k/akt pathway.,eng,computers & chemical engineering,comput chem eng,0098-1354,71.0,-1.0,4/#??14/12,715-727,{shibin mathewipsita banerjee}
57,2887214.579853577,does neuraxial anesthesia reduce intraoperative blood loss? a meta-analysis.,eng,journal of clinical anesthesia,j clin anesth,0952-8180,18.0,6.0,1/6/09,427-35,{david n mainegenevieve e courpasjames f wellerjeffrey m richmanandrew j rowlingsonchristopher l wu}
58,221086.0,novel genetic linkage of rat sp6 mutation to amelogenesis imperfecta,eng,j. ex??p. clin. cancer res.%,3.3294731959926143,1756-9966,7.0,0.0,1/#12/%01,34,{k. miyoshit. nomat. mutoh. hagitat. horiguchi}
59,548616.0,educating emergent bilinguals: policies programs and practices for english language learners. language & literacy series,%@@eng,teachers college press,oral oncol.,0-8077-4913-3,0.0,0.0,1/10/10,720-6,{ofelia garciajo anne kleifgen}
60,669596.0,similar survival between uncemented and cemented fixation prostheses i@@n total knee arthropla#sty: a meta-analysis and systematic comparative analysis using registers.,eng,knee surgery sports traumatology arthroscopy : official journal of the esska,knee surg sports traumatol arthrosc,1433-7347,22.0,12.0,1/14/12,jul-91,{junwei jianghongchuan wanghua loukai liuhuiwei zhang}
61,474288.0,current palliative chemotherapy trials in the elderly neglect patient-centred outcome measures.,eng,journal of geriatric oncology,j geriatr oncol,1879-4076,6.0,1.0,1/15/01,15-22,{marlies l van bekkumbarbara c van munstermarije e hamakercarolien h smorenburgpeter l m thunnissen}
62,108424.0,outcome of gastric bypass patients.,eng,obesity surgery,obes surg,0960-8923,68.23172925808572,2.0,1/2/04,261-4,{ryan holzwarthbasir tareenalicia majkrzakdarren huber}
63,4435453.202155118,a modified technique for pulmonary valve replacement with a homograft,english,j. card. surg.,respiration,-7977,98.57507826873112,2.0,1/11/01,144-147,{s. k. choudharyg. s. gulatip. sharmas. talwarb. airans. mishra}
64,173830.0,advances in allergic skin disease anaphylaxis and hypersensitivity reactions to foods drugs and insects,3.669083728516809,journal of allergy and clinical immunology,croat.med.j.,0091-6749 (print),116.0,1.0,1/5/01,153-163,{s. h. sichererd. y. m. leung}
65,852927.0,phase ii study of epirubicin oxaliplatin and docetaxel combination in metastatic gastric or gastroesophag$eal junction adenocarcinoma.,eng,j. ex??p. clin. cancer res.%,burns,1756-9966,28.0,-1.0,@#@1/9/01,34,{laura giacintisilvia ileana fattorusomaria grazia arenaluigi di lauromassimo lopezdomenico sergidiana giannarelli}
66,237623.0,neck pain.,eng,clinical evidence,clin evid (online),1752-8526,2008.0,1.0,1/8/01,13-m%ay,{allan i binder}
67,912884.0,a guide to physiotherapy in cerebral palsy,3.016709118872358,paediatrics and child health,5.470681629393083,9790000000000,18.0,0.0,1/8/01,410-413,{c. e. barber}
68,318931.0,community associated methicillin-resi#stant staphylococcus aureus in hiv-infected patients,4.215306854415128,aids reviews,diabetes technol. ther.,1139-6121,12.0,3.0,1/10/01,153-163,{m. pujolp. barragnj.m. tiraboschia. imazm.. dom_nguezd. podzamczer}
69,93659.0,[the anxiety level of the patients who will have ultrasound-guided puncture biopsy: a survey study].,chi,sheng wu yi xue gong cheng xue za zhi = journal of biomedical engineering = shengwu yixue gongchengxue zazhi,sheng wu yi xue gong cheng xue za zhi,1001-5515,172.37809917010907,3.0,1/%12/#06,453-5 459,{rujun zhengyulan pengshuzhen zhaohong huangii liangxiaoli he}
70,349150.0,the relationship between capsulorhexis size and anterior chamber depth relation.,eng,ophthalmic surgery and lasers,ophthalmic surg lasers,1082-3069,134.86025012463972,3.0,3/1/99,185-90,{o ceki_c batman}
71,572010.0,a$ pilot study of rituximab in patients with recurrent classic hodgkin$ disease.,eng,cancer,cancer,0008-543x,98.0,2.0,7/15/03,310-4,{anas younesl jeffrey medeirosfrederick hagemeistermaria alma rodriguezsima jehapaolo fiumaralynne v abruzzojohn t manningjorge romagueraandre goydan jonespeter mclaughlin}
72,826030.0,a cognitive behavior intervention program in women with unexplained chest pain--a pilot study,eng,european journal of cardiovascular nursing : journal of the working group on cardiovascular nursing of the european society of cardiology,eur j cardiovasc $nurs,1474-5151,11.0,2.0,1/12/01,183-9,{cecilia bj_rkelundmargaretha jerlock}
73,34962.0,assessing social i??solation in motor neurone disease: a rasch analysis of the mnd social withdrawal scale.,eng,journal of the neurological sciences,j. neurol. sci.,1878-5883,334.0,1.0,11/15/13,112-8,{everard w thorntoncarolyn a youngalan tennantjohn ealingkevin talbot[collective name] ukmnd-qol groupchris j gibbonspamela j shaw}
74,574309.0,three-year outcomes in de novo liver transplant patients     receiving everolimus with reduced tacrolimus: follow-up results from     a randomized multicenter study,english,transplantation,transplantation,0041-1337,99.0,24.23496479316563,1/15/01,1455-1462,{junge grauer bde simone pfischer lde carlis lkaiser gmsaliba fduvoux cmetselaar hjdong gnevens ffung jj}
75,200077.0,plasma cell leukemia--a case report.,eng,indian journal of pathology and microbiology,oral oncol.,0377??-@@4929,46.0,17.613563504075714,1/3/07,484-7,{t k duttapampa ch toibhawana a badhel h ghotekardebdatta basu}
76,421512.0,cabg again outshines stenting for some patients with coronary artery blockage,eng,j nutr gerontol geriatr,journal of nutrition in gerontology and geriatrics,4.843525634494215,1725.3189347684397,1.0,1/13/01,17-aug,{m. mitka}
77,715052.0,health-promoting behaviors of low-income cancer survivors,4.215306854415128,3.179019050725645,4.369898923850038,0091-0562,143.6887438364813,3.0,1/11/01,118-124 7p,{alexa stuifbergenmartha gene meraviglia}
78,719241.328184221,food allergy in children,#eng#lish,archives de pediatrie,college teachi$n@@g,0929-%693x,13.0,10.0,1/6/01,1349-1353,{e. bidat}
79,140274.0,here to stay. an interview with dr. david satcher director u.s. centers for disease control and prevention.,eng,nepal medical college journal : nmcj,nepal med coll j,22%-mar,1.0,17.0,11/1/96,9-jun,{j stilkind}
80,282039.0,the fi%rst case of drug-induced immune hemolytic anemia due to hydrocortisone,en??glish,transfusion,5.470681629393083,0041-1132,48.0,9.0,1/8/01,1925-1929,{m. martinengod. f. ardenghig. realig. tripodi}
81,835177.0,kras mutational status assessment in patients with metastatic colorectal cancer: are the clinical implications so clear?,eng,eur j cancer care (engl),european journal of cancer care,0961-5423 (print) 0961-5423,19.0,2.0,1/10/01,167-71,{m. hebbarp. fourniero. romano}
82,519732.0,classifying radiographic progression status i%n early rheumatoid arthritis patients using propensity scores to adjust for baseline differences.,eng,s#tatistical methods in medical research,stat me@@t$hods med res,0962-2802,16.0,1.0,1/7/02,13-29,{john t sharpweng kee wonggrace s parkharold e paulusmyungshin ohrichard h golddinesh khan#na}
83,761104.0,infusing tolerance diversity and social personal curriculum into inclusive social studies classes using family portraits and contextual teaching and learning,4.215306854415128,teaching exceptional children plus,cases journal,1553-9318 1553-9318,1.0,3.0,1/5/01,464-468,{milagros m. sessionskevin j. miller}
84,408062.0,adherence to fesoterodine in women with overactive bladder in routine clinical practice.,engspa,ac@@tas urologi#cas espanolas,actas urol esp,1699-7980,39.0,4.0,1/15/05,222-8,{e hugueto portae mart_nezi moram sim_j pubillj a ortegam t castillo}
85,889481.0,chronic pain related to quality of sleep,eng     por,einste??in (sao paulo),einstein (sao paulo brazil),1679-4508,12.0,2.0,1/14/01,159-63#,{w. hummigj. stechman netol. f. tonial}
86,894596.0,on the role of pre and post-processing in environmental data mining,%@@eng,proc. iemss 4th biennial meeting - int. congress on environmenta#l modelling and software: integrating sciences and information technology for environmental assessment and decision making iemss 2008,occup environ med,9790000000000,3.0,0.0,1/8/01,1937-1958,{miquel s_nchez-marrgeoff holmesjoaqu_n izquierdojoaquim comasioannis athanasiadiskarina gibert}
87,604985.0,cardioactive steroid poisoning: a comparison of plant- and animal-derived compounds.,eng,j med toxicol,journal of medica@@l toxicology : official journal of the american college of medical toxicology,1556-9039,2.0,4.0,1/6/12,152-5,{robert s hoffmanbrian w cotterbarbara m kirranefermin barruetolewis s nelson}
88,220950.0,forensic odontology: a prosthodontic view,eng,behaviour research and therapy,acta cytol.,3.566001035214283,4.0,1.0,1/12/01,38-41,{s. gosavis. gosavi}
89,770196.0,figo staging of gynecologic cancer. 1994-1997 figo committee on gynecologic oncology. international federation of gynecology and obstetrics,eng,int j gynaecol obstet,international journal of gynaecology and obstetrics: the official organ of the international federation of gynaecology and obstetrics,0020-7292,64.0,1.0,1/1/99,10-may,{w. t. creasmans. pecorellij. l. benedetj. h. shepherd}
90,914468.0,effect of neuromuscular$ electrical stimulation and isotonic exercises in flexor and extensor muscles of knee of hemiplegic patients,4.215306854415128,revista de neurologia,rev.neurol.,0210-0??010??,46.0,3.0,1/8/01,135-13@@8,{s. regina-ribeiroc. tortozar. p. s. limas. t. t. de freitasp. r. lucarelim. o. limam. t. pachecoj. gomes-lucarelir. a. lopes-martins}
