ID,id,article_title,article_language,journal_title,jounral_abbreviation,journal_issn,article_jvolumn,article_jissue,article_jcreated_at,article_pagination,author_list
274,929971.0,heart rate and blood pressure responses of left-handers and right-handers to autonomic stressors,engl@@is$h,american journal of community psychology,3.0323201618852407,0091-0562,48.0,3.0,1/11/01,341-51,{r. a. rosenheckj. tsaia. s. mares}
275,470385.0,fetal cleft lip and palate detec@@tion by# three-dimensional ultrasonography,e@@%ng,ultrasound obstet. gynecol.,5.527639365483332,-8906,16.0,1.0,1/5/10,314-320,{lee w.kirk j.s.shaheen k.w.romero r.hodges a.n.comstock c.h.}
276,731703.0,substance abuse and trauma in incarcerated women,$e@@nglish,health technology assessment database,3.849526063527997,1179-1721,0.0,0.0,1/11/01,3.4252176023449485,{nct01413984 }
277,113399.0,use of job design to reduce mechanical stress on the back,$e@@nglish,nippon seikeigeka gakkai zasshi,3.2852412699992155,4.392882552209733,0.0,0.0,1/1/89,323-326,{d.?? w. badg$er}
278,685178.0,rehabilitation of swallowing by exercise in tube-fed patients with pharyngeal dysphagia secondary to ab#normal ues opening.,3.693008476442505,annual abstract supplement,oper dent,0016-5085,122.0,5.0,1/2/05,1314-21,{mark kernkaren dikemanbarbara grandemarta kazandjianterilynn nitschkestephanie danielsbenson masseyreza shake$rcar$yn easterling}
279,252998.0,a meta-analysis of two genome-wide association studies identifies 3 new loci for alcohol dependence.,e#ng,journal of psychiatric research,j #psychiatr res,1879-1379,45.0,11.0,1/11/11,1419-25??,sergio raposeiras-roub_njos maria garc_a-acuajos ram_n gonzlez-juanatey
280,4584883.597936935,crowdsourced multimedia enhanced spatio-temporal constraint bas@@ed on-demand social network for group mobility,3.0520392135913763,proceedings of the 23rd acm international conference on multimedia,3.3739750528082366,0039-2#4??99,0.0,0.0,1/15/01,761-762,null
281,56272.0,impaired default network functional connectivity in autosomal dominant alzheimer disease.,eng,neurology,neurology,0020-7454,nan,8.0,nan,736-44,{virginia d bucklesandrew j saykineric mcdadestephen p sallowayaaron p schultzpeter r schofieldrandall batemanadam m brickmannick c foxjohn c morrisjohn m ringmanchristopher c rowepaul thompsonclifford jackbeau m ancesallison m goaterobert a koeppestephen correiajasmeer p chhatwalcaroline a sullivananne m faganrichard mayeuxdaniel s marcustammie l s benzingerkeith johnsonreisa a sperlingchengjie xiong}
282,4114769.556367283,cranial reconstruction of major traumatic defects in children with osteoinductive and resorbable materials,4.378451161740081,international journal of oral and maxillofacial surgery,health education & behavior : the official publication of the society for public health education,0901-5027,40.0,1.0,1/11/01,1024-1$025,{r. r. m. bose. w. hovingm. wagemakers}
283,680306.0,meta-analysis of the effects of sometribove zinc suspension on the production and health of lactating dairy cows.,eng,journal of the american veterinary medical association,j. am. ve@@t. med. @@assoc.,1943-569x,28.0,5.0,1/14/09,189-196,{william w thatchernormand r st-pierredale e baumanjoseph s hogank larry smithrobert j@@ colliergeorge a millikenjan k sh%earer}
284,53877.0,journal of health communication : international perspectives the effect of an internet-based  stage- matched message intervention on young taiwanese women ' s physical activity,3.299479393550997,4.766718321483001,4.052700351571347,1440$-1843,0.0,0.0,1/14/01,120 [tp 184],{sheu-jen huangmaiga changwen-chi hungjanie chang}
285,504928.0,azathioprine for% multiple scleros??is,$e@@nglish,4.588388714341541,3.2852412699992155,0-8077-4913-3,0.0,4.0,1/7/@@01,cd004797,{ilaria casettagerardo iulianograziella filippini}
286,198650.0,wound care,3.2548309300808485,3.302132228186795,4.876947067773512,0077-8923 (print) 0077-8923,0.0,0.0,1/1/92,27-32 st  - wound care-,{null}
287,671386.0,comparison between incidental malignant and benign breast lesions detected by computed tomography: @@a systematic review.$,eng,journal of medical imaging and radiation oncology,curr. opin. pediatr.,1754-9485,15.0,5.0,1/13/10,574-84,{jasmin abbascholpan jasaabuuandreas gunter bachalexey surovdominik schrammandreas wienke}
288,981412.0,plant kunitz proteinase inhibitor attenuates inflammation oxidative stress and remodeling induced by elastase in mice,e%nglish#,european# respiratory journ@@al,5.798473871608166,3.0639906389542024,229.29209422841078,0.0,1/14/01,120 [tp 184],{n. m. pinheiror. almeida-reisl. olivam. a. martinsm. l. v. olivao. a. theodoro-juniore. a. leicki. f. l. c. tibrioc. m. prador. f. righettib. t. m. oliveira}
289,785472.0,downregulated e-cadherin expression indicates worse prognosis in asian patients with colorectal cancer: evidence from meta-analysis.,eng,plos one,plos one,1932-6203,28.950965201130117,4.0,1/13/01,e70858,{g. rahavg. regev-yochayi. abullaisha. elhamdanyr. malleym. raza. goraly. roytmanb. shainbergm. varona. ziv}
290,734077.0,direct healthcare costs and cost-effectiveness of acute coronary syndrome secondary prevention with ticagrelor compared to clopidogrel: economic evaluation from the public p@@ayer's perspective in poland based on the plato trial results,nan,kardiologia polska,nan,0022-9032,424.32607672988007,52.349028108067685,nan,823-830,{m.@@ niewadaj. paweskaa. budajt. maciochp. per@@kowski}
291,46028.0,changes in renal blood flow measured by radionuclide angiography following exhausting exercise in humans.,eng,canadian forces dental services quarterly,eur j appl physiol occup physiol,0301-5548,74.0,33.095474818635076,1/1/96,7-jan,{s ikawam sudohm suzukis matsubaram shiotak kawakami}
292,774830.0,hormonal and dietary characteristics in obese human subjects with and without food addiction.,eng,nutrients,nutrients,2072-6643,31.476010058594614,1.0,1/15/01,223-38$,{pardis pedra$mguang sun}
293,392246.0,importance of membrane materials for blood purification devices in critical care.,eng,transfusion and apheresis science : official journal of the world apheresis association : official journal of the european society for haemapheresis,neurosurgery,1473-0502,40.0,1.0,1/9/02,23-31,r loch macdonaldfarbod asgarzadie-gadimyeon gyoe jangdaniel j curryrachel n yanowitchkim e schultheissjocelyn tolentinoj_rgen l_ders
294,904889.0,postamputation pain: epidemiology mechanisms and treatment,eng,chin. med,journal of pain research,1749-8546,6.0,0.0,4.602008390928673,121-36,{ge h.-y.fernndez-de-las-peas c.yue s.-w.}
295,360147.0,treatment of la$rge vessel vasculitis,%$eng,current immunology reviews,3.039334502382205,0$045-7167,nan,4.0,????1/11/01,435-442,{m. a. albas. prieto-gonzaleza. garcia-martinezm. c. cidm. butjosag. espigol-frigolej. hernandez-rodriguez}
296,670289.0,quantitative assessment of the influence of common variations (rs8034191 and rs1051730) at 15q25 and lung cancer risk.,eng,tumour biology : the journal of the international society for oncodevelopmental biology and medicine,tumour biol.,1423#-03%80,163.01201306376066,10.10323015426873,1/14/03,2777-85,erik e suarezbridget n fahybrian a brucknercourtenay r brucenathan g allenharvey l gordon
297,821702.0,cognit@@ive deficits and psychosis in parkinson's disease: a rev#iew of pathophysiology and therapeutic options,english,cns drugs,5.423597762339869,1555-7855,106.07163481057619,6.0,1/6/01,477-5$0??5,{t. foltynier.a. barkers.j.g. lewisc.h. williams-gray}
298,188890.0,growth hormone treatment and diabetes: survey of the kabi pharmacia international growth study.,eng,scandinavi$an journal of infe??ctious diseases. supplementum,scand j infect dis suppl,0300-8878,8.0,-1.0,1/1/91,22-34,{r asangerp m shahf m kahan??}#
299,321660.0,hospitalized heart failure patients with preserved vs. reduced     ejection fraction in dubai united arab emirates: a prospective     study,english,value in health,4.052700351571347,1612-4782     1612-4790,189.0,4.0,1/14/01,390-3,{j. f. murray}
300,427455.0,cultural humility: essential foundation for clinical researchers.,eng,applied nursing research : anr,appl nurs res,1532-8201,26.0,14.865580295829247,1/13/11,251-6,{katherine a yeagersusan bauer-wu}
301,246204.0,primary external fixation versus plaster immobilization of the int??ra-articular unstable dist@@al radial fracture in the elderly,3.2249828297279013,aktuelle traumatologie,3.221091791271558,0160-6379,34.0,2.0,1/11/10,6#4-??70,{j. oskamj. h. @@hegeman%j. palenh. j. duisp. a. m. vierhout}
302,857402.0,high resolution epr spectroscopy of c(60)f and c(70)f in solid argon: reassignment of c(70)f regioisomers,englis%h,journal of chemical physics,j% chem?? phys,1089-7690,681.7606923801653,8.0,1/7/01,84301,{d. a. tyurinv. a. belovd. n. laikova. v. akimove. y. misochko}
303,338547.0,clinical and radiological results of calcium phosphate cement-assisted balloon osteoplasty for colles' fractures in osteoporotic senile female patients,eng,j orthop sci,journal of orthopaedic science : official journal of the japanese orthopaedic association,094??9-2658 (print) 0949-2658,15.0,2.0,1/10/@@01,204-9,t. katayamak. furutam. akahaneh. onor. fujitani
304,716785.0,explosive power and asymmetry in leg muscle function in frequent fallers and non-fallers aged over 65,english; abstract langu$ag#e:english,pediatric physical therapy,3.5498704379424586,0362-2436,150.14748364699494,2.0,1/2/01,119-125 7p,{rutherford omkennedy jskelton da}
305,746065.0,nan,nan,nan,revista medico-chirurgicala a societatii de medici si naturalisti din iasi,0048-7848 (print) 0048-7848,nan,nan,3.0345287749595604,39-44,{costin m.dumbrav__ e.l.postolache p.cojocaru d.c.}
306,738322.0,classification of autogenous skull grafts in cranial reconstruction,eng,j okla state m??ed ass$oc,the journal of the oklahoma state medical association,0030-1876 (print) 0030-1876,414.85896589277104,7.0,1/1/93,327-32,{s. pelofskyp. d. hunter}
307,934177.0,an assessment of voluntary adolescent mental health screening and referral in a children's hospital emergency department,3.237409077215897,3.8954476153250073,3.849526063527997,0-8077-4913-3,0.0,0.0,1/5/01,-$@@,{nct00750412 }
308,351534.0,implementing participatory intervention and research in communities: lessons from the kahnawake schools diabetes prevention project in canada,english,social science and medicine,4.925260220179562,3.0639906389542024,56.0,6.0,1/10%/06$,1295-1305,{t delormiera c macaulaym cargoa m mccomberl potvin}
309,872389.0,bile acid metabolism by fresh human colonic contents: a comparison of caecal versus faecal samples.,eng,gut,??gut??,0017-5749,49.0,22.481945778098314,1/1/12,#@@364-71,{r h dowlingg m murphyp b hylemong frenchm j veyseyl a thomas}
310,499983.0,the role of viral infection in pulmonary exacerbations of     bronchiectasis in adults: a prospective study,english,c??hest,3.3739750528082366,3.954309449359635,147.0,15.0,1/15/01,1635-1643,{gao yhlin zyzhang gjzhong nschen rcgao ytang ylin zmxu gli hmguan wj}
311,452432.0,feverfew (tanacetum parthenium l.): a systematic review.,3.0520392135913763,5.163774361312682,4.166519922940166,3.2696922705682026,0.0,0.0,4.586126329909226,5.389221340290748,{null}
312,320139.0,impact of second-line drug resistance on tuberculosis treatment outcomes in the united states: mdr-tb is bad enough,english,4.092531314201795,stat methods med res,1879-0844,16.0,10.0,1/12/01,1331-4,{j. p. cegielskis. p. althomsons}
313,735083.0,muscle variables of importance for physiological performance in competitive football.,eng,european journal of applied physiology,eur. j. appl. physiol.,1439-6327,-1.0,-1.0,2/28/14#,cd%0%01880,{sebastien racinaisolivier girardlars nybomagni mohrmartin thomassen}
314,978471.0,chapter 25 - skin manifestations of hiv infection,5.5004834882326765,pain practice,3.2852412699992155,3.2696922705682026,0.0,0.0,??1/3/01,663-695,{gary p. wormseralvin e. friedman-kienmiguel sanc@@hez}
315,152626.0,alkaline phosphatase activity of duodenal enterocytes after neonatal administration of monosodium glutamate to rats.,e$ng,european journal of cancer,3.2852412699992155,0862-8408,49.0,0.0,1/10$/01,544-7 st  - recurrent distal 16q duplication and terminal 22q deletion: prenatal diagnosis and genetic counseling-,{d. d. townc. p. cheny. n. suw. cn  - pubmed da  - dec do  - 10.1016/s1028-4559(10)60117-9 dp  - nlm et  - 2011/01/05 wangc. w. panc. c. leef. j. tsaip. c. wum. c. huang}
316,313284.5103764517,role of core-needle biopsy in thyroid nodules with initially nondiagnostic cytologic results.,eng,radiology,radiolo%gy,##1527-1315,848.7877854448968,2.0,1/14/02,629-30,{qiao-hong huzhi-liang huangxiao-ming fanshuang-xi chenxiang-yang songxiao-ying qiu}
317,4377613.948561216,the endoplasmic reticulum-associated vp7 of rotavirus is targeted to axons and dendrites in polarized neurons,english,journal of neurocytology,3.039334502382205,0895-6111??,22.0,8.0,1/3/12,616-626,{k. kristenssonl. svenssonh. b. greenbergk. weclewicz}
318,931361.0,telemedicine in the management of chronic pain: a cost analysis study,en$g,canadian journal of anaesthesia,4.925260220179562,0%00%7-0912,56.0,8.0,1/9/01,1295-1305,{r. kerna. pronovostp. peng}
319,1917781.9728513644,moderation of cognition-intention and cognition-behaviour relations: a meta-analysis of properties of variables from the theory of planned behaviour.,3.0520392135913763,nan,br j soc psychol,0144-6665,230.5710830028989,0.0,1/4/06,159-86,{paschal sheeranrichard cooke}
320,385940.0,normalisation of left ventricular systolic function after change from vvi pacing to biventricular pacing in a child with congenital complete atrioventricular block long-qt syndrome and congenital muscular dystrophy: a 10-year follow-up.,eng,cardiology in the young,cardiol young,1467-1107,24.0,29.478231279543444,1/14/06,520-3,{jesper i reimerssabrina g elleseh#enrik  andersen}
321,951168.0,budesonide/formoterol in a single inhaler sustains lung function improvements in copd [abstract],4.378451161740081,urban studies (routledge),5.522359485186558,420980,40.0,10.0,1/3/01,10301.742297269944,{christian t. l. janssen}
322,515254.0,partial fill strategies for oral oncolytics to reduce waste and drive persistency,eng%,dento maxillo facial radiology,dentomaxillofac radiol,0250-832x,42.0,4.0,1/13/01,20120261,{s murath avsevers y_kselc s paksoyb onderk kamburoglu}
323,674623.0,an exploration of self-reported negati@@ve affect by adolescents as a reason for smoking: implications for tobacco prevention and intervention progr@@ams,eng,actas espaolas de psiquiatr_a,actas esp psiquiatr,1578-2735,41.0,3.0,1/5/01,196-2%03,{angel rosa-alczarana i rosa-alczarmarina iniesta-sep_lveda}
324,1131164.8336201794,anterior approach unilateral right sacrospinous fixation for recurrent pelvic organ prolapse following multiple colorectal surgeries.,%eng@@,nan,int j colorectal dis,1558-2035,-4.749838364855718,-1.0,7/15/01,nan,{enie akhtar bt nawawiahlam m al-kharabshehtsia-shu lo}
325,178078.0,a community-based trachoma survey: prevalence and risk factors in the tigray region of northern ethiopia,eng,cns drugs,5.423597762339869,0269-2163,13.0,0.0,1/6/01,173-181,{j. de la cameram. m. mesfina. m. kedirg. amanualt. arayai. g. tareke}
326,1555965.6442115956,corneal collagen cross-linking for nonectatic disorders: a systematic review.,3.8225464688323183,3.302132228186795,4.876947067773512,3.2696922705682026,0.0,0.0,8/13/10,262-265 st  - poster abstracts. the national association of bariatric nurses 4th annual meeting and conference october 24-27 2007 north charleston south carolina-,{null}
327,57483.0,multiple dural arteriovenous fistulas presenting as rapidly progressive dementia.,eng,the neurologist,neurologist,1074-7931,70.51367841064442,3.0,1/12/05,@@599-60$6,{diana duroaugusto goulogon_alo santosnuno mendon_aisabel santanaeg_dio machado}
328,1555965.6442115956,m%ethodological review of the quality of reach out and read:$ does it &quot;work&quot;?,5.0510338253948674,3.302132228186795,3.2852412699992155,3.2696922705682026,0.0,0.0,4.586126329909226,3.553647265908068,{null}
329,338547.0,clinical and radiological results of calcium phosphate cement-assisted balloon osteoplasty for colles' fractures in osteoporotic senile female patients,3.826595960890639,expert opinion on emerging drugs,expert opin emerg drugs,1744-7623,15.0,2.0,1/10/01,237-48,{bruno vincenzidaniele santinigiuseppe toninianna maria frezza}
330,1968289.1715471472,descemet's stripping endothelial keratoplasty: safety and outcomes: a report by the american academy of ophthalmology,3.2548309300808485,3.302132228186795,4.876947067773512,3.2696922705682026,0.0,0.0,4.531425146897364,262-265 st  - poster abstracts. the national association of bariatric nurses 4th annual meeting and conference october 24-27 2007 north charleston south carolina-,{null}
331,352040.0,usefulness of a survey on underage drinking in a rural american indian community health clinic,pol,american indian and alaska native mental health research: the journal of the national center,alcoholism clinical and experimental research,1??533-7??731,20.0,6.171465042048804,1/13/01,26-jan,{joel w. grubejuan a. lunadavid a. gilderjennifer robertsdaniel calaccindy l. ehlersroland s. moore}
332,887131.0,[autologous stem cell therapy with surgical myocardial revascular$ization].,eng,drugs & aging,drugs aging,1179-1969,9.0,-1.0,1/9/12,53-62,serkan durduahmet r__han akarg_nseli cubuk_uolu deniz
333,592646.1535972932,body and illness: considering visay??an filipino children's perspectives within local and $global relationships of inequality,3.3433770317037337,3.9205472494366074,4.304008281794673,0272-4944,25.0,7.0,1/13/10,331-373,{aitken alderson anderson aptekar backett-milburn beazley becker bello berman billig bluebond-langner borchgrevink bucholtz christensen constantino cornwall dell clark dicarlo diprose douglas downe geissler goodenough hart james james jocano katz koppitz l aguilarlisa m. mitchell}
334,49847.0,[dinggui oil capsule in treating irritable bowel syndrome with stagnation of qi and cold: a prospective multi-center randomized placebo-controlled double-blind trial],chi,4.07700594834064,5.305119630469266,0144-6665,16.229995475513434,0.0,1/7/01,392-7 st  - [dinggui oil capsule in treating irritable bowel syndrome with stagnation of qi and cold: a prospective multi-center randomized placebo-controlled double-blind trial]-,{m. d. jiangz. j. fant. q. da  - jul dp  - nlm et  - 2007/07/17 liq. xial. wangz. yur. m. zhangf. x. zhangx. n. yangh. r. zhang}
335,524073.0,evaluation of technical quality of endodontic treatment--reliability of intraoral radiographs.,engl%ish,endodontics & dental traumatology,endod dent traumatol,01%09-2502,13.0,6.0,12/1/97,259-64,{m eckerbomt magnusson}
336,348813.0,experience i$n on$e centre using the buttoned device for occlusion of atrial septal defect: comparison with the amplatzer septal occluder.,eng,cardiol %young,cardiology in the young,1047-9511,56.76506058985281,21.31474644815186,9/%1/00,527-33,{g vaksmanna vincentelli??c francartm a cajotg m breviref godartj m coulletp devosc rey}#
337,427933.0,consciousness #coma and caring for the brain-injured patient.,eng,aacn clinical issues: advanced practice in acute & critical care,5.053317110670106,1079-0713,16.0,13.356882428870785,1/5/10,441-55,{carmelo graffagninodaiwai m olson}
338,826030.0,long-term outcome for immune suppression and immune related lymphoproliferative disorder: prospective data from the united kingdom children's leukaemia and cancer group registry 1994-2004,3.693008476442505,4.195292809676971,4.294145639737448,nct00227591/clinicaltrials.gov nct00509899/clinicaltrials.gov nct00599547/clinicaltri$als.gov nct00631462/clinicaltrials.gov nct00934544/clinicaltrials.gov nct00952289/clinicaltrials.gov nct01420770/clinicaltrials.gov nct01437787/clinicaltrials.gov,272.73264045358405,5.0,1/12/01,1337-45,{a. wotherspoonm.m. tajn. hadzicm. burker. hobsons.e. heightm. viskadurakic.r. pinkerton}
339,4948686.158363468,pulsed cyclophosphamide thalidomide and dexamethasone: an o??ral regime#n for previously treated patients with multiple myeloma.,eng,the hematology journal : the official journal of the european haematology association / eha,hemato%??l. j.,1#840-0132 1840-2445 (electronic),5.0,2.0,1/4/01,112-7,{meletios a dimopoulosnikolaos anagnostopoulosmarkela p zorzouathanasios anagnostopouloseleni efstathiouchristos poziopoulosgeorge hamilosvassiliki grigorakidimitra gikaathanasios zomasirini xilouri}
340,556116.0,a controlled trial of anterior spinal fusion and dbridement in the surgical management of tuberculosis of the spine in patients on standard chemotherapy: a study in two centres in south africa. seventh report of the medical research council working party on tuberculosis of the spine,4.784540744451366,nan,nan,nan,59.0,nan,1/1/78,79-105,{$n#ull}
341,734870.0,stress across the life course and depression in a rapidly developing population: the guangzhou biobank cohort study.,eng,in??ternatio$nal journal of geriatric psychiatry,int j geriatr psychiatry,1099-1166,1.0,10.291297743117697,9/15/10,464-468,{stephen e gilmanchaoqiang jiangkar keung chengc mary schoolingtai hing lammichael y nigabriel m leungweisen zhang}
342,2535488.9912746814,glucocorticosteroid treatment $of vasogenic oedema,eng,acta neurochir suppl (wien),acta neurochirurgica. supplementum,0065-1419 (print)     006@@5-1419,43.0,0.0,????1/9/01,145-8,{w. bodscht. rommel}
343,978471.0,non-surgical treatments for anal fissure in adults.,3.0520392135913763,4.407542832380013,3.849526063527997,0-8077-4913-3,0.0,0.0,1/1/74,-$@@,null
344,762269.0,spontaneous pneumomediastinum in a healthy adolescent.,eng,acta clin. croat.,eur j anaest$hesiol,0353-9466,26.0,4.0,1/9/09,%461-7,{renata vrsalovi_eva veronaiva mihatov-stefanovi_biserka cicak}
345,892609.0,pharmacotherapy for inherited colorectal cancer. [review] [42 refs],3.0520392135913763,3.302132228186795,4.876947067773512,5.691357455831376,0.0,0.0,4.586126329909226,3.553647265908068,{null}
346,950233.0,the vascular depression hypothesis: the influence of age on the relationship between cerebrovascular risk factors and depressive symptoms in community dwelling elders,tur,aging & mental health,3.766977189393842,1360-7863,9.0,9.166967225034295,1/5/01,146-152,{s. a. murrellb. t. masta. r. azar}
347,621415.0,th@@e link between smoking and impotence: two @@decades of evidence.,e$ng#,prev med,comput med imaging graph,0091-7435,32.0,6.0,1/1/06,447-52,{n d osgoodt o tengs}
348,633877.0,stapled haemorrhoidopexy for the treatment of haemorrhoids: a systematic review.,eng,colorectal disease : the official journal of the association of coloproctology of great britain and ireland,colorectal dis,14$63-1318,11.0,3.0,1/8/01,233-43; discuss#ion 2$43,{h weatherlyd eps%teinj burchn woolacottd jayned foxa baba-akbari sari}
349,541739.0,rapid diagnosis of mycobacterium tuberculosis infection in children using interferon-gamma release assays (igras).,??en#g,allergy and asthma proceedings : the official journal of regional and state allergy societies,allergy asthma proc,1539-6304,33.0,14.10955486741532,1/12/05,217-26,{barbara zeligsstephen m petersonorina di mitashahla riazihenry yeagergerman a benavidesjoseph a bellanti}
350,549461.1074711884,l2 spinal nerve-block effects on acute low back pain from osteoporotic vertebral fracture,eng,pain medicine,5.498232911123253,1051-0443,10.0,4.0,6/1/95,870-5,{s. oritam. takasos. ohtoris. kishidag. inouem. suzukik. yamauchin. ochiaim. yamashitay. eguchik. takahashi}
351,720775.0,depression @@treatment preferences among japanese undergraduates: using conjoint an%alysis,english,international journal of social psychiat$ry,3.449308938963976,1062-8401,225.62092844786503,2.0,1/12/01,195-203,v. lorussom. de lenam. guidam. correalei. abbatea. latorrea. casamassimam. d. musci
352,294439.0,alcohol-related road traffic injuries in eldoret kenya,e#n#g,east african medical journal,archives of internal medicine,0#0#12-835x,75.0,12.0,1/1/98,708-711,{w odero}
353,816944.0,a study of the clinicians approach to patients' driving status in the memory clinic setting,english,value in health,4.052700351571347,3.954309449359635,0.0,0.0,1/15/01,1444,{m. thomase. fairholmen. nicholsm. george}
354,689666.0,frequency of #cdh1 germline mutations in gastric carcinoma coming from high- and low-risk areas: metana#lysis and systematic review of the literature.,eng,bmc cancer,bmc neurol,1471-2407@@,12.0,-1.0,1/12/01,8,marion habersackirmina-anna gerlichgero luschin
355,896848.0,recovery of postoperative cognitive function in elderly patients after a long duration of desflurane anesthesia: a pilot study.,eng,journal of anesthesia,j anesth,1$438-8359#,29.0,4.0,1/??15/#08,627-30,{michiko osudasatoshi kazumamichiaki yamakageshunsuke tachibanatomo hayase$}
356,231182.0,the change in eating disorder symptoms scale: scale development and psychometric properties,3.6310504299034054,annals of oncology,3.919980990514408,1@@464-0325,11.0,10.721073348027605,1/10/01,134-44,{d. l. spangler}
357,572010.0,detecting and monitoring the symptoms of parkinson's disease using smartphones: a pilot study.,eng,computers & chemical engineering,parkinsonism relat. disord.,1873-5126,575.837944162892,-1.0,7/15/03,31%0-4,{s aroraa zhans donohuee r dorseyk m biglanv venkataramanm a little}
358,798716.0,osteoid osteoma in a 16-year-old boy presenting with atrophy of the left thigh: diagnostic difficulties.,eng,turk. j. pediatr.,3.5921349212788796,0041-4301,50.0,7.0,1/8/07,3%73-6@@,{akin uz_mc_$gilmeral #top_um fani bozkurtsinem akg_l}
359,704812.0,systematic review of economic aspects of alternative modes of delivery,e$n@@g,4.788415859111661,pharmacoeconomics,0033-3549,108.0,9.127602165580848,1/1/01,15-%2#1,null
360,882786.0,[in vitro culture of cells from respiratory mucosa on foils of collagen poly-l-lactide (plla) and poly-3-hydroxy-butyrate (phb)].,ger@@,ps@@y#chother. psychosom.,5.423597762339869,-4928,82.0,2.0,1/3/10,106-119,b krampj ostwalds dommerichclaudia nischan
