ID,id,article_title,article_language,journal_title,jounral_abbreviation,journal_issn,article_jvolumn,article_jissue,article_jcreated_at,article_pagination,author_list
270,692358.0,the effect of a cervical lateral glide on the upper limb neurodynamic test: a blinded placebo-controlled investigation,%@@eng,the chartered society of physiotherapy annual congress and exhibition: defining practice friday october 17 to sunday october 19 2003 international convention centre birmingham.,5.724003778042454,4.691745412942367,0.0,0.0,1/3/01,10-oct,{a greenj lewisc worsfoldj saranga}
271,836847.0,thoracic aortic aneurysm: reading the enemy's playbook,3.5393777833661146,curr. ??probl. cardiol.,clin psychol rev,-32698.47974702889,33.0,5.0,1/$??15/10,203-277,{elefteriades j.a.}
272,867207.0,early predicting of blood component quality by statistical process control,%@@eng,vox sanguinis,transplantation,0042-9007,99.0,0.0,1/10/01,227,{h. jungkw. madlav. schottstedtt. alt}
273,253149.0,lifetime ris$k of suicide in affective disorders,5.197320681349744,the british journal of psychiatry,5.188910370241085,0007-1250 1472-1#465#,173.0,0.0,1/1/98,185-185,{a. s. lees. daviesp. c. naik}
274,929971.0,a geographic analysis of chronically homeless adults before and after enrollment in a multi-site supported housing initiative: community characteristics and migration,4.215306854415128,american journal of community psychology,j am acad child adolesc psychiatry,0091-0562,48.0,3.0,1/11/01,341-51,{r. a. rosenheckj. tsaia. s. mares}
275,470385.0,fetal cleft lip and palate detection by three-dimensional ultrasonography,3.1647390188064115,ultrasound obstet. gynecol.,j int neuropsychol soc,-8906,16.0,4.0,1#/1@@4/01,314-320,{lee w.kirk j.s.shaheen k.w.romero r.hodges a.n.comstock c.h.}
276,731703.0,substance abuse and trauma in incarcerated women,%@@eng,health technology assessment database,4.369898923850038,3.2311424032013587,0.0,0.0,1/11/01,207-220,{nct01413984 }
277,113399.0,use of job design to reduce mechanical stress on the back,%@@eng,nippon seikeigeka #gakk$ai zasshi,3.1679587575510357,3.2311424032013587,0.0,0.0,1/1/89,323-326,{d. w. bad$ger}
278,4016910.6655479586,rehabilitation of swallowing by exercise in tube-fed patients with pharyngeal dysphagia secondary to abnormal ues opening.,eng,annual abstr%act supplement,oper dent,0016-5085,122.0,5.0,1/2/05,1314-21,{mark kernkaren dikemanbarbara grandemarta kazandjianterilynn nitschkestephanie danielsbenson masseyreza shakercaryn easterling}
279,653325.0,a meta-analysis of two genome-wide association studies identifies 3 new loci for alcohol dependence.,eng,journal of psyc$h$iatric research,j psychiatr res,1879-1379,45.0,11.0,1/11/11,1419-25,{min zengyue panqunyuan zhangke-sheng wangnagesh aragamxuefeng liu}
280,893573.0,crowdsourced multimedia enhanced spatio-temporal constraint based on-demand social network for group mobility,%@@eng,proceedings of the 23rd acm international c%@@onference on multimedia,3.78839723170902,978-1-4503-3459-4,0.0,0.0,1/15/01,761-762,{ahmad qamarmuhammad shahidmd. abdur rahmanahmed lbathakhlaq ahmadfaizan ur rehmanabdullah muradbilal sadiq}
281,56272.0,impaired default network functional connectivity in autosomal dominant alzheimer disease.,eng,neurology,neurology,1526-632x,81.0,8.0,8/20/13,736-44,{virginia d bucklesandrew j saykineric mcdadestephen p sallowayaaron p schultzpeter r schofieldrandall batemanadam m brickmannick c foxjohn c morrisjohn m ringmanchristopher c rowepaul thompsonclifford jackbeau m ancesallison m goaterobert a koeppestephen correiajasmeer p chhatwalcaroline a sullivananne m faganrichard mayeuxdaniel s marcustammie l s benzingerkeith johnsonreisa a sperlingchengjie xiong}
282,737786.0,cranial reconstruction of major traumatic defects in children with osteoinductive and resorbable materials,%@@eng,international journal of oral and maxillofacial surgery,integr. physiol. behav. sci.,0901-5027,40.0,0.0,1/11/01,1024-1025,{r. r. m. bose. w. hovingm. wagemakers}
283,680306.0,meta-analysis of the effects of sometribove zinc suspension on the production and health of lactating dairy cows.,eng,journal of the american veterinary medical association,j. am. vet. med. assoc.,1943-569x,245.0,5.0,1/14/09,550-64,{william w thatchernormand r st-pierredale e baumanjoseph s hogank larry smithrobert j colliergeorge a millikenjan k shearer}
284,53877.0,journal of health communication : international perspectives the effect of an internet-based  stage- matched message intervention on young taiwanese women ' s physical activity,%@@eng,3.555387623201737,3.0690797688349623,3.2311424032013587,0.0,0.0,1/1$4/01,37-41 do  - 10.1080/10810730902805788,{sheu-jen huangmaiga changwen-#chi hungjanie chang}
285,504928.0,azathioprine for multiple sclerosis,4.727128229140603,5.73453270312016,3.0690797688349623,3.2311424032013587,0.0,4.0,1/7/01,193-9,{ilaria casettagerardo iulianograziella filippini}
286,198650.0,wound care,3.016709118872358,ann n y acad sci,3.3294731959926143,0077-8923 (print) 0077-8923,7.0,0.0,1/1/92,27-32 st  - wound care-,{null}
287,3845817.2362421937,comparison between incidental malignant and benign breast lesions detected by computed tomography: a systematic review.,eng,journal of medical imaging and radiation oncology,j med imaging radiat oncol,1754-9485,57.0,5.0,1/13/10,529-33@@,{jasmin abbascholpan jasaabuuandreas gunter bachalexey surovdominik schrammandreas wienke}
288,981412.0,plant kunitz proteinase inhibitor attenuates inflammation oxidative stress and remodeling induced by elastase in mice,3.016709118872358,european respiratory jour$nal,5.588695488040236,0340-2592,44.0,0.0,1/14/01,4.9174951142722385,{n. m. pinheiror. almeida-reisl. olivam. a. martinsm. l. v. olivao. a. theodoro-juniore. a. leicki. f. l. c. tibrioc. m. prador. f. righettib. t. m. oliveira}
289,785472.0,streptococcus pneumoniae carriage in the gaza strip,eng,plos one,plos one,19#32-6203,7.0,4.0,1/12/01,e3??506@@1,{g. rahavg. regev-yochayi. abullaisha. elhamdanyr. malleym. raza. goraly. roytmanb. shainbergm. varona. ziv}
290,734077.0,dire%ct healthcare costs and cost-effectiveness of acute coronary syndrome secondary prevention with ticagrelor ??compared to clopidogrel: economic evaluation from the public payer's perspective in poland based on the plato trial results,english,kardiologia% polska,hawai'i journal of medicine & public health : a journal of asia pacific medicine & public health,0022-9032,72.0,34.92318555750956,1/14/01,823-830,{m. niewadaj. paweskaa. budajt. maciochp. perkowski}
291,167200.2007358342,changes in renal blood flow measured by radionuclide angiography following exhausting exercise in humans.,eng,european journal of applied physiology and occupational physiology,eur j appl physiol occup physiol,0301-5548,74.0,1.0,1/1/96,7-jan,{s ikawam sudohm suzukis matsubaram shiota@@k kawakami}
292,743129.0,hormonal and dietary characteristics in obese human subjects with and without food addiction.,eng,nutrients,nutrients,??2072-6643,7.0,5.300805050246285,1/15/01,223-38,{pardis pedramguang sun}
293,392246.0,importance of membrane materials for blood purification devices in critical care.,en$g??,transfusion and apheresis science : official journal of the world apheresis association : official journal of the european so@@ciety for haemapheresis,integr. physiol. behav. sci.,1473-0502,40.0,4.417425547791811,1/9/02,23-31,{narumi tomisawaakihiro c yamashita}
294,904889.0,myofascial trigger points: spontaneous electrical activity and its consequences for pain induction and propagation,%@@eng,chin. med,4.240067506736971,1749-8546,32.52739345094995,0.0,nan,nan,{ge h.-y.fernndez-de-las-peas c??.yue s.-w.}
295,360147.0,treatment of large vessel vasculitis,$jp%n,current immunology reviews,4.369898923850038,1573-3955     1875-631x,7.0,4.0,1/11/01,435-442,{m. a. albas. prieto-gonzaleza. garcia-martinezm. c. cidm. butjosag. espigol-frigolej. hernandez-rodriguez}
296,670289.0,quantitative assessment of the influence of common variations (rs8034191 and rs1051730) at 15q25 and lung cancer risk.,eng,tumour biology : the journal of the international society for oncodevelopmental biology and medicine,tumour biol.,1423-0380,35.0,3.0,1/14/03,2777-85,{bin huhong-ju maojing zhaoying huangrong-huan yuchao guan}
297,821702.0,cognitive deficits and psychosis in parkinson's disease: a review of pathophysiology and therapeutic options,english,cns drugs,annales francaises d'anesthesie et de reanimation,3.641105295533569,113.05314755753024,6.0,1/6/01,%477-50#5,{t. foltynier.a. barkers.j.g. lewisc.h. williams-gray}
298,188890.0,incidence of multi-resistance in gram-negative aerobes from intensive care units of 10 german hospitals.,eng,scandinavian journal of infectious diseases. supplementum,scand j infect dis suppl,0300-8878,78.0,-1.0,1/1/91,22-34,{r asangerp m shahf m kahan}
299,321660.0,tuberculosis and high altitude. worth a try in extensively drug-resistant tuberculosis?,english,pharmacogenomics,5.588695488040236,3.491721898945338,189.0,4.0,1/14/01,390-3,{j. f. murray}
300,427455.0,cultural humility: essential foundation for clinical researchers.,eng,applied nursing research : anr,a@@ppl nurs res%,1532-8201,26.0,23.37570181467475,1/13/11,251-6,{katherine a yeagersusan bauer-wu}
301,246204.0,primary external fixation versus plaster immobilization of the intra-articular unstable distal radial fracture in the elderly,3.0917865410548266,aktuelle traumatologie,clin cardiol,1672-0733,34.0,2.0,1/4/01,64-70,{j. o??skamj. h. hegem#anj. palenh. j. duisp. a. m. vierhout}
302,857402.0,??high resolution epr spectroscopy of c(60)f an$d c(70)f in solid argon: reassignment of c(70)f regioisomers,english,journal of chemical physics,j chem phys,1089-7690,127.0,8.0,1/$7/01,84301,{d. a. tyurinv. a. belovd. n. laikova. v. akimove. y. misochko}
303,704357.0,clinical and radiological results of calcium phosphate cement-assisted balloon osteoplasty for colles' fractures in osteoporotic senile female patients,eng,j o#rthop sci,journal of orthopaedic science : official journal of the japanese orthopaedic association,0949-2658 (print) 0949-2658,15.0,2.0,1/10/01,204-9,{a. sudos. ishigurok. iida}
304,716785.0,explosive power and asymmetry in leg muscle function in frequent f#allers and non-fallers aged over 65,3.0917865410548266,pediatric physical therapy,neurorehabilitation,1699-5198,31.0,2.0,1/2/01,119-125 7p,{rutherford omkennedy jskelto$n da??}
305,746065.0,anxiety and depression in patients with chronic obstructive pulmonary disease: an open agenda for research.,$engl%ish,rev med chir soc med nat iasi,revista medico-chirurgicala a societatii de medici si naturalisti din ias$i,0048-7848 (print) 0048-7848,118.0,1.0,1/14/12,39-44,{costin m.dumbrav__ e.l.postolache p.cojocaru d.c.}
306,738322.0,classification of autogenous skull grafts in cranial reconstruction,eng,j okla state med assoc,the journal of the oklahoma state medical association,0030-1876 (print) 0030-1876,86.0,7.0,1/1/93,327-32,{s. pelofskyp. d. hunter}
307,934177.0,an assessment of voluntary adolescent mental health screening and referral in a children's hospital emergency department,%@@eng,3.555387623201737,4.240067506736971,4.342468054764033,0.0,0.0,1/1/74,-,{nct00750412 }
308,351534.0,implementing participatory intervention and research in communities: lessons from the kahnawake schools diabetes prevention project in canada,english,social science and medicine,5.724003778042454,3.566001035214283,56.0,6.0,1/3/01,1@??@295-1305,{t delormiera c macaulaym cargoa m mccomberl potvin}
309,872389.0,bile acid metabolism by fresh human colonic contents: a comparison of caecal versus faecal samples.,eng,gut,gut,0017-5#7??49,49.0,6.0,1/1/12,835-42,{r h dowlingg m murphyp b hylemong frenchm j veyseyl a thomas}
310,499983.0,the role of viral infection in pulmonary exacerbations of     bronchie#ctasis in# adults: a prospective study,english,chest,chest,1931-3543,147.0,6.0,1/15/01,1635-1643,{gao yhlin zyzhang gjzhong nschen rcgao ytang ylin zmxu gli hmguan wj}
311,452432.0,feverfew (tanacetum parthenium l.): a systematic review.,%@@eng,3.555387623201737,4.240067506736971,4.030052022391779,0.0,0.0,1/1/98,4.884338177331462,{null}
312,320139.0,impact of second-line drug resistance on tuberculosis treatment outcomes in the united states: mdr-tb is bad enough,english,5.5146568590891984,eur. j. heart fail.,1879-0844,16.0,10.0,1/12/01,1331-4,{j. p. cegielskis. p. althomsons}
313,735083.0,muscle variables of importance for physiological performance in competitive football.,eng,european journal of applied physiology,eur. j. appl. physiol.,1439-6327,-1.0,-1.0,8/15/@@10,4.180180434558312,{sebastien racinaisolivier girardlars nybomagni mohrmartin thomassen}
314,978471.0,chapter 25 - skin manifestations of hiv infection,%@@eng,ex%perimental cell research,5.724003778042454,3.2311424032013587,0.0,0.0,1/3/01,663-695,{gary p. wormseralvin e. friedman-kienmiguel sanchez}
315,817630.5574229584,recurrent distal 16q duplication and terminal 22q deletion: pr$enatal diagnosis and genetic counseling,eng,european journal of cancer,4.75075082081165,3.6872371745360817,49.0,0.0,1/10/01,544-7 st  - recurrent distal 16q duplication and terminal 22q deletion: prenatal diagnosis and?? genetic counseling-,{d. d. townc. p. cheny. n. suw. cn  - pubmed da  - dec do  - 10.1016/s1028-4559(10)60117-9 dp  - nlm et  - 2011/01/05 wangc. w. panc. c. leef. j. tsaip. c. wum. c. huang}
316,509952.0691196978,role of core-needle biopsy in thyroid nodules with initially nondiagnostic cytologic results.,en#g$,radiology,radiology,1527-1315,270.0,2.0,1/14/02,629-30,{qiao-hong huzhi-liang huangxiao-ming fanshuang-xi chenxiang-yang songxiao-ying qiu}
317,776651.0,the endoplasmic reticulum-associated vp7 of rotavirus is targeted to axons and dendrites in polarized neurons,engl#ish,journal of neurocytology,aust j rural health,0392-9590,22.0,8.0,1/1@@/93,616-626,{k. kristenssonl. svenssonh. b. greenbergk. weclewicz}
318,4385261.672699957,telemedicine in the management of chronic pain: a cost analysis study,5.425540837418444,canadian journal of anaesthesia,4.731130366591406,-321432.50586064346,237.08019314014726,42.8519280701759,1/9/01,590-6,{r. kerna. pronovostp. peng}
319,623358.0,moderation of cognition-intention and cognition-behaviour relations: a meta-analysis of properties of variables from the theory of planned behaviour.,eng,the british journal of social psychology / the british psychological society,br j soc psychol,0144-6665,43.0,0.0,1/4/06,159-86,{paschal sheeranrichard cooke}
320,385940.0,normalisation of left ventricular systolic function after change from vvi pacing to biventricular pacing in a child with congenital complete atrioventricular block long-qt syndrome and congenital muscular dystrophy: a 10-year follow-up.,eng,cardiology in the young,cardiol young,1467-1107,24.0,3.0,1/14/06,5$20-3#,{jesper i reimerssabrina g ellesehenrik  andersen}
321,951168.0,estimating the effect@@ of land leases on prices of inner-city apartment buildings,#eng#lish,urban studies (routledge),5.724003778042454,420980,40.0,10.0,1/3/01,2049,{christian t. l. janssen}
322,515254.0,radiographic detection of artificially created horizontal root fracture using different cone beam ct units with small fields of view.,e@@ng,dento maxillo facial radiology,dentomaxillofac radiol,0250-832x,42.0,4.0,1/13/01,20120261,{s murath avsevers y_kselc s paksoyb onderk kamburoglu}
323,674623.0,pharmacological treatments for obsessive-compulsive disorder in children and adolescents: a qualitative review.,#eng,actas espaolas de psiquiatr_a,actas esp psiquiatr,1578-2735,41.0,3.0,1/13/05,196-203,{angel rosa-alczarana i rosa-alczarmarina iniesta-sep_lveda}
324,226419.0,anterior approach unilateral right sacrospinous fixation for recurrent pelvic organ prolapse following multiple colorectal surgeries.,e%ng,international journal of colorectal disease,int j colorectal dis,1432-1262,-4.028888981048955,-1.0,7/15/01,1219-1220,{enie akhtar bt nawawiahlam m al-kharabshehtsia-shu lo}
325,584019.0536884312,a community-based trachoma survey: prevalence and risk factors in the tigray region of northern ethiopia,%@@eng,pain practice,3.1210255201718633,0929-%693x,13.0,0.0,1/6/01,173-181,{j. de la cameram. m. mesfina. m. kedirg. amanualt. arayai. g. tareke}
326,1490411.5693137501,corneal collagen cross-linking for nonectatic disorders: a systematic review.,4.936392422017943,3.555387623201737,4.240067506736971,4.030052022391779,0.0,0.0,1/1/98,5.784415799135203,{null}
327,198840.03629331983,multiple dural arteriovenous fistulas presenting as rapidly progressive dementia.,eng,the neuro%logist,neurologist,1074-7931,18.0,3.0,1/12/05,130-2,{diana duroaugusto goulogon_alo santosnuno mendon_aisabel santanaeg_dio machado}
328,462849.0,methodological review of the quality of reach out and read: does it &quot;work&quot;?,4.131813398921404,3.555387623201737,3.3294731959926143,4.030052022391779,0.0,0.0,1/1/98,4.884338177331462,{null}
329,338547.0,new therapies in soft tissue sarcoma,3.0917865410548266,expert opinion on emerging drugs,expert opin emerg drugs,1744-7623,15.0,2.0,1/10/01,237-48,{bruno vincenzidaniele santinigiuseppe toninianna maria frezza}
330,438808.0,descemet's stripping endothelial keratoplasty: safety and %outcomes: a report by the american academy of ophthalmology,%@@eng,3.555387623201737,3.0690797688349623,3.2311424032013587,0.0,0.0,4.881089386524323,-,{%null}
331,352040.0,usefulness of a survey on underage drinking in a rural american indian community health clinic,3.0917865410548266,american indian and alaska native mental health research: the journal of the national center,5.333219630946499,1533-7731,20.0,2.0,1/13/01,26-jan,{joel w. grubejuan a. lunadavid a. gilderjennifer robertsdaniel calaccindy l. ehlersroland s. moore}
332,887131.0,antidiabetic oral treatment in older people: does frailty matter?,eng,drugs & aging,drugs aging,1179-1969,26.0,-1.0,1/9/12,53-62,{angela marie abbatecolaandrea corsonellosilvia bustacchinifabrizia lattanziogiuseppe paolisso}
333,182296.0,body and illness: considering visayan filipino children's perspectives within l??ocal and global relationships of inequality,3.016709118872358,journal of psychopharmacology,4.936821102124343,%0@@750-7658,25.0,0.0,1/6/01,331-373,{aitken alderson anderson aptekar backett-milburn beazley becker bello berman billig bluebond-langner borchgrevink bucholtz christensen constantino cornwall dell clark dicarlo diprose douglas downe geissler goodenough hart james james jocano katz koppitz l aguilarlisa m. mitchell}
334,49847.0,[dinggui oil capsule in treating irritable bowel syndrome with stagnation of qi and cold: a prospective multi-center randomized placebo-controlled double-blind trial],chi,5.73453270312016,3.0690797688349623,1840-0132 1840-2445 (electronic),5.0,0.0,1/7/01,392-7 st  - [dinggui oil capsule in treating irritable bowel syndrome with stagnation of qi and cold: a prospective multi-center randomized placebo-controlled double-blind trial]-,{m. d. jiangz. j. fant. q. da  - jul dp  - nlm et  - 2007/07/17 liq. xial. wangz. yur. m. zhangf. x. zhangx. n. yangh. r. zhang}
335,524073.0,evaluation of technical quality of endodontic treatment--reliability of intraoral radiographs.,eng,endodontics & dental traumatology,endod dent traumatol,0109-2502,13.0,6.0,12/1/97,259-64,{m eckerbomt magnusson}
336,348813.0,experience in one centre using the buttoned device for occlusion of atrial septal defect: comparison with the amplatzer septal occluder.,eng,card$iol young@@,cardiology in the young,1047-9511,10.0,5.0,9@@/1/00,527-33,{g vaksmanna vincentellic francartm a cajotg m breviref godartj m coulletp devosc rey}
337,427933.0,consciousness coma and caring for the brain-injured patient.,eng,aacn clinical issues: advanced practice in acute & critical care,5.062448528745811,1079-0713,85.77658333757725,4.0,1/?%?5/10,441-55,{carmelo graffagninodaiwai m olson}
338,6862.0,long-term outcome for immune suppression and immune related lymphoproliferative disorder: prospective data from the united kingdom children's leukaemia and cancer group registry 1994-2004,3.5393777833661146,leukemia and lymphoma,angew. chem. int. ed. engl.,nct00227591/clinicaltrials.gov nct00509899/clinicaltrials.gov nct00599547/clinicaltrials.gov nct00631462/clinicaltrials.gov nct00934544/clinicaltrials.gov nct00952289/clinicaltrials.gov nct01420770/clinicaltrials.gov nct01437787/clinicaltrials.gov,53.0,5.0,1/12/01,842-848,{a. wotherspoonm.m. tajn. hadzicm. burker. hobsons.e. heightm. viskadurakic.r. pinkerton}
339,853676.0,pulsed cyclophosphamide thalidomide and dexamethasone: an oral regimen for previously treated patients with multiple myeloma.,%eng,the hematology journal : the official journal of the european haematology association / eha,hematol. j.,1466-4860,15.526942595805561,10.916165399229513,1/4/01,112-7,{meletios a dimopoulosnikolaos anagnostopoulosmarkela p zorzouathanasio@@s anagnostopouloseleni efstathiouchristos poziopoulosgeorge hamilosvassiliki grigorakidimitra gikaathanasios zomasirini xilouri}
340,556116.0,a controlled trial of anterior spinal fusion and dbridement in the surgical management of tuberculosis of the spine in patients on standard chemotherapy: a study in two centres in south africa. seventh report of the medical research council working party on tuberculosis of the spine,3.0917865410548266,3.555387623201737,3.3294731959926143,4.030052022391779,59.0,2.0,1/1/78,79-105,{null}
341,734870.0,stress across the life course and depression in a rapidly developing population: the guangzhou biobank cohort study.,eng,international journal of geriatric psychiatry,int j geriatr psychiatry,1099-1166,1.0,-1.0,9/15/10,5.252082542631685,{stephen e gilmanchaoqiang jiangkar keung chengc mary schoolingtai hing lammichael y nigabriel m leungweisen zhang}
342,540850.0,glucocorticosteroid treatment of vasogenic oedema,eng,acta neurochir suppl (wien),acta neurochirurgica. supplementum,0065-1419 (print)  $   0065-1419,43.0,0.0,1@@#/1/88,145-8,{w. bodscht. rommel}
343,465756.0,non-surgical treatments for anal fissure in adults.,4.936392422017943,3.555387623201737,4.240067506736971,4.030052022391779,0.0,0.0,1/1/98,5.19866340432289,{null}
344,4150693.8225066,spontaneous pneumomediastinum in a healthy adolescent.,eng,acta clin. croat.,eur j anaesthesiol,0353-9466,48.0,4.0,1/9/09,461-7,{renata vrsalovi_eva veronaiva mihatov-stefanovi_biserka cicak}
345,441902.0,pharmacotherapy for inherited colorectal cancer. [review] [42 refs],4.9876299709618115,3.555387623201737,3.3294731959926143,5.689081494983972,0.0,0.0,1/1/98,4.884338177331462,{null}
346,950233.0,the vascular depression hypothesis: the influence of age on the relationship between cerebrovascular risk factors and depressive symptoms in community dwelling elders,3.0917865410548266,aging & mental health,4.7589939828367545,1360-7863,9.0,2.0,1/5/01,146-152,{s. a. murrellb. t. masta. r. azar}
347,621415.0,the link between smoking and impotence: two decades of evidence.,eng,supp@@lement: active# living research - niche to norm,preventive medicine,0091-7435,32.0,6.0,1/1/06,447-52,{%n# d osgoodt o tengs}
348,633877.0,stapled haemorrhoidopexy for the treatment of haemorrhoids: a systematic review.,eng,colorectal disease : the official journal of the association of coloproctology of great britain and ireland,colorectal dis,1463-1318,11.0,3.0,1/9/03,233-43$; discussion @@243,{h weatherlyd epsteinj burchn woolacottd jayned foxa baba-akbari sari}
349,756208.0,rapid diagnosis of mycobacterium tuberculosis infection in children using interferon-gamma release assays (igras).,$e??ng,allergy and asthma proceedings : the official journal of regional and state allergy societies,allergy asthma proc,1539-6304,149.13750412416272,9.30519930692464,1/12/05,217-26,{barbara zeligsstephen m petersonorina di mitashahla riazihenry yeagergerman a benavidesjoseph a bellanti}
350,97853.0,l2 spinal nerve-block effect$s on acute# low back pain from osteoporotic vertebral fracture,eng,best pract??ice & research. clinic@@al gastroenterology,5.174358188612905,4.203936899648159,41.137992968590524,8.0,1/9/01,870-5,{s. oritam. takasos. ohtoris. kishidag. inouem. suzukik. yamauchin. ochiaim. yamashitay. eguchik. takahashi}
351,720775.0,depression treatment preferences among japanese undergraduates: using conjoint analysis,engli%sh,international journal of social psychiatry,j am geriatr soc,0020-7640,58.0,2.0,1/12/01,195-203,{s. sakamotoy. okumura}
352,901593.6204982969,alcohol-related road traffic injuries in eldoret kenya,jpn,east african medical journal,3.3204860886499814,00#12-835x%,75.0,12.0,1/1/98,708-711,{w odero}
353,375430.0,a study of the clinicians approach to patients' driving status in the memory clinic setting,english,3.389327672906442,3.1130716298373824,0266-7681 (print) 0266-7681,30.0,0.0,1/15/01,1444,{m. thomase. fairholmen. nicholsm. george}
354,689666.0,frequency of cdh1 germline mutations in gastric carcinoma coming from high- and low-risk areas: metanalysis and systematic review of the literature.,eng,bm??c cancer,acta cytol.,1471-2407,12.0,-1.0,1/12/01,8,{franco roviellodaniele marrellicarla vindignivaleria pascalegiovanni corso}
355,896848.0,recovery of postoperative cognitive function in elderly patients after a long duration of desflurane anesthesia: a pilot study.,eng,journal of anesthesia,j anesth,1438-8359,29.0,4.0,1/15/08,627-30,{michiko osudasatoshi kazumamichiaki yamakageshunsuke tachibanatomo hayase}
356,843894.4678822567,the change in eating disorder symptoms scale: scale development and psychometric properties,3.9936394013259826,eating behaviors,5.588695488040236,-7518,11.0,12.072212881274528,1/10/01,131-137,{d. l. spangler}
357,232896.0,detecting and monitoring the symptoms of parkinson's disease using smartphones: a pilot study.,eng,park@@insonism & r$elated disorders,parkinsonism relat. disord.,1873-5126,1.0,-1.0,7/15/03,310-4,{s aroraa zhans donohuee r dorseyk m biglanv venkataramanm a little}
