ID,id,article_title,article_language,journal_title,jounral_abbreviation,journal_issn,article_jvolumn,article_jissue,article_jcreated_at,article_pagination,author_list
229,581864.0,Improving Implementation of Classroom Instruction through Teacher-Directed Behavioral Consultation: A Single-Case Demonstration,English     Italian,Inter$national Journal of Behavioral Consultation and Therapy,Co%llege Teaching,155$5-785@@5,nan,3.0,0,432-438,{Marcie W. HandlerJames K. LuiselliJennifer A. #Mautone}
230,455406.0,Green tea in dermatology. [Review],nan,nan,0,nan,0,0.0,0,0,{NULL}
231,696362.0,Teaching Calculus and Other Challenging Courses to Nontraditional and At-Risk Students at a Research University.,nan,McNeill Mathematics Program,Co%llege Teaching,87567555,216.2176928682264,nan,1/6/01,291-297,{C. G. Mendez}
232,1621437.9750357645,Tropical infection after a case of total hip arthroplasty.,0,nan,J. Hosp. Infect.,1532-2939,87.0,3.0,0,179-81,{E SennevilleH MelliezV LoviC JosephM DouaudM PradierT BoyerA MeybeckL Fortin-Lebraud}
233,800900.0,Chronic pelvic pain.,0,Best practice & research. Clinical gastroenterology,The Journal of bone and joint surgery. American volume,1532-1916,134.229458983294,4.0,0,593-610,{Andrew Paul Baranowski}
234,235689.0,Obstetrical anal sphincter laceration and anal incontinence 5-10 years after childbirth,eng,Am J Obstet Gynecol,BMC Neurol,0002-9378 (Print) 0002-9378,207.0,5.0,0,nan,nan
235,nan,Comparative effectiveness of instructional design features in simulation-based education: systematic review and meta-analysis.,eng,Medical teacher,Journal o@@f n#utrition in gerontology and geriatrics,1466-187X,35.0,3.3376599031487304,0,e867-98,{Benjamin ZendejasStanley J HamstraRose HatalaDavid A CookAmy T WangJason H SzostekPatricia J ErwinRyan Brydges}
236,84944.0,Body mass index and outcome of ASC-H-interpreted cervical smears in postmenopausal women.,eng,Acta cytologica,BMC Neurol,??Jan-47,56.0,3.0,0,259-65,{Jae Jun LeeSang Yong SongSoomin AhnYoung Lyun OhJi-Youn SungChang Ohk SungYoo-Young Lee}
237,1531501.1407677128,Plasma concentration of asymmetric dimethylarginine and the risk of coronary heart disease: rationale and design of the multicenter CARDIAC study.,0,Atherosclerosis. Supplements,Atheroscler Suppl,1567-5688,4.0,4.0,0,29-32,nan
238,922795.0,[Toxicology and cli@@nical significance of base-??catalized degradation of sevoflurane to Compound A].,ger,Schlafst_rungen bei kritisch kranken patienten,nan,17-Mar,nan,-1.0,2/1/96,S10-3,{R M JonesP Conzen}
239,768486.0,Functionality and feedback: a protocol for a realist synthesis of the collation interpretation and utilisation of PROMs data to improve patient care,eng,nan,Clinical nutrition (Edinburgh Scotland),nan,20.677902003000405,7.0,0,nan,{C. MillsS. DalkinJ. GreenhalghC. WoodL. WoodJ. WrightE. GibbonsN. BlackJ. M. ValderasR. PawsonD. Meads}
240,428363.0,Case report. Cutaneous cryptococcosis in a patient with systemic erythematous lupus.,eng,Mycoses,Myc$oses$,0933-7407,173.33734717930773,9.0,1/1/11,419-21,{L RamosS Mathur_nA MateoC L_pezC G_mez}
241,nan,A method for determining skeletal lengths from DXA images.,nan,BMC Musculoskelet Disord,J Sci Med Sport,nan,8.0,-1.0,0,113,{Glen M BlakeTim D SpectorIgnac FogelmanUsha Chinappen-Horsley}
242,638918.0,nan,nan,Clinical Oncology (Royal College of Radiologists),nan,1433-2#9@@81,24.0,1.0,1/12/0#2??,52-63,{R WebsterE SpeziS MukherjeeR AdamsS GwynneJ StaffurthB Coles}
243,111336.0,The influence of smoking and impaired glucose homoeostasis on the outcome in patients presenting with an acute coronary syndrome: a cross-sectional study.,English??,BMJ Open,Foot & ankle international,2044-6055,4.0,26.632637306121733,0,e005077,{Anders HallingHkan OdebergHenrik ForssellJacob OdebergMarie-Louise PerssonLennart RstamIvar VaaraUlf LindbladMichael Freitag}
244,747279.0,Systematic review exploring the effect of exercise in pulmonary rehabilitation on depression levels in patients with chronic obstructive pulmonary disease,nan,Physiotherapy,0,nan,97.0,0.0,0,eS502-eS503,{Patil S.Horobin H.}
245,674696.0,Environmental and genomic factors as well as interventions influencing smoking cessation: a systematic review of reviews and a proposed working model.,0,nan,Journal o@@f n#utrition in gerontology and geriatrics,1662-8063,16.0,4.0,0,159-73,{A BrandJ Van der HeydenS de VironH Van OyenN Malats}
246,0,Impact of seasonality on recruitment retention adherence and outcomes in a web-based smoking cessation intervention: randomized controlled trial,eng,nan,nan,0,0,0,nan,e249-,{Mushro ANiaura R SGraham A LCobb N KFang YCha S}
247,59308.0,White matter diffusivity predicts memory in @@patients with subjective and mild cognitive impairment and normal CSF total tau levels.,eng,nan,International journal of epidemiology,1469-7661,51.20751550138552,4.12054983995114,0,58-69,{Ramune GrambaiteAnders M FjellTormod FladbyKristine B WalhovdVidar StensetIvar Reinvang}
248,610641.0,Comparison between open and closed suction systems: a systematic review.,ENGPOR,Revista Brasileira de terapia intensiva,Rev Bras Ter Intensiva,1982-4335,20.0,4.0,1/8/12,nan,{Luiz Ro@@grio de Carvalho OliveiraNilza Aparecida Almeida de CarvalhoFlvio C L Cavalcanti Ara_joIzabela Menezes PagottoPaul@@o Chiavone}
249,nan,Association between interleukin-10 promoter polymorphisms and endometriosis: a meta-analysis.,eng,#Ge%ne,Gene,1879-0038,515.0,1.0,2%/15/13,49-55,{Qiong ChenWei FanQianhong MaZhongying HuangZhun XiaoShangwei Li}
250,846537.0,Overactive bladder: Optimizing quality of care,nan,Am. J. Managed Care,nan,1088-0224,7.0,nan,5.006505882910344,S46-S61,{Lemack G.E.}@@
251,973076.0,nan,nan,nan,0,nan,nan,3.0,1/2/09,245-8,nan
252,931402.0,nan,0,0,nan,1741-7015,nan,nan,0,415-422 8p,{A. K. MarceeS. P. RoatenJ. B. MorrowK. J. KowalskeL. E. SnellL. L. Goetz}
253,908690.0,nan,English,Biomedical engineering online,5.419537528091443,1475-925X,59.75567879066436,0.0,1/11/01,22,nan
254,417373.0,Shared decision making and the future of managed care,0,Disease Management and Clinical Outcomes,nan,1088-3$$371,5.327057553306739,1.0,0,15-16,{J. E. Wennberg%}
255,759329.0,nan,eng,Nature: New b??@@iology,Nature New Biol.,0090-0@@028,nan,117.0,3/28/73,1$10-1,nan
256,nan,MicroRNAs: a new piece in the paediatric cardiovascular disease puzzle.,nan,Cardiology in the young,Cardiol Young,1467-1107,23.0,5.0,1/13/10,nan,{Dalia ElimamKeith A WebsterAhmed OmranFei YinLina A Shehadeh}
257,3602872.055097461,Association of Ureaplasma urealyticum colonization with development of bronchopulmonary dysplasia: a systemic review and meta-analysis.,e@@ng,nan,J Huazhong Univ Sci Technolog Med Sci,1672-0733,nan,2.0,nan,265-9,{Jia-rui PuDan LiDe-hua YangLi-duan ZhengXiao-dan ZhengHong MeiXuan XiangQiang-song Tong}
258,191908.0,Mortality at older ages and moves in residential and sheltered housing: evidence from the UK,0,Journal of Epidemiology and Community Health,0,nan,68.0,6.0,0,524-529,{J. FalkinghamM. EvandrouA. VlachantoniJ. Robards}
259,1270623.313745232,A multinational study of thromboprophylaxis practice in c@@ritically ill #children.,eng,Critical care medicine,nan,1530-0293,42.0,5.0,1/14/05,1232-40,{Sarah H O'BrienMarisa TucciAntonio Rodriguez NunezPhilip C SpinellaLi QinEdward Vincent S FaustinoAdrienne G RandolphEdward TruemperSimon LiKimberly MarohnSheila HansonMichael Yung[Collective Name] PROphylaxis against ThRombosis prACTice (PROTRACT) Study Investigators of the PALISI BloodNet}
260,0,Asymmetric inheritance of mitochondrial content in% aging budding yeast cells,nan,nan,0,nan,23.0,24.0,0,nan,{$E. A. MartinL. F. CostaH. LiY. ZhangM. P. VianaS. M. RafelskiW. F. Marshall}
261,nan,Physical activity moderates time-of-day differences in older adults' working memory performance.,nan,Experimental Aging Research,0,nan,32.0,4.0,0,431-446 16p,{DeLosh ELBugg JMClegg BA}
262,nan,Uses o??f the electrical skin resistance method in the study of patients with neck and upper extremity pain,0,Johns Hopkins Medical Journal,Integr. Physiol. Behav. Sci.,0,137.0,0,nan,nan,{C.P. RichterL.H. Riley Jr.}
263,625016.0,[New aspects in hernia surgery].,ger,Urologe A,nan,0340-2592,164.3415885784709,7.0,1/5/07,??774??-9,{P E GoretzkiB J LammersT Otto}
264,nan,An exploration of self-reported negative affect by adolescents as a reason for smoking: implications for tobacco prevention and intervention programs,eng,Prev Med,Lancet,0091-7435,41.0,2.0,1/5/01,5@@@@89-96,{J. RobinsonD. W. SmithB. ColwellS. L. S#tevensC. McMi#llan}
265,967376.0,Diagnosis of peripheral lung cancer with three echoic features via endobronchial ultrasound,nan,nan,Integr. Physiol. Behav. Sci.,0,132.0,0,0,922-9,{H. C. ChenS. M. LinC. L. ChouC. T. YuH. P. KuoC. H. Kuo}
266,640230.0,A meta-analysis of labor supply effects of interventions for major depressive disorder.,eng,Psychiatric Services.,nan,1075-2730,57.0,nan,1/6/02,212-8,{Justin W TimbieMarcela Horvitz-LennonSharon-Lise T NormandRichard G Frank}
267,625663.0,nan,eng,Archives of General Psychiatry,Arch.Gen.Psychiatry,0003-990X,61.0,7.0,1/4/07,714-9,nan
268,480649.0,Dyspareunia and sexual dysfunction following vaginal delivery in thai primiparous women with second degree perineal tear: A prospective cohort study,spa,nan,Stroke,1467-1107,0,0,0,58,{A. UngkanungdechaC. ChayachindaJ. VeeragulJ. Jisabai}
269,782541.0,eComment. EuroSCORE II - corrected in-hospital mortality rate in a modern cohort of patients undergoing cardiac surgery,English,Interactive Cardiovascular & Thoracic Surgery,Interact Cardiovasc Thorac Surg,nan,nan,nan,1/14/01,733,{D. G. Nezic}
270,692358.0,nan,nan,nan,0,nan,0.0,0.0,1/3/01,10-Oct,{A GreenJ LewisC WorsfoldJ Saranga}
271,0,Thoracic Aortic Aneurysm: Reading the Enemy's Playbook,nan,Curr. Probl. %Cardiol.,0,nan,33.0,5.0,0,203-277,{Elefteriades J.A.}
272,nan,nan,English,Vox Sanguinis,Journal of orthopaedic science : official journal of the Japanese Orthopaedic Association,0042-9007,99.0,0.0,0,227,nan
273,0,Lifetime risk of suicide in affective disorders,nan,The British Journal of Psychiatry,nan,0007-1250 1472-1465,nan,0.0,0,185-185,{A. S. LeeS. DaviesP. C. Naik}
274,929971.0,nan,nan,American Jour@@nal of Community Psychology,nan,0091-0562,48.0,3.0,1%/11/01,341-51,{R. A. RosenheckJ. TsaiA. S. Mares}
275,0,Fetal cleft lip and palate detection by three-dimensional ultrasonography,nan,Ultrasound Obstet. Gynecol.,0,nan,16.0,4.0,0,314-320,{Lee W.Kirk J.S.Shaheen K.W.Romero R.Hodges A.N.Comstock C.H.}
276,731703.0,Substance Abuse and Trauma in Incarcerated Women,4.303900526585451,nan,0,nan,0,0.0,0,0,{NCT01413984 }
277,113399.0,nan,nan,nan,nan,nan,0.0,0.0,1/1/89,323-326,{D. W. Badger}
278,685178.0,Rehabilitation of swallowing by exercise in tube-fed patients with pharyngeal dysphagia secondary to abnormal UES opening.,eng,nan,Oper Dent,nan,nan,5.0,1/2/05,1314-21,{Mark KernKaren DikemanBarbara GrandeMarta KazandjianTerilynn NitschkeStephanie DanielsBenson MasseyReza ShakerCaryn Easterling}
279,0,A meta-analysis of two genome-wide association studies identifies 3 new loci for alcohol dependence.,0,Jour%nal of psychiatric re%search,J% Psychiatr Res,1879-1$379#,45.0,11.0,0,1419-25,{Min ZengYue PanQunyuan ZhangKe-Sheng WangNagesh AragamXuefeng Liu}
280,893573.0,Crowdsourced Multimedia Enhanced Spatio-temporal Constraint Based on-Demand Social Network for Group Mobility,nan,Proceedings of the 23rd ACM international conference on Multimedia,Stroke,978-1-4503$-3459-#4,0.0,0.0,0,761-762,{Ahmad QamarMuhammad ShahidMd. Abdur RahmanAhmed LbathAkhlaq AhmadFaizan Ur RehmanAbdullah MuradBilal Sadiq}
281,56272.0,Impaired default network functional connectivity in autosomal dominant Alzheimer disease.,eng,Neurology,Neurology,1526-632X,343.893517553576,8.0,8/20/13,736-44,{Virginia D BucklesAndrew J SaykinEric McDadeStephen P SallowayAaron P SchultzPeter R SchofieldRandall BatemanAdam M BrickmanNick C FoxJohn C MorrisJohn M RingmanChristopher C RowePaul ThompsonClifford JackBeau M AncesAllison M GoateRobert A KoeppeStephen CorreiaJasmeer P ChhatwalCaroline A SullivanAnne M FaganRichard MayeuxDaniel S MarcusTammie L S BenzingerKeith JohnsonReisa A SperlingChengjie Xiong}
282,737786.0,nan,nan,International Journal of Oral and Maxillofacial Surgery,0,nan,40.0,0.0,0,1024-1025,{R. R. M. BosE. W. HovingM. Wagemakers}
283,680306.0,Meta-analysis of the %effects of sometribove zinc suspension on the production and health of lactating dairy cows.,eng,Journal of the American Veterinary Medical Association,J. Am. Vet. Med. Assoc.,1943-569X,0,nan,1/14/09,0,{William W ThatcherNormand R St-PierreDale E BaumanJoseph S HoganK Larry SmithRobert J CollierGeorge A MillikenJan K Shearer}
284,53877.0,nan,nan,nan,nan,nan,nan,0.0,1/14/01,nan,{Sheu-jen HuangMaiga ChangWen-chi HungJanie Chang}
285,0,Azathiopri@@ne for multiple sclerosis,0,nan,nan,nan,0.0,4.0,0,nan,{Ilaria CasettaGerardo IulianoGraziella Filippini}
286,198650.0,Wound care,0,nan,nan,0,0,0,1/1/92,27-32 ST  - Wound care-,{NULL}
287,671386.0,Comparison between incidental malignant and benign breast lesions detected by computed tomography: a systematic review.,eng,Journal of medical imaging and radiation oncology,J Med Imaging Radiat Oncol,175??4-9@@485,203.4187438167755,5.0,1/13/10,nan,{Jasmin AbbasCholpan JasaabuuAndreas Gunter BachAlexey SurovDominik SchrammAndreas Wienke}
288,nan,Plant Kunitz proteinase inhibitor attenuates inflammation oxidative stress and remodeling induced by elastase in mice,0,nan,4.225585472364846,0,0,0,1/14/01,nan,nan
289,0,Streptococ??cus pneumoniae carriage in the% Gaza strip,English,PLoS One,0,0020-7640,7.0,4.0,0,e35061,{G. RahavG. Regev-YochayI. AbullaishA. ElhamdanyR. MalleyM. RazA. GoralY. RoytmanB. ShainbergM. VaronA. Ziv}
290,734077.0,Direct healthcare costs and cost-effectiveness of acute coronary syndrome secondary prevention with ticagrelor compared to clopidogrel: Economic evaluation from the public payer's perspective in Poland based on the PLATO trial results,0,nan,Integr. Physiol. Behav. Sci.,nan,72.0,9.0,0,823-830,{M. NiewadaJ. PaweskaA. BudajT. MaciochP. Perkowski}
291,46028.0,Changes in renal blood flow %measured by radionuclide angiography following exhausting@@ exercise in humans.,e#n%g,European journal of applied physiology and occupational physiology,Eur J Appl Physiol Occup Physiol,0301-5548,74.0,nan,1/1/96,7-Jan,{S IkawaM SudohM SuzukiS MatsubaraM ShiotaK Kawakami}
292,743129.0,nan,nan,Nutrients,Stroke,2072-6643,7.0,nan,1/15/01,223-38,{Pardis PedramGuang Sun}
293,392246.0,Importance of membrane materials for blood purification devices in critical care.,eng,Transfusion and apheresis science : official journal of the World Apheresis Association : official journal of the European Society for Haemapheresis,nan,1473-0502,40.0,nan,1/9/02,2@@3??-31,{Narumi TomisawaAkihiro C Yamashita}
294,0,Myofascial trigger points: Spontaneous electrical activity and its consequences for pain induction and propagation,0,nan,nan,nan,6.0,nan,0,3.684981930358545,{Ge H.-Y.Fernndez-de-las-Peas C.Yue S.-W.}
295,360147.0,Treatment of large vessel vasculitis,nan,Current Immunology Reviews,0,1573-3955     1875-631X,7.0,4.0,0,nan,{M. A. AlbaS. Prieto-GonzalezA. Garcia-MartinezM. C. CidM. ButjosaG. Espigol-FrigoleJ. Hernandez-Rodriguez}
296,0,Quantitative assessment of the influence of common variations (rs8034191 and rs1051730) at 15q25 and lung cancer risk.,0,Tumour biology : the journal of the International Society for Oncodevelopmental Biology and Medicine,Tumour Biol.,1423-0380,35.0,3.0,0,2777-85,{Bin HuHong-ju MaoJing ZhaoYing HuangRong-huan YuChao Guan}
297,821702.0,Cognitive deficits and psychosis in Parkinson's disease: A review of pathophysiology and therapeutic options,English,nan,0,nan,20.0,6.0,0,477-505,{T. FoltynieR.A. BarkerS.J.G. LewisC.H. Williams-Gray}
298,188890.0,Incidence of multi-resistance in gram-negative aerobes from intensive care units of 10 German hospitals.,0,Scandinavian journal of infectious diseases. Supplementum,Scand J Infect Dis Suppl,0,78.0,0,1/1/91,22-34,{R AsangerP M ShahF M Kahan}
299,321660.0,Tuberculosis and high altitude. Worth a try in extensively drug-resistant tuberculosis?,0,nan,nan,0,806.4880405371498,0,0,nan,{J. F. Murray}
300,427455.0,Cultural humility: essential foundation for clinical researchers.,0,Applied nursing research : ANR,Am. J. Respir. Crit. Care Med.,1532-8201,26.0,nan,0,251-6,{Katherine A YeagerSusan Bauer-Wu}
301,246204.0,Primary external fixation versus plaster immobilization of the intra-articular unstable distal radial fracture in the elderly,5.826365184004675,nan,nan,nan,34.0,2.0,1/4/01,0,{J. OskamJ. H. HegemanJ. Pale%nH. J. Du$isP. A. M. Vierhout}
302,857402.0,High resolution EPR spectroscopy of C(60)F and C(70)F in solid argon: reassignment of C(70)F regioisomers,English,JOURNAL OF CHEMICAL PHYSICS,J Chem Phys,1089-7690,127.0,8.0,1/7%@@/01,nan,{D. A. TyurinV. A. BelovD. N. LaikovA. V. AkimovE. Y. Misochko}
303,0,Clinical and radiological results of calcium phosphate cement-assisted balloon osteoplasty for Colles' fractures in osteoporotic senile female patients,%eng,J Orthop Sci,0,0949-2658 (Print) 0949-2658,15.0,2.0,0,204-9,{A. SudoS. IshiguroK. Iida}
304,nan,Explosive power and asymmetry in leg muscle function in frequent fallers and non-fallers aged over 65,nan,nan,nan,nan,31.0,nan,1/2/01,119-125 7p,{Rutherford OMKennedy JSkelton DA}%
305,0,Anxiety and depression in patients with chronic obstructive pulmonary disease: an open agenda for research.,0,Rev Med Chir Soc Med Nat Iasi,nan,0048-7848 (Print) 0048-7848,nan,1.0,0,39-44,{Costin M.Dumbrav__ E.L.Postolache P.Cojocaru D.C.}
306,0,nan,0,J Okla State Med Assoc,Planta,nan,86.0,7.0,0,327-32,{S. PelofskyP. D. Hunter}
307,nan,An Assessment of Voluntary Adolescent Mental Health Screening and Referral in a Children's Hospital Emergency Department,nan,nan,nan,nan,0,0.0,nan,0,{NCT00750412 }
308,351534.0,Implementing participatory intervention and research in communities: lessons from the Kahnawake Schools Diabetes Prevention Project in Canada,English,nan,0,nan,nan,6.0,0,1295-1305,nan
309,872389.0,Bile acid metabolism by fresh human colonic contents: a comparison of caecal versus faecal samples.,eng,nan,Gut,0017-5749,49.0,nan,1/1/12#,nan,{R H DowlingG M MurphyP B HylemonG FrenchM J VeyseyL A Thomas}
310,499983.0,The role of viral infection in pulmonary exacerbations of     bronchiectasis in adults: a prospective study,English,nan,0,nan,147.0,23.831702593389625,%1/1??5/01,1635-1643,{Gao YHLin ZYZhang GJZhong NSChen RCGao YTang YLin ZMXu GLi HMGuan WJ}
311,0,Feverfew (Tanacetum parthenium L.): A systematic review.,0,nan,nan,nan,0,nan,0,0,{NULL}
312,320139.0,Impact of second-line drug resistance on tuberculosis treatment outcomes in the United States: MDR-TB is bad enough,English,0,nan,nan,nan,10.0,1/12/01,1331-4,{J. P. Cegiels@@kiS. P. Althomsons}
313,735083.0,nan,ENG,European journal of applied physiology,Eur. J. Appl. Physiol.,1439-6327,-4.529859725704176,-4.293828623797328,nan,nan,{Sebastien RacinaisOlivier GirardLars NyboMagni MohrMartin Thomassen}
314,nan,nan,nan,nan,0,nan,0.0,0.0,1/3/01,663-695,{Gary P. WormserAlvin E. Friedman-KienMiguel Sanchez}
315,152626.0,Recurrent distal $16q duplication and terminal 22q del#etion: prenatal diagnosis and genetic counseling,%eng,nan,nan,nan,49.0,0.0,0,544-7 ST  - Recurrent distal 16q duplication and terminal 22q deletion: prenatal diagnosis and genetic counseling-,{D. D. TownC. P. ChenY. N. SuW. CN  - PubMed DA  - Dec DO  - 10.1016/s1028-4559(10)60117-9 DP  - NLM ET  - 2011/01/05 WangC. W. PanC. C. LeeF. J. TsaiP. C. WuM. C. Huang}
316,90272.0,Role of core-needle biopsy in thyroid nodules with initially nondiagnostic cytologic results.,eng,nan,Planta,nan,nan,2.0,0,nan,{Qiao-Hong HuZhi-Liang HuangXiao-Ming FanShuang-%Xi ChenXiang-Yang SongXiao-Ying Qiu}
317,776651.0,The endoplasmic reticulum-associated VP7 of rotavirus is targeted to axons and dendrites in polarized neurons,nan,nan,0,nan,69.61418977179845,8.0,0,616-626,nan
318,931361.0,Telemedicine in the management of chronic pain: a cost analysis study,nan,nan,J Environ Monit,nan,56.0,8.0,0,nan,{R. KernA. PronovostP. Peng}
319,623358.0,Moderation of cognition-intention and cognition-behaviour $relations: a meta-analysis of properties of variables from the theory of planned behaviour.,eng,The British journal of social psychology / the British Psychological Society,Br J Soc Psychol,0144-6665,43.0,0.0,1/4/06,0,{Paschal SheeranRichard Cooke}
320,385940.0,Normalisation of left ventricular systolic function after change from VVI pacing to biventricular pacing in a child with congenital complete atrioventricular block long-QT syndrome and congenital muscular dystrophy: a 10-year follow-up.,eng,Cardiology in the young,J Cardiovasc Med (Hagerstown),1467-1107,24.0,3.0,1/14/06,520-3,{Jesper I ReimersSabrina G ElleseHenrik  Andersen}
321,951168.0,Estimating the Effect of Land Leases on Prices of Inner-city Apartment Buildings,nan,Urban Studies (Routledge),nan,420980,nan,58.069949789470776,1/3/01,2049,{Christian T. L. Janssen}
322,515254.0,Radiographic detection of artificially created horizontal root fracture using different cone beam CT units with small fields of view.,eng,nan,Dentomaxillofac Radiol,??0250-%832X,42.0,nan,1/13??/01,20120261,{S MuratH AvseverS Y_kselC S Paks$oyB Ond%erK Kamburoglu}
323,674623.0,Pharmacological treatments for obsessive-compulsive disorder in children and adolescents: a qualitative review.,e%@@ng,nan,0,nan,41.0,3.0,1/13/05,196-203,{Angel Rosa-AlczarAna I Rosa-AlczarMarina Iniesta-Sep_lveda}
324,226419.0,Anterior approach unilateral right sacrospinous fixation for recurrent pelvic ??organ prolapse following multiple colorecta@@l surgeries.,ENG,International journal of colorectal disease,Int J Colorectal Dis,1432-1262,0,-1.0,7/15/01,0,{Enie Akhtar Bt NawawiAhlam M Al-KharabshehTsia-Shu Lo}
325,879195.8449520802,A communit??y-based trachoma survey: Prevalence and risk factors in the Tigray@@ region of northern Ethiopia,3.9107656785670324,nan,0,nan,13.0,nan,0,173-181,{J. De La CameraM. M. MesfinA. M. KedirG. AmanualT. ArayaI. G. Tareke}
326,nan,Corneal collagen cros@@s-%linking for nonectatic disorders: A systematic review.,nan,nan,nan,nan,0,0.0,nan,0,nan
327,57483.0,Multiple dural arteriovenou%s fistulas presenting% as rapidly progressive dementia.,eng,nan,Neurologist,1074-7931,18.0,3.0,1/12/05%#,130-2,nan
328,nan,Methodological Review of the Quality of Reach Out and Read: Does It &quot;Work&quot;?,nan,nan,nan,nan,0.0,0.0,nan,nan,nan
329,338547.0,New therapies in soft tissue sarcoma,0,Expert opinion on emerging drugs,Expert Opin Emerg% %Drugs,1744-7623,15.0,nan,0,nan,nan
330,438808.0,Descemet's stripping endothelial keratoplasty: safety and outcomes: a report by the American Academy of Ophthalmology,0,nan,nan,nan,0,0.0,0,0,{NULL}
331,1208817.5358556062,Usefulness of a Survey on Underage Drinking in a Rural American Indian Community Health Clinic,4.894281579650716,American Indian and Alaska Native Mental Health Research: The Journal of the National Center,0,1533-7731,20.0,2.0,1/13/01,26-Jan,{Joel W. GrubeJuan A. LunaDavid A. GilderJennifer RobertsDaniel CalacCindy L. EhlersRoland S. Moore}
332,nan,Antidiabetic oral treatment in older people: does frailty matter?,eng,Drugs & aging,Planta,1179-1969,26.0,-1.0,0,53-62,{Angela Marie AbbatecolaAndrea CorsonelloSilvia BustacchiniFabrizia LattanzioGiuseppe Paolisso}
333,182296.0,Body and Illness: Considering Visayan Filipino Children's Perspectives Within Local and Global Relationships of Inequality,0,nan,nan,0,0,0,1/6/01@@,nan,nan
334,49847.0,[Dinggui Oil Capsule in treating irritable bowel syndrome with stagnation of qi and cold: a prospective multi-center randomized placebo-controlled double-blind trial],nan,nan,0,nan,nan,0.0,0,392-7 ST  - [Dinggui Oil Capsule in treating irritable bowel syndrome with stagnation of qi and cold: a prospective multi-center randomized placebo-controlled double-blind trial]-,nan
335,2810367.604236333,Evaluation of technical quality of endodontic treatment--reliability of intraoral radiographs.,0,Endodontics & dental traumatology,Planta,0109-2502,13.0,6.0,0,259-64,{M EckerbomT Magnusson}
336,348813.0,nan,eng,nan,Cardiology in the young,1047-9511,10.0,5.0,9/1/00,527-33,{G VaksmannA VincentelliC FrancartM A CajotG M BrevireF GodartJ M CoulletP DevosC Rey}
337,427933.0,Consciousness coma and caring for the brain-injured patient.,0,AACN Clinical Issues: Advanced Practice in Acute & Critical Care,J Sci Med Sport,nan,62.566309359209725,4.0,0,4??41#-55,{Carmelo GraffagninoDaiWai M Olson}
338,6862.0,nan,nan,Leukemia and Lymphoma,0,NCT00227591/ClinicalTrials.gov NCT00509899/ClinicalTrials.gov NCT00599547/ClinicalTrials.gov NCT00631462/ClinicalTrials.gov NCT00934544/ClinicalTrials.gov NCT00952289/ClinicalTrials.gov NCT01420770/ClinicalTrials.gov NCT01437787/ClinicalTrials.gov,53.0,5.0,0,842-848,{A. WotherspoonM.M. TajN. HadzicM. BurkeR. HobsonS.E. HeightM. ViskadurakiC.R. Pinkerton}
339,nan,Pulsed cyclophosphamide thalidomide and dexamethasone: an oral regimen for previously treated patients with multiple myeloma.,nan,The hematology journal : the official journal of the European Haematology Association / EHA,Clin Med,nan,nan,2.0,1/4/01,112-7,{Meletios A DimopoulosNikolaos AnagnostopoulosMarkela P ZorzouAthanasios AnagnostopoulosEleni EfstathiouChristos PoziopoulosGeorge HamilosVassiliki GrigorakiDimitra GikaAthanasios ZomasIrini Xilouri}
340,556116.0,A controlled trial of anterior spinal fusion and dbridement in the surgical management of tuberculosis of the spine in patients on standard chemotherapy: a study in two centres in South Africa. Seventh Report of the Medical Research Council Working Party on tuberculosis of the spine,nan,nan,nan,nan,59.0,nan,1/1/78,nan,nan
