ID,id,article_title,article_language,journal_title,jounral_abbreviation,journal_issn,article_jvolumn,article_jissue,article_jcreated_at,article_pagination,author_list
458,226966.0,Vaginal incisional wound healing in a rabbit menopause model: a histologic analysis.,eng,International urogynecology journal,J Clin Epidemiol,1433-3023,23.0,nan,1/12/12,1763-9,{Roger P GoldbergYoram AbramovBarbara GoldenPeter K SandMegan Sullivan}
459,nan,Acute and Persistent Postoperative Pain after Breast Surgery,0,nan,J Environ Monit,nan,10.0,4.0,1/9/01,708-715,{N. Klauber-DeMoreK. FechoN. R. MillerW. S. BlauS. A. MerrittC. S. Hultman}
460,811354.0,The role of transforming growth factor-beta-mediated tumor-stroma interactions in prostate cancer progression: An integrative approach,0,Cancer Research,5.013858813684477,nan,nan,17.0,0,7111-7120,{G. E. AyalaA. R. A. AndersonD. BasantaR. B. LuknerO. E. FrancoS. W. HaywardD. E. CliffelD. W. Strand}
461,nan,nan,nan,Revista latino-americana de enfermagem,nan,0104-1169,20.0,1.0,0,101-108,{Luiza Akiko Komura HogaAna Luisa Zaniboni GomesLuciana Magnoni Reberte}
462,485934.0,Comparison of the CHADS2 CHA2DS2-VASc and HAS-BLED scores for the prediction of clinically relevant bleeding in anticoagulated patients with atrial fibrillation: the AMADEUS trial.,eng,Thr%ombosis And Haemostasis,Am. J. Respir. Crit. Care Med.,0340-6245,110.0,5.0,0,nan,{D A LaneS ApostolakisG Y H LipH Buller}
463,743602.0,Comparison of energy balance-related behaviours and measures of body composition between Turkish adolescents in Turkey and Turkish immigrant adolescents in the Netherlands.,eng,0,nan,nan,17.0,12.0,1/14/12,Sep-92,{Makbule Gezmen-KaradagAnke OenemaSaskia J te VeldeHilal YildiranMai J M ChinapawJohannes BrugMine YildirimEda KoksalSaniye BiliciNilufer Acar-TekGamze AkbulutNevin SanlierMaartje M van StralenJudith S B de MeijAmika S Singh}
464,4068262.3958294624,nan,nan,nan,Integr. Physiol. Behav. Sci.,nan,30.0,nan,0,nan,{Hilary L. BekkerDavid J. DodwellRosalind F. Collins}
465,nan,Postamputation pain: epidemiology mechanisms and treatment,eng,nan,Journal o@@f n#utrition in gerontology and geriatrics,1178-7090,6.0,0.0,0,121-36,{E. HsuS. P. Cohen}
466,nan,Bullous impetigo in children infected with methicillin-resistant Staphylococcus aureus alone or in combination with methicillin-susceptible S. aureus: analysis of genetic characteristics including assessment of exfoliative toxin gene carriage,0,J Clin Microbiol,nan,0,49.0,0,0,Apr-72,{T. YamamotoT. TakanoM. TakanoW. HiguchiY. NitaharaK. SaitoD. ShiK. Ozaki}
467,968211.0,Ebus-tbna yields multiple gene analyses and a panel of immunohistochemical stains on routinely prepared cell blocks in non-small cell lung cancer cases,nan,Laboratory Investigation,nan,0023-6837,95.0,0.0,$1/15/01,100A,{Z. MalekiO. Nikolskaia}
468,nan,The Social Workers Guide to Child and Adolescent Mental Health.,nan,Child & Family Social Work,Bundesgesundheitsblatt Gesundheitsforschung Gesundheitsschutz,1356-7500,0,2.0,1/11/05,0,{Jo Finch}
469,0,Impact of endoscopic ultrasonography (EUS) on surgical decision-making in upper gastrointestinal tract cancer: An international multicenter study,4.2568506158665205,nan,nan,nan,21.0,3.0,0,431-$438,{Nielsen H.O.Edwin B.H_nerbein M.Hovendal C.Liedman B.M%ortensen M.B.}
470,0,Family care giving in the context of HIV/AIDS in Africa,0,nan,4.276703879920921,0,21.0,0,0,13-21,{J. HuntR. A. Powell}
471,3981065.901557879,Empowered diabetes management: life coaching and pharmacist counseling for employed adults with diabetes,eng,nan,Journal o@@f n#utrition in gerontology and geriatrics,1090-1981,40.0,5.0,1/13/01,581-91,{D. L. UeharaC. NishitaT. TomG. Cardazone}
472,640932.3700352667,School neighborhood and family factors are associated with children's bullying involvement: a nationally representative longitudinal study.,eng,Journal of the American Academy of Child and Adolescent Psychiatry,Planta,1527-5418,48.0,nan,0,545-53,{Lucy BowesBarbara MaughanAvshalom CaspiLouise ArseneaultAlan TaylorTerrie E Moffitt}
473,498344.0,Infectious diseases. As Ebola wanes trials jockey for patients.,eng,nan,0,1095-9203,348.0,6230.0,3/15/04,20,{Kai Kupferschmidt}
474,385772.0,DiGeorge Syndrome Presenting as Hypocalcaemia-Induced Seizures in Adulthood.,0,Case Reports in Medicine,Planta,1687-9627,nan,-1.0,0,923129,{Alexander AttardJosephine PsailaAdrian ZammitDeborah Grech Marguerat}
475,917417.0,In vivo effects of different anesthetic agents on apoptosis.,eng,Korean Journal of Anesthesiology,Eur#. Heart J.??,2005-7563,218.6280654106768,nan,1/12/07,nan,{Hanan F KhafagyMona M HassanEmad S OsmanFaten M El-ShanawanyAbdel Rahman M FathallahYasser M SamhanGehan G El-Fandy}
476,517503.0,The impact of 3D volume of interest definition on accuracy and precision of activity estimation in quantitative SPECT and planar processing methods.,nan,Physics in medicine and biology,??Phys Med Biol,1361-6560,55.0,12.0,6/21/10,3535-44,{Bin HeEric C Frey}
477,72325.0,Comparison between oral antibiotics and probiotics as bowel preparation for elective colon cancer surgery to prevent infection: prospective randomized trial.,eng,Surgery,Planta,1532-7361,155.0,3.0,0,493@@-50#3,nan
478,516758.0,Comparison of 3D OS-EM and 4D MAP-RBI-EM reconstruction algorithms for cardiac motion abnormality classification using a motion observer.,nan,IEEE transactions on nuclear science,IEEE Trans Nucl Sci,0018-9499,57.0,5.0,8/26/10,nan,nan
479,499276.6238366522,Adipocyte is a non-trivial dynamic partner of breast cancer cells.,eng,The International journal of developmental biology,Int. J. Dev. Biol.,1696-3547,221.69969912620343,7.0,1/11/01,851-9,{Marie-Pierre ChenardNassim Dali-YoucefEmilie BuacheMarie-Christine RioJinxiang Tan}
480,nan,HRQoL after coronary artery bypass grafting and percutaneous coronary intervention for stable angina.,nan,Scandinavian cardiovascular journal : SCJ,Scand. Cardiovasc. J.,1651-2006,43.0,2.0,1/9/04,nan,{Michael LutherKari KorpilahtiMatti R TarkkaHeini HuhtalaJari LaurikkaJan-Ola WistbackaPertti Loponen}
481,4440121.163077975,Weighting improves the information provided by joint counts on the severity of arthritis and its impact on patients' well-being in juvenile idiopathic arthritis,eng,Rheumatology (Oxford),Rheumatology (Oxford England),1462-0324,45.0,3.0,1@@/6/01#,343-7,nan
482,889580.0,Chronic pain-associated behaviors in the nursing home: resident versus caregiver percepti@@ons,0,Pain,nan,nan,nan,3.0,0,577-588,{F. KeefeB. PetersonD. Weiner}
483,732272.0,nan,0,Emergency Radiology,0,1070-3004,18.0,nan,0,119-126 8p,{Linsenmaier UGeyer LLK_rner MMeisel CDWirth SReiser MF}
484,0,Community nursing issues in Maori mental health.,0,Australian & New Zealand Journal of Mental Health Nursing,nan,1324-3780@@,5.0,8.324406922599232,0,54-62,{A StreetC Walsh}
485,276000.0,Tobacco-related scenes in television dramas for young Japanese audiences,0,Tob Control,Journal of hum%an hypertension,nan,8.0,nan,0,350,{T. Sone}
486,378289.0,Alkaline phosphatase activity of duodenal enterocytes after neonatal administration of monosodium glutamate to rats.,eng,nan,The Journal of hospital infection,0862-8408,49.0,2.0,1/1/00,269-77,{L LenhardtS MozesA Martinkov}
487,684476.0,Pulmonary rehabilitation for chronic obstructive pulmonary disease: a pilot study evaluating a once-weekly versus twice-weekly supervised programme.,0,Physiotherapy,Planta,1873-1465,96.0,1.0,0,68-74#,{Janet WebberFiona Liddell}
488,nan,Primary Banded Roux-en-Y Gastric Bypass: a Systematic Review.,nan,nan,nan,nan,0,0.0,nan,0,{NULL}
489,nan,Improving referrals to fracture clinic from the paediatric emergency department an inte??rvention.,0,nan,0,nan,0,0.0,0,0,{O. CallenderJ. CravenC. Martin}
490,0,Health literacy and child health promotion: Implications for research clinical care and public policy,0,Pediatrics,0,nan,nan,0.0,0,S306-S314,{Rudd R.Guez G.Sanders L.M.Baur C.Shaw J.S.}
491,179093.0,Persistence of profenophos and quinolphos on cultivated cucumber and its removal,English??,nan,nan,5.152881526496514,0,0,1/14/01,nan,nan
492,539034.0,Cognitive impairment and risk of cardiovascular events and mortality.,eng,European heart journal,Eur#. Heart J.??,1522-9645,nan,14.0,1/12/07,1777-86%,{Salim YusufMartin O'DonnellCraig AndersonIrene MarzonaPeter SleightJeff ProbstfieldAntonio DansPeggy GaoJackie BoschKoon Teo}
493,208435.0,nan,eng,Knee surgery sports traumatology arthroscopy : official journal of the ESSKA,Knee Surg Sports Traumatol Arthrosc,1433-7347,18.0,9.0,1/10/09,1282-9,nan
494,nan,Fludarabine vs cladribine plus busulfan and low-dose TBI as reduced intensity conditioning for allogeneic hematopoietic stem cell transplantation: a prospective randomized trial,nan,nan,0,nan,39.0,4.0,1/7/01,193-9,{D. J. WeisdorfD. DouekY. TanL. J. BurnsJ. S. MillerB. R. BlazarM. AroraT. DeForM. L. MacMillanM. MarkovaJ. E. WagnerJ. N. BarkerT. Repka}
495,36253.0,[Limited experience in adrenocortical function tests in infants].,%jpn%,nan,Horumon To Rinsho,0045-7167,nan,nan,4/1/68,273-6,{Y HiroseS KurataY Abe}
496,422857.0,Does this patient have obstructive sleep apnea?: The Rational Clinical Examination systematic review.,eng,nan,J Aerosol Med Pulm Drug Deliv,nan,310.0,7.0,1/13/08,731-741,{David L SimelKathryn A MyersMarko Mrkobrada}
497,720372.0,APPLICATION OF AGING MANAGEMENT STRATEGIES FOR REACTOR VESSEL INTERNALS AND CORE SUPPORT STRUCTURES,nan,Proceedings of the Asme Pressure Vessels and Piping Conference 2010 Vol 7,nan,978-0-7918-4926-2,0.0,0.0,1/1$0/01,277-286,nan
498,863342.0,Molecular detection of hepatitis B virus: Recent developments,0,nan,Croat.Med.J.,0,0,0,1/5/01,33-43,{B. Weber$A. Berger}$
499,nan,Droperidol vs metoclopramide for prophylaxis of postoperative nausea and vomiting after breast cancer surgery,nan,0,0,nan,28.0,0.0,1/11/01,0,{F. ColettaS. D'ArienzoP. SansoneC. AurilioM. C. PaceG. ZagariaR. Stumbo}
500,941515.0,Is prolonged use of computer games a risk factor for deep venous thrombosis in children?,nan,Clinical medicine (London England),Clin Med,1473-4893,4.0,2.0,1/4/01,190-1,{Richard J. A. Murrin}
501,641972.0,[Pelvic floor training for women with urinary incontinence].,dan,Forsinket implementering af internationale re$tnings??linjer for computertomografi med iodholdigt kontraststof .,0,$1603-6824,726.1687327820821,7.0,0,nan,{Sren BrostrmGunnar Lose}
502,699523.0,nan,English,nan,4.900652766638139,nan,nan,8.874395920445606,1/1/91,289-318,{David Dyzenhaus}
503,0,Older Women in the Homeless Shelter: Personal Perspectives and Practice Ideas,0,Journal of Women & Aging,0,nan,23.0,nan,0,360-374,nan
504,nan,Ethically justified system-level decisions in health care: Toward a decision support workbook for healthcare leaders,0,Dissertation Abstracts International: Section B: The Sciences and Engineering,5.867265986618824,-94325,70.0,nan,0,238,{Bashir Jiwani}
505,0,Takayasu's arteritis with multiple intracranial aneurysms,5.556733816454866,TAKAYASUSCHE ARTERIITIS MIT MULTIPLEN INTRAKRANIELLEN ANEURYSMEN,0,nan,23.0,1.0,0,60-61,{Matsumoto K.Yamada F.Fukuda S.}
506,125302.0,nan,eng,Scandinavian journal of rheumatology,nan,??0300-974#2,185.7634297610949,nan,0,nan,{E A M JanssenC BrodinP OgreidK KjellevoldL G GranssonL VattenP R RomundstadR OmdalK Wildhagen}
507,168889.0,Trends in domestic violence service and leadership: implications for an integrated shelter model,0,Administration and policy in mental health,Adm Policy Ment Health,0894-587X,27.0,5.0,0,339-52,{M. B. PhilipR. A. Hayward}
508,63977.0,[Clinical and hist#ologic results of treatment of serous pulp inflammations with Ledermix].,pol,nan,Czas Stomatol,nan,20.0,11.0,nan,1145-53,{H Zakrzewska-Jastrzebska}
509,782211.0,Application of a model based on fuzzy logic for evaluating nursing diagnostic accuracy of students,English,nan,J Cell Biol,nan,82.0,nan,0,875-81,{R. JensenF. G. MatosA. da Cruz DdeP. S. SilveiraM. H. LopesN. R. Ortega}
510,nan,nan,4.587767932598914,International Urology and Nephrology,3.7462160193022687,nan,45.0,5.0,1/13/01,1309-1318,{Yh HsuMs YaoCs WongCh BaiMy WuYf LinCy HsiangKw TamYw LiHf Hsiang}
511,915463.0,[Commentary on] Gait changes in children with cerebral palsy following a neuro-developmental treatment course. Adams M Chandler L Shuhmann K PEDIATRIC PHYSICAL THERAPY 2000;12:114-120,nan,0,nan,nan,14.0,nan,0,55-56 2p,{J. Slusarski}
512,nan,Cognitive Outcome of Pediatric Moyamoya Disease.,eng,Journal of Korean Neurosurgical Society,Planta,2005-3711,57.0,6.0,0,440-4,{Ju-Seong KimDong-Seok KimEun-Kyung ParkKyu-Won Shim}
513,0,nan,4.894281579650716,Bmj-British Medical Journal,0,1756-1833,347.0,-1.0,0,nan,nan
514,0,A biomechanical study of replacement of the posterior cruciate ligament with a graft. Part II: Forces in the graft compared with forces in the intact ligament,nan,nan,nan,nan,79.0,0,0,381-386,{K.L. ArmstrongG.A.M. FinermanK.L. MarkolfM.S. ShapiroJ.R. Slauterbeck}
515,0,The safety and immunogenicity of rotavirus vaccination in infants with intestinal failure,0,0,0,0,3.0,1.0,0,57-65,{McNeal M.M.Sanchez S.E.Jacob S.Javid P.J.Englund J.A.Horslen S.P.}
516,89897.0,A growing lesion on the cheek.,eng,JAMA otolaryngology-- head & neck surgery,JAMA Otolaryngol Head Neck Surg,2168-619X,140.0,nan,1/14/04,??3%83-4,{Eric J LentschJordan Whitney RawlMichael J Caplan}
517,1017296.7519834912,Protective effect of ginsenoside Rb1 against myocardial ischemia/reperfusion injury in streptozotocin-induced diabetic rats,nan,Molecular Biology Reports,nan,0301-4851,38.0,23.73034529858732,0,4327-4335,{Y. WuZ. Y. XiaH. M. LiuS. Q. LeiL. ZhangJ. J. XuB. ZhaoJ. Dou}
518,144339.0,Comparative in vitro performance of three small-volume valved holding chambers with beclomethasone/formoterol pressurized metered dose inhaler.,eng,nan,J Aerosol Med Pulm Drug Deliv,1941-2703,26.0,4.0,1/13/08,223-7,{Kamel AlhanoutJean-Christophe DubusTalita Mota GoncalvesVeronique AndrieuAlain NicolayDavi Pereira de Santana}
519,2077476.004164993,The effectiveness of anti-illicit-drug public-service announcements: a systematic review and meta-analysis.,nan,Journal of epidemiology and community health.,Planta,1470-2738,65.0,10.0,0,834-40,{Julio S G MontanerKora DebeckEvan WoodTho??mas KerrEdward J MillsDan Werb}@@
520,925315.0,[Use of statins prior to or following invasive therapy for coronary artery disease].,chi,nan,Chung Hua I Hsueh Tsa Chih,0376-2491,85.0,40.0,10/26/05,15-Jul,{Wei Gao}
521,130308.0,Malignant lymphomas of the oral region.,engfre,Canadian Forces Dental Services quarterly,nan,0045-4850,18.0,1.0,1/1/77,7-Jan,{J R TrottD J MorrowD W Buntine}
522,237077.0,Women's experiences of acupuncture during labour,pol,British Journal of Midwifery,nan,15-Jan,21.0,4.0,0,254-262,{Irena Anna FreiKatharina FierzAngela PoatMartina Gisin}
523,2273199.192323165,@@Nutritional supplementation for hip fracture aftercare i#n the elderly.,eng,Cochrane Database Syst. Rev.,The Journal of hospital infection,1469-493X,-1.0,4.0,0,CD001880,{A AvenellH H Handoll}
524,nan,Quality of life factors and survival after total or extended maxillectomy for sinonasal malignancies.,eng,Journal Of Oral And Maxillofacial Surgery: Official Journal Of The American Association Of Oral And Maxillofacial Surgeons,Eur J Anaesthesiol,1531-5053,73.0,4.0,0,759-63,{James MurphyAmal IsaiahJoshua E LubekJeffrey S Wolf}
525,67292.0,Epithelial Splicing Regulatory Proteins 1 (ESRP1) and 2 (ESRP2) Suppress Cancer Cell Motility via Different Mechanisms.,eng,The Journal of biological chemistry,J. Biol. Chem.,1083-35%1$X,289.0,228.74488295735685,3/14/10,27386-99,{Mitsuyoshi MotizukiKeiji MiyazawaTetsuo KondoKeisuke MasuyamaMasao SaitohHiroki IshiiRyohei KatohKei SakamotoShota Tanaka}
526,129698.0,Combined and sequential treatment of oral and maxillofacial malignancies: an evolving concept and clinical protocol.,eng#,Chinese medical journal,nan,0366-6999,121.0,19.0,5/8/10,1945-52,{Zhi-yuan ZhangWei-liu QiuJia-wei Zheng}
527,1279169.2964065257,Evaluation of a workshop on evidence-based medicine for social insurance physicians.,eng,Occupational Medicine-Oxford,nan,0962-7480,58.0,2.0,0,Jul-83,{Jos?? H VerbeekRob KokJan L HovingFrederieke G S%chaafsmaFrank J H van DijkPaul B A Smits}
528,556803.0,Neurocognitive assessment in 13 patients affected by muchopolysaccharidosis IVA (MPS IVA),5.968799935731239,nan,0,nan,37.0,1.0,0,S136,{M. RigoldiS. Ga%speriniB. M. Del MenicoF. NichelliA. BonciminoM. CalabriaP. MeregalliR. Parini}
529,nan,Evaluation of the protective effect of Ilex paraguariensis and Camellia sinensis extracts on the prevention of oxidative damage caused by ultraviolet radia??tion.#,eng,Environmental toxicology and pharmacology,Foot & ankle international,1872-7077,37.0,1.0,1/14/01,195-201,{Marlon BargEmilio L StreckLara M GomesVanessa M AndradeDaniela D LeffaFelipe Dal-PizzolFabricia PetronilhoFrancieli VuoloMilena Carvalho-SilvaF??ernanda BalbinotGislaine T Rezin}
530,nan,New anticoagula@@nts for atrial fibrillation.,eng,J. Cardiovasc. Med.,nan,1558-2027,10.0,6.0,1/9/06,4%46-53,{Raffaele De CaterinaGiulia RendaSteen Dalby Kristensen}
531,nan,Our Health Counts -- Unmasking Health and Social Disparities among Urban Aboriginal People in Ontario.,English,nan,0,nan,0,0.0,3.9352924369522784,0,nan
532,105981.0,A common variant in the FTO gene is associated with body mass index and predisposes to childhood and adult obesity.,eng,Science (New York N.Y.),Science,1095-9203,0,5826.0,11/7/0%5,0,{George Davey SmithAmanda J BennettEleftheria ZegginiMarjo-Riitta JarvelinNicholas J WarehamLorna W HarriesColin N A PalmerShah EbrahimTimothy M FraylingSusan M RingBridget KnightSian EllardKatharine R OwenRachel M FreathyHana LangoDebbie A LawlorLon R CardonJohn R B PerryJeffrey C BarrettAndrew D MorrisGraham A HitmanKatherine S ElliottUlla SovioMark I McCarthyDavid MelzerAlex S F DoneyAndrew R NessYoav Ben-ShlomoAndrew T HattersleyAnn-Marie PatchNicholas J TimpsonNigel W RaynerMark WalkerMichael N WeedonRuth J F LoosFredrik KarpeIn_s BarrosoLuigi FerrucciChristopher J GrovesCecilia M LindgrenBeverley Shields}
533,1869934.908252884,The parvalbumin-positive interneurons in the mouse dentate gyrus express GABAA receptor subunits 1 _2 and  along their extrasynaptic cell membrane.,nan,Neuroscience,Neuroscience,1873#-75$44,254.0,-1.0,12/19/13,80-96,{H H_gerW SieghartT KlausbergerI MilenkovicM VasiljevicD Maurer}
534,nan,Glial cells in amyotrophic lateral sclerosis.,ENG,Experimental neurology,Exp. Neurol.,1090-2430,0,nan,5/22/14,0,nan
535,623367.0,nan,0,Annals of Emergency Medicine American College of Emergency Physician's Research Forum,J Sci Med Sport,0196-0644,37.0,5.0,0,453-60,{J P IoannidisJ LauC MilchD SalemP W C$hewN TerrinE M Balk}
536,13408.0,Eczema - quiz.,nan,#Paedia@@trics & child health,Paediatr Child Health,1918-1485,nan,2.0,3/1/00,105,{NULL}
537,449003.0,Stroke in children with posterior fossa brain malformations hemangiomas arterial anomalies coarctation of the aorta and cardiac defects and eye abnorm@@alities (PHACE) syndrome: A system%atic review of the literature.,nan,nan,nan,nan,0.0,0.0,nan,nan,{NULL}
538,299297.0,Employing a youth-led adult-guided %framework: why drive high? social m@@arketing campaign.,nan,0,3.4414187300452355,nan,34.0,4.0,1/11/10,319-330,{Terry-Lynne Mar@@koTyler W#att}
539,302268.0,Review of Handbook for Working with Children and Youth: Pathways to Resilience across Cultures and Contexts,English,nan,nan,0,47.0,3.0,0,230-232,{Robert J. Flynn}
540,592663.0,Helicobacter pylori antibiotic resistance patterns and genotypes in adult dyspeptic patients from a regional population in North Wales,eng,nan,3.252177491042868,nan,54.0,2.0,1/4/01,435-40,{A. M. WalkerJ. XerryK. DaviesN. C. ElvissR. J. Owen}
541,520843.0,Sonographically guided biopsy of focal lesions: a comparison of freehand and probe-guided techniques using a phantom.,eng,AJR. American Journal Of Roentgenology,AJR Am J Roentgenol,0361-803X,184.0,5.0,1/5/05,1652-6,{Duncan M BrooksPramit M PhalRory Wolfe}
542,nan,Splinting o#sseointegrated implants and natural teeth in par%tially edentulous patients: a systematic review of the literature. [Review],nan,nan,nan,nan,0,0.0,5.783898141270543,0,nan
543,866131.0,Long-term subcutaneous recombinant interleukin-2 as maintenance therapy: Biolog@@ical effects and clinical implications,0,Cancer Biotherapy,nan,1062-8401,10.0,3.0,0,195-203,{V. Loruss??oM. De LenaM. GuidaM. CorrealeI. AbbateA. LatorreA. CasamassimaM. D. Musci}
544,751811.0,School soft drink in%tervention stud%y,nan,BMJ,Clin Med,1468-5833 (Electronic),329.0,nan,0,E315-6,{S. A. FrenchM. StoryP. J. Hannan}
545,436781.0,nan,nan,0,0,0,0,0.0,0,0,{NULL}
546,796900.0,nan,nan,Rheumatology (Oxford),Croat.Med.J.,1462-0324,44.0,11.0,0,1442-6,nan
547,491837.0,nan,nan,nan,Integr. Physiol. Behav. Sci.,nan,82.0,3.0,0,238-49,nan
548,893227.0,A screening methodology for crowdsourcing video QoE evaluation,0,nan,nan,nan,nan,0.0,0,nan,{E. Aneg??ekuh L. Sun L. Ifeachor}
549,nan,Potential for inter-observer and intra-observer variability in x-ray review to establish stone-free rates after lithotripsy.,eng,0,nan,0,147.0,15.888449299191585,3/1/92,559-62,{D Caron@@S J WitchellM A JewettE L St LouisR R GrayC BombardierS KumraK E PsihramisM R Ryan}
550,nan,nan,ENG$%,Disability and rehabilitation,Disabil Rehabil,1464-5165,-3.556625335480149,-1.0,nan,6-Jan,{Paul Jones}
551,nan,Endovascular Treatment of Ruptured Large or Wide-Neck Basilar Tip Aneurysms Associated with Moyamoya Disease Using the Stent-Assisted Coil Technique.,ENG,Journal of stro%ke and cerebrovascular diseases : the official journal of National Stroke Association,nan,1532-8511,-1.0,-1.0,7/24/15,nan,{Yibin FangPengfei YangJianmin LiuYi XuQinghai HuangWenyuan ZhaoDongwei DaiYan Chen}
552,0,Subjectiv%e states: A more robust model,0,Games and Economic Behavior,0,nan,67.0,6.470951793234215,0,nan,{K. SeoL. G. Epstein}
553,0,The fundamental role of bone morphogenetic protein 15 in ovarian function and its      involvement in female fertility disorders.,0,nan,nan,nan,0,0.0,0,0,{NULL}
554,268361.0,Giant-cell tumour of the knee: the condition of the cartilage after treatment by curettage and cementing,eng,J Bone Joint Surg Br,The Journal of bone and joint surgery. British volume,nan,89.0,3.0,1/7/01,??361-5%,{K. JonssonA. RydholmI. KristianssonD. HeinegardF. V. von SteyernP. Mannfolk}
555,664795.0,nan,eng,Journal of cancer research and clinical oncology,J. Cancer Res. Clin. Oncol.,1432-1335,138.0,9.0,1/12/09,1433-41,{Hangcheng ZhouRenbao YangJiong ChenYunlian XiaYin Lu}
556,102180.0,Safety tolerability and sustained weight loss over 2 y$ears with the once-daily human GLP-1 analog liraglutide.,eng,International journal of obesity (2005),Planta,$1476-549??7,36.0,6.0,0,843-54,nan
557,nan,Web-based nutrition education intervention improves self-efficacy and self-regulation related to increased dairy intake in college students,English,nan,0,nan,nan,11.0,1/10/01,1723-7,{Kathy W HosigSharon M Nickols-RichardsonKavita H PoddarSusan E DuncanEileen S Anderson}
558,0,Three Abstracts on Chinese Research,0,American Acupuncturist,0,nan,63.0,0.0,0,nan,nan
559,52681.0,Retrograde nailing of humeral shaft fractures,nan,nan,Planta,0,0,0,0,26-%39,nan
560,828156.0,Behavioral and cognitive measurements predict scores on the MAST: a 3-year prospective study.,eng,nan,Alcoh@@olism clinical an$d experimental research,0145-6008,20.0,7.0,10/1/96,1173-8,{V HesselbrockA W Deckel}
561,3759088.885234696,Development of a SNP genotyping panel and a medical decision support algorithm to predict drug response in schizophrenia,0,Klinik Psikofarmakoloji Bulteni,nan,0,0,0,0,S156-S157,{Y. A. SonG. UstunkarM. A. DokeH. A. DomY. Y. Tuncel}
562,713518.0,ELDERLY AND PHYSICAL ACTIVITY: BENEFITS AND CHALLENGES IN SEARCH FOR LIFE QUALITY.,nan,0,nan,nan,31.114693269347427,11.0,1/12/11,2761-2769 9p,{Gerlane ngela da Costa MoreiraDenyse Dutra Alencar VasconcelosAmanda Costa de FreitasCarla Cristina Braga MaranhoDanielle Figueiredo Patricio}
563,0,Neighbourhood characteristics and mortality in the Atherosclerosis Risk in Communities Study,0,5.8169901077718045,nan,nan,nan,0.0,0,398-407,{L. N. BorrellK. RoseB. L. ClarkD. CatellierA. V. D. Roux}
564,nan,Transference-focused psychotherapy v. treatment by community psychotherapists for borderline personality disorder: randomised controlled trial.,eng,The British journal of psychiatry : the journal of mental science,Br J Psychiatry,nan,196.0,5.0,1/10/05,389-95,{Philipp MartiusAnna BuchheimPeter BuchheimSusanne H_rzMichael RentropCord BeneckePeter SchusterMelitta Fischer-KernStephan Doering}
565,0,The changing residential environme??nts of %older people,0,nan,nan,nan,0.0,0.0,0,nan,{Basta Beard Beard Beel-Bates Bierman Bowling Cagney Calkins Carder Carlsson Chan Clark Clarke Cutchin Cutler Davidoff Diehl Doty Durrett Feldman Foote Freedman Gaugler Gitlin Gitlin Glass Golant Golant Golant Golant Golant Golant Golant Grafova Gross Hunt AlleyStephen M. Golant}
566,677752.0,A systematic review of the surgical treatment of large incisional hernia.,eng,Herni??a : the journal of hernias and abdominal wall surgery,Int J Med Inform,1248-9204,82.36165327399421,nan,1/15/02,89-101,nan
567,107417.0,Fast-food habits weight gain and insulin resistance (the CARDIA study): 15-year prospective analysis.,eng,Lancet,Lancet,14??74-547X,2082.651029376464,9453.0,1/5/01,36-42,{David R JacobsDavid S LudwigCara B EbbelingAlex I KartashovMartha L SlatteryLinda Van HornMark A Pereira}
568,141282.0,Early prenatal survival in relation to the parental environment in sheep: A review,3.6801329575228676,Small Ruminant Research,0,nan,29.0,nan,0,143-156,{E DecuypereE DewilD VanmontfortH Michels}
569,708911.0,nan,5.148951845527053,5.974987812401096,nan,4.3085399844317855,146.60423271260282,2.0,1/10/0%1,163-176,{J. SkeesT. K. Race}
570,621640.0,nan,nan,International psychogeriatrics / IPA,Neurobiol. Aging,nan,12.0,2.0,0,231-47,{J McCuskerF PrimeauM ColeL HanF Bellavance}
