ID,id,article_title,article_language,journal_title,jounral_abbreviation,journal_issn,article_jvolumn,article_jissue,article_jcreated_at,article_pagination,author_list
425,1266.0,Practicability and patients' subjective experiences of low-dose spinal anaesthesia using hyperbaric bupivacaine for transanal surgery,eng,PLoS One,PloS one,1932-6203,0.0,0.0,1pl/Y1,827-836,{NULL}
426,1266.0,Disconti$nuing penicillin prophylaxis in children with sickle cell anemia. Prophylactic Penici#llin Stud??y II,eng,PLoS One,PloS one,1932-6203,0.0,0.0,1/1/95,685-90,{R. V. IyerG. M. WoodsE. VichinskyT. R. KinneyJ. I. VerterS. T. MillerC. T. HolbrookC. H. PegelowJ. M. FallettaG. R. Buchanan}
427,1266.0,Dose optimization of infliximab in patients with rheumatoid arthritis.,eng,PLoS One,PloS one,1932-6203,0.0,0.0,1/14/01,-,{NULL}
428,1266.0,[Autologous stem cell therapy with surgical myocardial revascularization].,tur,Anadolu kardiyoloji dergisi : AKD = the Anatolian journal of cardiology,Anadolu Kardiyol Derg,1308-0032,0.0,0.0,1/9/12,465-6,{NULL}
429,1266.0,THE BRITISH MEDICAL ASSOCIATION.: SEVENTY-EIGHTH ANNUAL MEETING IN LONDON,eng,The Lancet,PloS one,1932-6203,0.0,0.0,8/13/10,468-493,{NULL}
430,1266.0,Reproduction of excursive tooth contact in an articulator with computerized axiography data,English,PLoS One,PloS one,1932-6203,0.0,0.0,1/1/97,373-378,{K. TamakiA. G. C_larS. BeyrerH. Aoki}
431,1266.0,A conservative treatment protocol of acute lumbosacral radiculopathy syndrome for general practitioner and physical therapist [Dutch],eng,Nederlands Tijdschrift Voor Fysiotherapie,PloS one,Z377-2f8X,0.0,0.0,1/1/00,5-Feb,{NULL}
432,1266.0,Intraoperative stability testing of lateral-entry pin fixation of pediatric supracondylar humeral fractures,eng,PLoS One,PloS one,1932-6203,0.0,0.0,1/7/01,695-702,{NULL}
433,1266.0,Myocardial scar differences between polymorphic and monomorphic ventricular events in ischemic cardiomyopathy: A contrast-enhanced magnetic resonance imaging,eng,European Heart Journal,PloS one,1932-6203,0.0,0.0,1/11/01,94-95,{NULL}
434,1266.0,Genetic and phenotypic determinants of blood pressure and other cardiovascular risk factors (GAPP),English,Swiss Medical Weekly,PloS one,1932-6203,0.0,0.0,1/13/01,w13728,{W. FrehnerS. AeschbacherL. RischT. SchonM. RischG. PareD. Conen}
435,1266.0,gamma-tocopherol the major form of vitamin E in the US diet deserves more attention,eng,Am J Clin Nutr,The American journal of clinicalzOutrition,Feb-65,0.0,0.0,1/1/01,714-22,{S. ChristenQ. JiangB. N. AmesM. K. Shigenaga}
436,1266.0,Randomized double-blind placebo-controlled trial of the 5-HT1A receptor antagonist AZD7371 tartrate monohydrate (robalzotan tartrate monohydrate) in patients with irritable bowel syndrome,eng,PLoS One,PloS one,1932-6203,0.0,0.0,1/8/01,-,{J. NaesdalM. DanilewitzJ. AdlerD. G. DA  - Oct DO  - 10.1111/j.1572-0241.2008.02115.x DP  - NLM ET  - 2008/09/09 SilbergC. HwangD. A. Drossman}
437,1266.0,The impact of orthodontic treatment on the quality of life a systematic review.,eng,BMC Oral Health,PloS one,1472-6831,0.0,0.0,1/14/01,66,{Yi WangYu ZhouRongDang HuXiuYing WangGerald Volire}
438,1266.0,Phenotypic analysis of misato function reveals roles of noncentrosomal microtubules in Drosophila spindle formation,English,PLoS One,J Cell Sci,0021-9533,0.0,0.0,1/11/01,706-17,{NULL}
439,1266.0,Cost implications for missed malnutrition diagnoses in patients hospitalised with an exacerbation of chronic obstructive pulmonary disease (COPD),eng,PLoS One,PloS one,1932-6203,0.0,0.0,1/15/01,36,{I. YangJ. StonestreetP. CollinsP. Masel}
440,1266.0,Effective combination chemotherapy with paclitaxel and cisplatin with or without human granulocyte colony-stimulating factor and/or erythropoietin in patients with advanced gastric cancer.,eng,PLoS One,PloS one,0007-0920,0.0,0.0,6/17/02,1858-63,rF LangG V 
441,1266.0,A case of delirium triggered by sub-clinical seizures,eng,J. Am. Geriatr. Soc.,PloS one,14-Feb,0.0,0.0,1/14/01,S223,{Ahmad A.S.}
442,1266.0,Intra-mandibular adenoid cystic carcinoma.,eng,Revue de stomatologie de chirurgie maxillo-faciale et de chirurgie orale,Rev Stomatol Chir Maxillofac Chir Orale,2213-6541,0.0,0.0,1/14/04,100-4,{N ZwetyengaA BouaichiS Aimad-Eddi%%neB EllaX-A Mommers}
443,1266.0,Why is functional capacity decreased in hypertensive patients? From mechanisms to clinical studies.,eng,Journal of cardiovascular medicine (Hagerstown Md.),J Cardiovasc Med (Hagerstown),1558-2035,0.0,0.0,1/14/06,447-55,{NULL}
444,1266.0,Personality profile and exercise dependence,eng,Italian Journal of Psychopathology,PloS one,1592-1107,0.0,0.0,1/7/01,400-405,{NULL}
445,1266.0,s? Say,eng,Consumer Reports on Health,PloS one,1058-0832,0.0,0.0,1/7/01,3-Mar,{NULL}
446,1266.0,Prevalence of Masked Hypertension in African Americans.,ENG,Journal of clinical hypertension (Greenwich Conn.),J Clin Hypertens (Greenwich),1751-7176,0.0,0.0,10/20/14,-,{Frances WilliamsAlehegn GelayeSusan SteigerwaltYara DaloulHadeel AssadTimothy R LarsenBarryton WaanbahMichael Williams}
447,1266.0,Differences of inter-tract correlations between neonates and children around puberty: a study based on microstructural measurements with DTI.,eng,Frontiers in human neuroscience,PloS one,1662-5161,0.0,0.0,1/13/01,721,{Gaolang GongHua ChengYong HeQi DongHao HuangVirendra Mishra}
448,1266.0,Electrocardiogram QRS detection using multiscale filtering based on mathematical morphology,English,Conference proceedings : ... Annual International Conference of the IEEE Engineering in Medicine and Biology Society. IEEE Engineering in Medicine and Biology Society. Conference,PloS one,1557-170X,0.0,0.0,1/7/01,d19Z-3199,{Department of Electrical F. ZhangElectrical Department ofNational Computer EngineeringSingapore Email elezf nus edu sg University of SingaporeSingapore National University of SingaporeF. ZhangEngineering ComputerAddress CorrespondenceY. LianAddresses Author}
449,1266.0,Barriers and facilitators to implementing electronic prescription: a systematic review of user groups' perceptions.,eng,Journal of the American Medical InformaticsvAssociation : JAMIA,J Am Med Inform Assoc,1527-974X,0.0,0.0,1/14/05,535-41,{Marie-Pierre GagnonClaude Sicotte_dith-Romy NsangouSonya GrenierJulie Payne-Gagnon}
450,1266.0,Cystic fibrosis: cost of illness and considerations for the economic evaluation of potential therapies,eng,Pharmacoeconomics,PloS one,1932-6203,0.0,0.0,1/3/01,1001-24,{T~!. WelteR. BusseN. J##??alilvandC. Krauth}
451,1266.0,Working memory shorgaterm memory and reading disabilities: a selective meta-analysis of the literature.,eng,Journal of learning disabilities,J Learn Disabil,0022-2194,0.0,0.0,1/9/05,260-87,{H Lee Swanson[Collective Name] Xinhua ZhengOlga Jerman}
452,1266.0,Hypothalamic obesity in children.,eng,Obesity reviews : an official journal of the International Association for the Study of Obesity,Obes Rev,1467-789X,0.0,0.0,1/12/09,780-98,Lustig
453,1266.0,Health literacy diabetes self-care and glycemic control in adults with type 2 diabetes,eng,Diabetes technology & therapeutics,Diabetes Technol. Ther.,1520-9156,0.0,0.0,1/10/01,913-9,{Chandra Y. and Bains Sujeev S. and Egede Leonard E. Osborn}
454,1266.0,Central corneal melting associated with reformulated generic diclofenac in a patient with inferior fornix foreshortening.,eng,Ophthalmology and eye diseases,Ophthalmol Eye Dis,1179-1721,0.0,0.0,1/11/01,21-24,{Cameron Campbell Johnson}
455,1266.0,Heart rate and blood pressure responses of left-handers and right-handers to autonomic stressors,English,Indian Journal of Physiology and Pharmacology,PloS one,0019-5499,0.0,0.0,1/4/01,31-40,{M.B. DikshitS. RajeD.S. JajuV.R. Purandare}
456,1266.0,[The use of intravascular nitinol stents in the treatment of subclavian vein compression for thoracic outlet syndrome].,pol,Nowoczesne biomateria_y jako opatrunki hemostatyczne w chirurgii oszczedzajacej miazsz nerki--model zwierzecy. Doniesienie wstepne.,PloS one,0370-0747,0.0,0.0,1/7/01,May-51,{Przemys_aw P SzyberArtur PupkaPiotr SzyberJerzy Garcarek}
457,1266.0,Primary head and neck cancers in North -Western Nigeria,eng,PLoS One,PloS one,1932-6203,0.0,0.0,1/9/01,227-33,{P. H. JalloE. C. OtohA. MohammedS. O. AjikeN. W. JohnsonI. S. Danfillo}
458,1266.0,Vaginal incisional wound healing in a rabbit menopause model: a histologic analysis.,eng,International urogynecology journal,Int Urogynecol J,1433-3023,0.0,0.0,1/12/12,1763-9,{Roger P GoldbergYoram AbramovBarbara GoldenPeter K SandMegan Sullivan}
459,1266.0,Acute and Persistent Postoperative Pain after Breast Surgery,eng,Pain Medicine,PloS one,1932-6203,0.0,0.0,1/9/01,708-715,{NULL}
460,1266.0,The role of transforming growth factor-beta-mediated tumor-stroma interactioaorppa evitargetni nA :noissergorp recnac etatsorp ni snch,eng,Cancer Research,PloS one,1932-6203,0.0,0.0,1/9/01,7111-7120,{G. E. AyalaA. R. A. AndersonD. BasantaR. B. LuknerO. E. FrancoS. W. HaywardD. E. CliffelD. W. Strand}
461,1266.0,Process of construction of an educational booklet for health promotion of pregnant women,eng,Revista latino-americana de enfermagem,Rev Lat Am Enfermagem,0104-1169,0.0,0.0,1/12/01,101-108,Magnoni Rebe
462,1266.0,Comparison of the CHADS2 CHA2DS2-VASc and HAS-BLED scores for the prediction of clinically relevant bleeding in anticoagulated patients with atrial fibrillation: the AMADEUS trial.,eng,Thrombosis And Haemostasis,Thromb Haemost,0340-6245,0.0,0.0,1/13/11,1074-9,{D A LaneS ApostolakisG Y H LipH Buller}
463,1266.0,Comparison of energy balance-related behaviours and measures of body composition between Turkish adolescents in Turkey and Turkish immigrant adolescents in the Netherlands.,eng,Public health nutrition,Public Health Nutr,1475-2727,0.0,0.0,1/14/12,Sep-92,{Makbule Gezmen-KaradagAnke OenemaSaskia J te VeldeHilal YildiranMai J M ChinapawJohannes BrugMine YildirimEda KoksalSaniye BiliciNilufer Acar-TekGamze AkbulutNevin SanlierMaartje M van StralenJudith S B de MeijAmika S Singh}
464,1266.0,Follow-up care of patients treated for breast cancer: a structured review,English,Cancer Treatment Reviews,PloS one,1932-6203,0.0,0.0,1/4/01,19-35,{Hilary L. BekkerDavid J. DodwellRosalind F. Collins}
465,1266.0,Postamputation pain: epidemiology mechanisms and treatment,eng,J Pain Res,Journalofpainresearch,1178-7090,0.0,0.0,1/13/01,121-36,{NULL}
466,1266.0,Bullous impetigo in children infected with methicillin-resistant Staphylococcus aureus alone or in combination with methicillin-susceptible S. aureus: analysis of genetic characteristics including assessment of exfoliative toxin gene carriage,eng,J Clin Microbiol,Journal of clinical microbiology,0095-1137 (Print) 0095-1137,0.0,0.0,1/11/01,Apr-72,{T. YamamotoT. TakanoM. TakanoW. HiguchiY. NitaharaK. SaitoD. ShiK. Ozaki}
467,1266.0,Ebus-tbna yields multiple gene analyses and a panel of immunohistochemical stains on routinely prepared cell blocks in non-small cell lung cancer cases,English,Laboratory Investigation,PloS one,0023-6837,0.0,0.0,1/15/01,100A,{NULL}
468,1266.0,The Social Workers Guide to Child and Adolescent Mental Health.,eng,Child&FamilySocialWork,PloS one,1356-7500,0.0,0.0,1/11/05,241-242,}
469,1266.0,Impact of endoscopic ultrasonography (EUS) on surgical decision-making in upper gastrointestinal tract cancer: An international multicenter study,eng,PLoS One,PloS one,-5514,0.0,0.0,1/14/01,431-438,{Nielsen H.O.Edwin B.H_nerbein M.Hovendal C.Liedman BB.M nesnetroM..}
470,1266.0,Family care giving in the context of HIV/AIDS in Africa,eng,##?#???,PloS one,1932-6203,0.0,0.0,1/13/01,13-21,{J. HuntR. A. Powell}
471,1266.0,Empowered diabetes management: life coaching and pharmacist counseling for employed adults with diabetes,eng,Health Educ Behav,Health education & behavior : the official publication of the Society for Public Health Education,1090-1981,0.0,0.0,1/13/01,581-91,{D. L. UeharaC. NishitaT. TomG. Cardazone}
472,1266.0,School neighborhood and family factors are associated with children's bullying involvement: a nationally representative longitudinal study.,eng,Journal of the American Academy of Child and Adolescent Psychiatry,J Am Acad Child Adolesc Psychiatry,1527-5418,0.0,0.0,1/9/05,545-,{Lucy BowesBarbara MaughanAvshalom CaspiLouise ArseneaultAlan TaylorTerrie E Moffitt}
473,1266.0,Infectious diseases. As Ebola wanes trials jockey for patients.,eng,Science (New York N.Y.),Science,1095-9203,0.0,0.0,3/15/04,20,{Kai Kupferschmidt}
474,1266.0,DiGeorge Syndrome Presenting as Hypocalcaemia-Induced Seizures in Adulthood.,eng,Case Reports in Medicine,Case Rep.Med.,1687-9627,0.0,0.0,1/14/01,923129,{Alexander AttardJosephine PsailaAdrian ZammitDeborah Grech Marguerat}
475,1266.0,In vivo effects of different anesthetic agents on apoptosis.,eng,Korean Journal of Anesthesiology,Korean J.Anesth.,2005-7563,0.0,0.0,1/12/07,18-24,{HananFKhafagyMonaMHassanEmadSOsmanFatenMEl-ShanawanyAbdelRahmanMFathallahYasserMSamhanGehanGEl-Fandy}
476,1266.0,The impact of 3D volume of interest definition on accuracy and precision of activity estimation in quantitative SPECT and planar processing methods.,eng,Physics in medicine and biology,Phys Med Biol,1361-6560,0.0,0.0,6/21/10,3535-44,{Bin HeEric C Frey}
477,1266.0,Comparison between oral antibiotics and probiotics as bpwel prepUration for Blective colon cancer surgery to prevent infection: prospective randomized trial.,eng,PLoS One,Surgery,1532-7361,0.0,0.0,1/14/03,493-503,{Yasuhiro KogaKazutake OkadaToru OzakiSotaro SadahiroAkira TanakaToshiyuki SuzukiHiroko Kamata}
478,1266.0,Comparison of 3D OS-EM and 4D MAP-RBI-EM reconstruction algorithms for cardiac motion abnormality classification using a motion observer.,EN^###^~!G,IEEE transactions on nuclear science,PloS one,0018-9499,0.0,0.0,8/26/10,2571,{Taek-Soo LeeW Paul SegarsXin HeJing TangBenjamin M W Tsui}
479,1266.0,f breast cancer cell,eng,The International journal of developmental biology,Int. J. Dev. Biol.,1696-3547,0.0,0.0,1/11/01,851-9,{Marie-Pierre ChenardNassim Dali-YoucefEmilie BuacheMarie-Christine RioJinxiang Tan}
480,1266.0,nd percutaneous coronary interven,eng,Scandinavian cardiovascular journal : SCJ,Scand. Cardiovasc. J.,1651-2006,0.0,0.0,1/9/04,Sep-94,{Michael LutherKari KorpilahtiMatti R TarkkaHeini HuhtalaJari LaurikkaJan-Ola WistbackaPertti Loponen}
481,1266.0,Weighting improves the information provided by joint counts on the severity of arthritis and its impact on patients' well-being in juvenile idiopathic arthritis,eng,PLoS One,Rheumatology (Oxford England),1462-0324,0.0,0.0,1/6/01,343-7,{A. RavelliS. Magni-ManzoniA. PistorioM. BandeiraA. MartiniE. SalaA. FalconeA. BuoncompagniN. RupertoA. Loy}
482,1266.0,Chronic pain-associated behaviors in the nursing home: resident versus caregiver perceptions,eng,Pain,Pain,9593-4030,0.0,0.0,1/1/99,577-588,{F. KeefeB. PetersonD. Weiner}
483,1266.0,Analysis of responses of radiology personnel to a simulated mass casualty incident after the implementation of an automated alarm system in hospital emergency planning.,eng,Emergency Radiology,EMERG RADIOL,1070-3004,0.0,0.0,1/11/04,119-126 8p,{Linsenmaier UGeyer LLK_rner MMeisel CDWirth SReiser MF}
484,1266.0,Community nursing issues in Maori mental health.,eng,Australian & New Zealand Journal of Mental Health Nursing,AUST NZ J MENT HEALTH NURS,1324-3780,0.0,0.0,6/1/96,54-62,{NULL}
485,1266.0,Tobacco-related scenes in television dramas for young Japanese audiences,eng,Tob Control,PloS one,9064-4563,0.0,0.0,1/1/99,350,{T. Sone}
486,1266.0,Alkaline phosphatase activity of duodenal enterocytes after neonatal administration of monosodium glutamate to rats.,eng,Physiological research / Academia Scientiarum Bohemoslovaca,Physiol Res,0862-8408,0.0,0.0,1/1/00,269-77,{L LenhardtS MozesA Martinkov}
487,1266.0,Pulmonary rehabilitation for chronic obstructive pulmonary disease: a pilot study evaluating a once-weekly versus twice-weekly supervised programme.,eng,Physiotherapy,Physiotherapy,1873-1465,0.0,0.0,1/10/03,68-74,{Janet WebberFiona Liddell}
488,1266.0,Primary Banded Roux-en-Y Gastric Bypass: a Systematic Review.,eng,PLoS One,PloS one,1932-6203,0.0,0.0,1/14/01,-,{NULL}
489,1266.0,Improving referrals to fracture clinic from the paediatric emergency department an intervention.,eng,PLoS One,PloS one,1932-6203,0.0,0.0,1/14/01,-,{O. CallenderJ. CravenC. Martin}
490,1266.0,Health literacy and child health promotion: Implications for research clinical care and public policy,eng,Pediatrics,PloS one,1932-6203,0.0,0.0,1/14/01,S306-S314,{Rudd R.Guez G.Sanders L.M.Baur C.Shaw J.S.}
491,1266.0,Persistence of profenophos and quinolphos on cultivated cucumber and its removal,eng,PLoS One,PloS one,1932-6203,0.0,0.0,1/14/01,917-920,{B. VijayalakshmiD. Siva Rama PrasadD. RaveendranathK. Sri Rama MurthyA. Harinatha Reddy}
492,1266.0,Cognitcsavoidrac fo ksir dna tnemriapmi eviular events and mortality.,eng,European heart journal,Eur. Heart J.,1522-9645,0.0,0.0,1/12/07,1777-86,{Salim YusufMartin O'DonnellCraig AndersonIrene MarzonaPeter SleightJeff ProbstfieldAntonio DansPeggy GaoJackie BoschKoon Teo}
493,1266.0,Comparison of tunnel positions in single-bundle anterior cruciate ligament reconstructions using computer navigation.,eng,Knee surgery sports traumatology arthroscopy : official journal of the ESSKA,KnIe murg Sports Traumatol Arthrosc,1433-7347,0.0,0.0,1/10/09,1282-9,{Travis G MaakThomas L WickiewiczVolker MusahlJames E VoosAndrew D Pearle}
494,1266.0,Fludarabine vs cladribine plus busulfan and low-dose TBI as reduced intensity conditioning for allogeneic hematopoietic stem cell transplantation: a prospective randomized trial,eng,PLoS One,PloS one,1932-6203,0.0,0.0,1/7/01,193-9,{D. J. WeisdorfD. DouekY. TanL. J. BurnsJ. S. MillerB. R. BlazarM. AroraT. DeForM. L. MacMillanM. MarkovaJ. E. WagnerJ. N. BarkerT. Repka}
495,1266.0,[Limited experience in adrenocortical function tests in infants].,jpn,Horumon to rinsho. Clinical endocrinology,Horumon To Rinsho,0045-7167,0.0,0.0,4/1/68,273-6,{Y HiroseS KurataY Abe}
496,1266.0,Does this patient have obstructive sleep apnea?: The Rational Clinical Examination systematic review.,eng,PLoS One,PloS one,1932-6203,0.0,0.0,1/13/08,731-741,{David L SimelKathryn A MyersMarko Mrkobrada}
497,1266.0,APPLICATION OF AGING MANAGEMENT STRATEGIES FOR REACTOR VESSEL INTERNALS AND CORE SUPPORT STRUCTURES,eng,Proceedings of the Asme Pressure Vessels and Piping Conference 2010 Vol 7,PloS one,978-0-7918-4926-2,0.0,0.0,1//0101,277-286,{H. Q. XuM. SnyderS. FyfitchA. ChetaG. BezdikianV. N. ShahT. R. LiszkaiH. CharkasN. GuptaY. ShojiC. S. BajwaC. MayM. SanwarwalaM. BrumovskyI. Ezekoye}
498,1266.0,Molecular detection of hepatitis B virus: Recent developments,eng,LaboratoriumsMedizin,PloS one,1932-6203,0.0,0.0,1/5/01,33-43,{NULL}
499,1266.0,Droperidol vs metoclopramide for prophylaxis of postoperative nausea and vomiting after breast cancer surgery,eng,PLoS One,PloS one,1932-6203,0.0,0.0,1/11/01,141,{NULL}
500,1266.0,Is prolonged use of computer games a risk factor for deep venous thrombosis in children?,eng,Clinical medicine (London England),Clin Med,1473-4893,0.0,0.0,1/4/01,190-1,{Richard J. A. Murrin}
501,1266.0,[Pelvic floor training for women with urinary incontinence].,dan,Forsinket implementering af internationale retningslinjer for computertomografi med iodholdigt kontraststof .,PloS one,1603-6824,0.0,0.0,/7/,593-5,{Sren BrostrmGunnar Lose}
502,1266.0,Regulating free speech,English,PLoS One,PloS one,1932-6203,0.0,0.0,1/1/91,289-318,{David Dyzenhaus}
503,1266.0,Older Women in the Homeless Shelter: Personal Perspectives and Practice Ideas,eng,Journal of Women & Aging,PloS one,0895-2841,0.0,0.0,1/11/01,3##??#60-374,{Jennifer Davis-Berman}
504,1266.0,Ethically justified system-level decisions in health care: T###oward a decision support workbook for hea$lthcare leaders,eng,Dissertation Abstracts International: Section B: The Sciences and Engineering,PloS one,-94325,0.0,0.0,1/9/01,-,{Bashir Jwwani}
505,1266.0,Takayasu's arteritis with multiple intracranial aneurysms,eng,PLoS One,PloS one,0428-8246,0.0,0.0,1/14/01,60-61,{NULL}
506,1266.0,Intravenous cyclophosphamide in patients with chronic systemic inflammatory diseases: morbidity and mortality.,eng,Scandinavian journal of rheumatology,Scandg J. Rheumatol.,0300-9742,0.0,0.0,1/8/03,130-4,{E A M JanssenC BrodinP OgreidK KjellevoldL G GranssonL VattenP R RomundstadR OmdalK Wildhagen}
507,1266.0,##??Trends in domestic violence service and leadership: implicat##??ion^^s for an integrated shelter model,eng,Administration and policy in mental health,Adm ^^Policy Ment Health,0894-587X,0.0,0.0,1/1/00,339-52,{M. B. PhilipR. A. Hayward}
508,1266.0,[Clinical and histologic results of treatment of serous pulp inflammations with Ledermix].,pol,Czasopismo stomatologiczne,Czas Stomatol,Nov-53,0.0,0.0,1/1/67,1145-53,{H Zakrzewska-Jastrzebska}
509,1266.0,Application of a model based on fuzzy logic for evaluating nursing diagnostic accuracy of students,g,International Journal of Medical Informatics,PloS one,1932-6203,0.0,0.0,1/13/01,875-81,{R. JensenF. G. MatosA. da Cruz DdeP. S. SilveiraM. H. LopesN. R. Ortega}
510,1266.0,The effectiveness of N-acetylcysteine in preventing contrast-induced nephropathy in patients undergoing contrast-enhanced computed tomography: a meta-analysis of randomized controlled trials (Provisional abstract),eng,International Urology and Nephrology,PloS one,0301-1623,0.0,0.0,1/13/01,1309-1318,{Yh HsuMs YaoCs WongCh BaiMy WuYf LinCy HsiangKw TamYw LiHf Hsiang}
511,1266.0,[Commentary on] Gait changes in children with cerebral palsy following a neuro-developmental treatment course. Adams M Chandler L Shuhmann K PEDIATRIC PHYSICAL THERAPY 2000;12:114-120,eng,Pediatric physical therapy,PloS one,1932-6203,0.0,0.0,1/14/01,55-56 2p,{J. Slusarski}
512,1266.0,Cognitive Outcome of Pediatric Moyamoya Disease.,eng,Journal of Korean Neurosurgical Society,J Korean Neurosurg Soc,2005-3711,0.0,0.0,1/15/06,440-4,{Ju-Seong KimDong-Seok KimEun-Kyung ParkKyu-Won Shim}
513,1266.0,Fruit consumption and risk of type 2 diabetes: results from three prospective longitudinal cohort studies.,eng,Bmj-British Medical Journal,PloS one,1756-1833,0.0,0.0,1/13/01,f5001,{Rob M van DamFrank B HuIsao MurakiJoann E MansonFumiaki ImamuraQi SunWalter C Willett}
514,1266.0,A biomechanical study of replacement of the posterior cruciate ligament with a graft. Part II: Forces in the graft compared with forces in the intact ligament,eng,PLoS One,PloS one,1932-6203,0.0,0.0,1/1/97,381-386,{NULL}
515,1266.0,The safety and immunogenicity of rotavirus vaccination in infants with intestinal failure,eng,PLoS One,PloS one,-14400,0.0,0.0,1/14/01,57-65,{NULL}
516,1266.0,A growing lesion on the cheek.,eng,JAMA otolaryngology-- head & neck surgery,JAMA Otolaryngol Head Neck Surg,2168-619X,0.0,0.0,1/14/04,383-4,{NULL}
517,1266.0,Protective effect of ginsenoside Rb1 against myocardial ischemia/reperfusion injury in streptozotocin-induced diabetic rats,eng,Molecular Biology Reports,PloS one,0301-4851,0.0,0.0,1/11/01,4327-4335,{NULL}
518,1266.0,Comparative in vitro performance of three small-volume valved holding chambers with beclomethasone/formoterol pressurized metered dose inhaler.,eng,Journal of aerosol medicine and pulmonary drug delivery,J Aerosol Med Pulm Drug Deliv,1941-2703,0.0,0.0,1/13/08,223-7,{Kamel AlhanoutJean-Christophe DubusTalita Mota GoncalvesVeronique AndrieuAlain NicolayDavi Pereira de Santana}
519,1266.0,The effectiveness of anti-illicit-drug public-service announcements: a systematic review and meta-analysis.,eng,Journal of epidemiology and community health.,PloS one,1470-2738,0.0,0.0,1/11/10,834-40,{Julio S G MontanerKora DebeckEvan WoodThomas KerrEdward J MillsDan Werb}
520,1266.0,[Use of statins prior to or following invasive therapy for coronary artery disease].,chi,PLoS One,Chung Hua I Hsueh Tsa Chih,0376-2491,0.0,0.0,10/26/05,15-Jul,{Wei Gao}
521,1266.0,Malignant lymphomas of the oral region.,eng,Canadian Forces Dental Services quarterly,Can Forces Dent Serv Q,0045584-0,0.0,0.0,1/1/77,7-Jan,{NULL}
522,1266.0,Women's eQperiences of acupuncture during babour,eng,British Journal of Mid%wifery,PloS one,0969-4900,0.0,0.0,1/13/01,254-262,{Irena A%%nn%a FreiKatharina FierzAngela Po~!atMartina Gisin}
523,1266.0,Nutritional supplementation for hip fracture aftercare in the elderly.,eng,Cochrane Database Syst. Rev.,PloS one,1469-493X,0.0,0.0,1/1/00,CD001880,{NULL}
524,1266.0,Quality of life factors and survival after total or extended maxillectomy for sinonasal malignancies.,eng,PLoS One,PloS one,1531-5053,0.0,0.0,1/15/04,759-63,{James MurphyAmal IsaiahJoshua E LubekJeffrey S Wolf}
525,1266.0,ithelial Splicing Regulatory Proteins 1 (ESRP1) and 2 (ESRP2) Suppress Cancer Cell Mo,eng,The Journal of biological chemistry,PloS one,1083-351X,0.0,0.0,3/14/10,27386-99,{Mitsuyoshi MotizukiKeiji MiyazawaTetsuo KondoKeisuke MasuyamaMasao SaitohHiroki IshiiRyohei KatohKei SakamotoShota Tanaka}
526,1266.0,Combined and sequential treatment of oral and maxillofacial malignancies: an evolving concept and clinical protocol.,eng,Chinese medical journal,Chin. Med. J.,0366-6999,0.0,0.0,5/8/10,1945-52,{Zhi-yuan ZhangWei-liu QiuJia-wei Zheng}
527,1266.0,Evaluation of a workshop on evidence-based medicine for social insurance physicians.,eng,PLoS One,PloS one,0962-7480,0.0,0.0,1/8/03,Jul-83,{Jos H VerbeekRob KokJan L HovingFrederieke G SchaafsmaFrank J H van DijkPaul B A Smits}
528,1266.0,Neurocognitive assessment in 13 patients affected by muchopolysaccharidosis IVA (MPS IVA),eng,PLoS One,PloS one,1932-6203,0.0,0.0,1/14/01,S136,{NULL}
529,1266.0,Evaluation of the protective effect of Ilex paraguariensis and Camellia sinensis extracts on the prevention of oxidative damage caused by ultraviolet radiation.,eng,Environmental toxicology and pharmacology,Environ. Toxicol. Pharmacol.,1872-7077,0.0,0.0,1/14/01,195-201,{Marlon BargEmilio L StreckLara M GomesVanessa M AndradeDaniela D LeffaFelipe Dal-PizzolFabricia PetronilhoFrancieli VuoloMilena Carvalho-SilvaFernanda BalbinotGislaine T Rezin}
