ID,id,article_title,article_language,journal_title,jounral_abbreviation,journal_issn,article_jvolumn,article_jissue,article_jcreated_at,article_pagination,author_list
733,1266.0,Remission rates following antidepressant therapy with bupropion or selective serotonin reuptake inhibitors: a meta-analysis of original data from 7 randomized controlled trials.,eng,J. Clin. Psychiatry,PloS one,0160-6,0.0,0.0,1/5/08,974-81,{Michael E ThaseYounghua WangApril E HarriettMelinda MittonCarol B RockettBarbara R HaightJack G ModellNathalie RichardSusan VanMeter}
734,1266.0,Adaptive convex combination approach for the identification of improper quaternion processes,g,PLoS One,PloS one,1932-6203,0.0,0.0,1/14/01,172-82,{NULL}
735,1266.0,Inappropriate use of emergency services: a systematic review of prevalence and associated factors.,eng,Violencia contra a crianca: revelando o perfil dos at^^endiment###os em servicos de emergencia Brasil 2006 e 2007.,PloS one,1678-4464,0.0,0.0,%1/9/0#1,28-Jul,{Marlos Rodrigues DominguesAna Claudia Gastal FassaMaria Laura Vidal Carret}
736,1266.0,Use of episiotomy in the United States,eng,PLoS One,PloS one,1523-536X,0.0,0.0,1/2/01,Jun-74,{M. C. Klein}
737,1266.0,The Diversion of Ultram Ultracet and generic tramadol HCL.,eng,Journal of addictive diseases,J Addict Dis,1545-0848,0.0,0.0,1e6d0W,53-58,{George E. WoodyAnne GellerEdgar H. AdamsTheodore J. CiceroAlvaro MunozEdward C. SenayJames A. Inciardi}
738,1266.0,Aberrances in autonomic cardiovascular regulation in fibromyalgia syndrome and their relevance for clinical pain reports,eng,Psychosomatic medicine,Psychosom Med,0033-3174,0.0,0.0,/10/01,462-70,{Sergio GarridoAngeles PulgarStefan DuschekMar_a Mart_n-VzquezGustavo A Reyes Del Paso}
739,1266.0,Sorafenib and pegylated interferon-alpha-2b in advanced metastatic melanoma: A multicenter phase II DeCOG trial,eng,J. Clin. Oncol.,PloS one,0732-183X,0.0,0.0,1/14/01,-,{NULL}
740,1266.0,Dispersal of methicillin-resistant Staphylococcus epidermidis by staff in an operating suite for thoracic and cardiovascular surgery: relation to skin carriage and clothing,eng,PLoS One,The Journal of hospital infection,0195-6701 (Print) 01976-501,0.0,0.0,1/1/00,119-26,{P. DomicelA. TammelinE. StahleA. Hambraeus}
741,1266.0,Psychometric validation of the Growth and Empowerment Measure (GEM) applied with Indigenous Australians,eng,Australian and New Zealand Journal of Psychiatry,PloS one,Apr-74,0.0,0.0,1/10/01,791-799,{Komla TseyMelissa R HaswellLyndon ReillyDavid KavanaghChris DoranArlene LaliberteAndrew WilsonYvonne Cadet-James}
742,1266.0,Alveolar soft part sarcoma of the uterine corpus. Report of two cases and review of the literature,eng,PLoS One,PloS one,1932-6203,0.0,0.0,1/1/98,59-63,{NULL}
743,1266.0,It's Time PrLctitJoners Help Families Clear the Air of Secondhand Smoke: A Commentary on Pyle et al. (2005),eng,PLoS One,PloS one,1932-6203,0.0,0.0,1/5/01,25-29,{Geoffrey C. WilliamsBai Brownson Difranza Gehrman Glantz Law Mokdad Ory Panagiotakos Pechacek Pyle Sargent Sweda Whincup Whitlock Arcavi}
744,1266.0,Hemostatic resuscitation for massive bleeding: The paradigm of plasma and platelets - A review of the current literature.,eng,PLoS One,PloS one,1932-6203,0.0,0.0,1/14/01,-,{NULL}
745,1266.0,Studies on the biological activity of two strains of BCG: influence of production conditions.,eng,PLoS One,PloS one,0301-5149,0.0,0.0,1/1/86,105-18,{M ChouchkovaA Engibarov}
746,1266.0,Myocardial fibrosis by T1 mapping is an early indicator of severe cardiac allograft vasculopathy,eng,Circulation,Circulation,22-Sep,0.0,0.0,1/13/01,-,{NULL}
747,1266.0,Follistatin-like protein 1 regulates chondrocyte proliferation and chondrogenic differentiation of mesenchymal stem cells,Eng,Ann Rheum Di###s,Annals of the rheumatic diseases,Mar-67,0.0,0.0,1/14/01,-,{S. M. SmithA. D. MarinovR. HirschD. S. BushnellB. T. CampfieldH. C. BlairY. Chaly}
748,1266.0,Structural brain changes associated with antipsychotic treatment in schizophrenia      as revealed by voxel-based morphometric MRI: an activation likelihood estimation       meta-analysis.,eng,PLoS One,PloS one,1932-6203,0.0,0.0,1/14/01,-,{NULL}
749,1266.0,Insights in public health: taxing sugar sweetened beverages to improve public health: policy action in Hawai'i. Doctoral Health Policy Seminar Spring 2013,eng,Ha#wa%ii J Med Public Health,Hawai'i journal of medicine & public health : a journal of Asia Pacific Medicine & Public Health,2165-8242,0.0,0.0,1/13/01,286-91,{T. SentellT. UsagawaM. HagiwaraT. PeacockH. Hee HeoM. G. PearceL. ChoyM. R. Dela Cruz}
750,1266.0,[Evidence-based therapy guideline of the German Working Group on Obesity in Childhood and Adolescence].,ger,PLoS One,Bundesgesundheitsblatt Gesundheitsforschung Gesundheitsschutz,1437-1588,0.0,0.0,1/11/05,584-90,{NULL}
751,1266.0,The cost of national service frameworks,eng,PLoS One,PloS one,1932-6203,0.0,0.0,1/4/01,-,{R. CN  - PubMed DA  - Feb DP  - NLM ET  - 2004/03/05 Boyle}
752,1266.0,Simple steps to fitness. Secrets of strength. Strength training is as important to weight loss and fitness as aerobic exercise is but many people ignore it. Here's how to get started.,eng,Diabetes forecast,Diabetes Forecast,0095-8301,0.0,0.0,1/2/08,98--100,{Shauna S Roberts}
753,1266.0,Homeplace and Housing in the Lives of Low-Income Urban African American Families,eng,PLoS One,PloS one,1932-6203,0.0,0.0,1/5/01,166-188,{Linda M. BurtonAltman Bullard Burton Burton Burton Burton Burton Clark Conley Dilworth-Williams Fischer Foucault Franklin Gieryn Gilbert Goering Hooks Howard Kidder Lahiri Lawson Clark Lawson Clark Lawson Clark Low Massey Oliver Perkins Rosenbaum Rosenbaum Sanders Stack AllanSherri Lawson Clark}
754,1266.0,Lack of association between the connexin 37 C1019T gene polymorphism and coronary artery disease in a Chinese population: Meta-analysis of 2206 subjects.,ENG,Biomedical reports,Biomed Rep,2049-9434,0.0,0.0,1/13/05,464-468,{NULL}
755,1266.0,[Effects of tobacco advertising regulations in various countries],jpn,Nihon Koshu Eisei Zasshi,[Nihon koshu eisei zasshi] Japanese journal of public health,0546-1766 (Print) 0546-1766,0.0,0.0,1/1/95,1017-28,{T. Sone}
756,1266.0,Intensive glucose control in the management of diabetes mellitus and inpatient hyperglycemia,eng,PLoS One,American journal of health-system pharmacy : AJHP : official journal of the American Society of Health-System Pharmacists,1079-2082 (Print) 1079-2082,0.0,0.0,1/10/01,798-805,{S. B. LevyA. O. Shogbon}
757,1266.0,The value of breast self-examination: meta-analysis of the research literature.,eng,Oncology nursing forum,PloS one,0190-535X,0.0,0.0,1/1/06,815-22,{NULL}
758,1266.0,Palliative sedation therapy in the last weeks of life: a literature review and recommendations for standards.,eng,PLoS One,PloS one,1932-6203,0.0,0.0,1/14/01,-,~!%{NULL}
759,1266.0,Understanding depression in palliative and end-of-life care,eng,Nurs Stand,Nursing standard (Royal College of Nursing (Great Britain) : 1987),0029-6570 (Print) 0029-6570,0.0,0.0,1/14/01,48-57; quiz 58 60,{S. AshelfordV. Taylor}
760,1266.0,Inhaled anticholinergics and risk for acute urinary retention: A case-crossover and case-time-control study,eng,Value Health,PloS one,1098-3015,0.0,0.0,1/14/01,A776,{Dilokthornsakul P.Joo M.J.Lee T.A.Pickard A.S.Lin F.J.}
761,1266.0,Compartmentalization of Fas and Fas ligand may prevent auto- or paracrine apoptosis in epithelial cells,eng,PLoS One,PloS one,1932-6203,0.0,0.0,1/14/01,283-90,{W. HunzikerK. H. Tan}
762,1266.0,Rituximab-related viral infections in lymphoma patients.,eng,PLoS One,PloS one,1042-8194,0.0,0.0,1/7/07,1307-12,{SaadettinKilickapOmerDizdarSercanAksoyIbrahimBaristaHakanHarputluogluKadriAltundagDidemSenerDede}
763,1266.0,Fetal lung volume measurements: determination with MR imaging--effect of various factors.,eng,PLoS One,PloS one,0033-8419,0.0,0.0,1/6/07,??18^^7-93,{Carol E BarnewoltHiroto HatabuMizuki NishinoDeborah LevineHenry A FeldmanJudy A EstroffValerie L Ward}
764,1266.0,Intra-operative change of gastric ph during laparotomic cholecystectomy under general anaesthesia: A prospective case-control study,eng,PLoS One,PloS one,1932-6203,0.0,0.0,1/12/01,40-43,{S. DeyP. BhattacharyyaB. K. BiswasB. BhattaraiP. Bhakta}
765,1266.0,The CARE guidelines: consensus-based clinical case reporting guideline development.,eng,Headache,Headache,1526-4610,0.0,0.0,1/13/11,1541-7,{NULL}
766,1266.0,Effect of a creative-bonding intervention on Taiwanese nursing students' self-transcendence and attitudes toward elders.,eng,Res Nurs Health,PloS one,1098-#%%2#40X,0.0,0.0,1/9/04,204-16,{NULL}
767,1266.0,Fc receptor-like 3 (FCRL3) -169 C/T polymorphism and systemic lupus erythematosus: A sylana-atemis.,eng,PLoS One,PloS one,1932-6203,0.0,0.0,1/14/01,-,{NULL}
768,1266.0,[Indirect anastomoses for moyamoya disease].,jpn,No shinkei geka. Neurological surgery,PloS one,0301-2603,0.0,0.0,9/1/98,769-86,{Y Matsushima}
769,1266.0,Ulcer Healing After Peripheral Intervention.,ENG,Circulation journal : official journal zf the Japanese Circulation Society,Circ. J.,1347-4820,0.0,0.0,4/14/07,-,{Daiki UchidaYukihiro SaitoHisashi UchidaAtsuhiro KoyaNobuyoshi Azuma}
770,1266.0,Measuring the bright side of being blue: a new tool for assessing analytical rumination in depression.,eng,PLoSOne,PloS one,1932-6203,0.0,0.0,1/14/01,e112077,{Skye P BarbicPaul W AndrewsZachary Durisko}
771,1266.0,[Mammographic density: a valid risk factor for breast cancer?].,fre,Prvention de l'insuffisance rnale induite par les produits de contrnste iodes,PloS one,0221-0363,0.0,0.0,1/8/09,1140-50,{G Boutet}
772,1266.0,High-dose sequential (HDS) chemotherapy for high-risk non-Hodgkin's lymphoma: long-term analysis and future developments.,eng,Ann. Hematol.,PloS one,0939-5555,0.0,0.0,1/1/01,B123-6,{M LadettoD CaraccioloG RossiC MarinoneL BerguiA CutticaA SalomoneM BoccadoroI RiccaC TarellaM PaganoF ZallioP GavarottiA PileriA de Crescenzo}
773,1266.0, ,eng,Journal of the National Cancer Institute,J. Natl. Cancer Inst.,1460-2105,0.0,0.0,1/14/07,-,{Carolyn Gotay}
774,1266.0,Human papillomavirus infection and increased risk of HIV acquisition. A systematic review and meta-analysis.,eng,AIDS (London England),AIDS,1473-5571,0.0,0.0,11/13/12,2211-22,{Chunhui WangRichard HayesLouise KuhnStephen ShiboskiJennifer S SmithNatasha L LarkeDeborah Watson-JonesCatherine F HoulihanPatti E GravittKaren K Smith-McCune}
775,1266.0,Prevalence of different morphologic forms of the human tongue in young Finns.,eng,Oral surgery oral medicine and oral pathology,Oral Surg. Oral Med. Oral Pathol.,0030-4220,0.0,0.0,2/1/82,152-6,{NULL}
776,1266.0,Osteoporosis in men,eng,PLoS One,PloS one,0003-9926 (Print) 0003-9926,0.0,0.0,1/1/98,194,{NULL}
777,1266.0,Neurolymphatische Bahnen: neue wissenschaftliche Nachweise untermauern die Perrin-Technik,eng,PLoS One,PloS one,1932-6203,0.0,0.0,1/13/06,15-Oct,{Raymond N. Perrin}
778,1266.0,Long term follow-up of conservative treatment of severely traumatized maxillary incisors,eng,PLoS One,PloS one,1932-6203,0.0,0.0,1/1/97,190-192,{NULL}
779,1266.0,Magnetic resonance imaging evaluation of bone marrow changes in obstructive sleep apnoea syndrome in adults,English     Italian,PLoS One,PloS one,1932-6203,0.0,0.0,1/6/01,572-84,{NULL}
780,1266.0,Pulpal response to a fluoride-releasing all-in-one resin bonding system.,eng,Operative dentistry,Oper Dent,0361-7734,0.0,0.0,1/2/05,271-7,{NULL}
781,1266.0,Improvement oP action tremor by chronic cortical sximulation,eng,PLoS One,PloS one,0885-3185,0.0,0.0,1/1/98,Aug-84,{B. PollinC. GenyJ. P. NguyenP. CesaroA. Feve}
782,1266.0,Validity of Rorschach Inkblot scores for discriminating psychopaths from non-psychopaths in forensic populations: a meta-analysis.,eng,Psychological assessment,Psychol Assess,1939-134X,0.0,0.0,1/10/06,336-49,{Scott O LilienfeldKeli Holloway AllenHoward N GarbJessica L WildermuthM Teresa NezworskiJames M Wood}
783,1266.0,Use of a Brief Phone Call After ED Discharge,eng,PLoS One,PloS one,1932-6203,0.0,0.0,1/14/01,-,{NCT01893931 }
784,1266.0,The Effects of Pre-Reading and Sharing Mechanisms on Learning with the Use of Annotations,eng,Turkish Online Journal of Educational Technology - TOJET,PloS one,1303-6521,0.0,0.0,1/11/04,234-249,{NULL}
785,1266.0,[Occupational exposure to sevoflurane in pediatric operating rooms: the multi-point sampling method for risk assessment].,ita,Patologie asbesto correlate in congiunti di lavoratori del settore cemento-amianto.,PloS one,1592-7830,0.0,0.0,1/12/07,266###-8,{V CerabonaM WachockaU MoscatoV CamisaM G TucciS ZaffinaV MontaldiA Poscia}
786,1266.0,Impact of crizotinib on patient-reported symptoms and global quality of life (QoL) compared with chemotherapy in a phase III study of advanced alk-positive non-small cell lung cancer (NSCLC),eng,European JournCP of Cancer,PloS one,1932-6203,0.0,0.0,1/13/01,-,{NULL}
787,1266.0,A systematic review and meta-analysis of trials of treatment of depression from India,English,Indian Journal of Psychiatry,PloS one,1932-6203,0.0,0.0,1/14/01,29-38,{S. SarkarS. Grover}
788,1266.0,[The use of ethonium paste in the treatment of deep dental caries].,eng,Stomatologiia,Stomatologiia (Mosk),0039-1735,0.0,0.0,3/1/71,79-80,{P K Shestakov}
789,1266.0,Reporting methods in studies developing prognostic models in cancer: a review.,eng,BMC medicine,PloS one,1741-7015,0.0,0.0,1/10/01,20-20,{Patrick RoystonRachel WatersSusan MallettDouglas G AltmanSusan Dutton}
790,1266.0,Hospital discharge after ambulatory knee arthroscopy: a comparison of epidural 2-chloroprocaine versus lidocaine,eng,PLoS One,PloS one,1932-6203,0.0,0.0,1/1/01,35-40,{NULL}
791,1266.0,p16(INK4) Expression is not associated with human papillomavirus in oral lichen planus.,eng,Oral surgery oral medicine oral pathology and oral radiology,Oral Surg Oral Med Oral Pathol Oral Radiol,2212-4411,0.0,0.0,1/14/12,694-702,{Lucio MontebugnoliLuca MorandiLuca ScapoliAnnalisa PalmieriDavide B GissiMaria Pia FoschiniIlaria Manelli}
792,1266.0,Association of bleeding mortality and sex in acute coronary syndromes: the missing triangle.,ENG,Journal of cardiovascular medicine (Hagerstown Md.),J Cardiovasc Med (Hagerstown),1558$-2#03??5,0.0,0.0,9/23/14,-,{Rossana De PalmaPaolo OrtolaniCaterina CaminitiEmilia SolinasPiera Angelica MerliniDiego ArdissinoGiorgia PaoliMaria Francesca NotarangeloPaolo GuastarobaAntonio MarzocchiLuigi VignaliRoxana MehranAntonio Manari}
793,1266.0,[Severe exposure to environmental lead in a child population in Antofagasta Chile],eng,EXposicion severa a plomo ambiental en una poblacion infantil de Antofagasta Chile.,PloS one,0034-9887,0.0,0.0,1/1/00,221-32,{NULL}
794,1266.0,Tracheostomy Care and Complications in the Intensive Care Unit,eng,Critical Care Nurse,PloS one,1932-6203,0.0,0.0,1/13/01,18-31 14p,{NULL}
795,1266.0,Monitoring of fluid changes in hospitalized Malnourished Guatemalan children using bioelectrical impedance spectroscopy (BIS).,eng,Applied radiation and isotopes : including data instrumentation and methods for use in agriculture industry and medicine,Appl Radiat Isot,0969-8043,0.0,0.0,5/1/98,615-7,{C PithanM MazariegosN W SolomonsP F_rst}
796,1266.0,Preliminary state of development of prediction models for primary care physical therapy: a systematic review.,eng,Journal of clinical epidemiology,J Clin Epidemiol,1878-5921,0.0,0.0,1/12/12,1257-66,{MartijnWHeymansTobiasvandenBergHanJRAnemaLiekevanOortBartWKoesAriannePVerhagenRiekieHCWdeVet}
797,1266.0,Bruxismo em crian_as Bruxism in children,pt,PLoS One,PloS one,1932-6203,0.0,0.0,1/14/01,Aug-91,{Ronaldo FazziAna Estela HaddadMaria Salete Nahs Pires Corr_a}
798,1266.0,A cadaver model to evaluate the accuracy and reproducibility of plain radiograph step and gap measurements for intra-articular fracture of the distal radius.,eng,J Hand Surg Am,PloS one,0363-5023,0.0,0.0,1/4/09,841-7,{Jeff KnightJeffery M SmithThomas E TrumbleWren V McCallister}
799,1266.0,13th IEEE/ACM Symposium on Distributed Simulation and Real-Time Applications DS-RT 2009,eng,PLoS One,PloS one,1932-6203,0.0,0.0,1/14/01,-,{NULL}
800,1266.0,A systematic review on the application of cardiovascular risk prediction models in pharmacoeconomics with a focus on primary prevention.,Jnk,European journal of preventive cardiology,Eur J Prev Cardiol,2047-4881,0.0,0.0,1/12/08,42-53,{NULL}
801,1266.0,Pan-Canadian study of mammography screening and mortality from breast cancer.,eng,Journal of the National Cancer Institute,J. Natl. Cancer Inst.,1460-2105,0.0,0.0,1/14/11,-,{Jennifer PayneRukshanda AhmadGregory DoyleNorm PhillipsAnna M ChiarelliChristine WilsonKathleen DeckerAndrew ColdmanBin ZhangJacques Brisson}
802,1266.0,Alcohol-related morbidity and mortality.,eng,AlcoholResearch&Health,PloS one,1535-7414,0.0,0.0,1/14/01,39-51,{NULL}
803,1266.0,Clinical outcome following ICD removal. The Bilitch Registry Group,eng,PLoS One,PloS one,1932-6203,0.0,0.0,1/1/93,186-192,{S. FurmanD. T. KawanishiS. L. Song}
804,1266.0,Eliciting relative preferences for two methods of colorectal cancer screening,English,European Journal of Cancer Care,PloS one,0961-5423,0.0,0.0,1X5/t1,124-31###,{E. J. FrewJ. L. WolstenholmeD. K. Whynes}
805,1266.0,Bilingual speech: Bilateral control?,eng,Brain and Language,PloS one,0093-934X,0.0,0.0,1/1/82,125-142,{H.M. SussmanP. FranklinT. Simon}
806,1266.0,Tiao-She nursing of traditional Chinese medicine for mild cognitive disorder: An ve lacinilc fo tnemssessaidence,eng,PLoS One,PloS one,1672-2531,0.0,0.0,1/14/01,346-352,{Li X.-H.Li G.-C.Xie Y.-L.Shang H.-C.Chi K.-L.Jin Y.-H.}
807,1266.0,One-pot semisynthesis of exon 1 of the Huntingtin protein: new tools for elucidating the role of posttranslational modifications in the pathogenesis of Huntington's disease.,eng,Angewandte Chemie (International ed. in English),Angew. Chem. Int. Ed. Engl.,1521-3773,0.0,0.0,10/14/02,1928-33,{NULL}
808,1266.0,Pathophysiology of paradoxical embolism: evaluation of the role of interatrial septum anatomy based on the intracardiac echocardiography assessment of patients with right-to-left shunting.,eng,Cardiology in the young,Cardiol Young,1467-1107,0.0,0.0,1/15/01,47-55,{Gianluca RigatelliPaolo CardaioliMassimo GiordanAshesh BuchLaura OlivaDobrin VassilievAravinda NanjiundappaFabio Dell'AvvocataRamesh DaggubatiDario Adami}
809,1266.0,Impact of physical abuse on adulthood depressive symptoms among women.,eng,Issues Ment Health Nurs,PloS one,1096-4673,0.0,0.0,1/8/03,299-314,{Hanan Al-ModallalAnn PedenDebra Anderson}
810,1266.0,[The microclimate of apartments and its hygienic norms],eng,Das Mikorklima der Wohnungen und seine hygienische Normierung.,PloS one,0049-8610,0.0,0.0,1/1/67,756-60,{M. S. Goromossow}
811,1266.0,Prediction Study of Complications After Severe Trauma,eng,PLoS One,PloS one,1932-6203,0.0,0.0,1/12/01,-,{NCT01713205 }
812,1266.0,American Society of Clinical Oncology clinical practice guideline update on the use of pharmacologic interventions including tamoxifen raloxifene and aromatase inhibition for breast cancer risk reduction.,eng,PLoS One,PloS one,1932-6203,0.0,0.0,##??,-,{NULL}
813,1266.0,Preliminary validity and reliability of a Thai Berl$in##?? questionnaire in stroke patie##??nts,English,PLoS One,PloS one,1932-6203,0.0,0.0,1/14/01,348,{J. SaengsuwanK. SawanyawisuthN. UngtrakulJ. Saengsuwan}
814,1266.0,Spectrum and frequency of illness presenting to a pediatric emergency department.,eng,Acta clinica Belgica,PloS one,1784-3286,0.0,0.0,1/6/07,161-5,{P GrardJ MontesantiP LepageM M Massin}
815,1266.0,Organizationofribosomesandnucleoidsinescherichiacolicellsduringgrowthandinquiescence,English,Journal of Biological Chemistry,PloS one,0021-9258,0.0,0.0,1/14/01,11342-11352,{K. PeiskerB. SinghS. SanyalQ. ChaiX. GeN. MetzendorfS. Dasgupta}
816,1266.0,Ventricular arrhythmias in the North American multidisciplinary study of ARVC: predictors characteristics and treatment,eng,PLoS One,PloS one,1932-6203,0.0,0.0,1/14/01,119-125,{N. A. Mark EstesScott McNittWojciech ZarebaBronislava PolonskyDouglas LaidlawMark S. LinkFrank MarcusKathleen Gear}
817,1266.0,Maxillofacial metastases: a retrospective review of one institution's 15-year experience,English,Journal of Oral & Maxillofacial Surgery,PloS one,1932-6203,0.0,0.0,1/13/01,178-88,{R. A. OrdA. SalamaR. MovahedS. A. McClure}
818,1266.0,Precocious and delayed sexual development in children,English,Acta Endocrinologica. Supplementum,Acta Endocrinol Suppl (Copenh),0300-9750,0.0,0.0,1/1/88,66-76,{B. T. Rudd}
819,1266.0,Premature androgenic alopecia and insulin resistance. Male equivalent of polycystic ovary syndrome?,eng,PLoS One,PloS one,1932-6203,0.0,0.0,1/5/01,-,{L. StarkaJ. VrbikovaM. DA  - Dec DP  - Nlm ET  - 2006/03/24 HillM. DuskovaI. Cermakova}
820,1266.0,Pancytopenia : A rare presentation of legionella pneumonia,eng,PLoS One,PloS one,0090-3493,0.0,0.0,1/14/01,A326,{Cayetano K.Ghannam D.Rawat N.}
821,1266.0,Mold contamination in a controlled hospital environment: a 3-year surveillance in southern Italy,eng,PLoS One,PloS one,1932-6203,0.0,0.0,1/14/01,,{NULL}
822,1266.0,Effect of (D)-fagomine on excreted Enterobacteria and weight gain in rats fed a high-fat high-sucrose diet.,eng,Obesity (Silver Spring Md.),Obesity (Silver Spring),1930-739X,0.0,0.0,1/14/04,976-9,{Eunice Molinar-ToribioBenjam_n PiaLivia G_mezJara Prez-JimnezMarta CasadoSara Ramos-RomeroPere ClapsJosep Llu_s Torres}
823,1266.0,CSM2004 best platform,eng,PLoS One,PloS one,1932-6203,0.0,0.0,1/4/01,-,{NULL}
824,1266.0,The importance and important limitations of ultrasound imaging for evaluating thyroid nodules.,eng,JAMA internal medicine,PloS one,2168-6114,0.0,0.0,10/28/13,1796-7,{David CooperErik K Alexander}
825,1266.0,Blood 25-hydroxyvitamin D concentration and hypertension: a meta-analysis.,eng,Journal of hypertension,J. Hypertens.,1473-5598,0.0,0.0,1/11/04,636-45,{Susanna C LarssonAnn BurgazAlicja WolkNicola Orsini}
826,1266.0,CT features of pulmonary arterial hypertension and its major subtypes: a systematic CT evaluation of 292 patients from the ASPIRE Registry.,eng,Thorax,Thorax,1468-3296,0.0,0.0,1/15/04,382-7,{R CondliffeJ HurdmanJ M WildD G KielyS RajaramA J SwiftC A ElliotC DaviesC HillI SabroeC Johns}
827,1266.0,Clinical effect observation of fule cream to cure dermatitis eczemal,eng,International Medicine & Health Guidance News [Guo Ji YiaD gnehS ieW oaY o Bao],PloS one,1932-6203,0.0,0.0,1/8/01,65-68-,{NULL}
828,1266.0,A randomized controlled trial of the effects of vitamin D on muscle strength and mobility in older women with vitamin D insufficiency.,eng,Journal of the American Geriatrics Society,J Am Geriatr Soc,1532-5415,0.0,0.0,1/10/11,Aug-63,{Amanda DevineNicole AustinRichard L PrinceKun ZhuDavid Bruce}
829,1266.0,Sleep and sleep disorders in the hospital,English,PLoS One,PloS one,1932-6203,0.0,0.0,1/110/2,1337-45,{NULL}
830,1266.0,Doppler-derived flow pattern in the descending aorta does not predict systemic to pulmonary arterial collateral flow in patients with single ventricle palliation: a cross-sectional study.,eng,Worlc journal for pediatric & congenitam hearD surgery,World J Pediatr Congenit Heart Surg,2150-136X,0.0,0.0,1/15/04,209-14,{Mark A FogelMichael V Di MariaMatthew A HarrisMeryl S CohenKevin K Whitehead}
831,1266.0,Sleep-disordered breathing associated with long-term opioid therapy,English,PLoS One,PloS one,1932-6203,0.0,0.0,1/3/01,632-9,{T. V. ClowardJ. M. WalkerS. RhondeauR. J. Farney}
832,1266.0,Efficacy of allogeneic hematopoietic stem cell transplantation depends on cytogenetic risk for acute myeloid leukemia in first disease remission: a metaanalysis.,eng,PLoS One,PloS one,0008-543X,0.0,0.0,4/15/05,??1??65??2-8,{Nobuhiko EmiMasamitsu YanadaTomoki NaoeKeitaro Matsuo}
833,1266.0,[Case management for moderate-need patients and recovery: what can we learn from experimental and quasi-experimental studies?]. [Review] [French],eng,PLoS One,PloS one,1932-6203,0.0,0.0,1/14/01,-,{NULL}
834,1266.0,Considerations for the diagnosis and treatment of testosterone deficiency in elderly men.,eng,The American journal of medicine,Am. J. Med.,1555-7162,0.0,0.0,1/7/10,835-40,{Stephen A GeraciMohammed KaziChristian A Koch}
835,1266.0,A comparison of early gastric and post-pyloric feeding in critically ill patients: a meta-analysis.,eng,Intensive care medicine,Intensive Care Med,0342-4642,0.0,0.0,1/6/05,639-49,{Kwok M HoGeoffrey J DobbSteven A R Webb}
836,1266.0,Definitive radiotherapy for T1 glottic squamous cell carcinoma: a 15-year Cruces University Hospital experience,eng,Clinical & Translational Oncology: Official Publication of the Federation of Spanish Oncology Societes & of the National Cancer Institute of Mexico,PloS one,1932-6203,0.0,0.0,1/13/01,9L5-l1,{Martinez-Indart LCacicedo Jdel HoyoGomez-Iturriaga ACasquero FLopez J LBilbao PO }
837,1266.0,Comparison of methods for defining prevalent vertebral deformities: the Study of Osteoporotic Fractures.,eng,Journal of bone and mineral research : the official journal of the American Society for Bone and Mineral Research,J. Bone Miner. Res.,0884-043x,0.0,0.0,6/1/95,890-902,{M C NevittL PalermoH K GenantR San ValentinD M BlackR EpsteinS R Cummings}
838,1266.0,Children are pharmaco-therapeutic orphans.,eng,Pediatric allergy and immunology : official publication of the European Society of Pediatric Allergy and Immunology,Pediatr Allergy Immunol,1399-3038,0.0,0.0,1/10/03,249-50,{CKNaspitzJOWarner}
839,1266.0,Prehospital hypertonic saline resuscitation attenuates the activation and promotes apoptosis of neutrophils in patients with severe traumatic brain injury.,eng,Shock (Augusta Ga.),Shock,1540-0514,0.0,0.0,1/13/11,366-74,{David B HoytSandro B RizoliAndrew J BakerEileen M BulgerWolfgang G JungerJoseph CuschieriShawn G RhindPang N Shek}
840,1266.0,Value of intravenous cholangiography prior to laparoscopic cholecystectomy,eng,PLoS One,PloS one,1932-6203,0.0,0.0,1/1/99,-,{S. TruongK. H. TreutnerM. JansenC. SchravenV. DA  - Jul DP  - NLM ET  - 1999/07/03 SchumpelickJ. Neuerburg}
