ID,id,article_title,article_language,journal_title,jounral_abbreviation,journal_issn,article_jvolumn,article_jissue,article_jcreated_at,article_pagination,author_list
416,nan,Phase angle for prognostication of survival in patients with advanced cancer: Preliminary findings.,eng,Cancer,nan,109$7-0142,633.0,81.8906602417756,7/15/14,2207-14,{Gary ChisholmEduardo BrueraSwati BansalDavid HuiRony DevMargarita Mor@@gado}
417,29,Safety and efficacy of weekly nab_-paclitaxel in combination with carboplatin as first-line therapy in elderly patients with advanced non-small-cell lung cancer.,eng,Annals of oncology : official journal of the European Society for Medical Oncology / ESMO,Ann Oncol,1569-8041,24,9.353124164194575,1/13/02,314-21,{C J LangerJ OrsiniJ K HonS R DakhilM F RenschlerR D PageV HirshH ZhangI OkamotoM A Socinski}
418,475847,,eng,PALLIATIVE MED.,nan,0269-2163,13,2,3/1/99,Mar-91$,{J M Teno}
419,893664,Role of N-acetylcysteine in prevention of contrast-induced nephropathy after cardiovascular pro$cedures: a meta-analysis,eng,Clinical cardiology,C??lin Card$iol,0160-9289,93,11,1/4/01,607-10,{Deepika and Leibowitz Keith and Gowda Ramesh M. and Shapiro Michael and Khan Ijaz A. Misra}
420,15,Impact of hepatitis C on survival in dialysis patients: A link with cardiovascular mortality?.,nan,nan,nan,nan,0,0,nan,nan,{NULL}
421,838034,Clinical course of neuropathologically confirmed frontal-variant Alzheimer's disease,nan,Nature Clinical Practice Neurology,nan,1745-834X     17??45-8358,4,4,1/8/01,226-232,{A.U. MonschM. TolnayK.I. TaylorA. ProbstA.R. Miserez}
422,59036,Smoking and oral cancer.,nan,Journal of dental research,J??$. Dent. Res.,0022-0345,42,-1,1/1/63,328-39,{J J SALLEY}
423,274083,Risk profiles among adolescent nonmedical opioid users in the United States,nan,Addictive Behaviors,Addict.Behav.,0306-4603,37,8,1/12/01,974-7,{B. E. PerronQ. FuL. T. WuM. G. Vaughn}
424,784224,Prolonged early antibiotic use and bronchopulmonary dysplasia in very low birth weight infants,nan,Am J Perina$tol,American journal of perinatology,0735-1631,32,1,#1/1$5/01,Aug-43,{D. A. PaulR. G. LockeL. SaimanD. TuttleA. NovitskyA. Mackley}
425,260769,Practicability and ??patients' subjective experiences of low-dose spinal anaesthesia using hyperbaric bupivacaine for transanal surgery,nan,nan,nan,nan,24,0,1/9/01,827-??836,{M. D. SchmittnerA. JankeD. G. BussenG. C. BeckC. Weiss}
426,592831,Discontinuing penicillin prophylaxis in children with sickle cell anemia. Prophylactic Penicillin Study II,nan,4.51390102343189,nan,nan,127,5,1/1/95,685-90,{R. V. IyerG. M. WoodsE. VichinskyT. R. KinneyJ. I. VerterS. T. MillerC. T. HolbrookC. H. PegelowJ. M. FallettaG. R. Buchanan}
427,464911,Dose optimization of infliximab in patients with rheumatoid arthritis.,nan,nan,nan,nan,0,0,nan,nan,{NULL}
428,369162,[Autologous stem cell therapy with surgical myocardial revascularization].,eng,Anadolu kardiyoloji dergisi : AKD = the Anat$olian journal of cardiology#,Anadolu Kardiyol Derg,1%308-0032,44.44651037855216,6,1/9/12,465-6,{Serkan DurduAhmet R__han AkarG_nseli Cubuk_uolu #Deniz}
429,209896,THE BR$ITISH MEDICAL ASSOCIATION.: SEVENTY-EIGHTH ANNUAL MEETING IN LONDON,nan,The Lancet,nan,nan,0,0,8/13/10,nan,{NULL}
430,nan,Reproduction of excursive tooth contact in an articulator with computerized axiography data,English,nan,nan,nan,78,4,1/1/97,373-378,{K. TamakiA. G. C_larS. BeyrerH. Aoki}
431,694007,A conservative treatment protocol of acute lumbosacral radiculopathy syndrome for general practitioner and physical therapist [Dutch],eng,nan,nan,0377-208X,85.82015615953196,1,1/1/00,5-Feb,{R F $CastienJ van Wagenb@@erg}
432,53319,Intraoperative stability testing of lateral-entry pin fixation of pediatric supracondylar humeral fractures,eng,nan,nan,nan,27,25.089580696935407,1/7/01,695-702,{N. SmithB. MilneM. ZeniosM. RamachandranD. Little}
433,962338,Myocardial scar differences between polymorphic and monomorphic ventricular events in ischemic cardiomyopathy: A contrast-enhanced magnetic resonance imaging,nan,Eur#opean Heart Jour@@nal,nan,nan,32,,1/11/01,94-95,{W. RottbauerV. HombachS. StillerP. BernhardtD. Walcher}
434,33,Genetic and phenotypic determinants of blood pressure and other cardiovascular risk factors (GAPP),English,Swiss Medical Weekly,nan,nan,143,0,1/13/01,nan,{W. FrehnerS. AeschbacherL. RischT. SchonM. RischG. PareD. Conen}
435,587024,gamma-tocopherol the major form of vitamin E in the US diet deserves more attention,eng$,Am J Clin $Nutr,The American journal of clinical nutrition,nan,74,6,1/1/01,714-22,{S. ChristenQ. JiangB. N. AmesM. K. Shigenaga}
436,49274,Randomized double-blind placebo-controlled trial of the 5-HT1A receptor antagonist AZD7371 tartrate monohydrate (robalzotan tartrate monohydrate) in patients with irritable bowel syndrome,eng,nan,nan,nan,404.4,0,1/%8/01$,2562-9 ST  - Randomized double-blind placebo-controlled trial of the 5-HT1A receptor antagonist AZD7371 tartrate monohydrate (robalzotan tartrate monohydrate) in patients with irritable bowel syndrome-,{J. NaesdalM. DanilewitzJ. AdlerD. G. DA  - Oct DO  - 10.1111/j.1572-0241.2008.02115.x DP  - NLM ET  - 2008/09/09 SilbergC. HwangD. A. Drossman}
437,687404,The impact of orthodontic treatment on the quality of life a systematic review.,eng,BMC Oral Health,BMC oral health,1472-6831,14,1,1/14/01,66,{Yi WangYu ZhouRongDang HuXiuYing WangGerald Volire}
438,858569,Phenotypic analysis of misato function reveals roles of noncentrosomal microtubules in Drosophila spindle formation,English,JOURNAL OF CELL SCIENCE,J Cell Sci,0021-9533,690.3,0,1/11/01,706-17,{M. GattiS. BonaccorsiV. Mottier-PavieF. VerniG. Cenci}
439,982590,Cost implications fo@@r missed malnutrition diagnoses in patients hospitalised with an exacerbation of chronic obstructive pulmonary disease (COPD),nan,Respirology,nan,nan,20,0,1/15/01,nan,{I. YangJ. StonestreetP. CollinsP. Masel}
440,853882,Effective combination chemotherapy with paclitaxel and cisplatin with or without human granulocyte colony-stimulating factor and/or erythropoietin in patients with advanced gastric cancer.,eng,BR. J. CANCER,nan,0007-0920,86,12,,1858-63,{M RadererC GedlickaA LenauerD DepischW ScheithauerB SchneeweissW FiebigerF LangG V KornekB Sch_ll}
441,743989,A case of delirium triggered by sub-clinical seizures,nan,J. Am. Geriatr. Soc.,nan,14-Feb,63,0,,%S223,{Ahmad A.S.}
442,nan,Intra-mandibular adenoid cystic carcinoma.,eng,Revue de stomatologie de chirurgie maxillo-faciale et de chirurgie orale,Rev Stomatol Chir Maxillofac Chir Orale,2213-6541,115,2,1/14/04,nan,{N ZwetyengaA BouaichiS Aimad-EddineB EllaX-A Mommers}
443,111970,,eng,Journal of cardiovascular medicine (Hagerstown Md.),J Cardiovasc Med (Hag%erstown),nan,85.9421163864696,6,1/14/06,447-55,{Branislava IvanovicMarijana Tadic}
444,nan,Personality profile and exercise dependence,nan,nan,nan,1592-1107,13,3,1/7/01,400-405,{A. StumpoG. PalmieriM. F. PantusaM. MarascoV. Fuoco}
445,397190,Say yes? Say no?,nan,Consumer Reports on Health,nan,1058-0832,19,0,1$/7/01,3-Mar,{NULL}
446,98562,Prevalence of Masked Hypertension in African Americans.,ENG,Journal of clinical hypertension (Greenw??ich %Conn.),J Clin Hypertens (Greenwich),1751-7176,-1,,10/20/14,nan,{Frances WilliamsAlehegn GelayeSusan SteigerwaltYara DaloulHadeel AssadTimothy R LarsenBarryton WaanbahMichael Williams}
447,56014,Differences of inter-tract correlations between neonates and children around puberty: a study based on microstructural measurements with DTI.,eng,Frontiers in human neuroscience,Front Hum Neurosci,nan,7,-1,1/13/01,721,{Gaolang GongHua ChengYong HeQi DongHao HuangVirendra Mishra}
448,nan,Electrocardiogram QRS detection using multiscale filtering based on mathematical morphology,English,Conference proceedings : ... Annual International Conference of the IEEE Engineering in Medicine and Biology Society. IEEE Engineering in Medicine and Biology Society. Conference,nan,1557-170X,2007.0,0,1/7/@??@01,3196-3#199,{Department of Electric@@al F. ZhangElectrical Department ofNational Computer EngineeringSingapore Email elezf nus edu sg University of SingaporeSingapore National University of SingaporeF. ZhangEngineering ComputerAddress Correspond$enceY. LianAddresses Author}
449,565528,Barriers and facilitators to implementing electronic prescription: a systematic review of user groups' perceptions.,eng,Journal of the American Medical Informatics Association : JAMIA,J Am Med Inform Assoc,1527-974X,88.8262659454361,3,1/14/05%,535-41,{Marie-Pierre GagnonClaude Sicotte_dith-Romy NsangouSonya GrenierJulie Payne-Gagnon}
450,951143,Cystic fibrosis: cost of illness and considerations for the economic evaluation of potential therapies,eng,Pharmacoeconomics,nan,nan,21,14,1/3/01,1001-24,{T. WelteR. BusseN. JalilvandC. Krauth}
451,658707,Working memory short-term memory and reading disabilities: a selective meta-analysis of the literature.,eng,Journal of learning disabilities,J Learn Disabil,0022-2194,42,3,1/9/05,260-87,{H Lee Swanson[Collective Name] Xinhua ZhengOlga Jerman}
452,84905,Hypothalamic obesity i%n children.,eng,@@Obesity reviews : an official journal of the International Association for the Study of Obesity,Obes Rev,nan,13,30.232790645872623,,780-98,{A BereketZ HochbergY YavuzH L MullerR H LustigR WeissW KiessA P Goldstone}
453,891370,Health ??literacy diabetes self-care and glycemic control in adults with type 2 diabetes,eng,Diabetes technology & therapeutics,Diabetes Technol. Ther.,1520-9156,12,,1/10/01,913-9,{Chandra Y. and Bains Sujeev S. and Egede Leonard E. Osborn}
454,697286,Central corneal melting associated with reformulated generic diclofenac in a patient with inferior fornix foreshortening.,eng,Ophthalmology and eye diseases,Ophthalmol Eye Dis,1179-1721,3,0,1/11/01,21-24,{Cameron Campbell Johnson}
455,819701,,English,Indian Journal of Physiology and Pharmacology,nan,0019-5499,48,1,1/4/01,31-40,{M.B. DikshitS. RajeD.S. JajuV.R. Purandare}
456,855099,[The use of intravascular nitinol stents in the treatment of subclavian vein compression for thoracic outlet syndrome].,pol,Nowoczesne biomateria_y jako opatrunki hemostatyczne w chirurgii oszczedzajacej miazsz nerki--model zwi#erzecy. Doniesienie wstepne.,nan,0370-0747,37,2,1/7/01,May-51,{Przemys_aw P SzyberArtur Pup#kaPiotr SzyberJerzy Garcarek}
457,64755,Primary head and neck cancers in North -Western Nigeria,eng,nan,nan,nan,28,4,1/9/01,22??7-33,{P. H. JalloE. C. OtohA. MohammedS. O. AjikeN. W. JohnsonI. S. Danfill??o}
458,226966,Vaginal incisional wound healing in a rabbit menopause model: a histologic analysis.,nan,International urogynecology journal,Int Urogynecol J,1433-3023,13.14081060370908,12,1/12/12,1763-9??,{Roger P GoldbergYoram AbramovBarbara GoldenPeter K SandMegan Sullivan}
459,11,Acute and Persistent Postoperative Pain after Breast Surgery,nan,Pain Medicine,3.5396945157990283,nan,10,4,1/9/01,708-715,{N. Klauber-DeMoreK. FechoN. R. MillerW. S. BlauS. A. MerrittC. S. Hultman}
460,811354,The role of transforming growth factor-beta-mediated tumor-stroma interactions in prostate cancer progression: An integrative approach,nan,Cancer Research,nan,nan,69,17,1/9/01,7111-7120,{G. E. AyalaA. R. A. AndersonD. BasantaR. B. LuknerO. E. FrancoS. W. HaywardD. E. CliffelD. W. Strand}
461,323305,,nan,Revista latino-americana de enfermagem,nan,0104-1169,20,1,1/12/01,101#-108,{Luiza Akiko Komura HogaAna Luisa Zaniboni GomesLuciana Magnoni Reberte}
462,485934,Comparison of the CHADS2 CHA2DS2-VASc and HAS-BLED scores for the prediction of clinically relevant bleeding in anticoagulated patients with atrial fibrillation: the AMADEUS trial.,eng,nan,Thromb Haemost,nan,110,,1/13/11,1074-9,{D A LaneS ApostolakisG Y H LipH Buller}
463,743602,Comparison of energy balance-related behaviours and measures of body composition between Turkish adolescents in Turkey and Turkish immigrant adolescents in the N#etherlands.,eng,Public health nutrition,Public Health Nutr,1475-2727,17,12,1/14/12,Sep-92,{Makbule Gezmen-KaradagAnke OenemaSaskia J te VeldeHilal YildiranMai J M ChinapawJohannes BrugMine YildirimEda KoksalSaniye BiliciNilufer Acar-TekGamze AkbulutNevin SanlierMaartje M van StralenJudith S B de MeijAmika S Singh}
464,nan,Follow-up care of patients treated for breast cancer: a structured review,English,Cancer Treatment Reviews,nan,nan,30,1,1/4/01,19-35,{Hilary L. BekkerDavid J. DodwellRosalind F. Collins}
465,944668,Postamputation pain: epidemiology mechanisms and treatment,eng,J #P%ain Res,Journal of pain research,1178-7090,6,0,,121-36,{E. HsuS. P. Cohen}
466,873987,Bullous impetigo in children infected with methicillin-resistant Staphylococcus aureus alone or in combination with methicillin-susceptible S. aureus: analysis of genetic characteristics including assessment of exfoliative toxin gene carriage,eng,J Clin Microbiol,Journal of clinical microbiology,0095-1137 (Print) 0095-1137,49,5,1/11/01,Apr-72,{T. YamamotoT. TakanoM. TakanoW. HiguchiY. NitaharaK. #SaitoD. ShiK.$ Ozaki}
467,4349792.837349434,Ebus-tbna yields multiple gene analyses and a panel of immunohistochemical stains on routinely prepared cell blocks in non-small cell lung cancer cases,English,Laboratory Investigation,nan,0023-6837,95,0,1/15/01,100A,{Z. MalekiO. Nikolskaia}
468,299635,The Social Workers Guide to Child and Adolescent Mental Health.,nan,Child & Family Social Work,nan,1??356-750%0,16,2,1/11/05,241-%2??42,{%Jo Finch}
469,846319,Impact of endoscopic ultrasonography (EUS) on surgical decision-making in upper gastrointestinal tract cancer: An international multicenter study,nan,Surg. Endosc. Interv. Tech.,nan,-5514,21,3,,431-438,{Nielsen H.O.Edwin B.H_nerbein M.Hovendal C.Liedman B.Mortensen M.B.}
470,263027,Family care giving in t??he context of HIV/??AIDS in Africa,nan,nan,nan,5.60930734977494,21,1,1/13/01,13-21,{J. HuntR. A. Powell}
471,40,Empowered diabetes management: life coaching and pharmacist counseling for employed adults with diabetes,eng,Health Educ Behav,Health education & behavior : the official publication of the Society for Public Health Education,1090-1981,82.48321050721685,5,1/??13/01,581-91,{D. L. UeharaC. NishitaT. TomG. Cardazone}
472,146560,School neighborhood and family factors are associated with children's bullying involvement: a nationally representative longitudinal study.,eng,Journal of the American Academy of Child and Adolescent Psychiatry,J Am Acad Child Adolesc Psychiatry,1527-5418,48,5,1/9/05,5$45-53??,{Lucy BowesBarbara MaughanAvshalom CaspiLouise ArseneaultAlan TaylorTerrie E Moffitt}
473,498344,Infectious diseases. As Ebola wanes trials jockey for patients.,eng,Science (New York N.Y.),Science,1095-9203,348,6230,3/15/04,20,{Kai Kupferschmidt}
474,385772,DiGeorge Syndrome Presenting as Hypocalcaemia-Induced Seizures in Adulthood.,eng,Case Reports in Medicine,Case Rep.Med.,1687-9627,10,-3.842353719337872,1/13/01,923129,{Alexander AttardJosephine PsailaAdrian ZammitDeborah Grech Marguerat}
475,917417,In vivo effects of different anesthetic agents on apoptosis.,eng,Korean Journal of Anesthesiology,Korean J.Anesth.,2005-7563,63,1,1/12/07,18-24,{Hanan F KhafagyMona M HassanEmad S OsmanFaten M El-ShanawanyAbdel Rahman M FathallahYasser M SamhanGehan G El-Fandy}
476,517503,The impact of 3D volume of interest definition on accuracy and precision of activity estimation in quantitative SPECT and planar processing methods.,eng,Physics in medicine and biology,Phys Med Biol,13??61-6560%,55,12,6/21/10,3535-44,{Bin HeEric C Frey}
477,230785.75164782663,Comparison between oral antibiotics and probiotics as bowel preparation for elective colon cancer surgery to prevent infection: prospective randomized trial.,eng,Surgery,Surgery,1532-7361,155,3,1/14/03,493-503,{Yasuhiro KogaKazutake OkadaToru OzakiSotaro SadahiroAkira TanakaToshiyuki SuzukiHiroko Kamata}
478,516758,Comparison of 3D OS-EM and 4D MAP-RBI-EM reconstruction algorithms for cardiac motion abnormality classification using a motion observer.,ENG,IEEE transactions on nuclear science,IEEE Trans Nucl$ Sci,0018-9499,57,5,8/26/10,2571,{Taek-Soo LeeW Paul SegarsXin HeJing TangBenjamin M W Tsui}
479,85920,Adipocyte is a non-trivial dynamic partner of breast cancer cells.,%en%g,The International journal of developmental biology,Int. J. Dev. Biol.,1696-3547,55,7,@@1/11/01$,851-9,{Marie-Pierre ChenardNassim Dali-YoucefEmilie BuacheMarie-Christine RioJinxiang Tan}
480,nan,HRQoL after coronary artery bypass grafting and percutaneous coronary interven%tion for stable angina.,eng,Scandinavian cardiova$scular journal : SCJ,Scand. Cardiovasc. J.,1651-2006,43,2,1/9/04,Sep-94,{Michael LutherKari KorpilahtiMatti R TarkkaHeini HuhtalaJari LaurikkaJan-Ola WistbackaPertti Loponen}
481,888553,Weighting improves the information provided by joint counts on the severity of arthritis and its impact on patients' well-being in juvenile idiopathic arthritis,eng,Rheumatology (Oxfor@@d),Rheumatology (Oxford England),1462-0324,45,3,1/6/01,343-7,{A. RavelliS. Magni-ManzoniA. PistorioM. BandeiraA. MartiniE. SalaA. FalconeA. BuoncompagniN. RupertoA. Loy}
482,889580,Chronic pain-associated behaviors in the nursi$ng home: resident versus caregiver perceptions,nan,Pain,Pain,0304-3959,80,,,577-588,{F. KeefeB. PetersonD. Weiner}
483,732272,Analysis of responses of radiology personnel to a simulated mass c#asualty incident after the implementation of an automated alarm system in hospital emergency planning.,nan,Emergency Radiology,EMERG RADIOL,1070-3004,18,2,1/11/04,119-126 8p,
484,351877,Community nursing issues in Maori mental health.,nan,Australian & New Zealand Journal of Mental Health Nursing,AUST NZ J MENT HEALTH NURS,1324-3780,5,2,6/1/96,#5#4-62,{A StreetC Walsh}
485,276000,Tobacco-related scenes in television dramas fo@@r young Japanese audiences,nan,Tob Control,Tobacco control,0964-4563,8,3,1/1/99,348,{T#. %Sone}
486,378289,Alkaline phosphatase activity of duodenal enterocytes after neonatal administration of monosodium glutamate to rats.,eng,Physiological research / Academia Scientiarum Bohemoslovaca,Physi#ol Res,0862-8408,49,2,1/1/00,269-77,{L Lenhar$dtS MozesA Martinkov}
487,684476,Pulmonary rehabilitation for chronic obstructive pulmonary disease: a pilot study evaluating a once-weekly versus twice-weekly supervised programme.,eng,Physiotherapy,Phy$siotherapy,1873??-14??65,96,5.274419692804196,1/10/03,68-74,{Janet WebberFiona Liddell}
488,467344,Primary Banded Roux-en-Y Gastric Bypass: a Systematic Review.,nan,nan,nan,nan,0,0,,nan,#{NULL}
489,39687,Improving referrals to fracture clinic from the paediatric emergency department an intervention.,nan,nan,nan,nan,0,0,,-,
490,697880,Health literacy and child health promotion: Implications for research clinical care and public policy,nan,Pediatrics,nan,nan,124,0,,S306%-S??314,{Rudd R.Guez G.Sanders L.M.Baur C.Shaw@@ J.S.}
491,179093,Persistence of profenophos and quinolphos on cultivated cucumber and its removal,nan,nan,nan,nan,6,0,$1/14/#01,917-920,{B. VijayalakshmiD. Siva Rama PrasadD. RaveendranathK. Sri Rama MurthyA. Harinatha Reddy}
492,22,Cognitive impairment and risk of cardiovascular events and mortality.,nan,European heart journal,Eur. Heart J.%,1522-9645,33,14,1/12/07,??1777-86,{Salim YusufMartin O'DonnellCraig AndersonIrene MarzonaPeter SleightJeff ProbstfieldAntonio DansPeggy GaoJackie BoschKoon Teo}
493,208435,Comparison of tunnel positions in single-bundle anterior cruciate ligament reconstructions using computer navigation.,eng,Knee surgery sports traumatology arthroscopy : official journal of the ESSKA,Knee Surg Sports Traumatol Arthrosc,1433-7347,18,9,1/10/09,nan,{Junwei JiangHongchuan WangHua LouKai LiuHuiwei Zhang}
494,556624,Fludarabine vs cladribine plus busulfan and low-dose TBI as reduced intensity conditioning for allogeneic hematopoietic stem cell transplantation: a prospective randomized trial,nan,nan,nan,nan,39,4,1/7/01,193-9,{D. J. WeisdorfD. Douek#Y. TanL. J. BurnsJ. S. MillerB. R. BlazarM. AroraT. DeForM. L. MacMillanM. MarkovaJ. E. WagnerJ. N. BarkerT. Repka}
495,114118.67341302116,,jp@@??n,Horumon to rinsho. Clinical endocrinology,Horumon To Rinsho,0045-7167,16,4,4/1/68,273-6,{Y HiroseS KurataY Abe}
496,422857,Does this patient have obstructive sleep apnea?: The Rational Clinical Examination systematic review.,eng,JAMA%,nan,nan,310,7,1/13/08,7#31-??741,{David L SimelKathryn A MyersMarko Mrkobrada}
497,720372,APPLICATION OF AGING MANAGEMENT STRATEGIES FOR REACTOR VESSEL INTERNALS AND CORE SUPPORT STRUCTURES,nan,nan,nan,978-0-%7918-49$26-2,,0,1/10/01,277-286,{H. Q. XuM. SnyderS. FyfitchA. ChetaG. BezdikianV. N. ShahT. R. LiszkaiH. CharkasN. GuptaY. ShojiC. S. BajwaC. MayM. SanwarwalaM. BrumovskyI. Ezekoye}
498,863342,Molecular detection of hepatitis B virus: Recent developments,eng,Laboratorium$@@sMedizin,nan,nan,29,1,1/5/01,33-43,{B. WeberA. Berger}
499,260745,Droperidol vs metoclopramide for prophylaxis of postoperative nausea and vomiting after breast cancer surgery,nan,nan,nan,nan,40,0,1/11/01,40,{F. ColettaS. D'ArienzoP. SansoneC. AurilioM. C. PaceG. ZagariaR. Stumbo}
500,941515,Is prolonged use of computer games a risk factor for deep venous thrombosis in children?,nan,Clinical medicine (London England),Clin Med,1473-4893,4,2,1/4/01,190-1,{Richard J. A. Murrin}
501,641972,[Pelvic floor training for women with urinary incontinence].,dan,Forsinket implementering af internationale retningslinjer for computertomografi med iodholdigt kontraststof .,nan,1603-6824,,7,12/7/??02,593-5,??{Sren Bros#trmGunnar Lose}
502,699523,Regulating free speech,English,nan,nan,nan,23,2,1/%1$/91,28$9-318,{David Dyzenhaus}
503,39,Older Women in the Homeless Shelter: Personal Perspectives and Practice Ideas,nan,Journal of Women & Aging,nan,0895-2841,23,4,1/11/01,#360-374,{Jennifer Davis-Berman}
504,958639,Ethically justified system-level decisions in health ca??re: Toward a decision support workbook for healthcare leaders,nan,Dissertation Abstracts International: Section B: The Sciences and Engineering,nan,-94325,70,3.3244214318951317,1/9/01,238,{Bashir Jiwani}
505,850418,Takayasu's arteritis with multiple intracranial aneurysms,nan,TAKAYASUSCHE ARTERIITIS MIT MULTIPLEN INTRAKRANIELLEN ANEURYSMEN,nan,0428-8246,23,3.4718931645729185,3.6224316146386757,60-61,{Matsumoto K.Yamada F.Fukuda S.}
506,64505,Intravenous cyclophosphamide in patients with chronic systemic inflammatory diseases: morbidity and mortality.,eng,Scandinavian journal of rheumatology,Scand. J. Rheumatol.,0300-9742,37,2,1/8/03,130-4,{E A M JanssenC BrodinP OgreidK KjellevoldL G GranssonL Vatt%enP R RomundstadR OmdalK Wildhagen}
507,168889,,eng,Administration and policy in mental health,Adm Policy Ment Health,0894-587X,27,5,1/1/00,339-52,
508,63977,[Clinical and histologic results of treatment of serous pulp inflammations with Ledermix].,pol,Czasopismo stomatologiczne,Czas Stomatol,Nov-53,20,11,1/1/67,1145-53,{H Zakrzewska@@-Jastrzebska}
509,782211,Application of a model based on fuzzy logic for evaluating nursing diagnostic accuracy of students,English,International Journal of Medical Informatics,nan,nan,82,9,1/13/01,8??75-8$1,{R. JensenF. G. MatosA. da Cruz DdeP. S. SilveiraM. H. LopesN. R. Ortega}
510,473599,The effectiveness of N-acetylcysteine in preventing contrast-induced nephropathy in patients undergoing contrast-enhanced computed tomography: a meta-analysis of randomized controlled trials (Provisional abstract),nan,International Urology and Nephrology,nan,0301-162@@3,45,,1/13/01,1309?#?-1318,{Yh HsuMs YaoCs WongCh BaiMy WuYf LinCy HsiangKw TamYw LiHf Hsiang}
511,915463,[Commentary on] Gait changes in children with cerebral palsy following a neuro-developmental treatment course. Adams M Chandler L Shuhmann K PEDIATRIC PHYSICAL THERAPY 2000;12:114-120,nan,Pediatric physical therapy,nan,4.81274315184978,14,,1/2/01,55-56 2p,{J. Slusarski$}
512,nan,Cognitive Outcome of Pediatric Moyamoya Disease.,eng,Journal of Korean Neurosurgical Society,J Korean Neurosurg Soc,2005-3711@@@@,341.9,6,1/15/06,440-4,{Ju-Seong KimDong-Seok KimEun-Kyung ParkKyu-Won Shim}
513,405141,Fruit consumption and risk of type 2 diabetes: results from three prospective longitudinal cohort studies.,eng,Bmj-British Medical Journal,nan,1756-1833,347,-1,1/13/01,f5001,{Rob M van DamFrank B HuIsao MurakiJoann E MansonFumiaki ImamuraQi# SunWalter C Willett}
514,213794,A biomechanical study of replacement of @@the posterior cruciate ligament with a graft. Part II: Forces in the graft compared with forces in the intact ligament,nan,nan,nan,nan,79,3,,381-386,{K.L. ArmstrongG.A.M. FinermanK.L. MarkolfM.S. ShapiroJ.R. Slauterbeck}
515,18,The safety and immunogenicity of rotavirus vaccination in infants with intestinal failure,nan,J. Pediatric Infect. Dis. Soc.,nan,-14400,3,1,,57-65,{McNeal M.M.Sanchez S.E.Jacob S.Javid P.J.Englund J.A.Horslen S.P.}
516,89897,A growing lesion on the cheek.,eng,JAMA otolaryngology-- head & neck surgery,JAMA Otolaryngol Head Neck Surg,2168-619X,140,4,1/14/04,383-4,{Eric J LentschJordan Whitney RawlMichael J Caplan}
517,187552,Protective effect of ginsenoside Rb1 against myocardial ischemia/reperfusion injury in streptozotocin-induced diabetic rats,nan,Molecular Biology Reports,nan,0301-4851,38,39.234340058823975,1/11/01,nan,{Y. WuZ. Y. XiaH. M. LiuS. Q. LeiL. ZhangJ. J. XuB. ZhaoJ. Dou}
518,144339,Comparative in vitro performance of three small-volume valved holding chambers with beclomethasone/formoterol pressurized metered dose inhaler.,eng,Journal of aerosol medicine and pulmonary drug?? delivery,J Aerosol Med Pulm Drug Deliv,1941-2703,26,4,1/13/08,223-7,{Kamel AlhanoutJean-Christophe DubusTalita Mota GoncalvesVeronique AndrieuAlain NicolayDavi Pereira de Santana}
519,656518,The effectiveness of anti-illicit-drug public-service announcements: a systematic review and meta-analysis.,eng,Journal of epidemiology and community health.,nan,1470-2738,39.98570972402473,10,1/11/10,834-40,{Julio S G MontanerKora DebeckEvan WoodThomas KerrEdward J MillsDan Werb}
