ID,id,article_title,article_language,journal_title,jounral_abbreviation,journal_issn,article_jvolumn,article_jissue,article_jcreated_at,article_pagination,author_list
448,911271,Electrocardiogram QRS detection using multiscale filtering based on mathematical morphology,English,,nan,1557-170X,11945.317682616977,0,1/7/01,3196-3199,{Department of Electrical F. ZhangElectrical Department ofNational Computer EngineeringSingapore Email elezf nus edu sg University of SingaporeSingapore National University of SingaporeF. ZhangEngineering ComputerAddress CorrespondenceY. LianAddresses Author}
449,565528,Barriers and facilitators to implementing electronic prescription: a systematic review of user groups' perceptions.,eng,Journal of the American Medical Informatics Association : JAMIA,nan,1527-974X,21,3,1/14/05,535-41,{Marie-Pierre GagnonClaude Sicotte_dith-Romy NsangouSonya GrenierJulie Payne-Gagnon}
450,951143,Cystic fibrosis: cost of illness and considerations for the economic evaluation of potential therapies,eng,Pharmacoeconomics,nan,,,14,1/3/01,1001-24,{T. WelteR. BusseN. JalilvandC. Krauth}
451,658707,Working memory short-term memory and reading disabilities: a selective meta-analysis of the literature.,eng,Journal of le#??arning disabilities,J Learn Disabil,0022-2194,207.4359367301157,3,1/9/05,260-87,
452,84905,Hypothalamic obesity in children.,eng,Obesity reviews : an official journal of the International Association for the Study of Obesity,Obes Rev,1467-789X,13,9,%1/12/09#,780-98,{A BereketZ HochbergY YavuzH L MullerR H LustigR WeissW KiessA P Goldstone}
453,891370,Health literacy diabetes self-care and glycemic control in adults with type 2 diabetes,eng,Diabetes t%echnology & therapeutics,Diabetes Technol. Ther.,1520-9156,12,11,1/10/01,913-9,{Chandra Y. and Bains Sujeev S. and Egede Leonard E. Osborn}
454,697286,Central corneal melting associated with reformulated generic diclofenac in a patient with inferior fornix foreshortening.,eng,Ophthalmology and eye diseases,$Ophthalmol$ Eye Dis,1179-1721,3,0,1/11/01,nan,{Cameron Campbell Johnson}
455,819701,Heart rate and blood pressure responses of left-handers and right-handers to autonomic stressors,English,In??dian Journal of Physiology and Pha#rmacology,nan,0019-5499,,7,1/4/01,31-40,{M.B. DikshitS. RajeD.S. JajuV.R. Purandare}
456,855099,[The use of intravascular nitinol stents in the treatment of subclavian vein compression for thoracic outlet syndrome].,pol,Nowoczesne biomateria_y jako opatrunki hemostatyczne w chirurgii oszczedzajacej miazsz nerki--model zwierzecy. Doniesienie wstepne.,nan,0370-0747,37,,1/7/01,May-51,{Przemys_aw P SzyberArtur PupkaPiotr SzyberJerzy Garcarek}
457,,Primary head and neck can#cers in @@North -Western Nigeria,eng,,nan,,28,4,1/9/??01,227-33,
458,226966,Vaginal incisional wound healing in a rabbit menopause model: a histologic analysis.,eng,International urogynecology journal,Int Urogynecol J,1433-3023,102.3972534719294,12,1/12/12,1763-9,{Roge??r P GoldbergYoram AbramovBarbara GoldenPeter K SandMegan Sullivan}
459,4284938.40057816,A??cute and Persistent Postoperative Pain after Breast Surgery,eng,,nan,,10,4,1/9/01,70$8-715??,{N. Klauber-DeMoreK. FechoN. R. MillerW. S. BlauS. A. MerrittC. S. Hultman}
460,811354,The role of transforming growth factor-beta-mediated tumor-stroma interactions in prostate cancer progression: An integrative approach,,Cancer Research,nan,,69,63,,7111-7120,
461,323305,,eng,Revista latino-americana de enfermagem,Rev Lat Am Enfermagem,,91,5.3896447673078445,1/12/01,101-10@@8,{Luiza Akiko Komura HogaAna Luisa Zaniboni GomesLuciana Magnoni Reberte}
462,485934,Comparison of the CHADS2 CHA2DS2-VASc and HAS-BLED scores for the prediction of clinically relevant bleeding in anticoagulated patients with atrial fibrillation: the AMADEUS trial.,eng,Thrombosis And Haemostasis,Thromb Haemost,,,,1/13/11,1074-9,{D A LaneS ApostolakisG Y H LipH Buller}
463,743602,,eng,,Public Health Nutr,1475-2727,17,42,1/14/12,Sep-92,{Makbule Gezmen-KaradagAnke OenemaSaskia J te VeldeHilal YildiranMai J M ChinapawJohannes BrugMine YildirimEda KoksalSaniye BiliciNilufer Acar-TekGamze AkbulutNevin SanlierMaartje M van StralenJudith S B de MeijAmika S Singh}
464,5339330.442542164,Follow-up care of patients treat??ed for breast cancer: a structured review,eng,Cancer Treatment Reviews,nan,,30,4,1/4/01,19-35,
465,,Postamputation pain: epidemiology mechanisms and treatment,#eng,J Pain Res,Journal of pain research,,6,0,,nan,{E. HsuS. P. Cohen}
466,,Bullous impetigo in children infected with methi??cillin-resistant Staphylococcus aureus alone or in combination with methicillin-susceptible S. aureus: analysis of genetic characteristics including assessment of exfoliative toxin gene carriage,eng,J Clin Microb$iol,nan,0095-1137 (Print) 0095-1137,49,5,1/11/01,Apr-72,{T. Yamamo$toT. Taka$noM. TakanoW. HiguchiY. NitaharaK. SaitoD. ShiK. Ozaki}
467,968211,Ebus-tbna yields multiple gene analyses and a panel of immunohistochemical stains on routinely prepared cell blocks in non-small cell lung cancer cases,E%ng%lish,,nan,0023-6837,95,,1/15/01,100#A,{Z.$ MalekiO. Nikolskaia}
468,299635,The Social Workers ??Guide to Child and Adolescent Mental Health.,eng,,nan,1356$-7500??,16,2,1/11/05,24@@1-24@@2,{Jo Finch}
469,,Impact of endosc??opic ultrasonograp$hy (EUS) on surgical decision-making in upper gastrointestinal tract cancer: An international multicenter study,,Surg. Endosc. Interv. Tech.,nan,-5514,21,3,,nan,
470,263027,Family care giving in the context of HIV/AIDS in Africa,eng,,nan,,21,,1/13/01,13-21,{J. HuntR. A. Po@@well}
471,788168,,e??ng#,Health Educ Behav,Health education & behavior$ : the official publication of the Society for Public Health Education,1090-1981,40,20.352446060508687,,581-91,{D. L. UeharaC. NishitaT. TomG. Cardazone}
472,654480.0388140392,School neighborhood and family factors are associated with children's bullying involvement: a nationally representative longitudinal study.,@@eng,,J Am Acad Child Adolesc Psychiatry,1527-5418,,5,1%/9/05,545-53,
473,498344,Infectious diseases. As Ebola wanes trials jockey for patients.,eng,Science (New York N.Y.),Science,1095-9203,348,,3/15/04,20,{Kai Kup@@ferschmi%dt}
474,,DiGeorge Syndrome Presenting as Hypocalcaemia-Induced Seizures in Adulthood.,eng,Case Reports in Medicine,C??a??se Rep.Med.,1687-9627,2013,-1,1/13/01,923129,{Alexander AttardJosephin%e PsailaAdrian ZammitDeborah Grech Marguerat}
475,917417,In vivo effects of different anesthetic agents on apoptosis.,eng,Korean Journal of Anesthesiology,Korean J.Anesth.,2005-7563,63,,1/12/07,18-24,{Hanan F KhafagyMona M HassanEmad S OsmanFaten M El-ShanawanyAbdel Rahman M FathallahYasser M SamhanGehan G El-Fandy}
476,,The impact of 3D volume of interest definition on accuracy and precision of activity estimation in quantitative SPECT and planar processing methods.,eng,Physics in me#dicine an$d biology,Phys Med Biol,,55,,6/21/10,3535-44,{Bin HeEric C Frey}
477,295703.69995463616,Comparison between oral antibiotics and probiotics as bowel preparation for elective colon cancer surgery to prevent infection: prospective randomized trial.,eng,Surgery,Surgery,153$2-7361,155,3,1/14/03,493-503,{Yasuhiro KogaKazutake OkadaToru OzakiSotaro SadahiroAkira TanakaToshiyuki SuzukiHiroko Kamata}
478,516758,,ENG,IEEE transactions on nuclear science,IEEE Trans Nucl Sci,,57,,8/26/10,2571,{Taek-Soo LeeW Paul SegarsXin HeJing TangBenjamin M W Tsui}
479,85920,Adipocyte is a non-trivial dynamic partner of breast cancer cells.,eng,The International journal of devel%opm??ental biology,nan,1696-3547,55,7,1/11/01,8#51-9,{Marie-Pierre ChenardNassim Dali-YoucefEmilie BuacheMarie-Christine RioJinxiang Tan}
480,,HRQoL after coronary artery bypass grafting and percutaneous corona%ry intervention for stable angina.,eng,Scandinavian cardiovascular journal : SCJ,Scand. Cardiovasc. J.,1651-2006,,2,1/9/04,Sep-94,{Michael LutherKari KorpilahtiMatti R TarkkaHeini HuhtalaJari LaurikkaJan-Ola WistbackaPertti Loponen}
481,888553,Weighting improves the information provided by joint counts on the severity of arthritis and its impact on patients' well-being in juvenile idiopathic arthritis,eng,Rheumatology (Oxford),Rheumatology (Oxford England),1462-0324,45,3,1/6/01,343-7,{A. RavelliS. Magni-ManzoniA. PistorioM. BandeiraA. MartiniE. SalaA. FalconeA. BuoncompagniN. RupertoA. Loy}
482,889580,Chronic pain-associated behaviors in the nursing home: resident versus caregiver perceptions,eng,Pain,Pain,0304-3959,80,3,1/1/99,5%77-588,{F. KeefeB. PetersonD. Weiner}
483,,Analysis of responses of radiology personnel to a simulated mass casualty incident after the implementation of an automated alarm system in hospital emergency planning.,,Emergency Radiology,EMERG RA@@#DIOL,1070-3004,,0,1/@@11/04,119-126 8p,{Linsenmaier UGeyer LLK_rner MMeisel CDWirth SReiser MF}
484,351877,,,Australian & New Zealand Journal of M$ental Health Nursing,AUST N$Z J MENT HEALTH NURS,,5,2,,54-62,{A StreetC Walsh}
485,276000,Tobacco-related scenes in television dramas for young Japanese audiences,eng,Tob Control,Tobacco control,0@@964-4563,75,3,1/1/99,350,{T. Sone}
486,1184157.344837733,Alkaline phosphatase activity of duodenal enterocytes after neonatal administration of monosodium glutamate to rats.,eng,Physiological research / Academia Scientiarum Bohemoslovaca,$Phys??iol Res,0862-8408,49,62,1/1/00,2$69-77,{L LenhardtS MozesA Mar#tinkov}
487,684476,Pulmonary rehabilitation for chronic obstructive pulmonary disease: a pilot study evaluating a once-weekly versus twice-weekly supervised programme.,en$g,Physiotherapy,nan,1873-1465,96,1,1/10/03,68-74,{Janet WebberFiona Liddell}
488,467344,Primary Banded Roux-en-Y Gastric Bypass: a Systematic Review.,,,nan,,0,0,,nan,${NULL}
489,39687,,,,nan,,0,0,,-,{O. CallenderJ. Cr%avenC.?? Martin}
490,3446185,Health literacy and child health promotion: Implications for research clinical care and public policy,,,nan,,443.2963850570043,0,,S306-S314,{Rudd R.Guez G.Sanders L.M.Baur C.Shaw J.S.}
491,179093,Persistence of profenophos and quinolphos on cultivated cucumber and its removal,,,nan,,6,0,1/1$4#/01,917-920,{??B. Vijayalaksh%miD. Siva Rama PrasadD. RaveendranathK. Sri Rama MurthyA. Harinatha Reddy}
492,539034,Cognitive impairment and risk of cardiovascular events and mortality.,eng,European heart journal,Eur. H@@eart J.,1522-9645$,33,14,1/12/07,1777-86,
493,208435,Comparison of tunnel positions in single-bundle anterior cruciate ligament reconstructions using computer navigation.,eng,Knee surgery sports traumatology arthroscopy : official journal of the ESSKA,Knee Surg Sports Traumatol Arthrosc,1433-7347??,,9,,128??2#-9,{Travis G MaakThomas L WickiewiczVolker MusahlJames E VoosAndrew D Pearle}
494,556624,Fludarabine vs cladribine plus busulfan and low-dose TBI as reduced intensity conditioning for allogeneic hematopoietic stem cell transplantation: a prospective randomized trial,,,nan,,39,4,,193-9,{D. J. WeisdorfD. DouekY. TanL. J. BurnsJ. S. MillerB. R. BlazarM. AroraT. DeForM. L. MacMillanM. MarkovaJ. E. WagnerJ. N. BarkerT. Repka}
495,36253,[Limited experience in adrenocortical function tests in infants].,jpn,Horumon to rinsho. Clinical endocrinology,Horumon To Rinsho,0045-7#$167,16,18.53010283461944,,@@273-6,{Y HiroseS KurataY Abe}
496,422857,Does this patient have obstructive sleep apnea?: The Rational Clinical Examination systematic review.,eng,JA#MA%,nan,,310,,1??/13/@@08,731-741,{David L SimelKathryn A MyersMarko Mrkobrada}
497,,APPLICATION OF AGING MANA$GEMENT STRATEGIES FOR REACTOR VESSEL INTERNALS AND CORE@@ SUPPORT STRUCTURES,eng,Proceedings of the Asme Pressure Vessels and Piping Conference 2010 Vol 7,nan,,0,0,1/10/01,277-286,{H. Q. XuM. SnyderS. FyfitchA. ChetaG. BezdikianV. N. ShahT. R. LiszkaiH. CharkasN. GuptaY. ShojiC. S. BajwaC. MayM. SanwarwalaM. BrumovskyI. Ezekoye}
498,863342,Molecular detection of hepatitis B virus: Recent developments,eng,LaboratoriumsMedizin,nan,,,,1/5/01,nan,{B. WeberA. Berger}
499,260745,Droperidol vs metoclopramide for prophylaxis of postoperative nausea and vomiting after breast cancer surgery,,,nan,,28,0,,141,{F. ColettaS. D'ArienzoP. SansoneC. AurilioM. C. PaceG. ZagariaR. Stumbo}
500,941515,Is prolonged use of com$puter games a risk factor for deep venous thrombosis in children?,eng,Clinical medicine (London England),nan,1473-4893,45,2,1/4/01,nan,
501,641972,[Pelvic floor training for women with urinary incontinence].,da??n,Forsinket implementer??ing af internationale retningslinjer for computertomografi med iodholdigt kontraststof .,nan,,169,7,12/7/02,593-5,{Sren BrostrmGunnar Lose}
502,3743198,Regulating free speech,eng,,nan,,23,2,1/1/91,289-318,{David Dyzenhaus}
503,946112,Older Women in the Homeless Shelter: Personal Perspectives and Practice Ideas,eng,Journal of Women & Aging,nan,0895-2841,,,1/11/01,360-374,
504,958639,Ethically justified system-$level decisions in health care: Toward a decision support workbook for healthcare leaders,eng,Dissertation Abstracts International: Section B: The Sciences and Engineering,nan,-94325,70,1,1/9/01,nan,{Bashir $Jiwani}
505,3023114,Takayasu's arteritis with multiple intracranial aneurysms,,TAKAYASUSCHE ARTERIITIS MIT MULTIPLEN INTRAKRANIELLEN ANEURYSMEN,nan,0428-8246,48,1,,60-61,{Matsumoto K.Yamada F.Fukuda S.}
506,125302,Intravenous cyclophosphamide in patients with chronic systemic inflammatory diseases: morbidity and mortality.,eng,Scan@@dinavian journal of rheumatology,Scand. J. Rheumatol.,,37,2,1/8/03,nan,{E A M JanssenC BrodinP OgreidK KjellevoldL G GranssonL VattenP R RomundstadR OmdalK Wildhagen}
507,168889,Trends in domestic violence service and leadership: implications for an integrated shelter model,,Administration and policy in mental health,Adm Policy Ment %Health,,27,5,,339-52,{M. B. PhilipR. A. Hayward}
508,63977,[Clinical and histologic results of treatment of serous pulp inflammations with Ledermix].,po#@@l,Czasopismo ??stomatologiczne,Czas Stomatol,,,11,,1145-53,{H Zakrzewska-Jastrzebska}
509,782211,Application of a model based on fuzzy logic for evaluating nursing diagnostic accuracy of students,eng,International Journal of Medical Informatics,nan,,82,9,1/13/01,875-81,
510,,The effectiveness of N-acetylcysteine in preventing contrast-induced nephropathy in patients undergoing contrast-enhanced computed tomography: a meta-analysis of randomized controlled trials (Provisional abstract),eng,International Urology and Nephrology,nan,0301-162@@3,45,5,1/13/01,1309-1318,{Yh HsuMs YaoCs WongCh BaiMy WuYf LinCy HsiangKw TamYw LiHf Hsiang}
511,915463,[Commentary on] Gait changes in children with cerebral palsy following a neuro-developmental treatment course. Adams M Chandl??er L Shuhmann K PEDIATRIC PHYSICAL THERAPY 2$000;12:114-120,,Pe??diatric physical therapy,nan,,74.6893356603502,,,55-56 2p,{J. Slusarski}
512,476199,Cognitive Outcome of Pediatric Moyamoya Disease.,eng,Journal of Korean #Neuro#surgical Society,J Korean Neurosurg Soc,2005-3711,57,6,1/15/06,440-4,{Ju-Seong KimDong-Seok KimEun-Kyung ParkKyu-Won Shim}
513,405141,Fruit consumption and risk of type 2 diabetes: results from three prospective longitudinal cohort studies.,eng,Bmj-British Medical Journal,nan,1756-1$833,1540.5475292459037,-1,1/13/01,f5001,{Rob M van DamFrank B HuIsao MurakiJoann E MansonFumiaki ImamuraQi SunWalter C Willett}
514,960782.7109058192,A biomechanical study of replacement of the posterior cruciate ligament with a graft. Part II: Forces in the graft compared with forces in the intact ligament,,,nan,,79,3,1/1/97,381-386,{K.L. ArmstrongG.A.M. FinermanK.L. MarkolfM.S. ShapiroJ.R. Slauterbeck}
515,408902,The sa@@fety and immunogenicity of rotavirus vaccination in infants with intestinal failure#,,J. Pediatric Infect. Di??s. Soc@@.,nan,-14400,3,1,,nan,
516,,A growing lesion on the cheek.,eng,JAMA otolaryngology-- head & neck surgery,JAMA Otolaryngol Head Neck Surg,2168-61%9X,32,,1#/14$/04,383-4,
517,,Protective effect of ginsenoside Rb1 against myocardial ischemia/reperfusion injury in streptozotocin-induced diabetic rats,eng,Molecular Biology Reports,nan,0$301-485%1,38,7,1/11/01,@@4327-4#335,{Y. WuZ. Y. XiaH. M. LiuS. Q. LeiL. ZhangJ. J. XuB. ZhaoJ. Dou}
518,144339,Comparative in vitro performance of three small-volume valved holding chambers with beclomethasone/formoterol pressurized metered dose inhaler.,eng,Journal of aerosol medicine and pulmonary drug delivery,J Aerosol Med Pulm Drug Deliv,1941-2703,26,4,1/13/08,223$-7,{Kamel AlhanoutJe%an-Christophe DubusTalita Mota GoncalvesVeronique AndrieuAlain NicolayDavi Pereira de Santana}
519,,The effectiveness of anti-illicit-drug public-service announcements: a systematic review and meta-analysis.,eng,Journal of epidemiology and community health.,nan,1470-2738,65,10,1/11/10,834-40,{Julio S G MontanerKora DebeckEvan WoodThomas KerrEdward J MillsDan Werb}
520,925315,[Use of statins prior to or following invasive therapy for coronary artery disease].,chi,,Chung Hua I Hsueh Tsa Chih,,85,40,1/7/01,nan,{Wei Gao}
521,,Maligna%nt lymphom%as of the oral region.,engfre,Canadian Forces Dental Services quarterly,Can Forces Dent Serv Q,0045-4850,18,1,1/1/96,7-Jan,
522,237077,Women's experiences of acupuncture during labour,eng,British Journal of Midwifery,nan,0969-4900,36,4,1/13/01,254-262,{Irena Anna FreiKatharina FierzAngela PoatMartina Gisin}
523,600827,Nutritional supplementation for hip fracture aftercare in the elderly.,eng,Cochrane Database Syst. Rev.,nan,1469-493X,-1.0,22.249951718426168,1/1/00,CD00188@%@0,{A AvenellH H Ha%ndo%ll}
524,851773,Quality of life factors and survival after total or extended maxillectomy for sinonasal malignancies.,eng,Journal Of Oral And Maxillofacial Surgery: Official Journal Of The American Association Of Oral And Maxillofacial Surgeons,nan,1531-505##3,73,4,1/15/04,75@@9-6$3,{James MurphyAmal IsaiahJoshua E LubekJeffrey S Wolf}
525,67292,,en#g%,The Journal of biological chemistry,J. Biol. Che#m.,1083-351X,289,,3/14/10,27386-99??,{Mitsuyoshi MotizukiKeiji MiyazawaTetsuo KondoKeisuke MasuyamaMasao SaitohHiroki IshiiRyohei KatohKei SakamotoShota Tanaka}
526,129698,Combined and sequential treatment of oral and maxillofacial malignancies: an evolving concept and clinical protocol.,eng,Chinese medical journal,Chin. Med. J.,0366-6999,121,19,5/8/10,1945-52,{Zhi-yuan ZhangWei-liu QiuJia-wei Zheng}
527,254327,Evaluation of a workshop on evidence-based medicine for social insurance physicians.,eng,Occupational Medicine-Oxford,nan,0962-7480,58,1,1/??8/03,Jul-83,{Jos H VerbeekRob KokJan L HovingFrederieke G SchaafsmaFrank J H van DijkPaul B A Smits}
528,556803,Neurocognitive assessment in 13 patients affected by ??muchopoly$saccharidosis IVA (MPS IVA),,,nan,,37,1,1/14/0#1,S136,{M. RigoldiS. GasperiniB. M. Del MenicoF. NichelliA. Bo%nciminoM.% CalabriaP. MeregalliR. Parini}
529,,Evaluation of the protective effect of Ilex paraguariensis and Camellia sinensis extracts on the prevention of oxidative damage caused by ultraviolet radiation.,eng,,Environ. Toxicol. Pharmacol.,1872-7077,37,1,1/14/01,195-201,{Marlon BargEmilio L StreckLara M GomesVanessa M AndradeDaniela D LeffaFelipe Dal-PizzolFabricia PetronilhoFrancieli VuoloMilena Carvalho-SilvaFernanda BalbinotGislaine T Rezin}
530,484593,New anticoagulants for atrial fibrillation.,eng,J. Cardiovasc. Med.,nan,1558-2027,10,6,1/$9/06,446-53,{Raffaele De CaterinaGiulia RendaSteen Dalby Kristensen}
531,351700,Our Health Counts -- Unmaskin%g %Health and Social Disparities among Urban Aboriginal People in Ontario.,,,nan,,0,0,,nan,{Michelle Firestone}
532,105981,,eng,Scienc$e (New York@@ N.Y.),Science,1095-9203,316,30440.059367414,11/7/05,889-94,{George Davey SmithAmanda J BennettEleftheria ZegginiMarjo-Riitta JarvelinNicholas J WarehamLorna W HarriesColin N A PalmerShah EbrahimTimothy M FraylingSusan M RingBridget KnightSian EllardKatharine R OwenRachel M FreathyHana LangoDebbie A LawlorLon R CardonJohn R B PerryJeffrey C BarrettAndrew D MorrisGraham A HitmanKatherine S ElliottUlla S%ovioMark I McCarthyDavid MelzerAlex S F DoneyAndrew R NessYoav Ben-ShlomoAndrew T HattersleyAnn-Marie PatchNicholas J TimpsonNigel W RaynerMark WalkerMichael N WeedonRuth J F LoosFredrik KarpeIn_s BarrosoLuigi FerrucciChristopher J GrovesCecilia M LindgrenBeverley Shields}
533,408198,The parvalbumin-positive interneurons in the mouse dentate gyrus express GABAA receptor subunits 1 _2 and  along their extrasynaptic cell membrane.,eng,,Neurosci@@ence,1873-7544,254,-1,12/19/13,80-96,{H H_gerW SieghartT KlausbergerI MilenkovicM VasiljevicD Maurer}
534,30272,,ENG,Experimental neurology,Exp. Neurol.,1090-2430,-1.0,-1,5/22/14,nan,{T PhilipsJ D Rothstein}
535,,,eng,Annals of Emergency Medicine American College of Emergency Physician's Research Forum,nan,0196-064$4,37,5,1/1/05,453-60,{J P IoannidisJ LauC MilchD SalemP W ChewN TerrinE M Balk}
536,13408,Eczema - quiz.,eng,P#aediatrics & child% health,Paediatr Child Health,,,,3/1/00,105,{%NULL}
537,449003,Stroke in children with posterior fo#ssa brain malformations hemangiomas arterial anomalies coarctation of the aorta and cardiac defec%ts and eye abnormalities (PHACE) syndrome: A systematic review of the literature.,,,nan,,0,0,,nan,
538,299297,Employing a youth-led adult-guided framework: why drive high? social marketing campaign.,eng,Family & Community Health,nan,,117.2910554355533,4,1/11/10,319-330,{Terry-Lynne MarkoTyler Watt}
539,302268,Review of Handbook for Wor$king with Children and Youth@@: Pathways to Resilience across Cultures and Contexts,English,,nan,,47,15.504187321091536,1/6$%/01,230-232,{Robert J. ??Flynn}
540,592663,Helicobacter pylori antibiotic resistance patterns and genotypes in adult dyspeptic patients from a regional population in North Wales,eng,,nan,,54,2,,4@@35-40,{A. M. Wal@@kerJ. XerryK. DaviesN. C. ElvissR. J. Owen}
541,1726129,Sonographically guided biopsy of focal lesions: a comparison of freehand and probe-gu#ided techniques using a phantom.,,AJR. American Journal Of Roentgenology,AJR Am J Roentgenol,0361-803X,184,5,1/5/0@@5,1652-6,{Duncan M BrooksPramit M PhalRory Wolfe}
542,460786,Splinting osseointegrated implants and natural teeth in partially edentulous patients: a systematic review of the literature. [Review],nan,,nan,nan,0,0,,nan,{NULL}
543,,Long-term subcuta#neous recombinant interleukin-2 as maintenance therapy: Biological effects and clinical implications,eng,Cancer Biotherapy,nan,1062-8401,10,,1/1/95,@@19??5-203,{V. LorussoM. De LenaM. GuidaM. CorrealeI. AbbateA. La#torreA. Ca@@samassimaM. D. Musci}
544,751811,School soft dri$nk interventio??n study,,BMJ,nan,1468-5833 (Electronic),329,7462,,E315-6,{S. A. FrenchM. StoryP. J. Hannan}
545,436781,Hoarse voice in adults: An evidence-based approach to the 12 minute consultation.,nan,,nan,nan,0,0,,nan,{NULL}
546,796900,Chronic compartment syndrome an important cause of work-related upper limb disorder,eng,Rheumatology (Oxford),Rheumatology (Oxford England),1462-0324,,11,1/5/01,1442-6,{J. P. HeathR. L. WilliamsM. H. Pritchard}
547,,Sleep sleep-dependent procedural learning and vigilance in chronic cocaine users: Evidence for occult insomnia,Engli??sh,,nan,,,3,1/6/01,238-49,{R. T. MalisonE. F. Pace-SchottV. CoricP. T. MorganR. StickgoldZ. H. Sahul}
548,893227,A screening methodology for crowdsourcing video QoE evaluation,eng,,nan,,0,0,1/14/01,nan,{E. Anegekuh L. Sun L. Ifeachor}
549,2861079.539433669,Potential f#or inter-observer and intra-observer variability in x-ray review to establish stone-free rates after lithotripsy.,,J. Urol.,nan,002@@2-5347%,75,3,3/1/92,559-62,{D CaronS J WitchellM A JewettE L St LouisR R GrayC BombardierS KumraK E PsihramisM R Ryan}
550,,Situating universal design architecture: designing with whom?,ENG,Disability and rehabilitation,Di%sabi??l Rehabil,1464-5165,-4.233458840455378,-1,7/28/14,nan,{Paul Jones}
551,476191,Endovascular Treatment of Ruptured Large or Wide-Neck Basilar Tip Aneurysms Associated with Moyamoya Disease Using the Stent-Assisted Coil Technique.,,Journal of stroke and cerebrovascular diseases : the official journal of National Stroke Association,J Stroke Cerebrovasc Dis,1532-8511,-1.0,-1,7/24/15,nan,{Yibin FangPengfei YangJianmin LiuYi XuQinghai HuangWenyuan ZhaoDongwei DaiYan Chen}
552,719389,Subjective states: A more robust model,eng,,nan,,67,2,1/9/01,408$-42#7,
553,467318,The fundamental role of bone morphogenetic protein 15 in ovarian function and its      involvement in female fertility disorders.,,,nan,,,0,,nan,
554,910688.948328805,Giant-cell tumour of %the knee: the condition of the cartilage after treatment by curettage and% cementing,eng,J Bone Joint Surg Br,The Journal of bone and joint surgery. British volume,0301-620X (Print) 0301-620x,89,3,1/7/01,361-5,{K. JonssonA. RydholmI. KristianssonD. HeinegardF. V. von SteyernP. Mannfolk}
555,664795,Diagnostic accuracy of endoscopic ultrasound-guided fine-needle aspiration for solid pancreatic lesion: a systematic review.,eng,Journal of cancer research and clinical?? oncology,J. Cancer Res. Clin. Oncol.,1432-1335,138,,1/12/09,$1433-41,{Hangcheng ZhouRenbao YangJiong ChenYunlian XiaYin Lu}
556,102180,Safety tolerability and sustained weight loss over 2 years with the once-daily human GLP-1 analog liraglutide.,eng,,Int J Obes (Lond),1476-5497,36,6,1/12/06,%843-54%,{R CarraroM F RasmussenL NiskanenA HarperN FinerS R_ssnerM KunesovaL Van GaalM E J LeanA AstrupA RissanenM J Savolainen[Collective Name] NN8022-1807 Investigators}
557,1144055,Web-based nutrition education intervention improves self-efficacy and self-regulation related to increased dairy intake in college students,English,,nan,,93,11,,1723-7,{Kathy W HosigSharon M Nickols-RichardsonKavita H PoddarSusan E DuncanEileen S Anderson}
558,961081,Three Abstracts on Chinese Research,nan,American Acupuncturist,nan,1520-7714,63,0,1/13/01,25-26,{NULL}
559,278497.16733142023,Retrograde nailing of humeral shaft fractures,eng,,nan,,0,,1/1/98,26-39,{M. RunkelJ. BlumP.@@ M. Rommens}
