ID,id,article_title,article_language,journal_title,jounral_abbreviation,journal_issn,article_jvolumn,article_jissue,article_jcreated_at,article_pagination,author_list
666,558824,Swabbing Surgical Sites Does Not Improve the Detection of Staphylococcus aureus Carriage in High-Risk Surgical Patients,Eng,nan,nan,nan,0,0,1/15/01,nan,{M. S. IharaJ. R. Tripet-DielK. ShahlaieC. S. LiJ. BrownS. H. CohenM. GiordaniE. O. Klineberg}
667,954980,Effect of chewing gun on the promotion of intestinal function recovery after colorectal cancer surgery: A meta-analysis. [Chinese],Chinese     English Chinese,Chinese Journal of Evidence-Based Medicine,Chin.J.Evid.-Based Med.,1672-253@@#1,15,39,1/15/01%@@,542-549,{Q. X. ZhangJ. H. TianX. Y. TanA. L. YangX. M. YangZ. X. Zhang}
668,896410,School Climate and Students' Early Mathematics Learning: Another Search for Contextual Effects.,eng,American Journal of Education,nan,,119,1,1/13/02,209-234,{KATERINA1 BODOVSKIRACHAEL3 WALSHINBAL2 NA????HUM-SHANI}
669,,Chronic hypokalemia due to excessive cola consumption: a case report,,Cases J,Cases journal,1757-1626,1,1,1#/8$/01,32,{C. D. %Packer}
670,303571,,,,nan,,106.3932043380514,2,,142-166,{Melinda Dooly}
671,193059,Wirkungen und Risiken neuartiger psychoaktiver Substanzen: Fehldeklaration und Verkauf als Badesalze Spice und Forschungschemikalien,eng,,nan,,50,9,1/14/01,139,{G. MikusN. HohmannD. Czock}
672,416171,[New guidelines for bariatric surgery care: practical implications],eng,,nan,,94,288,1/11/01,700-4,
673,810153,I#nosiplex for treatment of alopecia area#ta: A randomized placebo-controlled study,,Acta Derm.-Venereol.,nan,-9262,74,5,,422-424,{Katoulis A.C.Georgala K.Georgala S.Befon A.Stavropoulos P.G.}
674,164085,,eng,Environmental monitoring and assessment,nan,1573-2959,98,1,1/9/01,2%09-19,{Ahmet Asan}
675,619668,,eng,Acta Neurol Scand,nan,,110,22.8249016472435,1/4/10,207-20,{A GaitatzisM R TrimbleJ W Sander}
676,,Obesity and obstructive sleep apnea: Carry the torch of awareness,eng,,nan,,6,4,1/11/01,$55-56$,{K. F. Joyner}
677,,Aerobic fitness testing in patients with chronic low back pain: which test is best?,eng,,nan,,25,0,1/1/00,1704-10 ST  - Aerobic fitness testing in patients with chronic low back pain: which test is best?-,{T. H. MichelW. C1  - Frn RCT-s_kningen CN  - Pubmed DA  - Jul 1 DP  - NLM ET  - 2000/06/28 RogersA. WagnerH. WittinkR. KulichA. SukiennikR. Maciewicz}
678,198675,Poster abstracts. The National Association of Bariatric Nurses 4th Annual Meeting and Conference October 24-27 2007 North Charleston South Carolina,nan,nan,nan,nan,2,0,1/7/01,262-265 ST  - Poster abstracts. The National Association of Bariatric Nurses 4th Annual Meeting and Conference October 24-27 2007 North Charleston South Carolina-,{NULL}
679,316114,,eng,,nan,,,52,1/10/01,79-85,
680,626797,Meta-analyses of experimental data in animal nutrition.,eng,Journal of Experimental Psychology: General,nan,0096-3445,137,3,1/8/08,514-27,{Aaron P BlaisdellJa%red WongKenneth J LeisingMichael R Waldma??nn}
681,,Differential functional connectivity within an emotion regulation %neural network among individuals resilient and susceptible to the depressogenic effects of early life stress.,eng,,nan,003$6-8148 0036-8148,50,29.699540063236864,1/13/03,5%0-5$5,{Vanashri Nargund-JoshiJean S. Lee}
682,811629,Implementing pharmacogenetics: Pharmarray acodose and pharmacogenetic consultation,,Basic and Clinical Pharmacology and Toxicology,nan,,113,0,,22,
683,280418,Designing in the social context: Using the social ??contextual model of health behavior change to develop a tobacco control intervention for teachers in India,English,,nan,0268-1153,28,1,1/13/01,113-129,
684,757660,Association of interleukin-10 cytokine expression status with HLA non-DRB1*02 and Mycobacterium bovis BCG scar-negative status in south Indian pulmonary tuberculosis patients.,eng,Infection and immunity,Infect. Immun.,0019-9567,69,9,,5635-42,{A D NageswariS VaniP MuthuveeralakshmiS ShanmugalakshmiV DheenadhayalanG ArivarignanR M Pitchappan}
685,54163,Abstracts 15#,,,nan,,,0,1$/??10/01,nan,{P MroczkowskiR KubeA DzikiB MoranH LippertI Gastinger}
686,,,eng,Photomedicine and laser surgery,Photomed Laser Surg,,14,1,1/14/01,9-Mar,{Norbert GutknechtManuel F CarvalhoIrene Pina-VazMiguel R MartinsJose A CapelasMiguel A Martins}
687,293974,,eng,Eastern Mediterranean Health ??Journal,nan,1020-3397,81,4,1/14/01,257-264,{S HajjemM HsairiN Ben MansourH SkhiriH Aounallah-Skhiri}
688,247571,Anterior olecranon fracture-dislocations of the elbow in children. A report of four cases,eng,J Bone Joint Surg Am,The Journal of bone and joint surgery. Ameri??c@@an volume,00@@21-9355 (Print),91,6,1/9/01,1487-90,{D. RingR. G. AlbersT. G. Guitton}
689,,,eng,Oral surgery oral medicine oral pathology oral radiology and endodontics,Oral Surg Oral Med Oral Pathol Oral Radiol Endod,1528-395X,,1,1/$9/$07,nan,{Su-Gwan KimJi-Yeon AhnYoung-Kyun KimJong-Wan KimPil-Young Yun}
690,38197,[Studies on cefotaxime (HR 756) concentration in human biliary tract and clinical effect for acute or subacute cholecystitis with cholelithiasis (author's transl)],jpn,,nan,,121.9922687349151,0,1/1??/81??,447-52 ST  - [Studies on cefotaxime (HR 756) concentration in human biliary tract and clinical effect for acute or subacute cholecystitis with cholelithiasis (author's transl)]-,{I. HashimotoS. HirasawaY. SawadaY. KasaiJ. MikamiH. AbeM. NakanishiE. BekkiK. KasaiT. NakamuraM. DA  - Mar DP  - NLM ET  - 1981/03/01 Omosu}
691,,Isolated cerebellar involvement in a case of posterior reversible leukoencephalopathy.,en$g,C#linical r%adiology,Clin Radiol,#Sep-60,61,11,,983-6,{M CaliskanM Karab_c_ogluA CitakN UzelK AydinA NayirD D Soysal}
692,,The rocky road to rational prescribing,,,nan,,96,0,,nan,{I. Williamson}
693,,Defining interaction interfaces important for the establishmen$t of cell polarity in Drosophila @@neuroblasts,eng,FASEB Journal. Conference: Experimental Biology,nan,,,1,1/14/01,nan,{K. PrehodaA. NovakJ. Mauser}
694,45797,The exercise prescription: focus on vascular mechanisms.,,Blood pressure monitoring,nan,1473-5725,2,3,6/1/97,nan,{[Collective Name] Jennings[Collective Name] Kingwell}
695,605277,Child social skills training in developme??ntal crime prevention: effects on antisocial behavior and social competence.,,,Psicothema,,18,3,1@@/6/08,603-1??@@0,{Andreas BeelmannFriedrich L_sel}
696,749261,Soda and cell aging: associations between sugar-sweetened beverage consumption and leukocyte telomere length in healthy adults from the National Health and Nutrition Examination Surveys,eng,Am J Public Health,nan,1541-0048,104,05,1/14/01,2425?#?-31,{N. E. AdlerJ. LinE. S. EpelD. H. RehkopfB. A. LaraiaE. H. BlackburnB. L. NeedhamC. W. Leung}
697,752305,Unsuspected ethanol ingestion through soft drinks and flavored beverages,,J Anal Toxicol,Journal of analytical toxicology,0146-4760 (Print) 0146-4760,20,5,1/1/96,332-3,{L. KadehjianE. J. ConeB. A. Goldberger}
698,,Altering existing buildings in the UK,,Energy Policy,nan,0301-4$215@@,36,12,1/8/01,4482-4486,{S. Roberts}
699,150198,The c@@oncept of neurosis in a cross-cultural pe??rspective,eng,,nan,,20,0,,47-51 ST  - The concept of neurosis in a cross-cultural perspective-,{S. K. ChaturvediD. CN  - PubMed_140821 DA  - Jan DO  - 10.1097/YCO.0b013e328010ca65 DP  - NLM ET  - 2006/12/05 Bhugra}
700,894415,internetQueryObject to Partner With DataFlux; iQO to Provide Enhanced Application Scalability through QueryObject System; Dat@@aFlux to Enhance Data Accuracy through dfPower,English,Business Wire??,nan,,0,0,7/1/00,1-Jan,{Business/Technology Editors}
701,785707.3776501695,Feasibility of using hospital personnel to create a sustainable CPR training program for family members of hospitalized patients,eng,,nan,,126,,1/12/01,nan,{J. LeB. RiegelB. J. BobrowA. L. BlewerB. S. AbellaM. LearyD. Buckler}
702,556090,Lung function efficacy of olodaterol qd delivered via respimat vs placebo and formoterol bid in patients with COPD: two 48-week studies [Abstract],Englis#%h,Respirology (Carlton Vic.),Respirology,1440-1843,0,0,1#/14/01,120 [TP 184],{Pizzichini EHart LPaggiaro PHamilton APeters MKorducki LDe Salvo MDe La Hoz AKoch A}
703,770589,Antenatal lower genital tract infection screening and treatment programs for preventing preterm delivery,eng,Cochrane Database Syst Rev,nan,1469-493X,2,0,,Cd006178,{U. S. SangkomkamhangP. LumbiganonW. PrasertcharoensukM. Laopaiboon}
704,450743,Meta-analysis of guided bronchoscopy for the evaluation of the pulmonary nodule.,nan,,nan,nan,,0,,nan,{NULL}
705,157566,Bladder cancer and urothelial impairment: the role of TRPV1 as potential drug target.,eng,BioMed research international,nan,2314-6141,6168.648479780803,,1/14/01,987149,{Paolo Dell'OglioAlessandro LarcherNicola FossatiNicol_ Maria BuffiAlberto AbrateGiuliana ListaFrancesco MontorsiFrancesco MistrettaMassimo LazzeriGiorgio GuazzoniGiovanni Lughezzani}
706,,Effect of a cooling hood on physiological responses to work in a hot environment,eng,J A@@ppl Physiol,Journal of applied physiology,0021-8987 (Print)     0021-8987,29,1,1/1/70,Sep-36,{E. Shvartz}
707,560120,A novel approach to control hyperglycemia in type 2 diabetes: sodium glucose co-transport (SGLT) inhibitors: systematic %review and meta-analysis of randomized trials.,eng,,Ann. Med.,1365-2060,44,4,1/12/06,375-93,{Gianfranco PaganoGiovanni MussoMaurizio CassaderRoberto Gambino}
708,323820.282742984,Obesity weight change and risks for hypertension diabetes and hypercholesterolemia in Japanese men.,,European journal of clinical nutrition,Eur J Clin Nutr,0954-3007,56,7,1/2/07,601-7,{K Ishikawa-TakataT OhtaK MoritakiT GotouS Inoue}
709,3397422.677221737,Delayed costs of suppressed pain.,eng,Journal of personality and social psychology,J Pers Soc Psychol,,64,2,,274-82,{D CioffiJ Holloway}
710,265969,Osteoarthritis of the thumb carpometacarpal joint in women and occupational risk factors: a case-control study,eng,J Hand Surg$ Am$,The Journal of$ hand surgery,0363-5023,32,,1/7/01,$459-65#,{J. M. ClaiseS. NeelP. CatilinaL. FontanaS. Ughetto}
711,820508,A comparative outcome study of body awareness therapy feldenkrais and conventional physiotherapy for patients with nonspecific musculoskeletal disorders: Changes in psychological symptoms pain and self-image,English,Physiotherapy Theory and Practice,Physiother. Theory Pract.,09593985 (ISSN),17,2,1/1/01,77-95,{E.-B. Malmgren-OlssonK. ArmeliusB.-. Armelius}
712,446026,Use of implantabl??e cardioverter-defibrillators for primary prevention in older patients: A systematic literature review and meta-analysis.,nan,,nan,nan,,0,,nan,{NULL}
713,84941,,eng??,BMC neurology,BMC Neurol,,12,-4.741753002648187,1/12/01,25,{Anna BrownJane GreenValerie BeralGillian ReevesPat Doyle}
714,,Burkholderia cepacia complex infection in a case of sinonasal polyposis recurrence without cystic fibrosis,%eng,,nan,,35,3,1/8/01,414-6,{A. PavinA. StaffieriG. MarioniG. Bre%sciaR. Rinaldi}
715,428909,Pilot randomized controlled trial of web-based acceptance and commitment therapy for smoking cessation.,eng,Nicotine & Tobacco Research,nan,1462-22%03,15,10,1/13/10,1756-1764,{Jaimee L. HeffnerJonathan BrickerBryan ComstockChristopher Wyszynski}
716,110453,Anti-hypertensive medicines prescribing for medical outpatients in a premier teaching hospital in Nigeria: a probable shift of paradigm.,eng,Pharmacy practice,Pharm Pract (Granada),1885-642X,12,2,1/14/04,nan,{Kazeem B YusuffUnyime I Eshiet}
717,,Agitation aggression and disinhibition syndromes after traumatic brain injury,,NeuroRehabilitation,Neur%oRehabilitation,1053-8135,17,4,1/2/01,297-310,{E. Kim}
718,82695,The effect of lymphatico-venous anastomosis for an intractable ulcer at the lower leg in a marked obese patient.,eng,,Microsurgery,1098-2752,34,4,1/14/01,Jul-64,{Hisako HaraYukio SekiNoriyuki MuraiIsao KoshimaTakuya IidaMakoto MiharaTakeshi Todokoro}
719,820059,Effects of multifunctional fabrics on cardiac autonomic tone and psychological state,English,International Journal of Neuroscience,nan,0020-7454,114,8,1/4/01,nan,
720,771288,Manual versus electric vacuum aspiration for first-trimester abortion: a systematic review,en#g,,BJOG : an international journal of obstetrics and gynaecology,1470-0328 (Print) 1470-0328,115,1,1/1/86,13-May,{F. DengJ. WenQ. Y. CaiY. P. Li}
721,54202,Behaviour Research and Thera@@py Outcome predictors in guided and unguided self-help for social anxiety disorder,,Behaviour Research and Therapy,nan,,50,1,1?@@?/12/01,13-21 DO  - 10.1016/j.brat.2011.10.009,{O E HavikP CarlbringL G _stT NordgreenG AnderssonT Furmark}
722,3268830,,eng,J Pediatr (Rio J),nan,0021-7557,91,5,1/15/01,nan,{M. H. de Oliveira Juni$orE. S. SarinhoG. V. de AraujoD. M. Peixoto}
723,741279,Bradykinin is a mediator but unlikely a trigger of antiarrhythmic effects of ischemic preconditioning,,Journal of Cardiovascular Electrophysiology,nan,,18,1,1%/7/01@@,93-99 7p,{S. V. Driamo@@vS. ButzP. T. BuserC. E. ZauggM. Bellahcene}
724,64430,Symptoms tell it all: a systematic review of the value of symptom assessment to predict survival in advanced cancer patients.,eng,Molecular plant pathology,Mol. Plant Pathol.,1364-3703,13,8,1/12/10,900-14,{Siwy Ling YangKuang-Ren Chung}
725,461657,Review of epidemiology and management of atrial fibrillation in developing countries.,nan,,nan,nan,0,0,,nan,{NULL}
726,240949,William H. Taft High School Project HOLA 1985-1986. OEA Evaluation Report.,,,nan,,0,,@@1/%1/86,nan,{Brooklyn. Office of Educational Assessment. New York City Board of Education}
727,453909,The lung cancer management guidelines 2012.,,,nan,,,0,,nan,
728,222452,Special problems in the prosthetic rehabilitation of deep bite,,,nan,,,2,1/1/75,170-5,{R. Voss}
729,163839,The potential impact of bias in studies of residential exposure to magnetic fields and childhood leukemia,nan,Bioelectromagnetics,Bioelectromagnetics,1521-186X,0,,1/1/01,S32-47,{NULL}
730,696132,Changes of interaction during the development of a mathematical learning environment.,eng,,nan,1386-4416 #1386-4416,14,5,1/11/10,nan,{dirk.hoek@ou.nl Hoek Dirk1Koeno2 Gravemeijer}
731,257990,An internet-based program to enhance motivation to change in females with symptoms of an e$at??ing disorder: A randomized controlled trial,,,nan,,44,0,1%/%14/01,1947-1963,{Hotzel?? KR von BrachelKosfelder JHechler TVocks SRieger ESchulte DSchmidt U}
732,1590034,Air pollution and risk of urinary bladder cancer in a case-control study in Spain,,Occupational and environmental medicine,Occup Environ Med,14??70-79@@26,65,1,1/8/01,56-60,{Nuria MalatsAlfredo CarratoManolis KogevinasNathaniel RothmanConsol SerraReina Garcia-ClosasDebra SilvermanAdonina TardonKenneth P. CantorMustafa DosemeciGemma Castano-VinyalsRoel Vermeulen}
733,617801,Remission rates following antidepressant therapy with bupropion or selective serotonin reuptake inhibitors: a meta-analysis of original data from 7 randomized controlled trials.,eng,J. Clin. Psychiatry,nan,0160-6689@@,360.7720146556190,18,1/5/08,9%74-@@81,{Michael E ThaseYounghua WangApril E HarriettMelinda MittonCarol B RockettBarbara R HaightJack G ModellNathalie RichardSusan VanMeter}
734,480030,Adaptive convex combination approach for the identification of improper quaternion processes,eng,,nan,,25,1,,172-82,{C. JahanchahiC. C. TookB. C. UjangD. P. Mandic}
735,660499,,eng,Violencia contra a crianca: revelando o perfil dos atendimentos em servicos de emergencia Brasil 2006 e 2007.,nan,,25,1,1/9/01,28$-Jul,{Marl$os Rodrigues DominguesAna Cla$udia Gastal FassaMaria Laura Vidal Carret}
736,355078,Use of episiotomy in the United States,eng,Birth,nan,1@@@@523-536X,29,,,Jun-74@@,{M. C. Klein}
737,696985,The Diversion of Ultram Ultracet and generic tramadol HCL.,eng,Journal of addictive diseases,nan,1545-0848,25,2,,53-58,
738,826471,Aberrances in autonomic cardiovascular regulation in fibromyalgia syndrome and their relevance for clinical pain reports,eng,Psychosomatic medicine,Psychosom Med,0033-3174,,,1/10/01,462-70,{Sergio GarridoAngeles PulgarStefan DuschekMar_a Mart_n-VzquezGustavo A Reyes Del Paso}
739,807737,Sorafenib and pegylated interferon-alpha-2b in advanced metastatic melanoma: A multicenter phase II DeCOG trial,,,nan,0732-183X,28,15,,nan,
740,,Dispersal of methicillin-resistant Staphylococcus epidermidis by staff in an operating suite for thoracic and cardiovascular surgery: relation to skin carriage and clothing,eng,J H??osp Infect,nan,0195-6701 (Print) 0195-6701,,,1/1/00,nan,{P. DomicelA. Tammel#inE. StahleA. Hambraeus}??
741,322953,Psychometric validation of the Growth and Empowerment Measure (GEM) applied with Indigenous Australians,eng,Australian and New Zealand Journal of Psychiatry,nan,Apr$-74,44,9,1/10/01,nan,{Komla TseyMelissa R HaswellLyndon ReillyDavid KavanaghChris DoranArlene LaliberteAndrew WilsonYvonne Cadet-James}
742,479495.75967545214,Alveolar soft part sarcoma of the uterine corpus. Report of two cases and review of the literature,eng,,nan,,194,,1/1/98,59-63,{K. RadigA. RoessnerP. Buhtz}
743,768513.3163425239,It's Time Practitioners Help Families Clear the Air of Secondhand Smoke: A Commentary on Pyle et al. (2005),eng,,nan,,23,0,1/5/01,25-29,{Geoffrey C. WilliamsBai Brownson Difranza Gehrman Glantz Law Mokdad Ory Panagiotakos Pechacek Pyle Sargent Sweda Whincup Whitlock Arcavi}
744,440684,Hemostatic resuscitation for massive bleeding: The paradigm of plasma and platelets - A review of the current literature.,nan,,nan,nan,0,0,,nan,{NULL}
745,758629,Studies on the biological activity of two strains of BCG: influence of production conditions.,eng,DEV. BIOL. STAND.,nan,0301-5149,58,-3.9349201030246217,1/1/86,nan,{M ChouchkovaA Engibarov}
746,,Myocardial fibrosis by T1 mapping is an early indicator of severe cardiac allograft vasculopathy,eng,$Circulation,Circulation,1524-4539,128,22,1/13/01,nan,{N. HarcourtS. C. MasriM. ColvinG. Raveendran}
747,265490,Follistatin-like protein 1 regulates chondrocyte proliferation and chondrogen$ic differentiation of mesenchymal% stem cells,Eng,Ann Rheum Dis,Annals of the rheumatic $diseases,Mar-67,0,0,,nan,{S. M. SmithA. D. MarinovR. HirschD. S. BushnellB. T. CampfieldH. C. BlairY. Chaly}
748,,Structural brain changes %associated with antipsychotic treatment in schizophrenia      as revealed by voxel-based morphometric MRI: an activation likelihood estimation %      meta-analysis.,nan,,nan,nan,0,0,,nan,{NULL}
749,749844,Insights in public health: taxing sugar sweetened beverages to improve public health: policy action in Hawai'i. Doctoral Health Policy Seminar Spring 2013,eng,Hawaii J Med Public Health,nan,,72,75,1/13/01,286-91,{T. SentellT. UsagawaM. HagiwaraT. PeacockH. Hee HeoM. G. PearceL. ChoyM. R. Dela Cruz}
750,,[Evidence-based therapy guideline of the German Working Group on Obesity in Childhood and Adolescence].,eng,,Bundesgesundheitsblatt Ge$sundheitsforschung Gesundheitsschu#tz,1437-1588,240.4875887487618,5,1/11/05,584-90,{M W%abitschA MossD Kunze}
751,166521,The cost of national service frameworks,eng,,nan,,65,0,1/4/01,nan,{R. CN  - PubMed DA  - Feb DP  - NLM ET  - 2004/03/05 Boyle}
752,,Simple steps to fitness. Secrets of stre??ngth. Strength training is as important to weight loss and fitness as aerobic exercise is but many people ignore it. Here's how to get started.,eng,Diabetes forecast,nan,0095-8301,,8,1/2/08,9$8--100,{Shauna S Roberts}
753,181456,H??omeplace and Housing in the Lives of Low-Income Urban African Ame#rican Families,,,nan,,0,0,,$166??-188,{Linda M. BurtonAltman Bullard Burton Burton Burton Burton Burton Clark Conley Dilworth-Williams Fischer Foucault Franklin Gieryn Gilbert Goering Hooks Howard Kidder Lahiri Lawson Clark Lawson Clark Lawson Clark Low Massey Oliver Perkins Rosenbaum Rosenbaum Sanders Stack AllanSherri Lawson Clark}
754,2736281.766102648,,ENG,Biomedical reports,Biomed Rep,2049-94@@34,1,3,1/13/05,464-468,{Yan-Yan LiYun QianChuan-Wei Zhou}
755,276001,[Effects of tobacco advertising regulations in various countries],eng,Nihon Kosh#u Eisei Zasshi,[Nihon koshu eisei zasshi] Japanese journal of public health,0546-1766 (Print) 0546-1766,42,53,1/1/95,1017-28,{T. S@@one@@}
756,,Intensive glucose control in the management of diabetes mellitus and inpatient hyperglycemia,eng,Am J Health Syst Pharm,American jou#rnal of health-system pharmacy : AJHP : official journal of the American Society of Health-System Pharmacists??,1079-2082 (Print) 1079-2082,67,10,1/1#0/??01,798-805,
757,2462899.058486368,The link between smoking and impotence: two decades of evidence.,eng,Oncology n#ursing forum,Oncol Nurs F??@@orum,0190-535X,,5,1/1/06,815-22,{Y@@@@ L Ku}
758,433039,Palliative sedation therapy in the last weeks of life: a literature review and recommendations for standards.,,,nan,,0,0,,nan,
759,737167,Understanding depression in palliative and end-of-life care,en,Nurs Stand,#Nursing standard (Royal College of Nursing (Great Britain) %: 1987),0029-6%570 (Print) 0029-6570,23,12,,48-57; quiz 58 60,{S. AshelfordV. Taylor}
760,744601,Inhaled anticholinergics and risk for acute urinary retention: A case-crossover and case-time-control study,,Value Health,nan,,17,7,,A776,
761,856471,,eng,EXPERIMENT??AL C#ELL RESEARCH,nan,,284,2,,283-90,{W. HunzikerK. H. Tan}
762,570704,Rituximab$-related viral infections in lymphoma patients.,eng,Leukemia & Lymphoma,nan,1042-8194,,7,1/7/07,nan,{Saadettin KilickapOmer DizdarSercan AksoyIbrahim BaristaHakan HarputluogluKadri AltundagDidem Sener Dede}
763,520153,Fetal lung volume measurements: determination with MR imaging--effect of various factors.,,RADIOLOGY,nan,0033-8419,240,3.612467396395641,1/6/07,187-93,{Carol E BarnewoltHiroto HatabuMizuki NishinoDeborah LevineHenry A Feldman??Judy A Estr%offValerie L Ward}
764,259267,Intra-operative change of gastric ph during laparotomic cholecystectomy under general anaesthesia: A prospective case-control study,eng,,nan,,56,,1/12/01,40-43,{S. DeyP. BhattacharyyaB. K. BiswasB. BhattaraiP. Bhakta}
765,24381,The CARE guidelines: consensus-based clinical case reporting guideline development.,eng,Headache,Headache,1526-4610@@,,10,1/13/11,1541-7,{[Collective Name] CARE GroupJoel J GagnierDavid MoherDouglas G AltmanGunver KienleDavid RileyHarold Sox}
766,827921,Effect of a creative-bonding intervention on Taiwanese nursing students' self-transcendence and attitudes toward elders.,eng,Res Nurs Health,nan,1098-240X,32,2,1/9/04,204-16,
767,461204,Fc receptor-like 3 (FCRL3) -169 C/T polymorphism and systemic lupus erythematosus: A meta-analysis.,nan,,nan,nan,0,,,nan,{NULL}
768,482860,[Indirect anastomoses for moyamoya disease].,jpn,No shink#ei geka. @@Neurological surgery,nan,0301-2603,26,9,,nan,{Y Mats@@us$hima}
769,18298,Ulcer Healing After Peripheral Intervention.,ENG,,Circ. J.,1347-4820,-1.0,-1,4/14/07,nan,{Daiki UchidaYukihiro SaitoHisashi UchidaAtsuhiro KoyaNobuyoshi Azuma}
770,365654,Measuring the bright side of being blue: a new tool for assessing analytical rumination in depression.,eng,PLoS One,PloS one,1932-6203,9,11,1/14/01,e112077,{Skye P BarbicPaul W AndrewsZachary Durisko}
771,3032503.908480803,[Mammographic density: a valid risk factor for breast cancer?].,f??re??,Prvention de l'insuffisance rnale induite par les produits de contrnste iodes,nan,0221-0363,89,9,1/8/09,nan,{G Bou??tet}
772,2028576,,eng,Ann. Hematol.,nan,0939-5555,80,-3.7724102633403382,1/1/01,B123%-6#,
773,88262,Core symptom measures in cancer clinical trials.,eng??,Journal of the National Cancer Institute,J. Natl. Cancer Inst.,1460-2105@@,106,7,1/14/07,nan,{Carolyn Gotay}
774,3537179,Human papillomavirus infection and increased risk of HIV acquisition. A systematic review and meta-analysis.,eng,AIDS (London England),AIDS,1473-5571,26,17,11/13/12,2211-22,{Chunhui WangRichard HayesLouise KuhnStephen ShiboskiJennifer S SmithNatasha L LarkeDeborah Watson-JonesCatherine F Houliha??nPatti E GravittKaren K Smith-McCune}
775,718292,Prevalence of different morphologic forms of the human tongue in young Finns.,eng,Oral surgery oral medicine and oral pathology,Oral Surg. Oral Med. Oral Pathol.,0030-4220,53,2,2/1/82,152-6,{M MikkonenR KotilainenA Kullaa-Mikkonen}
776,245200,Osteoporosis in men,eng,Arch Intern Med,Archives of internal medi@@cine,0003-9926 (Print) 0003-9926,158,2,@@1/1/98,194,{M. Galus}
777,,Neurolymphatische Bahnen: neue wissenschaftliche Nachweise untermauern die Perrin-Technik,,,nan,,14,2,1$/13/06,15-Oct,{Raymond N. Perrin}
778,217418,Long term follow-up of conservative treatment of severely traumatized maxillary incisors,,,nan,,29,4,1/1/97,190-192,{Z. HirschfeldI. BrinA. FuksM. Guelmann}
779,2356916.338160941,Magnetic resonance imaging evaluation of bone marrow changes in obstructive sleep apnoea syndrome in adults,English     Italian,,nan,,46,4,1/6/01,572-84,{A. R. AleandriD. ManciniT. CosentiniR. Le DonneN. Colavita}
780,62246,Pulpal response to a fluoride-releasing all-in-one resin bonding system.,eng,Operative %dentistry,Oper Dent,,27,3,1/2/05,nan,{Masayuki OtsukiMakoto ArakawaHidekazu SonodaYasutaka SasafuchiYuichi KitasakoJunji Tagami}
781,945021,Improvement of action tremor by chronic cortical stimulation,eng,Mov Diso#rd,Movement disorders : official journal of the Movement Disorder Society,0885-3185,13,5,1/1/98,Aug-84,{B. PollinC. GenyJ. P. NguyenP. CesaroA. Feve}$
782,,Out-of-hospital cardiac arrests occurring in southern Ontario health care clinics: bystander cardiopulmonary resuscitation and automated external defibrillator use.,eng,Psychological assessment,Psychol Assess,,22,2,1/10/06,336-49,{Scott O LilienfeldKeli Holloway AllenHoward N GarbJessica L WildermuthM Teresa NezworskiJames M Wood}
783,934327,Use of a Brief Phone Call After ED Discharge,,,nan,,0,,,nan,{NCT01893931 }
784,546484,,eng,,nan,1303-6521,,2,1/11/04,234-249,{Wu-Yuin HwangGuo-Liang Hsu}
