ID,id,article_title,article_language,journal_title,jounral_abbreviation,journal_issn,article_jvolumn,article_jissue,article_jcreated_at,article_pagination,author_list
715,428909,Pilot randomized controlled trial of web-based a$cceptance and commitment therapy for smoking cessation.,nan,Nicotine & Tobacco Research,nan,1462-2203,64,10,1/13/10,1@@756-1764,{Jaimee L. HeffnerJonathan BrickerBryan ComstockChristopher Wyszynski}
716,110453,Anti-hypertensive medicines prescribing for medical outpatients in a premier teaching hospital in Nigeria: a probable shift of paradigm.,eng,Pharmacy practice,nan,1885-642X,12,2,1/14/04,419,{Kazeem B YusuffUnyime I Eshiet}
717,2716045.183014998,Agitation aggression and disinhibition syndromes after traumatic brain injury,nan,NeuroReha#bilitati$on,#NeuroR%ehabilitation,nan,17,4,1/2/01,????297-310,{E. Kim}
718,82695,The effect of lymphatico-venous anastomosis for an intractable ulcer at the lower leg in a marked obese patient.,eng,Microsurgery,Microsurgery,1098-2752,34,1,1/1%4/$01,Jul-64,{Hisako HaraYukio SekiNoriyuki MuraiIsao KoshimaTakuya IidaMakoto MiharaTakeshi Todokoro}
719,820059,Effects of multifunctional fabrics on cardiac autonomic tone and psychological state,English,International Journal of Neuroscience,Int.J.Neurosci.,0??020-7454,114,,1/4/01,923-931,{K.-W. ParkJ. SongH.-J. KimS.-R. MoonM.S. Lee}
720,771288,Manual versus electric vacuum aspiration for first-trimester abortion: a systematic review,eng,Bjog,BJOG : an international journal of obstetrics and gynaecology,1470-0328 (Print) 1470-0328,115,1,1/8/01,13-May,{F. DengJ.@@ WenQ. Y. CaiY. P. L??i}
721,54202,Behaviour Research and Therapy Outcome predictors in guided and unguided self-help for social anxiety disorder,nan,Behaviour Research and Therapy,nan,3.086830623975172,50,5.9200470581735,1/12/01,13-21 DO  - 10.1016/j.brat.2011.10.009,{O E HavikP CarlbringL G _stT NordgreenG AnderssonT Furmark}
722,888477,Probiotics for the treatment of upper and lower respiratory-tract infections in children: systematic review based on randomized clinical trials,eng,J Pediatr (Rio J),Jornal de pediatria,0021-7557,91,5,,413-27,{M. H. de Oliveira JuniorE. S.?? S$arinhoG. V. de AraujoD. M. Peixoto}
723,31,Bradykinin is a mediator but unlikely a trigger of antiarrhythmic effects of ischemic preconditioning,nan,Journal of Cardiovascular Electrophysiology,nan,nan,,1,1/7/01,93-99 7p,{S. V. DriamovS. ButzP. T. BuserC. E. ZauggM. Bellahcene}
724,64430,The NADPH oxidase-mediated production of hydrogen peroxide (H(2)O(2)) and resistance to oxidative stress in the necrotrophic pathogen Alternaria alternata of citrus.,ger,Molecular plant pathology,Mol. Plant Pathol.,1364-3#703??,13,8,1/12/10,??900-14,{Siwy Ling YangKuang-Ren Chung}
725,461657,Review of epidemiology and management of atrial fibrillation in developing countries.,nan,nan,nan,nan,0,0,,nan,@@{NU#LL}
726,240949,William H. Taft High School Project HOLA 1985-1986. OEA Evaluation Report.,eng,nan,nan,nan,0,0,1/1/86,nan,{Brooklyn. Office of Educational Assessment. New York City Board of Education}
727,453909,The lung cancer management guidelines 2012.,nan,nan,nan,nan,0,0,nan,nan,{NULL}
728,222452,Special problems in the prosthetic rehab#ilitation of deep bite,nan,nan,nan,nan,30,,%1/1/75,170-5,{R. Voss}
729,69898,The potential impact of bias in studies of residential exposure to magnetic fields and childhood leukemia,nan,Bioelectromagnetics,Bioelectr%omagnetics,1521-186X,0,0,1/1/01,nan,{NULL}
730,696132,Changes of interaction during the development of a mathematical learning environment.,nan,Journal of Mathematics Teacher Education,nan,1386-4416 1386-4416,14,5,1/11/10,393-411,{dirk.hoek@ou.nl Hoek Dirk1Koeno2 Gravemeijer}
731,257990,An internet-based program to enhance motivation to change in females with symptoms of an eating disorder: A randomized controlled trial,nan,nan,nan,nan,,0,1/14/01,1947-1963,
732,332032,Air pollution and risk of urinary bladder cancer in a case-control study in Spain,nan,nan,Occup Environ Med,1470-7926,65,3.181556450199087,1/8/01,56-60,{Nuria MalatsAlfredo CarratoManolis KogevinasNathaniel RothmanConsol SerraReina Garcia-ClosasDebra SilvermanAdonina TardonKenneth P. CantorMustafa DosemeciGemma Castano-VinyalsRoel Vermeulen}
733,617801,Remission rates following antidepressant therapy with bupropion or selective serotonin reuptake inhibitors: a meta-analysis of original data from 7 randomized controlled trials.,eng,J. Clin. Psychiatry,nan,0160-6689,66,8,1/5/08,974-81,{Michael E ThaseYounghua WangApril E HarriettMelinda MittonCarol B RockettBarbara R HaightJack G ModellNatha??lie RichardSusan VanMeter}
734,480030,Adaptive convex combination approach for the identification of improper quaternion processes,eng,nan,nan,nan,25,1,1/14/01,172-82,{C. JahanchahiC. C. TookB. C. UjangD. P. Mandic}
735,660499,Inappropriate use of emergency services: a system@@atic review of prevalence and associated fa%ctors.,eng,Violencia contra a crianca: revelando o perfil dos atendimentos em servicos de emergencia Brasil 2006 e 2007.,nan,167$8-446#4,25,1,1/9/01,28-Jul,{Marlos Rodrigues DominguesAna Claudia Gastal FassaMaria Laura Vidal Carret}
736,355078,Us%e of episiotomy in the United States,eng,Birth,nan,1523-%536??X,29,4.305685286179287,1/2/01,Jun-74,{M. C. Klein}
737,nan,The Diversion of Ultram Ultracet and generic tramadol HCL.,eng,Journal of addictive diseases,J Addict Dis,1545-084#8,25,,1/6/01#??,nan,{George E. WoodyAnne GellerEdgar H. AdamsTheodore J. CiceroAlvaro MunozEdward C. SenayJames A. Inciardi}
738,826471,Aberrances in autonomic cardiovascular regulation in fibromy%algia syn#drome and their relevance for clinical pain reports,eng,Psychosomatic medicine,Psychosom Med,0033-3174,72,5,1/10/01,46??#2-70,{Sergio GarridoAngeles PulgarStefan DuschekMar_a Mart_n-VzquezGustavo A Reyes Del Paso}
739,3016591.817265967,Sorafenib and pegylated interferon-alpha-2b in @@advanced metastatic melanoma: A multicenter phase II DeCOG trial$,nan,J. Clin. Oncol.,nan,0732-183X,28,15,,nan,{Ugurel S.Schadendorf D.Garbe C.Tre$fzer U.Egberts F.Hassel J.Weichenthal M.Hauschild A.Mauch C.Gutzmer R.}
740,875781,Dispersal of methicillin-resistant Staphylococcus epidermidis by staff in an operating suite for thoracic and cardiovascular surgery: relation to skin carriage and clothing,eng,#J Hosp Infect,The Journal of hospital infection,0195-6701 (Print) 0195-6701,44,2,1/1/##00,119-26,{P. DomicelA. TammelinE. Sta??hleA. %Hambraeus}
741,322953,Psychometric validation of the Growth and Empowerment Measure (GEM) applied with Indigenous Australians,nan,Australian and New Zealand Journal of Psychiatry,3.5174689601955085,Apr-74,44,9,1/10/01,791-799,{Komla TseyMelissa R HaswellLyndon ReillyDavid KavanaghChris DoranArlene LaliberteAndrew WilsonYvonne Cadet-James}
742,123731,Alveolar soft part sarcoma of the uterine corpus. Report of two cases and review of the literature,eng,nan,nan,nan,194,,1/1/98,59-63,
743,nan,It's Time Practitioners Help Families Clear the Air of Secondhand Smoke: A Commentary on Pyle et al. (2005),eng,nan,3.9541191262733126,nan,23,0,1/5/01,25-29,{Geoffrey C. WilliamsBai Brownson Difranza Gehrman Glantz Law Mokdad Ory Panagiotakos Pechacek Pyle Sargent Sweda Whincup Whitlock Arcavi}
744,440684,Hemostatic resuscitation for massive bleeding: The paradigm of plasma and platelets - A review of the current literature.,nan,nan,nan,nan,0,0,nan,nan,{NULL}
745,758629,Studies on the biological activity of two strains of BCG: influence of production conditions.,eng,DEV. BIOL. S$T??AND.,nan,0301-5149,58,-1,1/1/86,105-18,{M ChouchkovaA Engibarov}
746,964184,Myocardial fibrosis by T1 mapping is an early indicator of severe cardiac allograft vasculopathy,nan,Circulation,Circulation,22-Sep,128,22,1/11/11,nan,{N. HarcourtS. C. %MasriM. ColvinG. Raveendran}
747,265490,Follistatin-like protein 1 regulates chondrocyte proliferation and chondrogenic differentiation of mesenchymal stem cells,Eng,Ann Rheum Dis,Annals of the rheumatic diseases,Mar-67,0,0,1/14/01,nan,{S. M. SmithA. D. MarinovR. HirschD. S. BushnellB. T. CampfieldH. C. BlairY. Chaly}
748,463556,Structural brain changes associated with antipsychotic treatment in schizophrenia      as revealed by voxel-based morphometric MRI: an activation likelihood estimation       meta-analysis.,nan,nan,nan,nan,0,0,nan,nan,{NULL}
749,749844,Insights in public health: taxing sugar sweetened beverages to improve public health: policy action in Hawai'i. Doctoral Health Policy Seminar Spring 2013,nan,Hawaii J Med Public Health,Hawai'i journal of medicine & public health : a journal of Asia Pacific Medicine & Public Health,2165-8242,,8,,286-91,{T. SentellT. UsagawaM. HagiwaraT. PeacockH. Hee HeoM. G. PearceL. ChoyM. R. Dela Cruz}
750,300057,[Evidence-based therapy guideline of the German Working Group on Obesity in Childhood and Adolescence].,ger,Bundesgesundheit??sblatt Gesundheitsforschung Gesundheitsschutz,Bundesgesundheitsblatt Gesundheitsforschung Gesundheitsschutz,1437-1588,54,5,1/11/05,584-90,{M WabitschA MossD Kunze}
751,166521,The cost of national service frameworks,eng,nan,nan,nan,65,0,1/4/01,68-9 ST  - The cost of national service frameworks-,{R. CN  - PubMed DA  - Feb DP  - NLM ET  - 2004/03/05 Boyle}
752,292018,Simple steps to fitness. Secrets of strength. Strength training is as important to weight loss and fitness as aerobic exercise is but many people ignore it. Here's how to get started.,eng,Diabetes forecast,nan,0095-8301,254.4,8,1/2/08,98--100,{S@@hauna S @@Roberts}
753,181456,Homeplace and Housing in the Lives of Low-Income Urban African American Families,eng,nan,nan,nan,0,0,1/5/01,166-188,{Linda M. BurtonAltman Bullard Burton Burto@@n Burton Burton Burton Clark Conley Dilworth-Williams Fischer Foucault Franklin Gieryn Gilbert Goering Hooks Howard Kidder Lahiri Lawson Clark Lawson Clark Lawson Clark Low Massey Oliver Perkins Rosenbaum Rosenbaum Sanders Stack AllanSher??ri Lawson Clark}
754,668772,Lack of association between the connexin 37 C1019T gene polymorphism and coronary artery disease in a Chinese population: Meta-analysis of 2206 subjects.,ENG,Biomedical reports,B@@iomed Rep,2049-9434,1,3,1/13/05,464-468,{Yan-Yan LiYun QianChuan-Wei Zhou}
755,276001,[Effects of tobacco advertising regulations in various countries],jpn,Nihon Koshu Eisei Zasshi,%[Nihon koshu eisei zasshi] Jap??anese journal of public health,0546-1766 (Print) 0546-1766,42,12,1/1/95,nan,${T. So??ne}
756,788507,Intensive glucose control in the management of diabetes mellitus and inpatient hyperglycemia,eng,Am J Health Syst Pharm,American journal of health-system pharmacy : AJHP : official journal of the American Society of Health-System Pharmacists,1079-2082 (Print) 1079-2082,67,10,1/10/01,798-805,{S. B. LevyA. O. Sho??gbon}#
757,620483,The value of breast self-examination: meta-analysis of the research literature.,eng,Oncolo%gy nursing forum,Oncol Nurs Forum,0190-535X,28,5,1/1/06,815-22,{Y L Ku}
758,433039,Palliative sedation therapy in the last weeks of life: a literature review and recommendations for standards.,nan,nan,nan,nan,0,0,,nan,{NULL}%
759,737167,Unde??rstanding depression in palliative and end-of-life care,en,nan,Nursing standard (Royal College of# Nursing (Great Britain) : 1987),0029-6570 (Print) 0029-6570,,12,,48-57; quiz 58 60,{S. AshelfordV. Taylor}
760,nan,Inhaled anticholinergics and risk for acute urinary retention: A case-crossover and c??ase-time-control study,nan,Value Health,nan,1098-3015,17,7,nan,A776,{Dilokthornsakul P.Joo M.J.Lee T.A.Pickard A.S.Lin F.J.}
761,856471,Compartmental@@ization of Fas and Fas ligand may prevent auto- or paracrine apoptosis in epithelial cells,eng,EXPERIMENTAL CELL RESEARCH,nan,nan,284,2,1/3/01,283-90,{W. HunzikerK. H. Tan}
762,570704,Rituximab-related viral infections in lymphoma patients.,eng,Leukemia & Lymphoma,nan,1042-8194,48,7,1/7/07,1307-12,{Saadettin KilickapOmer DizdarSercan AksoyIbrahim BaristaHakan HarputluogluKadri AltundagDidem Sener Dede}
763,520153,Fetal lung volume measurements: determination with MR imaging--effect of various factors.,eng,RADI@@OL%OGY,nan,nan,240,1,1/6/07,187-93,{Carol E BarnewoltHiroto HatabuMizuki NishinoDeborah LevineHenry A FeldmanJudy A EstroffValerie L Ward}
764,259267,Intra-opera%tive change of gastric ph during laparotomic cholecystectomy under general anaesthesia: A prospective case-control study,nan,nan,nan,nan,56,0,1/15/01,40-43,{S. DeyP. BhattacharyyaB. K. BiswasB. BhattaraiP. Bhakta}
765,24381,The CARE guidelines: consensus-based clinical case reporting guideline development.,eng,??H??eadache,Headache,nan,53,10,1/13/11,1541-7,{[Collective Name] CARE GroupJoel J GagnierDavid MoherDouglas G AltmanGunver KienleDavid RileyHarold Sox}
766,827921,Effect of a creative-bonding intervention on Taiwanese nursing students' self-transcendence and attitudes toward elders.,eng,Res Nurs Health,nan,1098-240X,32,2,1/9/04,204-16,{Sandra M WalshShiue Chen}
767,461204,Fc receptor-like 3 (FCRL3) -169 C/T polymorphism and systemic lupus erythematosus: A meta-analysis.,nan,nan,nan,nan,0,0,4.36524484846542,nan,
768,482860,[Indirect anasto#moses for moyamoya disease].,jpn,No shinkei geka. Neurological surgery,nan,0301-2%603,09.72335170693141,9,9/1/98,769-86,{Y Matsush#ima}
769,18298,Ulcer Healing Aft%er Peripheral Intervention.,ENG,Circulation journal : official journal of the Japanese Circulation Society,Circ. J.,1347-4820,-1,-1,4/14/07,nan,{Daiki UchidaYukihiro SaitoHisashi UchidaAtsuhiro KoyaNobuyoshi Azuma}
770,365654,Measuring the bright side of being blue: a new tool for assessing analytical rumination in depression.,eng,PLoS One,PloS one,1932-6203,44,11,1/14/01,nan,{Skye P BarbicPaul W AndrewsZachary Durisko}
771,625306,[Mammographic density: a valid risk factor for breast cancer?].,fre,Prvention de l'insuffisance rnale induite par les produits de contrnste iodes,nan,0221-0363,330.708812262604,9,1/8/09,1140-50,{G Boutet}
772,572343,High-dose sequential (HDS) chemotherapy for high-risk non-Hodgkin's lymphoma: long-term analysis and future developments.,eng,Ann. Hematol.,nan,0939-5555,41.63990098949654,,1/1/01,B123-6,{M LadettoD CaraccioloG RossiC MarinoneL BerguiA CutticaA SalomoneM BoccadoroI RiccaC TarellaM PaganoF ZallioP GavarottiA PileriA de Crescenzo}
773,88262,Core symptom measures in cancer clinical trials.,eng,Journal of the National Cancer Institute,J. Natl. Cancer Inst.,1460-2105,106,7,1/14/11,nan,{Jennifer PayneRukshanda AhmadGregory DoyleNorm PhillipsAnna M ChiarelliChristine WilsonKathleen DeckerAndrew ColdmanBin ZhangJacques Brisson}
774,663339,Human papillomavirus infection and increased risk of HIV acquisition. A systematic review and meta-analysis.,eng,AIDS (London England),AIDS,1473-5571,26,17,1??1/13/12,2211-22,{Chunhui WangRichard HayesLouise KuhnStephen ShiboskiJennifer S SmithNatasha L LarkeDeborah Watson-JonesCatherine F HoulihanPatti E GravittKaren K Smith-McCune}
775,718292,Prevalence of different morphologic forms of the human tongue in young Finns.,eng,Oral surgery oral medicine and oral pathology,Oral Surg. Oral Med. Oral Pathol.,0030-4220,53,2,,152-6,{M MikkonenR K??otilainenA Kullaa-Mikkonen}$
776,245200,Osteoporosis in men,eng,Arch Intern Med,Archives of internal medicine,0003-9926 (Print) 0003-9926,158,2,1/1/98,194,{M. Galus}
777,307302,Neurolymphatische Bahnen: neue wissenschaftliche Nachweise untermauern die Perrin-Technik,nan,nan,nan,nan,44.70984535359143,2,1/13/06,15-Oct,{Raymond N. Perrin}
778,1187552.143743684,Long term follow-up of conservative treatment of severely traumatized maxillary incisors,nan,nan,nan,4.269331247084985,67,4,1/1/97,nan,{Z. HirschfeldI. BrinA. FuksM. Guelmann}
779,413717,Magnet??ic resonance ima$ging evaluation of bone marrow changes in obstructive sleep apnoea syndrome in adults,English,nan,nan,nan,648.3,4,1/6/01,572-84,{A. R. AleandriD. ManciniT. CosentiniR. Le DonneN. Colavita}
780,62246,Pulpal response to a fluoride-releasing all-in-one resin bonding system.,??eng??,nan,Oper Dent,0361-7734,27,10.387453258374636,,271-7,{Masayuki OtsukiMakoto ArakawaHidekazu SonodaYasutaka SasafuchiYuichi KitasakoJunji Tagami}
781,nan,Improvement of action tremor by chronic cortical stimulation,eng,Mov Disord,Movement disorders : official journal of the Movement Disorder Society,0885??@@-3185,13,1,1/1/98,Aug-84,{B. PollinC. GenyJ. P. NguyenP. CesaroA. Feve}
782,649817,Validity of Rorschach Inkblot scores for discriminating psychopaths from non-psychopaths in forensic populations: a meta-analysis.,e%ng%,Psychological assessment,Psychol Assess,1939-134X,83,2,1/10/06,336-#49%,
783,934327,Use of a Brief Phone Call After ED Discharge,nan,nan,nan,nan,0,0,nan,nan,{NCT01893931 }
784,546484,The Effects of Pre-Reading and Sharing Mechanisms on Learning with the Use of Annotations,nan,Turkish Online Journal of Educational Technology - TOJET,nan,1303-6521,10,,1/11/04,234-249,{Wu-Yuin HwangGuo-Liang Hsu}
785,917231,[Occupational exposure to sevoflurane in pediatric operating rooms: the multi-point sampling method for risk assessment].,eng,Patologie asbesto correlate in congiunti di lavoratori del settore cemento-amianto.,nan,1592-7830,34,3,1/12/07,266-8,{V CerabonaM WachockaU MoscatoV CamisaM G TucciS ZaffinaV MontaldiA Poscia}
786,887418,Impact of crizotinib on patient-reported symptoms and global quality of life (QoL) compared with chemotherapy in a phase III study of advanced alk-positive non-small cell lung cancer (NSCLC),nan,European Journal of Cancer,nan,nan,61.96593831602644,0,%@@1/13/01,-,{V. HirshJ.Y. HanF. BlackhallS. IyerD.W. KimA. ShawA. ReismanK. WilnerH. NokiharaB. Besse}
787,724055,A systematic review and meta-analysis of trials of treatment of depression from India,nan,Indian Journal of Psychiatry,nan,nan,27.71350764656873,0,,29-38,{S. SarkarS. Grover}
788,63738,[The use of ethonium paste in the treatment of deep dental caries].,rus,Stomatologiia,Stomatologiia (Mosk),0039-1735,50,2,3/1/71,79-80,{P K Shestakov}
789,422739,Reporting methods in studies developing prognostic models in cancer: a review.,eng,BMC medicine,BMC Med,1741-7015,8,0,1/10/01,20-20,{Patrick RoystonRachel WatersSusan MallettDouglas G AltmanSusan Dutton}
790,97795,Hospital discharge after ambulatory knee #arthroscopy: a comparison of epidural 2-chloroprocaine versus lidocaine,nan,nan,nan,4.933896166611467,26,1,1/1/01,35-40,{J. M. NealD. J. KopaczM. A. LewisJ. J. Deck}
791,61965,p16(INK4) Expression is not associated with human papillomavirus in oral lichen planus.,eng,Oral surgery oral medicine oral pathology and oral radiology,Oral Surg Oral Med Oral Pathol Oral Radiol,2212-4411,118,6,,694-702,{Lucio MontebugnoliLuca MorandiLuca ScapoliAnnalisa PalmieriDavide B GissiMaria Pia FoschiniIlaria Manelli}
792,42263,Association of bleeding mortality and sex in acute coronary syndromes: the missing triangle.,ENG,Journal of cardiovascular medicine (Hagerstown M%d.),J Cardiovasc Med (Hagerstown),1558-2035,-1,-1,9/23/14,nan,{Rossana De PalmaPaolo OrtolaniCaterina CaminitiEmilia SolinasPiera Angelica MerliniDiego ArdissinoGiorgia PaoliMaria Francesca NotarangeloPaolo GuastarobaAntonio MarzocchiLuigi VignaliRoxana MehranAntonio Manari}
793,166179,[Severe exposure to environmental lead in a child population in Antofagasta Chile],eng,Exposicion severa a plomo ambiental en una poblacion infantil de Antofagasta Chile.,nan,0034-9887,766.4,2,1/1/00,221-32,{I. DelgadoJ. Vega}
794,740811,Tracheostomy Care and Complications in the Intensive Care Unit,nan,nan,nan,nan,33,27.978567340875223,1/13/01,18-$31 14p,{Linda L. MorrisAndrea WhitmerErik McIntosh}
795,379577,Monitoring of fluid changes in hospitalized Malnourished Guatemalan children using bioelectrical impedance spectroscopy (BIS).,e$%ng,Applied radiation and isotopes : including data instrumentation and methods for use in agriculture industry and medicine,Appl Radiat Isot,0969-8043,49,5,5/1/98,615-7,{C PithanM MazariegosN W SolomonsP F_rst}
796,28,Preliminary state of development of prediction models for primary care physical therapy: a systematic review.,eng,Journal of clinical epidemiology,J Clin Epidemiol,1878-5921,65,12,1/12/12,1257-66,{Martijn W HeymansTobias van den BergHan J R AnemaLieke van OortBart W KoesArianne P VerhagenRiekie H C W de Vet}
797,215650,Bruxismo em crian_as Bruxism in children,pt,nan,nan,5.0699935940144885,15.07870998817842,2,,Aug-91,{Ronaldo FazziAna Estela HaddadMaria Salete Nahs Pires Corr_a}
798,2047295.9950585,,eng,J #H$and Surg Am,The Journal of hand surgery,0363-5023,29,5,1/4/09,841-7,{Jeff KnightJeffery M SmithThomas E TrumbleWren V McCallister}
799,892609,13th IEEE/ACM Symposium on Distributed Simulation and Real-Time Applications DS-RT 2009,nan,nan,nan,nan,0,0,nan,nan,{NULL}
800,366275,A systematic review on the application of cardiovascular risk prediction models in pharmacoeconomics with a foc$us on primary preven$tion.,eng,European journal of preventive cardiology,Eur J Prev Cardiol,204??$7-4881,19,2,1/12/08,42-53,{Maarten J PostmaPetros PechlivanoglouJelena Stevanovic}
801,513630,Pan-Canadian study of mammography screening and mortality from breast cancer.,eng,Journal of the National Cancer$ Institute,J. Natl. Cancer Inst.,1460-2105,420.1,11,1/14/11,nan,{Jennifer PayneRukshanda AhmadGregory DoyleNorm PhillipsAnna M ChiarelliChristine WilsonKathleen DeckerAndrew ColdmanBin ZhangJacques Brisson}
802,605423,Alcohol-related morbidity and mortality.,eng,Alcohol Research & Health,nan,1535-7414,27,1,1/3/01,39-51,{J_rgen RehmGerhard GmelMauri@@zio TrevisanChristopher T Sempos}
803,495319,Clinical outcome following ICD removal. The Bilitch Registry Group,eng,nan,nan,3.4165690147875103,16,0,1/1/93,186-192,{S. FurmanD. T. KawanishiS. L. Song}
804,733752,Eliciting relative preferences for two methods?? of colorectal cancer screening,English,European Journal of Cancer Care,nan,0961-5423,14,2,1/5/01,124-31,{E. J. FrewJ. L. Wolstenho$l#meD. K. Whynes}
805,14,Bilingual speech: Bilateral control?,nan,Brain@@ and $Language,nan,0093-934X,71,3.579134053249152,1%/1/82,125-142,{H.M. SussmanP. FranklinT. Simon}
806,903817,Tiao-She nursing of traditional Chinese medicine for mild cognitive disorder: An assessment of clinical evidence,nan,Chin. J.$ #Evid.-Based Med.,nan,1672-2531,15,3,1/15/01,nan,{Li X.-H.Li G.-C.Xie Y.-L.Shang H.-C.Chi K.-L.Jin Y.-H.}
807,45265,One-pot semisynthesis of exon 1 of the Huntingtin protein: new tools for elucidating the role of posttranslational modifications in the pathogenesis of Huntington's disease.,eng,Angewandte Chemie (International ed. in English),Angew. Chem. Int. Ed. En??gl.,1521-3773,53,7,10/14/02,1928-33,
808,13,Pathophysiology of paradoxical embolism: evaluation of the role of interatrial septum anatomy based on the intracardiac echocardiography assessment of patients with right-to-left shunting.,nan,Cardiology in the young,Cardiol Young,1467-1107,21.38001660927014,1,1/15/01,47-55,{Gianluca RigatelliPaolo CardaioliMassimo GiordanAshesh BuchLaura OlivaDobrin VassilievAravinda NanjiundappaFabio Dell'AvvocataRamesh DaggubatiDario Adami}
809,645061,Impact of physical abuse on adulthood depressive symptoms among women.,eng,Issues Ment Health Nurs,nan,1096-4673,29,3,1/8/03,299-314,{Hanan Al-ModallalAnn Ped@@enDebra Anderson}
810,164721,[The microclimate of apartments and its hygienic norms],nan,Das Mikorklima der Wohnungen und seine hygienische Normierung.,nan,0049-8610,45,43.50844275486551,1/1/67,756-60,{M. S. Goromossow}
811,730721,Prediction Study of Complications After Severe Trauma,nan,nan,nan,nan,0,0,1/12/01,nan,{NCT01713205 }
812,439302,American Society of Clinical Oncology clinical practice guideline update on the use of pharmacologic interventions including tamoxifen raloxifene and aromatase inhibition for breast cancer risk reduction.,nan,nan,nan,nan,0,0,nan,nan,{NULL}
813,410748,Preliminary validity and reliability of a Th$ai Berlin questionnaire in stroke patients,English,nan,nan,nan,7,0,1/14/01,348,{J. SaengsuwanK.% SawanyawisuthN. UngtrakulJ. Saengsuwan}
814,133777,Spectrum and frequency of illness presenting to a pediatric emergency department.,eng,Acta clinica Belgica,Acta Clin Belg,1784-3286,61,4,1/6/07,161-5,{P GrardJ MontesantiP LepageM M Massin}
815,775428,Organization of ribo%somes and nucleoids in escherichia coli cells during growth and in quiescence,English,Journal of Biological Chemistry,nan,0021-9258,289,16,1/14/01,11342-11352,{K. PeiskerB. SinghS. SanyalQ. ChaiX. GeN. MetzendorfS#. Dasgupta}
816,497593,Ventricular arrhythmias in the North American mult#idisciplinary study of ARV??C: predictors characteristics and treatment,eng,nan,nan,nan,64,0,,119-??125,{N. A. Mark EstesScott McNittWojciech ZarebaBronislava PolonskyDouglas LaidlawMark S. LinkFrank MarcusKathleen Gear}
817,899060,Maxillofacial metastases: a retrospective review of one institution's 15-year experience,English,Journal of Oral & Maxillofacial Surgery,nan,nan,10,1,1/13/01,178-88,{R. A. OrdA. SalamaR. MovahedS. A. McClure}
818,424254,Precocious and delayed sexual development in children,nan,Acta Endocrinologica. Supplementum,Acta Endocrinol Suppl (Copenh),@@0300-9750%,288,0,1/1/88,66-76,{B. T. Rudd}
819,161290,Premature androgenic alopecia and insulin resistance. Male equivalent of polycystic ovary syndrome?,eng,nan,nan,nan,39,0,#1/5/0#1,127-31 ST  - Premature androgenic alopecia and insulin resistance. Male equivalent of polycystic ovary syndrome?-,{L. StarkaJ. VrbikovaM. DA  - Dec DP  - Nlm ET  - 2006/03/24 HillM. DuskovaI. Cermakova}
820,746312,Pancyt??openia : A rare presentation of le#gionella pneumonia,nan,Crit. Care Med.,nan,0090-3493,41,12,,A326,{Cayetano K.Ghannam D.Rawat N.}
821,59101,Mold contamination in a controlled hospital environment: a 3-year surveillance in southern Italy,nan,nan,nan,nan,14,0,1/1????4/01,nan,{C. CorettiC. NapoliG. LoveroM. T. MontagnaG. CaggianoG. ScarafileO. de Giglio}
