ID,id,article_title,article_language,journal_title,jounral_abbreviation,journal_issn,article_jvolumn,article_jissue,article_jcreated_at,article_pagination,author_list
481,888553.0,Weighting improves the information provided by joint counts on the severity of arthritis and its impact on patients' well-being in juvenile idiopathic arthritis,3.0917865410548266,Rheumatology (Oxford),3.004357918601092,nan,255.33907335373218,3.0,1/6/01,343-7,{A. RavelliS. Magni-ManzoniA. PistorioM. BandeiraA. MartiniE. SalaA. FalconeA. BuoncompagniN. RupertoA. Loy}
482,889580.0,Chronic pain-associated behaviors in the nursing home: resident versus caregiver perceptions,nan,Pain,3.004357918601092,nan,80.0,3.0,1/1/99,577-588,{F. KeefeB. PetersonD. Weiner}
483,732272.0,Analysis of responses of radiology personnel to a simulated mass casualty incident after the implementation of an automated alarm system in hospital emergency planning.,nan,Emergency Radiology,3.004357918601092,nan,18.0,2.0,1/11/04,119-126 8p,{Linsenmaier UGeyer LLK_rner MMeisel CDWirth SReiser MF}
484,351877.0,Community nursing issues in Maori mental health.,4.313793008786392,Australian & New Zealand Journal of Mental Health Nursing,3.004357918601092,nan,5.0,2.0,6/1/96,54-62,{A StreetC Walsh}
485,276000.0,Tobacco-related scenes in television dramas for young Japanese audiences,3.0917865410548266,Tob Control,3.004357918601092,nan,40.69203906106839,3.0,1/1/99,350,{T. Sone}
486,378289.0,Alkaline phosphatase activity of duodenal enterocytes after neonatal administration of monosodium glutamate to rats.,3.0917865410548266,Physiological research / Academia Scientiarum Bohemoslovaca,3.004357918601092,nan,49.0,2.0,1/1/00,269-77,{L LenhardtS MozesA Martinkov}
487,684476.0,Pulmonary rehabilitation for chronic obstructive pulmonary disease: a pilot study evaluating a once-weekly versus twice-weekly supervised programme.,3.0917865410548266,Physi@@oth#erapy,3.004357918601092,nan,96.0,5.865578403328535,1/10/03,68-74,{Janet WebberFiona Liddell}
488,467344.0,Primary Banded Roux-en-Y Gastric Bypass: a Systematic Review.,nan,nan,nan,nan,0.0,0.0,4.051665331388028,nan,{NULL}
489,39687.0,Improving referrals to fracture clinic from the paediatric emergency department an intervention.,nan,nan,nan,nan,0.0,0.0,nan,,{O. CallenderJ. CravenC. Martin}
490,697880.0,Health literacy and child health promotion: Implications for research clinical care and public policy,nan,Pe#diatrics,nan,nan,124.0,0.0,nan,S306-S314,{Rudd R.Guez G.Sanders L.M.Baur C.Shaw J.S.}
491,179093.0,Persistence of profenophos and quinolphos on cultivate#d cucumber and?? its removal,4.4360710678498485,nan,nan,nan,6.0,0.0,1/1%4/01,917-920,{B. VijayalakshmiD. Siva Rama PrasadD. RaveendranathK. Sri Rama MurthyA. Harinatha Reddy}
492,539034.0,Cognitive impairment and risk of cardiovascular events and mortality.,3.0917865410548266,European heart journal,3.004357918601092,nan,33.0,68.27618687743205,1/12/07,1777-86,{Salim YusufMartin O'DonnellCraig AndersonIrene MarzonaPeter SleightJeff ProbstfieldAntonio DansPeggy GaoJackie BoschKoon Teo}
493,208435.0,Comparison of tunnel positions in single-bundle anterior cruciate ligament reconstructions using computer navigation.,3.0917865410548266,Knee surgery sports traumatology arthroscopy : official journal of the ESSKA,3.004357918601092,nan,18.0,9.0,1/10/09,1282-9,{Travis G?? MaakThomas L WickiewiczVolker MusahlJames E VoosAndrew D Pearle}??
494,556624.0,Fludarabine vs cladribine plus busulfan and low-dose TBI as reduced intensity conditioning for allogeneic hematopoietic stem cell transplantation: a prospective randomized trial,nan,nan,4.468613553646597,nan,39.0,4.0,1/7/01,193-9,{D. J. WeisdorfD. DouekY. TanL. J. BurnsJ. S. MillerB. R. BlazarM. AroraT. DeForM. L. MacMillanM. MarkovaJ. E. WagnerJ. N. BarkerT. Repka}
495,36253.0,[Limited experience in adrenocortical function tests in infants].,3.0917865410548266,Horumon to rinsho. Clinical endocrinology,3.004357918601092,nan,16.0,4.0,4/#1/68,273-6,{Y HiroseS KurataY Abe}
496,422857.0,Does this patient have obstructive sleep apnea?: The Rational Clinical Examination systematic review.,nan,JAMA,nan,nan,310.0,7.0,1/13/08,731-741,{David L SimelKathryn A MyersMar#ko Mrkobrad??a}
497,720372.0,APPLICATION OF AGING MANAGEMENT STRATEGIES FOR REACTOR VESSEL INTERNALS AND CORE SUPPORT STRUCTURES,nan,Proceedings of the Asme Pressure Vessels and Piping Conference 2010 Vol 7,nan,nan,0.0,0.0,1/10/01,277-286,{H. Q. XuM. SnyderS. FyfitchA. ChetaG. BezdikianV. N. ShahT. R. LiszkaiH. CharkasN. GuptaY. ShojiC. S. BajwaC. MayM. SanwarwalaM. BrumovskyI. Ezekoye}
498,3014517.5749411914,Molecular detection of hepatitis B virus: Recent developments,nan,LaboratoriumsMedizin,nan,nan,29.0,1.0,1/5/01,33-43,{B. WeberA. Berger}
499,260745.0,Droperidol vs metoclopramide for prophylaxis of postoperative nausea and vomiting after breast cancer surgery,nan,4.229641693590995,nan,nan,28.0,0.0,1/11/01,141,{F. ColettaS. D'ArienzoP. SansoneC. AurilioM. C. PaceG. ZagariaR. Stumbo}
500,941515.0,Is prolonged use of computer games a risk factor for deep venous thrombosis in children?,nan,Clinical medicine (London England),3.004357918601092,nan,4.0,2.0,1/4/??01,190-@@1,{Richard J. A. Murrin}
501,641972.0,[Pelvic floor training for women with ur%inary incontinence].,3.0917865410548266,Forsinket implementering af internationale retningslinjer for computertomografi med iodholdigt kontraststof .,nan,nan,169.0,7.0,12/7/02,593-5,{Sren BrostrmGunnar Lose}
502,699523.0,Regulating free speech,nan,nan,nan,nan,23.0,9.118854069327943,1/1/91,289-318,{Dav%id Dyzenhaus}
503,946112.0,Older Women in #the Homeless Shelter: Personal Perspectives and Practice Ideas,4.807903015148544,Journal of Women & Aging,nan,nan,23.0,4.0,1/11/01,360-374,{Jennifer Davis-Berman}
504,958639.0,Ethically justified system-level decisions in health care: Toward a decision support workbook for healthcare leaders,nan,Dissertation Abstracts International: Section B: The Sciences and Engineering,nan,-321432.50586064346,70.0,1.0,1/9/01,238,{Bashir Jiwani}
505,850418.0,Takayasu's arteritis with multiple intracranial aneurysms,nan,TAKAYASUSCHE ARTERIITIS MIT MULTIPLEN INTRAKRANIELLEN ANEURYSMEN,nan,nan,23.0,1.0,nan,60-61,{Matsumoto K.Yamada F.Fukuda S.}
506,125302.0,Intravenous cyclophosphamide in patients with chronic syst#emic inflammatory diseases: m??orbidity and mortality.,3.0917865410548266,Scandinavian journal of rheumatology,3.004357918601092,nan,37.0,9.810309431519308,1/8/03,130-4,{E A M JanssenC BrodinP OgreidK KjellevoldL G GranssonL VattenP R RomundstadR OmdalK Wildhagen}
507,168889.0,Trends in domestic violence service and leadership: implications for an integrated shelter model,nan,Administration and policy in mental health,3.004357918601092,nan,27.0,5.0,1/1/00,339-52,{M. B. PhilipR. A.?? Hayward}
508,63977.0,[Clinical and histologic results of treatment of serous pulp inflammations with Ledermix].,3.0917865410548266,Czasopismo stomatologiczne,3.004357918601092,nan,91.1360993666273,11.0,1/1/67,1145-53,{H Zakrzewska-Jastrzebska}
509,782211.0,Application of a model based on fuzzy logic for evaluating nursing diagnostic accuracy of students,nan,International Journal of Medical Informatics,nan,nan,82.0,9.0,1/13/01,875-81,{R. JensenF. G. MatosA. da Cruz DdeP. S. SilveiraM. H. LopesN. R. Ortega}
510,473599.0,The effectiveness of N-acetylcysteine in preventing contrast-induced nephropathy in patients undergoing contrast-enhanced computed tomography: a meta-analysis of randomized controlled trials (Provisional abstract),5.819820139754601,International Urology and Nephrology,nan,nan,45.0,5.0,1/13/01,1309-1318,{Yh HsuMs YaoCs WongCh BaiMy WuYf LinCy HsiangKw TamYw LiHf Hsiang}
511,915463.0,[Commentary on] Gait changes in children with cerebral palsy following a neuro-developmental treatment course. Adams M Chandler L Shuhmann K PEDIATRIC PHYSICAL THERAPY 2000;12:114-120,nan,Pediatric physical therapy,nan,nan,14.0,1.0,1/2/01,55-56 2p,{J. Slusarski}
512,1560890.9197937774,Cognitive Outcome of Pediatric Moyamoya Disease.,3.0917865410548266,Journal of %Korean Neurosurgical Society%,3.004357918601092,nan,57.0,6.0,1/15/06,440-4,{Ju-Seong KimDong-Seok KimEun-Kyung ParkKyu-Won Shim}
513,405141.0,Fruit consumption and risk of type 2 diabetes: results from three prospective longitudinal cohort studies.,3.0917865410548266,Bmj-British Medical Journal,nan,nan,347.0,-1.0,1/13/01,f5001,{Rob M van DamFrank B HuIsao MurakiJoann E MansonFumiaki ImamuraQi SunWalter C Willett}
514,213794.0,A biomechanical study of replacement of the posterior cruciate ligament with a graft. Part II: Forces in the graft compared with forces in the intact ligament,nan,nan,nan,nan,79.0,3.0,1/1/97,381-386,{K.L. ArmstrongG.A.M. FinermanK.L. MarkolfM.S. ShapiroJ.R. Slauterbeck}
515,1795385.4458345158,The safety and immunogenicity of rotavirus vaccination in infants with intestinal failure,nan,J. Pe@@diatric Infect. Dis. Soc.,nan,-14400,3.0,1.0,nan,57-65,{McNeal M.M.Sanchez S.E.Jacob S.Javid P.J.Englund J.A.Horslen S.P.}
516,89897.0,A growing lesion on the cheek.,3.0917865410548266,JAMA otolaryngology-- head & neck surgery,3.004357918601092,nan,140.0,4.0,1/14/04,383-4,{Eric J @@LentschJordan Whitney RawlMichael J Caplan}
517,187552.0,Protective effect of ginsenoside Rb1 against myocardial ischemia/reperfusion injury in streptozotocin-induced diabetic rats,nan,Molecular Biology Reports,nan,nan,38.0,7.0,1/11/01,4327-4335,{Y. WuZ. Y. XiaH. M. LiuS. Q. LeiL. ZhangJ. J. XuB. ZhaoJ. Dou}
518,144339.0,Comparative in vitro performance of three small-volume valved holding chambers with beclomethasone/formoterol pressurized metered dose inhaler.,3.0917865410548266,Journal of aerosol medicine and pulmonary drug delivery,3.004357918601092,nan,26.0,4.0,1/13#/%08,223-7,{Kamel AlhanoutJean-Christophe DubusTalita Mota GoncalvesVeronique AndrieuAlain NicolayDavi Pereira de Santana}
519,656518.0,The effectiveness of anti-illicit-drug public-service announcements: a systematic review and meta-analysis.,3.0917865410548266,Journal of epidemiology and community health.,nan,nan,65.0,10.0,1/11/10,834-40,{Julio S G MontanerKora DebeckEvan WoodThomas KerrEdward J MillsDan Werb}
520,925315.0,[Use of statins prior to or following invasive therapy for coronary artery disease].,3.0917865410548266,CHUNG-HUA I HSUEH TSA CHIH [CHINESE MEDICAL JOURNAL],3.004357918601092,nan,85.0,40.0,10/26/05,15-Jul,{Wei Gao}
521,130308.0,Malignant lymphomas of the oral region.,3.0917865410548266,Canadian Forces Dental Services quarterly,3.004357918601092,nan,18.0,1.0,1/1/77,7-Jan,{J R TrottD J MorrowD W Buntine}
522,237077.0,Women's experiences of acupuncture during labour,nan,British Journal of Midwifery,5.333219630946499,nan,21.0,4.0,1/13/01,254-262,{Irena Anna FreiKatharina FierzAngela PoatMartina Gisin}
523,600827.0,Nutritional supplementation for hip fracture aftercare in the elderly.,3.0917865410548266,Cochrane Database Syst. Rev.,nan,nan,-1.0,4.0,1/1/00,CD001880,{A AvenellH H Handoll}
524,851773.0,Quality of life factors and survival after total or extended maxillectomy for sinonasal malignancies.,3.0917865410548266,Journal Of Oral And Maxillofacial Surgery: Official Journal Of The American Association Of Oral And Maxillofacial Surgeons,nan,nan,73.0,4.0,1/15/04,759-63,{James MurphyAmal IsaiahJoshua E LubekJeffrey S Wolf}
525,67292.0,Epithelial Splicing Regulatory Proteins 1 (ESRP1) and 2 (ESRP2) Suppress Cancer Cell Motility via Different Mechanisms.,3.0917865410548266,The Journal of biological chemistry,3.004357918601092,nan,0.0,40.0,3/14/10,27386-99,{Mitsuyoshi MotizukiKeiji MiyazawaTetsuo KondoKeisuke MasuyamaMasao SaitohHiroki IshiiRyohei KatohKei SakamotoShota Tanaka}
526,129698.0,Combined and sequential treatment of oral and maxillofacial malignancies: an evolving concept and clinical protocol.,3.0917865410548266,Chinese medical journal,3.004357918601092,nan,121.0,19.0,5/8/10,1945-52,{Zhi-yuan ZhangWei-liu QiuJia-wei Zheng}
527,254327.0,Evaluation of a workshop on evidence-based medicine for social insurance physicians.,3.0917865410548266,Occupational Medicine-Oxford,nan,nan,58.0,2.0,@@1/8/03,Jul-83,{Jos H VerbeekRob KokJan L HovingFrederieke G SchaafsmaFrank J H van DijkPaul B A Smits}
528,556803.0,Neurocognitive assessment in 13 patients affected by muchopolysaccharidosis IVA (MPS IVA),nan,4.089562197671263,nan,4.726393774242114,37.0,1.0,1/14/01,S136,{M. RigoldiS. GasperiniB. M. Del MenicoF. NichelliA. BonciminoM. CalabriaP. MeregalliR. Parini}
529,73792.0,Evaluation of the protective effect of Ilex paraguariensis and Camellia sinensis extracts on the prevention of oxidative damage caused by ultraviolet radiation.,3.0917865410548266,Environmental toxicology and pharmacology,3.004357918601092,nan,37.0,1.0,1/14/01,195@@$-201,{Marlon BargEmilio L StreckLara M GomesVanessa M AndradeDaniela D LeffaFelipe Dal-PizzolFabricia PetronilhoFrancieli VuoloMilena Carvalho-SilvaFernanda BalbinotGislaine T Rezin}
530,484593.0,New anticoagulants for atrial fibrillation.,3.0917865410548266,J. Cardiovasc. Med.,nan,nan,10.0,6.0,1/9/06,446-53,{Raffaele De CaterinaGiulia RendaSteen Dalby Kristensen}
531,351700.0,Our Health Counts -- Unmasking Health and Social Disparities among Urban Aboriginal People in Ontario.,nan,Dissertation Abstracts International A: The Humanities and Social Sciences,nan,nan,0.0,0.0,nan,nan,{Michelle Firestone}
532,105981.0,A common variant in the FTO gene is associated with body mass index and predisposes to childhood and adult obesity.,3.0917865410548266,Science (New York N.Y.),3.004357918601092,-321432.50586064346,316.0,36.42279003540279,11/7/05,889-94,{George Davey SmithAmanda J BennettEleftheria ZegginiMarjo-Riitta JarvelinNicholas J WarehamLorna W HarriesColin N A PalmerShah EbrahimTimothy M FraylingSusan M RingBridget KnightSian EllardKatharine R OwenRachel M FreathyHana LangoDebbie A LawlorLon R CardonJohn R B PerryJeffrey C BarrettAndrew D MorrisGraham A HitmanKatherine S ElliottUlla SovioMark I McCarthyDavid MelzerAlex S F DoneyAndrew R NessYoav Ben-ShlomoAndrew T HattersleyAnn-Marie PatchNicholas J TimpsonNigel W RaynerMark WalkerMichael N WeedonRuth J F LoosFredrik KarpeIn_s BarrosoLuigi FerrucciChristopher J GrovesCecilia M LindgrenBeverley Shields}
533,408198.0,The parvalbumin-positive interneurons in the mouse dentate gyrus express GABAA receptor subunits 1 _2 and  along their extrasynaptic cell membrane.,3.0917865410548266,Neuroscience,3.004357918601092,nan,254.0,-1.0,12/19/13,80-96,{H H_gerW SieghartT KlausbergerI MilenkovicM VasiljevicD Maurer}
534,30272.0,Glial cells in amyotrophic lateral sclerosis.,3.0917865410548266,Experimental neurology,3.004357918601092,nan,-1.0,-1.0,5/22/14,nan,{T?? PhilipsJ D Rothstei#n}
535,623367.0,Diagnosing acute cardiac ischemia in the emergency department: a systematic review of the accuracy and clinical effect of current technologies.,3.0917865410548266,Annals of Emergency Medicine American College of Emergency Physician's Research Forum,nan,nan,37.0,5.0,1/1/05,453-60,{J P IoannidisJ LauC MilchD SalemP W ChewN TerrinE M Balk}
536,13408.0,Eczema - quiz.,3.0917865410548266,Paediatrics & child health,3.004357918601092,nan,29.822770026271833,6.7093584228161305,3/1/00,105,{NULL}
537,449003.0,Stroke in children with posterior fossa brain malformations hemangiomas arterial anomalies coarctation of the aorta and cardiac defects and eye abnormalities (PHACE) syndrome: A systematic review of the literature.,nan,nan,nan,nan,0.0,0.0,nan,nan,{NULL}
538,299297.0,Employing a youth-led adult-guided framework: why drive high? social marketing campaign.,nan,Family & Community Health,nan,nan,34.0,4.0,1/11/10,319-330,{Terry-Lynne MarkoTyler Watt}
539,302268.0,Review of Handbook for Working with Children and Youth: Pathways to Resilience across Cultures and Contexts,nan,nan,nan,nan,47.0,3.0,1/6/01,230-232,{@@Robert J. Flynn%}
540,592663.0,Helicobacter pylori antibiotic resistance patterns and genotypes in adult dyspeptic patients from a regional population in North Wales,nan,nan,nan,nan,54.0,2.0,1/4/01,435-40,{A. M. WalkerJ. XerryK. DaviesN. C. ElvissR. J. Owen}
541,520843.0,Sonographically guided biopsy of focal lesions: a comparison of freehand and probe-guided techniques using a phantom.,3.0917865410548266,AJR. American Journal Of Roentgenology,3.004357918601092,nan,184.0,5.0,1/5/05,1652-6,{Duncan M BrooksPramit M PhalRory Wolfe}
542,460786.0,Splinting osseointegrated implants and natural teeth in partially edentulous patients: a systematic review of the literature. [Review],nan,nan,nan,nan,0.0,0.0,nan,nan,{NULL}
543,866131.0,Long-term subcutaneous recombinant interleukin-2 as maintenance therapy: Biological effects and clinical implications,nan,Cancer Biotherapy,nan,nan,10.0,3.0,1/1/95,195-203,{V. LorussoM. De LenaM. GuidaM. CorrealeI. AbbateA. LatorreA. CasamassimaM. D. Musci}
544,751811.0,School soft drink intervention study,5.642169045922457,BMJ,nan,-321432.50586064346,329.0,36.42279003540279,1/4/01,E315-6,{S. A. FrenchM. StoryP. J. Hannan}
545,436781.0,Hoarse voice in adults: An evidence-based approach to the 12 minute consultation.,nan,nan,nan,nan,0.0,0.0,nan,nan,{NULL}
546,796900.0,Chronic compartment syndrome an important cause of work-related upper limb disorder,nan,Rheum$$atology (Oxford),3.004357918601092,nan,44.0,11.0,1/5/01,1442-6,{J. P. HeathR. L.?? WilliamsM. H. Pritchard}
547,491837.0,Sleep sleep-dependent procedural learning and vigilance in chronic cocaine users: Evidence for occult insomnia,nan,nan,nan,nan,82.0,16.27288643476703,1/6/01,238-49,{R. T. MalisonE. F. Pace-SchottV. CoricP. T. MorganR. StickgoldZ. H. Sahul}
548,893227.0,A screening methodology for crowdsourcing video QoE evaluation,nan,nan,nan,3.2760903094688096,0.0,0.0,@@1/14/01,5.451196253126643,{E. Anegekuh L. Sun L. Ifeachor}
549,525874.0,Potential for inter-observer and intra-observer variability in x-ray review to establish stone-free rates after lithotripsy.,3.0917865410548266,J. Urol.,nan,nan,147.0,3.0,3/1/92,559-62,{D CaronS J WitchellM A JewettE L St LouisR R GrayC BombardierS KumraK E PsihramisM R Ryan}
550,26475.0,Situating universal design architecture: designing with whom?,3.0917865410548266,Disability and rehabilitation,3.004357918601092,nan,-1.0,-3.3002806325713583,7/28/14,6-Jan,{Paul Jones}
551,476191.0,Endovascular Treatment of Ruptured Large or Wide-Neck Basilar Tip Aneurysms Associated with Moyamoya Disease Using the Stent-Assisted Coil Technique.,3.0917865410548266,Journal of stroke and cerebrovascular diseases : the official journal of National Stroke Association,3.004357918601092,nan,-1.0,-1.0,7/24/15,nan,{Yibin FangPengfei YangJianmin LiuYi XuQinghai HuangWenyuan ZhaoDongwei DaiYan Chen}
552,719389.0,Subjective states: A more robust model,nan,Games and Economic Behavior,nan,nan,67.0,2.0,1/9/01,408-427,{K. SeoL. %G. Epstein}
553,467318.0,The fundamental role of bone morphogenetic protein 15 in ovarian function and its      involvement in female fertility disorders.,nan,5.635223177792644,nan,nan,0.0,0.0,nan,nan,{NULL}
554,268361.0,Giant-cell tumour of the knee: the condition of the cartil@@age after treatment by curettage and cementing,3.0917865410548266,J Bone Joint Surg Br,3.004357918601092,nan,89.0,3.0,1/7/01,361-5,{K. JonssonA. Rydholm%I. KristianssonD. HeinegardF. V. von SteyernP. Mannfolk}
555,664795.0,Diagnostic accuracy of endoscopic ultrasound-guided fine-needle aspiration for solid pancreatic lesion: a systematic review.,3.0917865410548266,Journa@@l of cancer research and clinical o$ncology,3.004357918601092,nan,138.0,9.0,1/12/09,1433-41,{Hangcheng ZhouRenbao YangJiong ChenYunlian XiaYin Lu}
556,102180.0,Safety tolerability and sustained weight loss over 2 years with the once-daily human GLP-1 analog liraglutide.,3.0917865410548266,Inter#national journal of obesity (2005),3.004357918601092,nan,36.0,6.0,1/12/06,843-54,{R CarraroM F RasmussenL NiskanenA HarperN FinerS R_ssnerM KunesovaL Van GaalM E J LeanA AstrupA RissanenM J Savolainen[Collective Name] NN8022-1807 Investigators}
557,258486.0,Web-based nutrition education intervention improves self-efficacy and self-regulation related to increased dairy intake in college students,nan,nan,4.75075082081165,nan,110.0,11.0,1/10/01,1723-7,{Kathy W HosigSharon M Nickols-RichardsonKavita H PoddarSusan E DuncanEileen S Anderson}
558,961081.0,Three Abstracts on Chinese Research,nan,American Acupuncturist,nan,nan,63.0,0.0,1/13/01,25-26,{NULL}
559,52681.0,Retrograde nailing of humeral shaft fractures,nan,5.6075224753440915,nan,nan,0.0,0.0,1/1/98,26-39,{M. RunkelJ. BlumP. M. Rommens}
560,828156.0,Behavioral and cognitive measurements predict scores on the MAST: a 3-year prospective study.,3.0917865410548266,Alcohol Clin Exp Res,3.004357918601092,nan,20.0,7.0,10/1/96,@@11??73-8,{V HesselbrockA W Deckel}
561,812757.0,Development of a SNP genotyping panel and a medical decision support algorithm to predict drug response in schizophrenia,nan,Klinik Psikofarmakoloji Bulteni,3.004357918601092,nan,21.0,0.0,1/11/01,S156-S157,{Y. A. SonG. UstunkarM. A. DokeH. A. DomY. Y. Tuncel}
562,713518.0,ELDERLY AND PHYSICAL ACTIVITY: BENEFITS AND CHALLENGES IN SEARCH FOR LIFE QUALITY.,nan,Journal of Nursing UFPE / Revista de Enfermagem UFPE,3.004357918601092,nan,6.0,11.0,1/12/11,2761-2769 9p,{Gerlane ngela da Costa MoreiraDenyse Dutra Alencar VasconcelosAmanda Costa de FreitasCarla Cristina Braga MaranhoDanielle Figueiredo Patricio}
563,180977.0,Neighbourhood characteristics and mortality in the Atherosclerosis Risk in Communities Study,nan,nan,nan,nan,166.19596527868225,0.0,1/4/01,398-407,{L. N. BorrellK. RoseB. L. ClarkD. CatellierA. V. D. Roux}
564,828214.0,Transference-focused psychotherapy v. treatment by community psychotherapists for borderline personality disorder: randomised controlled trial.,3.0917865410548266,The British journal of psychiatry : the journal of mental science,3.004357918601092,nan,196.0,21.049187755807377,1/10/05,389-95,{Philipp MartiusAnna BuchheimPeter BuchheimSusanne H_rzMichael RentropCord BeneckePete@@r SchusterMelitta Fischer-KernStephan Doeri@@ng}
565,176160.0,The changing residential environments of older people,nan,nan,nan,nan,0.0,0.0,1/11/01,207-220,{Basta Beard Beard Beel-Bates Bierman Bowling Cagney Calkins Carder Carlsson ??Chan Clark Clarke Cutc@@hin Cutler Davidoff Diehl Doty Durrett Feldman Foote Freedman Gaugler Gitlin Gitlin Glass Golant Golant Golant Golant Golant Golant Golant Grafova Gross Hunt AlleyStephen M. Golant}
566,3070762.736209635,A systematic review of the surgical treatment of large incisional hernia.,3.0917865410548266,Hernia : the journal of hernias and abdominal wall surgery,3.004357918601092,nan,19.0,1.0,1/15/@@02,89-101,{L TimmermansJ C SliekerJ F LangeE B DeerenbergJ JeekelD P HogerzeilP H C Eilers}
567,107417.0,Fast-food habits weight gain and insulin resistance (the CARDIA study): 15-year prospective analysi$s.,3.0917865410548266,Lancet,3.004357918601092,-321432.50586064346,365.0,36.42279003540279,1/5/01,36-42,{David R JacobsDavid S LudwigCara B EbbelingAlex I KartashovMartha L SlatteryLinda Van HornMark A Pereira}
568,141282.0,Early prenatal survival in relation to the parental environment in sheep: A review,3.444503323183033,Small Ruminant Research,nan,nan,29.0,2.0,6/29/98,143-156,{E DecuypereE DewilD VanmontfortH Michels}
569,708911.0,Changing tides: improving outcomes through mentorship on all levels of nursing,nan,nan,nan,nan,33.0,2.0,1/10/01,163-176,{J. SkeesT. K. Race}
570,621640.0,Tracking cognitive decline in Alzheimer's disease using the mini-mental state examination: a meta-analysis.,3.0917865410548266,International psychogeriatrics / IPA,3.004357918601092,nan,12.0,9.201944050139938,6/1/00,231-47,{J McCuskerF PrimeauM ColeL HanF Bellavance}
571,647583.0,Pulmonary rehabilitation programs for patients with COPD.,3.0917865410548266,Jornal brasileiro de pneumologia : publicacao oficial da Sociedade Brasileira de Pneumologia e Tisilogia,nan,nan,37.0,4.0,1/11/07,544-55,{Ana Maria Baptista MenezesDavid Alejandro GonzlezElaine Cardozo MacedoPedro Curi HallalMaria de Ftima MaiaMarli KnorstSamuel Carvalho DumithJeovany Mart_nez-MesaRicardo Bica NoalFernando Csar WehrmeisterJos Roberto Jardim}
572,361080.0,The Impact of Nursing Case Management on Women With Diabetes in Pregnancy,4.666393469244249,JOGNN: Journal of Obstetric Gynecologic & Neonatal Nursing,nan,nan,41.0,0.0,1/12/01,S131-2,{Corinn Taylor}
573,283168.0,[Pharmacotherapy for conduct disorder in children and adolescents],nan,Harefuah,nan,nan,151.0,7.0,1/12/01,421-6 435 434,{T. LevyY. Bloch}
574,189213.71747021528,Monteggia lesions in adults. A multicenter Bota study,nan,nan,nan,nan,62.0,0.0,1/1/96,78-83,{W. De GrooteD. StoffelenK. GovaertsP. ReyndersP. L. BroosJ. Rondia}
575,74821.0,Progesterone receptor PROGINS and +331G/A polymorphisms confer susceptibility to ovarian cancer: a meta-analysis based on 17 studies.,3.0917865410548266,Tumour biology : the journal of the International Society for Oncodevelopmental Biology and Medicine,3.004357918601092,nan,35.0,3.0,1/14/03,2427-36,{Xinran WangChenhuan DingLilan ChenShu LiTing LiuXia YinYou WangXiangjun SunWen DiHe Li}
576,373015.0,Gene analysis of steroid 5 alpha-reductase 1 in hyperandrogenic women,nan,Croat%ian Medical# Journal,3.004357918601092,nan,46.0,4.0,1/5/01,664-669,{B. HeljicR. KomelI. EminovicF. GavrankapetanovicJ. PrezeljJ. Karamehic}
577,2277235.5024945107,Intravenous insulin treatment in acute stroke: a systematic review and meta-analysis of randomized controlled trials.,3.0917865410548266,International journal of stroke : official journal of the International Stroke Society,3.004357918601092,nan,9.0,4.0,1/14/06,489-93,{P MichelV PapavasileiouG NtaiosA BargiotaK Makaritsis}
