ID,id,article_title,article_language,journal_title,jounral_abbreviation,journal_issn,article_jvolumn,article_jissue,article_jcreated_at,article_pagination,author_list
482,889580.0,Chronic pain-associated behaviors in the nursing home: resident versus caregiver perceptions,nan,Pain,Pain,-94325.0,80.0,3.0,nan,nan,{F. KeefeB. PetersonD. Weiner}
483,732272.0,Analysis of responses of radiology personnel to a simulated mass casualty incident after the implementation of an automated alarm system in hospital emergency planning.,nan,nan,EMERG RADIOL,-94325.0,18.0,2.0,1/11/04,nan,{Linsenmaier UGeyer LLK_rner MMeisel CDWirth SReiser MF}
484,351877.0,Community nursing issues in Maori mental health.,nan,Australian & New Zealand Journal of Mental Health Nursing,AUST NZ J MENT HEALTH NURS,-94325.0,nan,2.0,6/1/96,nan,{A StreetC Walsh}
485,276000.0,Tobacco-related scenes in television dramas for young Japanese audiences,eng,Tob Control,nan,nan,8.0,3.0,1/1/99,350,{T. Sone}
486,378289.0,Alkaline phosphatase activity of duodenal enterocytes after neonatal administration of monosodium glutamate to rats.,eng,Physiological research / Academia Scientiarum Bohemoslovaca,Physiol Res,-94325.0,49.0,2.0,1/1/00,nan,{L LenhardtS MozesA Martinkov}
487,684476.0,nan,eng,Physiotherapy,Physiotherapy,-94325.0,96.0,1.0,1/10/03,nan,{Janet WebberFiona Liddell}
488,467344.0,Primary Banded Roux-en-Y Gastric Bypass: a Systematic Review.,nan,nan,nan,nan,nan,0.0,nan,nan,{NULL}
489,39687.0,Improving referrals to fracture clinic from the paediatric emergency department an intervention.,nan,nan,nan,nan,0.0,0.0,nan,nan,{O. CallenderJ. CravenC. Martin}
490,697880.0,Health literacy and child health promotion: Implications for research clinical care and public policy,nan,nan,nan,nan,nan,nan,nan,nan,{Rudd R.Guez G.Sanders L.M.Baur C.Shaw J.S.}
491,nan,Persistence of profenophos and quinolphos on cultivated cucumber and its removal,nan,nan,nan,nan,6.0,0.0,1/14/01,nan,{B. VijayalakshmiD. Siva Rama PrasadD. RaveendranathK. Sri Rama MurthyA. Harinatha Reddy}
492,nan,Cognitive impairment and risk of cardiovascular events and mortality.,eng,European heart journal,nan,nan,33.0,14.0,1/12/07,nan,{Salim YusufMartin O'DonnellCraig AndersonIrene MarzonaPeter SleightJeff ProbstfieldAntonio DansPeggy GaoJackie BoschKoon Teo}
493,208435.0,Comparison of tunnel positions in single-bundle anterior cruciate ligament reconstructions using computer navigation.,eng,nan,Knee Surg Sports Traumatol Arthrosc,-94325.0,18.0,9.0,1/10/09,nan,{Travis G MaakThomas L WickiewiczVolker MusahlJames E VoosAndrew D Pearle}
494,556624.0,Fludarabine vs cladribine plus busulfan and low-dose TBI as reduced intensity conditioning for allogeneic hematopoietic stem cell transplantation: a prospective randomized trial,nan,nan,nan,nan,39.0,4.0,1/7/01,nan,{D. J. WeisdorfD. DouekY. TanL. J. BurnsJ. S. MillerB. R. BlazarM. AroraT. DeForM. L. MacMillanM. MarkovaJ. E. WagnerJ. N. BarkerT. Repka}
495,36253.0,[Limited experience in adrenocortical function tests in infants].,jpn,Horumon to rinsho. Clinical endocrinology,Horumon To Rinsho,-94325.0,nan,4.0,4/1/68,nan,{Y HiroseS KurataY Abe}
496,422857.0,Does this patient have obstructive sleep apnea?: The Rational Clinical Examination systematic review.,nan,nan,nan,nan,310.0,7.0,1/13/08,nan,nan
497,720372.0,APPLICATION OF AGING MANAGEMENT STRATEGIES FOR REACTOR VESSEL INTERNALS AND CORE SUPPORT STRUCTURES,nan,nan,nan,nan,0.0,0.0,1/10/01,nan,{H. Q. XuM. SnyderS. FyfitchA. ChetaG. BezdikianV. N. ShahT. R. LiszkaiH. CharkasN. GuptaY. ShojiC. S. BajwaC. MayM. SanwarwalaM. BrumovskyI. Ezekoye}
498,863342.0,Molecular detection of hepatitis B virus: Recent developments,nan,nan,nan,nan,29.0,nan,1/5/01,nan,{B. WeberA. Berger}
499,nan,Droperidol vs metoclopramide for prophylaxis of postoperative nausea and vomiting after breast cancer surgery,nan,nan,nan,nan,28.0,0.0,1/11/01,141,{F. ColettaS. D'ArienzoP. SansoneC. AurilioM. C. PaceG. ZagariaR. Stumbo}
500,941515.0,Is prolonged use of computer games a risk factor for deep venous thrombosis in children?,nan,Clinical medicine (London England),nan,nan,4.0,2.0,nan,nan,{Richard J. A. Murrin}
501,641972.0,[Pelvic floor training for women with urinary incontinence].,nan,Forsinket implementering af internationale retningslinjer for computertomografi med iodholdigt kontraststof .,nan,-94325.0,169.0,7.0,12/7/02,nan,{Sren BrostrmGunnar Lose}
502,699523.0,Regulating free speech,nan,nan,nan,nan,nan,2.0,1/1/91,nan,{David Dyzenhaus}
503,946112.0,nan,nan,nan,nan,nan,23.0,nan,nan,nan,{Jennifer Davis-Berman}
504,958639.0,Ethically justified system-level decisions in health care: Toward a decision support workbook for healthcare leaders,nan,nan,nan,-94325,70.0,1.0,1/9/01,238,{Bashir Jiwani}
505,850418.0,Takayasu's arteritis with multiple intracranial aneurysms,nan,TAKAYASUSCHE ARTERIITIS MIT MULTIPLEN INTRAKRANIELLEN ANEURYSMEN,nan,-94325.0,23.0,1.0,nan,nan,nan
506,nan,Intravenous cyclophosphamide in patients with chronic systemic inflammatory diseases: morbidity and mortality.,eng,Scandinavian journal of rheumatology,Scand. J. Rheumatol.,-94325.0,37.0,2.0,1/8/03,nan,{E A M JanssenC BrodinP OgreidK KjellevoldL G GranssonL VattenP R RomundstadR OmdalK Wildhagen}
507,168889.0,Trends in domestic violence service and leadership: implications for an integrated shelter model,nan,Administration and policy in mental health,Adm Policy Ment Health,-94325.0,27.0,5.0,nan,nan,{M. B. PhilipR. A. Hayward}
508,nan,[Clinical and histologic results of treatment of serous pulp inflammations with Ledermix].,pol,Czasopismo stomatologiczne,Czas Stomatol,-94325.0,20.0,11.0,1/1/67,nan,{H Zakrzewska-Jastrzebska}
509,782211.0,Application of a model based on fuzzy logic for evaluating nursing diagnostic accuracy of students,English,nan,nan,nan,82.0,9.0,nan,nan,nan
510,473599.0,The effectiveness of N-acetylcysteine in preventing contrast-induced nephropathy in patients undergoing contrast-enhanced computed tomography: a meta-analysis of randomized controlled trials (Provisional abstract),nan,nan,nan,nan,nan,5.0,1/13/01,nan,{Yh HsuMs YaoCs WongCh BaiMy WuYf LinCy HsiangKw TamYw LiHf Hsiang}
511,915463.0,[Commentary on] Gait changes in children with cerebral palsy following a neuro-developmental treatment course. Adams M Chandler L Shuhmann K PEDIATRIC PHYSICAL THERAPY 2000;12:114-120,nan,nan,nan,nan,14.0,1.0,1/2/01,nan,{J. Slusarski}
512,476199.0,Cognitive Outcome of Pediatric Moyamoya Disease.,nan,nan,nan,-94325.0,nan,6.0,nan,nan,nan
513,405141.0,Fruit consumption and risk of type 2 diabetes: results from three prospective longitudinal cohort studies.,nan,nan,nan,-94325.0,347.0,-1.0,1/13/01,nan,{Rob M van DamFrank B HuIsao MurakiJoann E MansonFumiaki ImamuraQi SunWalter C Willett}
514,213794.0,A biomechanical study of replacement of the posterior cruciate ligament with a graft. Part II: Forces in the graft compared with forces in the intact ligament,nan,nan,nan,nan,79.0,3.0,1/1/97,nan,{K.L. ArmstrongG.A.M. FinermanK.L. MarkolfM.S. ShapiroJ.R. Slauterbeck}
515,408902.0,The safety and immunogenicity of rotavirus vaccination in infants with intestinal failure,nan,nan,nan,-14400,3.0,1.0,nan,nan,nan
516,89897.0,nan,eng,nan,JAMA Otolaryngol Head Neck Surg,-94325.0,140.0,nan,nan,nan,{Eric J LentschJordan Whitney RawlMichael J Caplan}
517,187552.0,Protective effect of ginsenoside Rb1 against myocardial ischemia/reperfusion injury in streptozotocin-induced diabetic rats,nan,Molecular Biology Reports,nan,-94325.0,38.0,7.0,1/11/01,nan,{Y. WuZ. Y. XiaH. M. LiuS. Q. LeiL. ZhangJ. J. XuB. ZhaoJ. Dou}
518,nan,Comparative in vitro performance of three small-volume valved holding chambers with beclomethasone/formoterol pressurized metered dose inhaler.,eng,nan,J Aerosol Med Pulm Drug Deliv,-94325.0,26.0,4.0,1/13/08,nan,{Kamel AlhanoutJean-Christophe DubusTalita Mota GoncalvesVeronique AndrieuAlain NicolayDavi Pereira de Santana}
519,656518.0,The effectiveness of anti-illicit-drug public-service announcements: a systematic review and meta-analysis.,eng,Journal of epidemiology and community health.,nan,-94325.0,65.0,10.0,1/11/10,nan,{Julio S G MontanerKora DebeckEvan WoodThomas KerrEdward J MillsDan Werb}
520,925315.0,[Use of statins prior to or following invasive therapy for coronary artery disease].,chi,CHUNG-HUA I HSUEH TSA CHIH [CHINESE MEDICAL JOURNAL],Chung Hua I Hsueh Tsa Chih,-94325.0,85.0,40.0,10/26/05,nan,{Wei Gao}
521,130308.0,Malignant lymphomas of the oral region.,engfre,Canadian Forces Dental Services quarterly,nan,nan,18.0,1.0,1/1/77,nan,{J R TrottD J MorrowD W Buntine}
522,237077.0,Women's experiences of acupuncture during labour,nan,nan,nan,nan,21.0,4.0,1/13/01,nan,nan
523,600827.0,Nutritional supplementation for hip fracture aftercare in the elderly.,eng,Cochrane Database Syst. Rev.,nan,-94325.0,-1.0,4.0,1/1/00,nan,{A AvenellH H Handoll}
524,nan,Quality of life factors and survival after total or extended maxillectomy for sinonasal malignancies.,eng,Journal Of Oral And Maxillofacial Surgery: Official Journal Of The American Association Of Oral And Maxillofacial Surgeons,nan,-94325.0,73.0,4.0,1/15/04,nan,{James MurphyAmal IsaiahJoshua E LubekJeffrey S Wolf}
525,67292.0,Epithelial Splicing Regulatory Proteins 1 (ESRP1) and 2 (ESRP2) Suppress Cancer Cell Motility via Different Mechanisms.,eng,The Journal of biological chemistry,J. Biol. Chem.,-94325.0,289.0,40.0,nan,nan,nan
526,nan,nan,eng,Chinese medical journal,Chin. Med. J.,-94325.0,121.0,19.0,5/8/10,nan,{Zhi-yuan ZhangWei-liu QiuJia-wei Zheng}
527,254327.0,nan,eng,Occupational Medicine-Oxford,nan,-94325.0,58.0,2.0,nan,nan,{Jos H VerbeekRob KokJan L HovingFrederieke G SchaafsmaFrank J H van DijkPaul B A Smits}
528,556803.0,Neurocognitive assessment in 13 patients affected by muchopolysaccharidosis IVA (MPS IVA),nan,nan,nan,nan,37.0,1.0,1/14/01,nan,{M. RigoldiS. GasperiniB. M. Del MenicoF. NichelliA. BonciminoM. CalabriaP. MeregalliR. Parini}
529,73792.0,nan,nan,Environmental toxicology and pharmacology,Environ. Toxicol. Pharmacol.,-94325.0,37.0,nan,1/14/01,nan,{Marlon BargEmilio L StreckLara M GomesVanessa M AndradeDaniela D LeffaFelipe Dal-PizzolFabricia PetronilhoFrancieli VuoloMilena Carvalho-SilvaFernanda BalbinotGislaine T Rezin}
530,484593.0,New anticoagulants for atrial fibrillation.,eng,nan,nan,nan,10.0,6.0,1/9/06,nan,{Raffaele De CaterinaGiulia RendaSteen Dalby Kristensen}
531,351700.0,Our Health Counts -- Unmasking Health and Social Disparities among Urban Aboriginal People in Ontario.,nan,nan,nan,nan,0.0,0.0,nan,nan,nan
532,105981.0,A common variant in the FTO gene is associated with body mass index and predisposes to childhood and adult obesity.,nan,Science (New York N.Y.),Science,-94325.0,316.0,5826.0,nan,nan,nan
533,408198.0,The parvalbumin-positive interneurons in the mouse dentate gyrus express GABAA receptor subunits 1 _2 and  along their extrasynaptic cell membrane.,eng,Neuroscience,Neuroscience,-94325.0,254.0,-1.0,nan,nan,{H H_gerW SieghartT KlausbergerI MilenkovicM VasiljevicD Maurer}
534,30272.0,Glial cells in amyotrophic lateral sclerosis.,ENG,Experimental neurology,nan,nan,-1.0,-1.0,nan,nan,{T PhilipsJ D Rothstein}
535,623367.0,Diagnosing acute cardiac ischemia in the emergency department: a systematic review of the accuracy and clinical effect of current technologies.,eng,nan,nan,nan,37.0,5.0,1/1/05,nan,{J P IoannidisJ LauC MilchD SalemP W ChewN TerrinE M Balk}
536,nan,nan,eng,nan,nan,nan,5.0,2.0,3/1/00,105,{NULL}
537,449003.0,nan,nan,nan,nan,nan,0.0,0.0,nan,nan,{NULL}
538,299297.0,Employing a youth-led adult-guided framework: why drive high? social marketing campaign.,nan,Family & Community Health,nan,-94325.0,34.0,4.0,1/11/10,nan,{Terry-Lynne MarkoTyler Watt}
539,302268.0,nan,nan,nan,nan,nan,47.0,3.0,1/6/01,nan,{Robert J. Flynn}
540,nan,nan,nan,nan,nan,nan,54.0,2.0,1/4/01,nan,{A. M. WalkerJ. XerryK. DaviesN. C. ElvissR. J. Owen}
541,520843.0,nan,eng,AJR. American Journal Of Roentgenology,AJR Am J Roentgenol,-94325.0,184.0,5.0,1/5/05,nan,{Duncan M BrooksPramit M PhalRory Wolfe}
542,460786.0,nan,nan,nan,nan,nan,0.0,0.0,nan,nan,{NULL}
543,866131.0,nan,nan,nan,nan,nan,10.0,3.0,1/1/95,nan,{V. LorussoM. De LenaM. GuidaM. CorrealeI. AbbateA. LatorreA. CasamassimaM. D. Musci}
544,751811.0,School soft drink intervention study,nan,nan,nan,nan,329.0,nan,1/4/01,nan,{S. A. FrenchM. StoryP. J. Hannan}
545,436781.0,Hoarse voice in adults: An evidence-based approach to the 12 minute consultation.,nan,nan,nan,nan,0.0,0.0,nan,nan,{NULL}
546,796900.0,Chronic compartment syndrome an important cause of work-related upper limb disorder,nan,Rheumatology (Oxford),Rheumatology (Oxford England),-94325.0,44.0,11.0,1/5/01,nan,{J. P. HeathR. L. WilliamsM. H. Pritchard}
547,491837.0,Sleep sleep-dependent procedural learning and vigilance in chronic cocaine users: Evidence for occult insomnia,nan,nan,nan,nan,82.0,3.0,1/6/01,nan,{R. T. MalisonE. F. Pace-SchottV. CoricP. T. MorganR. StickgoldZ. H. Sahul}
548,893227.0,A screening methodology for crowdsourcing video QoE evaluation,nan,nan,nan,nan,0.0,0.0,1/14/01,nan,{E. Anegekuh L. Sun L. Ifeachor}
549,525874.0,Potential for inter-observer and intra-observer variability in x-ray review to establish stone-free rates after lithotripsy.,eng,nan,nan,-94325.0,nan,3.0,3/1/92,nan,{D CaronS J WitchellM A JewettE L St LouisR R GrayC BombardierS KumraK E PsihramisM R Ryan}
550,26475.0,Situating universal design architecture: designing with whom?,ENG,Disability and rehabilitation,nan,nan,-1.0,-1.0,7/28/14,nan,nan
551,476191.0,Endovascular Treatment of Ruptured Large or Wide-Neck Basilar Tip Aneurysms Associated with Moyamoya Disease Using the Stent-Assisted Coil Technique.,ENG,nan,nan,nan,-1.0,-1.0,7/24/15,nan,{Yibin FangPengfei YangJianmin LiuYi XuQinghai HuangWenyuan ZhaoDongwei DaiYan Chen}
552,719389.0,Subjective states: A more robust model,nan,Games and Economic Behavior,nan,-94325.0,67.0,2.0,1/9/01,nan,{K. SeoL. G. Epstein}
553,467318.0,The fundamental role of bone morphogenetic protein 15 in ovarian function and its      involvement in female fertility disorders.,nan,nan,nan,nan,0.0,0.0,nan,nan,{NULL}
554,268361.0,Giant-cell tumour of the knee: the condition of the cartilage after treatment by curettage and cementing,eng,nan,nan,nan,89.0,3.0,1/7/01,nan,{K. JonssonA. RydholmI. KristianssonD. HeinegardF. V. von SteyernP. Mannfolk}
555,664795.0,Diagnostic accuracy of endoscopic ultrasound-guided fine-needle aspiration for solid pancreatic lesion: a systematic review.,eng,Journal of cancer research and clinical oncology,nan,nan,nan,9.0,1/12/09,nan,{Hangcheng ZhouRenbao YangJiong ChenYunlian XiaYin Lu}
556,102180.0,Safety tolerability and sustained weight loss over 2 years with the once-daily human GLP-1 analog liraglutide.,eng,nan,nan,nan,36.0,6.0,1/12/06,nan,{R CarraroM F RasmussenL NiskanenA HarperN FinerS R_ssnerM KunesovaL Van GaalM E J LeanA AstrupA RissanenM J Savolainen[Collective Name] NN8022-1807 Investigators}
557,258486.0,Web-based nutrition education intervention improves self-efficacy and self-regulation related to increased dairy intake in college students,nan,nan,nan,nan,110.0,11.0,nan,nan,{Kathy W HosigSharon M Nickols-RichardsonKavita H PoddarSusan E DuncanEileen S Anderson}
558,961081.0,nan,nan,American Acupuncturist,nan,-94325.0,63.0,0.0,1/13/01,nan,{NULL}
559,52681.0,Retrograde nailing of humeral shaft fractures,nan,nan,nan,nan,nan,350.0,1/1/98,nan,{M. RunkelJ. BlumP. M. Rommens}
560,828156.0,Behavioral and cognitive measurements predict scores on the MAST: a 3-year prospective study.,nan,nan,nan,nan,nan,7.0,10/1/96,nan,{V HesselbrockA W Deckel}
561,nan,Development of a SNP genotyping panel and a medical decision support algorithm to predict drug response in schizophrenia,nan,Klinik Psikofarmakoloji Bulteni,Klin.Psikofarmakol.Bul.,-94325.0,21.0,0.0,1/11/01,nan,{Y. A. SonG. UstunkarM. A. DokeH. A. DomY. Y. Tuncel}
562,nan,ELDERLY AND PHYSICAL ACTIVITY: BENEFITS AND CHALLENGES IN SEARCH FOR LIFE QUALITY.,nan,Journal of Nursing UFPE / Revista de Enfermagem UFPE,nan,-94325.0,6.0,11.0,1/12/11,nan,{Gerlane ngela da Costa MoreiraDenyse Dutra Alencar VasconcelosAmanda Costa de FreitasCarla Cristina Braga MaranhoDanielle Figueiredo Patricio}
563,180977.0,nan,nan,nan,nan,nan,33.0,0.0,1/4/01,nan,nan
564,828214.0,Transference-focused psychotherapy v. treatment by community psychotherapists for borderline personality disorder: randomised controlled trial.,eng,The British journal of psychiatry : the journal of mental science,Br J Psychiatry,-94325.0,196.0,5.0,1/10/05,nan,{Philipp MartiusAnna BuchheimPeter BuchheimSusanne H_rzMichael RentropCord BeneckePeter SchusterMelitta Fischer-KernStephan Doering}
565,nan,The changing residential environments of older people,nan,nan,nan,nan,nan,0.0,1/11/01,nan,{Basta Beard Beard Beel-Bates Bierman Bowling Cagney Calkins Carder Carlsson Chan Clark Clarke Cutchin Cutler Davidoff Diehl Doty Durrett Feldman Foote Freedman Gaugler Gitlin Gitlin Glass Golant Golant Golant Golant Golant Golant Golant Grafova Gross Hunt AlleyStephen M. Golant}
566,677752.0,A systematic review of the surgical treatment of large incisional hernia.,eng,Hernia : the journal of hernias and abdominal wall surgery,nan,nan,19.0,1.0,nan,nan,{L TimmermansJ C SliekerJ F LangeE B DeerenbergJ JeekelD P HogerzeilP H C Eilers}
567,107417.0,Fast-food habits weight gain and insulin resistance (the CARDIA study): 15-year prospective analysis.,nan,Lancet,Lancet,-94325.0,365.0,9453.0,1/5/01,nan,{David R JacobsDavid S LudwigCara B EbbelingAlex I KartashovMartha L SlatteryLinda Van HornMark A Pereira}
568,141282.0,Early prenatal survival in relation to the parental environment in sheep: A review,nan,nan,nan,-94325.0,29.0,2.0,6/29/98,nan,{E DecuypereE DewilD VanmontfortH Michels}
569,nan,nan,nan,nan,nan,nan,33.0,2.0,1/10/01,nan,{J. SkeesT. K. Race}
570,621640.0,Tracking cognitive decline in Alzheimer's disease using the mini-mental state examination: a meta-analysis.,nan,nan,nan,nan,12.0,2.0,6/1/00,nan,{J McCuskerF PrimeauM ColeL HanF Bellavance}
571,647583.0,nan,engpor,nan,nan,nan,37.0,nan,nan,nan,nan
572,361080.0,nan,nan,nan,nan,nan,41.0,0.0,1/12/01,nan,nan
573,283168.0,nan,nan,nan,nan,nan,151.0,7.0,1/12/01,nan,nan
574,52633.0,Monteggia lesions in adults. A multicenter Bota study,nan,nan,nan,nan,62.0,0.0,1/1/96,nan,nan
575,74821.0,Progesterone receptor PROGINS and +331G/A polymorphisms confer susceptibility to ovarian cancer: a meta-analysis based on 17 studies.,eng,nan,nan,nan,35.0,3.0,1/14/03,nan,{Xinran WangChenhuan DingLilan ChenShu LiTing LiuXia YinYou WangXiangjun SunWen DiHe Li}
576,373015.0,Gene analysis of steroid 5 alpha-reductase 1 in hyperandrogenic women,nan,Croatian Medical Journal,nan,nan,46.0,4.0,1/5/01,nan,{B. HeljicR. KomelI. EminovicF. GavrankapetanovicJ. PrezeljJ. Karamehic}
577,529562.0,Intravenous insulin treatment in acute stroke: a systematic review and meta-analysis of randomized controlled trials.,nan,nan,Int J Stroke,-94325.0,9.0,nan,nan,nan,{P MichelV PapavasileiouG NtaiosA BargiotaK Makaritsis}
578,574242.0,Hospitalized heart failure patients with preserved vs. reduced     ejection fraction in Dubai United Arab Emirates: a prospective     study,English,nan,nan,nan,nan,nan,1/14/01,nan,{Al Sayed Hussain ASaheb Sharif-Askari NSulaiman SAAl-Mulla AATabatabai SSaheb Sharif-Askari F}
579,966388.0,Multiple endocrine neoplasia type 1 with multiple leiomyomas linked to a novel mutation in the MEN1 gene,English,Yonsei Medical Journal,nan,nan,49.0,4.0,nan,nan,{H. ChoiE. S. KangS. K. LimS. Y. JeongH. C. LeeH. J. KimS. KimY. RheeY. H. LeeJ. H. MoonK. R. KimC. W. AhnB. S. ChaE. J. Lee}
580,919014.0,[Anesthetic gases exposure: findings from a 13 year environmental and biological monitoring in a hospital company].,ita,nan,nan,nan,29.0,3.0,1/7/07,nan,{M A SanchezS RitzuV CapelliP BoccalonG Arcangeli}
581,494428.0,Out-of-hospital cardiac arrests occurring in southern Ontario health care clinics: bystander cardiopulmonary resuscitation and automated external defibrillator use.,eng,Canadian family physician Medecin de famille canadien,Can Fam Physician,-94325.0,56.0,6.0,1/10/06,nan,{Karen K LamSteven C BrooksLaurie J Morrison}
582,55809.0,Diffusion tensor imaging of deep gray matter in children treated for brain malignancies.,nan,Child's nervous system : ChNS : official journal of the International Society for Pediatric Neurosurgery,Childs Nerv Syst,-94325.0,30.0,4.0,1/14/04,nan,{Anna NideckerSiamak ArdekaniE Mark MahoneFirouzeh TannaziJarunee IntrapiromkulMoody WharamLarry J BrantAlena Horsk}
583,368651.0,A randomized controlled trial of paracetamol versus morphine for the treatment of acute painful crisis of sickle cell disease,nan,nan,nan,nan,20.0,5.0,nan,nan,{R. Rehmani}
584,nan,Puberty suppression in adolescents with gender identity disorder: a prospective follow-up study,English,nan,nan,nan,8.0,8.0,1/11/01,nan,{T. A. DoreleijersP. T. Cohen-KettenisA. L. de VriesT. D. Steensma}
585,435904.0,A meta-analysis of clinical trials comparing mirtazapine with selective serotonin reuptake inhibitors for the treatment of major depressive disorder.,nan,nan,nan,nan,0.0,0.0,nan,nan,{NULL}
586,407245.0,Group physiotherapy provides similar outcomes for participants after joint replacement surgery as 1-to-1 physiotherapy: a sequential cohort study.,eng,nan,Arch Phys Med Rehabil,-94325.0,90.0,10.0,1/9/10,nan,{Corinne L CoulterJennie M ScarvellJeanie M Weber}
587,918698.0,Sevoflurane postconditioning converts persistent ventricular fibrillation into regular rhythm.,eng,European Journal Of Anaesthesiology,nan,nan,26.0,9.0,1/9/09,nan,{Fengjiang ZhangGang ChenMin YanCongcong Chen}
588,209138.0,nan,nan,Clinical Biomechanics,nan,-94325.0,18.0,10.0,1/3/12,nan,{S NadeauF MalouinB.J McFadyen}
589,862844.0,DPYD IVS14+1G>A and 2846A>T genotyping for the prediction of severe fluoropyrimidine-related toxicity: A meta-analysis,nan,Pharmacogenomics,Pharmacogenomics,-94325.0,14.0,11.0,1/13/01,nan,{R. DanesiS. TerrazzinoP. L. CanonicoA. A. GenazzaniS. CargninM. Del Re}
590,nan,[Methicillin-resistant Staphylococcus aureus forming the fried egg appearance colonies isolated from a patient with septicemia],nan,Rinsho Byori,Rinsho byori. The Japanese journal of clinical pathology,-94325.0,43.0,10.0,1/1/95,nan,{K. IijimaA. TanimotoY. KitagakiM. HiuraH. FujiwaraS. Ikawa}
591,587683.0,Support for nutrition from the older Americans act programs: a clarification on its 40th anniversary,eng,J Nutr Gerontol Geriatr,nan,nan,32.0,1.0,1/13/01,nan,{J. L. Lloyd}
592,927711.0,Measures of exposure to the Well London Phase-1 intervention and their association with health well-being and social outcomes,nan,Journal of Epidemiology & Community Health,nan,-94325.0,nan,nan,nan,nan,nan
593,nan,The Effects of Cognitive Coaching and Nonverbal Classroom Management on Teacher Efficacy and Perceptions of School Culture.,nan,nan,nan,nan,0.0,0.0,1/1/98,53,nan
594,161847.0,Changes in glucose tolerance over time in women with polycystic ovary syndrome: a controlled study,nan,nan,nan,nan,90.0,nan,1/5/01,nan,{A. DA  - Jun DO  - jc.2004-1843 [pii] 10.1210/jc.2004-1843 [doi] DP  - Nlm ET  - 2005/03/31 DunaifA. R. KunselmanR. S. LegroC. L. Gnatuk}
595,543292.0,Effects of Test Administrator Characteristics on Achievement Test Scores,nan,nan,nan,nan,0.0,0.0,1/5/04,nan,{Maria PapapolydorouTaslima RahmanWilliam D. SchaferLori Parker}
596,248064.0,Distal radius fracture arthroscopic intraarticular displacement measurement after open reduction and internal fixation from a volar approach,eng,nan,Journal of orthopaedic science : official journal of the Japanese Orthopaedic Association,-94325.0,15.0,4.0,1/10/01,nan,nan
597,nan,Age-related driving disorders: screening in hospitals and outpatients settings.,eng,nan,Geriatrics & gerontology international,-94325.0,10.0,4.0,1/10/10,nan,{Kevin PatrickJill RybarLinda HillSara BairdRaul CoimbraSusanna Concha-Garcia}
598,nan,nan,nan,nan,nan,nan,nan,9.0,1/2/01,nan,{S. OpatrnaP. StehlikJ. RacekJr. Opatrny K.V. SenftF. SefrnaO. Topolcan}
599,709094.0,Evidence based practice and advanced competencies in a MHS-CLS program,nan,nan,nan,nan,24.0,4.0,1/11/01,nan,{L. PretlowA. RanneB. KrajE. K. LeibachB. Russell}
600,nan,Effect of QVA149 on lung volumes and exercise tolerance in COPD patients: the BRIGHT study,nan,nan,nan,nan,108.0,nan,1/14/01,nan,{Jutta BeierPeter D'AndreaMichelle HenleyStephanie KornKai-Michael BeehDonald BanerjiDalal Jadayel}
601,793206.0,Disseminated lymphoma with large granular lymphocyte morphology diagnosed in a horse via abdominal fluid and transtracheal wash cytology.,eng,Veterinary clinical pathology / American Society for Veterinary Clinical Pathology,Vet Clin Pathol,-94325.0,44.0,3.0,1/15/09,nan,{Fernanda CesarAnne A WooldridgeCinzia MastrorilliPete W ChristophersonKellye Joiner}
602,361682.0,Outcome of patients with severe PH due to lung disease with     and without targeted therapy,nan,nan,nan,nan,32.0,5.0,1/14/01,nan,{Seiler IBaron MArzt MPfeifer MLange TJ}
603,732256.0,A comprehensive assessment of maternal deaths in Argentina: translating multicentre collaborative research into action.,nan,Bulletin of the World Health Organization,Bull.WHO,-94325.0,85.0,8.0,1/7/08,nan,{Romero MMercer RRamos SKarolinski A}
604,636937.0,Human african trypanosomiasis diagnosis in first-line health services of endemic countries a systematic review.,eng,nan,nan,nan,6.0,11.0,1/12/01,nan,{Victor KandeEpco HaskerVeerle LejonJean-Jacques MuyembePatrick MitashiMarleen BoelaertPascal Lutumba}
605,nan,Overlap of food addiction and substance use disorders definitions: analysis of animal and human studies.,eng,Neuropharmacology,Neuropharmacology,-94325.0,85.0,-1.0,1/14/10,nan,{Antoine Hone-BlanchetShirley Fecteau}
606,592201.0,Efficacy of prolonged administration of intravenous erythromycin in an ambulatory setting as treatment of severe gastroparesis: one center's experience,nan,nan,nan,nan,28.0,2.0,1/1/99,nan,nan
