ID,id,article_title,article_language,journal_title,jounral_abbreviation,journal_issn,article_jvolumn,article_jissue,article_jcreated_at,article_pagination,author_list
242,638918.0,Imaging for target volume delineation in rectal cancer radiotherapy--a systematic review.,eng,Clinical Oncology (Royal College of Radiologists),nan,-94325.0,24.0,1.0,1/12/02,nan,nan
243,nan,The influence of smoking and impaired glucose homoeostasis on the outcome in patients presenting with an acute coronary syndrome: a cross-sectional study.,eng,BMJ Open,nan,-94325.0,nan,7.0,1/14/01,nan,{Anders HallingHkan OdebergHenrik ForssellJacob OdebergMarie-Louise PerssonLennart RstamIvar VaaraUlf LindbladMichael Freitag}
244,747279.0,Systematic review exploring the effect of exercise in pulmonary rehabilitation on depression levels in patients with chronic obstructive pulmonary disease,nan,Physiotherapy,nan,nan,97.0,0.0,nan,nan,{Patil S.Horobin H.}
245,674696.0,Environmental and genomic factors as well as interventions influencing smoking cessation: a systematic review of reviews and a proposed working model.,nan,nan,nan,nan,nan,nan,nan,nan,{A BrandJ Van der HeydenS de VironH Van OyenN Malats}
246,258108.0,Impact of seasonality on recruitment retention adherence and outcomes in a web-based smoking cessation intervention: randomized controlled trial,nan,nan,nan,nan,nan,nan,1/13/01,nan,nan
247,59308.0,White matter diffusivity predicts memory in patients with subjective and mild cognitive impairment and normal CSF total tau levels.,eng,Journal of the International Neuropsychological Society : JINS,J Int Neuropsychol Soc,-94325.0,16.0,1.0,nan,nan,{Ramune GrambaiteAnders M FjellTormod FladbyKristine B WalhovdVidar StensetIvar Reinvang}
248,610641.0,Comparison between open and closed suction systems: a systematic review.,ENGPOR,Revista Brasileira de terapia intensiva,Rev Bras Ter Intensiva,-94325.0,20.0,4.0,1/8/12,nan,{Luiz Rogrio de Carvalho OliveiraNilza Aparecida Almeida de CarvalhoFlvio C L Cavalcanti Ara_joIzabela Menezes PagottoPaulo Chiavone}
249,nan,Association between interleukin-10 promoter polymorphisms and endometriosis: a meta-analysis.,eng,nan,Gene,-94325.0,515.0,nan,2/15/13,nan,{Qiong ChenWei FanQianhong MaZhongying HuangZhun XiaoShangwei Li}
250,nan,Overactive bladder: Optimizing quality of care,nan,Am. J. Managed Care,nan,-94325.0,nan,2.0,nan,nan,{Lemack G.E.}
251,973076.0,Thyroid-related autoantibodies and celiac disease: a role for a gluten-free diet?,nan,nan,nan,nan,35.0,3.0,nan,nan,nan
252,931402.0,nan,nan,Journal of Health Care for the Poor & Underserved,nan,-94325.0,20.0,2.0,1/9/01,nan,nan
253,908690.0,A robust method for diagnosis of morphological arrhythmias based on Hermitian model of higher-order statistics,English,nan,nan,nan,10.0,0.0,1/11/01,22,{Address CorrespondenceS. KarimifardAddresses Authorahmadian@sina.tums.ac.ir Tehran Medical PhysicsTehran Medical PhysicsDepartment of Biomedical Systems S. KarimifardTums Tehran Iran Email University of Medical SciencesA. AhmadianTums Tehran Iran University of Medical SciencesSystems Department of Biomedical}
254,417373.0,Shared decision making and the future of managed care,nan,Disease Management and Clinical Outcomes,nan,-94325.0,1.0,nan,1/1/97,nan,{J. E. Wennberg}
255,759329.0,Specific plasma factors blocking human maternal cell-mediated immune reaction to placental antigens.,eng,Nature: New biology,Nature New Biol.,-94325.0,242.0,nan,3/28/73,nan,{V YoutananukornP Mantangkasombut}
256,386327.0,MicroRNAs: a new piece in the paediatric cardiovascular disease puzzle.,eng,Cardiology in the young,nan,-94325.0,23.0,5.0,1/13/10,nan,{Dalia ElimamKeith A WebsterAhmed OmranFei YinLina A Shehadeh}
257,695010.0,Association of Ureaplasma urealyticum colonization with development of bronchopulmonary dysplasia: a systemic review and meta-analysis.,eng,nan,J Huazhong Univ Sci Technolog Med Sci,-94325.0,34.0,2.0,1/14/04,nan,{Jia-rui PuDan LiDe-hua YangLi-duan ZhengXiao-dan ZhengHong MeiXuan XiangQiang-song Tong}
258,191908.0,Mortality at older ages and moves in residential and sheltered housing: evidence from the UK,nan,Journal of Epidemiology and Community Health,nan,-94325.0,68.0,6.0,1/14/01,nan,nan
259,384767.0,A multinational study of thromboprophylaxis practice in critically ill children.,eng,Critical care medicine,Crit. Care Med.,-94325.0,nan,5.0,1/14/05,nan,{Sarah H O'BrienMarisa TucciAntonio Rodriguez NunezPhilip C SpinellaLi QinEdward Vincent S FaustinoAdrienne G RandolphEdward TruemperSimon LiKimberly MarohnSheila HansonMichael Yung[Collective Name] PROphylaxis against ThRombosis prACTice (PROTRACT) Study Investigators of the PALISI BloodNet}
260,855912.0,Asymmetric inheritance of mitochondrial content in aging budding yeast cells,nan,nan,nan,nan,23.0,nan,1/12/01,nan,{E. A. MartinL. F. CostaH. LiY. ZhangM. P. VianaS. M. RafelskiW. F. Marshall}
261,710727.0,Physical activity moderates time-of-day differences in older adults' working memory performance.,nan,nan,nan,nan,nan,4.0,1/6/10,nan,nan
262,816996.0,Uses of the electrical skin resistance method in the study of patients with neck and upper extremity pain,English,Johns Hopkins Medical Journal,nan,nan,137.0,2.0,nan,nan,{C.P. RichterL.H. Riley Jr.}
263,625016.0,[New aspects in hernia surgery].,ger,Urologe A,nan,-94325.0,44.0,7.0,1/5/07,nan,{P E GoretzkiB J LammersT Otto}
264,275675.0,An exploration of self-reported negative affect by adolescents as a reason for smoking: implications for tobacco prevention and intervention programs,eng,Prev Med,nan,nan,41.0,2.0,1/5/01,nan,{J. RobinsonD. W. SmithB. ColwellS. L. StevensC. McMillan}
265,nan,Diagnosis of peripheral lung cancer with three echoic features via endobronchial ultrasound,English,nan,nan,nan,132.0,nan,1/7/01,nan,{H. C. ChenS. M. LinC. L. ChouC. T. YuH. P. KuoC. H. Kuo}
266,640230.0,A meta-analysis of labor supply effects of interventions for major depressive disorder.,eng,Psychiatric Services.,nan,-94325.0,57.0,2.0,1/6/02,nan,{Justin W TimbieMarcela Horvitz-LennonSharon-Lise T NormandRichard G Frank}
267,625663.0,Combined pharmacotherapy and psychological treatment for depression: a systematic review.,eng,Archives of General Psychiatry,nan,nan,61.0,7.0,1/4/07,nan,{Paola BolliniGiuseppe TibaldiBruce KupelnickCarmine MunizzaSandro Pampallona}
268,480649.0,Dyspareunia and sexual dysfunction following vaginal delivery in thai primiparous women with second degree perineal tear: A prospective cohort study,nan,nan,nan,nan,12.0,0.0,1/15/01,58,{A. UngkanungdechaC. ChayachindaJ. VeeragulJ. Jisabai}
269,782541.0,eComment. EuroSCORE II - corrected in-hospital mortality rate in a modern cohort of patients undergoing cardiac surgery,English,Interactive Cardiovascular & Thoracic Surgery,nan,nan,19.0,nan,1/14/01,733,{D. G. Nezic}
270,692358.0,The effect of a cervical lateral glide on the upper limb neurodynamic test: a blinded placebo-controlled investigation,nan,nan,nan,nan,nan,0.0,nan,nan,nan
271,836847.0,Thoracic Aortic Aneurysm: Reading the Enemy's Playbook,nan,nan,nan,-10475,33.0,5.0,nan,nan,{Elefteriades J.A.}
272,867207.0,Early predicting of blood component quality by Statistical Process Control,nan,nan,nan,nan,99.0,0.0,nan,227,{H. JungkW. MadlaV. SchottstedtT. Alt}
273,253149.0,Lifetime risk of suicide in affective disorders,nan,The British Journal of Psychiatry,nan,-94325.0,173.0,nan,1/1/98,nan,{A. S. LeeS. DaviesP. C. Naik}
274,929971.0,A geographic analysis of chronically homeless adults before and after enrollment in a multi-site supported housing initiative: community characteristics and migration,nan,nan,nan,nan,48.0,3.0,1/11/01,nan,{R. A. RosenheckJ. TsaiA. S. Mares}
275,470385.0,Fetal cleft lip and palate detection by three-dimensional ultrasonography,nan,nan,nan,-8906,16.0,nan,nan,nan,{Lee W.Kirk J.S.Shaheen K.W.Romero R.Hodges A.N.Comstock C.H.}
276,731703.0,Substance Abuse and Trauma in Incarcerated Women,nan,nan,nan,nan,0.0,0.0,1/11/01,nan,{NCT01413984 }
277,113399.0,Use of Job Design to Reduce Mechanical Stress on the Back,nan,nan,nan,nan,0.0,0.0,nan,nan,{D. W. Badger}
278,685178.0,Rehabilitation of swallowing by exercise in tube-fed patients with pharyngeal dysphagia secondary to abnormal UES opening.,eng,Annual Abstract Supplement,nan,-94325.0,122.0,5.0,1/2/05,nan,{Mark KernKaren DikemanBarbara GrandeMarta KazandjianTerilynn NitschkeStephanie DanielsBenson MasseyReza ShakerCaryn Easterling}
279,653325.0,A meta-analysis of two genome-wide association studies identifies 3 new loci for alcohol dependence.,eng,Journal of psychiatric research,J Psychiatr Res,-94325.0,nan,11.0,1/11/11,nan,{Min ZengYue PanQunyuan ZhangKe-Sheng WangNagesh AragamXuefeng Liu}
280,893573.0,Crowdsourced Multimedia Enhanced Spatio-temporal Constraint Based on-Demand Social Network for Group Mobility,nan,nan,nan,nan,nan,0.0,nan,nan,{Ahmad QamarMuhammad ShahidMd. Abdur RahmanAhmed LbathAkhlaq AhmadFaizan Ur RehmanAbdullah MuradBilal Sadiq}
281,56272.0,Impaired default network functional connectivity in autosomal dominant Alzheimer disease.,eng,nan,nan,nan,nan,8.0,nan,nan,{Virginia D BucklesAndrew J SaykinEric McDadeStephen P SallowayAaron P SchultzPeter R SchofieldRandall BatemanAdam M BrickmanNick C FoxJohn C MorrisJohn M RingmanChristopher C RowePaul ThompsonClifford JackBeau M AncesAllison M GoateRobert A KoeppeStephen CorreiaJasmeer P ChhatwalCaroline A SullivanAnne M FaganRichard MayeuxDaniel S MarcusTammie L S BenzingerKeith JohnsonReisa A SperlingChengjie Xiong}
282,737786.0,Cranial reconstruction of major traumatic defects in children with osteoinductive and resorbable materials,nan,International Journal of Oral and Maxillofacial Surgery,nan,-94325.0,40.0,0.0,1/11/01,nan,nan
283,680306.0,Meta-analysis of the effects of sometribove zinc suspension on the production and health of lactating dairy cows.,eng,nan,nan,nan,nan,nan,nan,nan,{William W ThatcherNormand R St-PierreDale E BaumanJoseph S HoganK Larry SmithRobert J CollierGeorge A MillikenJan K Shearer}
284,53877.0,nan,nan,nan,nan,nan,0.0,0.0,1/14/01,nan,{Sheu-jen HuangMaiga ChangWen-chi HungJanie Chang}
285,504928.0,Azathioprine for multiple sclerosis,nan,nan,nan,nan,0.0,4.0,1/7/01,nan,{Ilaria CasettaGerardo IulianoGraziella Filippini}
286,198650.0,nan,nan,nan,nan,nan,7.0,nan,1/1/92,nan,{NULL}
287,671386.0,Comparison between incidental malignant and benign breast lesions detected by computed tomography: a systematic review.,eng,Journal of medical imaging and radiation oncology,J Med Imaging Radiat Oncol,-94325.0,57.0,5.0,1/13/10,nan,{Jasmin AbbasCholpan JasaabuuAndreas Gunter BachAlexey SurovDominik SchrammAndreas Wienke}
288,nan,Plant Kunitz proteinase inhibitor attenuates inflammation oxidative stress and remodeling induced by elastase in mice,nan,nan,nan,nan,44.0,0.0,1/14/01,nan,{N. M. PinheiroR. Almeida-ReisL. OlivaM. A. MartinsM. L. V. OlivaO. A. Theodoro-JuniorE. A. LeickI. F. L. C. TibrioC. M. PradoR. F. RighettiB. T. M. Oliveira}
289,785472.0,Streptococcus pneumoniae carriage in the Gaza strip,eng,nan,nan,nan,7.0,4.0,1/12/01,nan,{G. RahavG. Regev-YochayI. AbullaishA. ElhamdanyR. MalleyM. RazA. GoralY. RoytmanB. ShainbergM. VaronA. Ziv}
290,734077.0,nan,English,nan,nan,-94325.0,72.0,9.0,1/14/01,nan,{M. NiewadaJ. PaweskaA. BudajT. MaciochP. Perkowski}
291,46028.0,Changes in renal blood flow measured by radionuclide angiography following exhausting exercise in humans.,eng,European journal of applied physiology and occupational physiology,Eur J Appl Physiol Occup Physiol,-94325.0,74.0,1.0,1/1/96,nan,{S IkawaM SudohM SuzukiS MatsubaraM ShiotaK Kawakami}
292,743129.0,Hormonal and dietary characteristics in obese human subjects with and without food addiction.,eng,Nutrients,Nutrients,-94325.0,7.0,1.0,1/15/01,nan,{Pardis PedramGuang Sun}
293,392246.0,Importance of membrane materials for blood purification devices in critical care.,eng,nan,nan,-94325.0,40.0,nan,1/9/02,nan,{Narumi TomisawaAkihiro C Yamashita}
294,904889.0,Myofascial trigger points: Spontaneous electrical activity and its consequences for pain induction and propagation,nan,nan,nan,nan,6.0,0.0,nan,nan,{Ge H.-Y.Fernndez-de-las-Peas C.Yue S.-W.}
295,360147.0,Treatment of large vessel vasculitis,nan,nan,nan,-94325.0,7.0,4.0,1/11/01,nan,nan
296,nan,Quantitative assessment of the influence of common variations (rs8034191 and rs1051730) at 15q25 and lung cancer risk.,eng,nan,Tumour Biol.,-94325.0,35.0,nan,1/14/03,nan,{Bin HuHong-ju MaoJing ZhaoYing HuangRong-huan YuChao Guan}
297,821702.0,Cognitive deficits and psychosis in Parkinson's disease: A review of pathophysiology and therapeutic options,English,nan,nan,nan,nan,6.0,1/6/01,nan,{T. FoltynieR.A. BarkerS.J.G. LewisC.H. Williams-Gray}
298,188890.0,Incidence of multi-resistance in gram-negative aerobes from intensive care units of 10 German hospitals.,eng,nan,Scand J Infect Dis Suppl,-94325.0,nan,-1.0,1/1/91,nan,{R AsangerP M ShahF M Kahan}
299,321660.0,Tuberculosis and high altitude. Worth a try in extensively drug-resistant tuberculosis?,nan,nan,nan,nan,189.0,4.0,nan,nan,{J. F. Murray}
300,427455.0,Cultural humility: essential foundation for clinical researchers.,eng,Applied nursing research : ANR,Appl Nurs Res,-94325.0,26.0,4.0,1/13/11,nan,nan
301,246204.0,Primary external fixation versus plaster immobilization of the intra-articular unstable distal radial fracture in the elderly,nan,nan,nan,nan,34.0,2.0,1/4/01,nan,{J. OskamJ. H. HegemanJ. PalenH. J. DuisP. A. M. Vierhout}
302,857402.0,High resolution EPR spectroscopy of C(60)F and C(70)F in solid argon: reassignment of C(70)F regioisomers,English,JOURNAL OF CHEMICAL PHYSICS,nan,nan,127.0,8.0,1/7/01,84301,{D. A. TyurinV. A. BelovD. N. LaikovA. V. AkimovE. Y. Misochko}
303,704357.0,Clinical and radiological results of calcium phosphate cement-assisted balloon osteoplasty for Colles' fractures in osteoporotic senile female patients,eng,J Orthop Sci,Journal of orthopaedic science : official journal of the Japanese Orthopaedic Association,-94325.0,15.0,2.0,1/10/01,nan,{A. SudoS. IshiguroK. Iida}
304,716785.0,Explosive power and asymmetry in leg muscle function in frequent fallers and non-fallers aged over 65,nan,nan,nan,nan,nan,2.0,1/2/01,nan,{Rutherford OMKennedy JSkelton DA}
305,746065.0,Anxiety and depression in patients with chronic obstructive pulmonary disease: an open agenda for research.,nan,nan,nan,nan,nan,1.0,nan,nan,{Costin M.Dumbrav__ E.L.Postolache P.Cojocaru D.C.}
306,nan,Classification of autogenous skull grafts in cranial reconstruction,eng,nan,The Journal of the Oklahoma State Medical Association,-94325.0,86.0,7.0,1/1/93,nan,{S. PelofskyP. D. Hunter}
307,934177.0,An Assessment of Voluntary Adolescent Mental Health Screening and Referral in a Children's Hospital Emergency Department,nan,nan,nan,nan,nan,0.0,nan,nan,{NCT00750412 }
308,nan,Implementing participatory intervention and research in communities: lessons from the Kahnawake Schools Diabetes Prevention Project in Canada,English,nan,nan,nan,nan,6.0,1/3/01,nan,nan
309,872389.0,Bile acid metabolism by fresh human colonic contents: a comparison of caecal versus faecal samples.,eng,Gut,Gut,-94325.0,nan,6.0,1/1/12,nan,{R H DowlingG M MurphyP B HylemonG FrenchM J VeyseyL A Thomas}
310,nan,The role of viral infection in pulmonary exacerbations of     bronchiectasis in adults: a prospective study,English,nan,nan,nan,nan,6.0,1/15/01,nan,{Gao YHLin ZYZhang GJZhong NSChen RCGao YTang YLin ZMXu GLi HMGuan WJ}
311,452432.0,Feverfew (Tanacetum parthenium L.): A systematic review.,nan,nan,nan,nan,0.0,0.0,nan,nan,{NULL}
312,320139.0,Impact of second-line drug resistance on tuberculosis treatment outcomes in the United States: MDR-TB is bad enough,nan,nan,nan,nan,nan,10.0,1/12/01,nan,nan
313,735083.0,Muscle variables of importance for physiological performance in competitive football.,ENG,European journal of applied physiology,nan,nan,nan,-1.0,nan,nan,{Sebastien RacinaisOlivier GirardLars NyboMagni MohrMartin Thomassen}
314,978471.0,Chapter 25 - Skin Manifestations of HIV Infection,nan,nan,nan,nan,0.0,nan,1/3/01,nan,nan
315,152626.0,Recurrent distal 16q duplication and terminal 22q deletion: prenatal diagnosis and genetic counseling,nan,nan,nan,nan,49.0,0.0,1/10/01,nan,{D. D. TownC. P. ChenY. N. SuW. CN  - PubMed DA  - Dec DO  - 10.1016/s1028-4559(10)60117-9 DP  - NLM ET  - 2011/01/05 WangC. W. PanC. C. LeeF. J. TsaiP. C. WuM. C. Huang}
316,90272.0,Role of core-needle biopsy in thyroid nodules with initially nondiagnostic cytologic results.,eng,Radiology,Radiology,-94325.0,nan,2.0,1/14/02,nan,nan
317,776651.0,The endoplasmic reticulum-associated VP7 of rotavirus is targeted to axons and dendrites in polarized neurons,English,nan,nan,nan,22.0,8.0,1/1/93,nan,{K. KristenssonL. SvenssonH. B. GreenbergK. Weclewicz}
318,nan,nan,nan,nan,nan,nan,56.0,8.0,1/9/01,nan,{R. KernA. PronovostP. Peng}
319,623358.0,Moderation of cognition-intention and cognition-behaviour relations: a meta-analysis of properties of variables from the theory of planned behaviour.,nan,The British journal of social psychology / the British Psychological Society,Br J Soc Psychol,-94325.0,nan,0.0,1/4/06,nan,{Paschal SheeranRichard Cooke}
320,385940.0,Normalisation of left ventricular systolic function after change from VVI pacing to biventricular pacing in a child with congenital complete atrioventricular block long-QT syndrome and congenital muscular dystrophy: a 10-year follow-up.,eng,Cardiology in the young,Cardiol Young,-94325.0,24.0,3.0,nan,nan,{Jesper I ReimersSabrina G ElleseHenrik  Andersen}
321,nan,Estimating the Effect of Land Leases on Prices of Inner-city Apartment Buildings,nan,nan,nan,420980,40.0,10.0,nan,2049,{Christian T. L. Janssen}
322,515254.0,Radiographic detection of artificially created horizontal root fracture using different cone beam CT units with small fields of view.,eng,Dento maxillo facial radiology,nan,nan,nan,nan,1/13/01,20120261,{S MuratH AvseverS Y_kselC S PaksoyB OnderK Kamburoglu}
323,674623.0,nan,eng,Actas espaolas de psiquiatr_a,Actas Esp Psiquiatr,-94325.0,41.0,nan,1/13/05,nan,{Angel Rosa-AlczarAna I Rosa-AlczarMarina Iniesta-Sep_lveda}
324,226419.0,Anterior approach unilateral right sacrospinous fixation for recurrent pelvic organ prolapse following multiple colorectal surgeries.,ENG,International journal of colorectal disease,nan,nan,-1.0,-1.0,7/15/01,nan,{Enie Akhtar Bt NawawiAhlam M Al-KharabshehTsia-Shu Lo}
325,nan,A community-based trachoma survey: Prevalence and risk factors in the Tigray region of northern Ethiopia,nan,nan,nan,nan,13.0,0.0,1/6/01,nan,{J. De La CameraM. M. MesfinA. M. KedirG. AmanualT. ArayaI. G. Tareke}
326,453637.0,Corneal collagen cross-linking for nonectatic disorders: A systematic review.,nan,nan,nan,nan,0.0,0.0,nan,nan,nan
327,nan,Multiple dural arteriovenous fistulas presenting as rapidly progressive dementia.,eng,The neurologist,nan,-94325.0,18.0,nan,1/12/05,nan,{Diana DuroAugusto GouloGon_alo SantosNuno Mendon_aIsabel SantanaEg_dio Machado}
328,462849.0,Methodological Review of the Quality of Reach Out and Read: Does It &quot;Work&quot;?,nan,nan,nan,nan,0.0,0.0,nan,nan,{NULL}
329,338547.0,New therapies in soft tissue sarcoma,nan,nan,nan,-94325.0,15.0,2.0,1/10/01,nan,{Bruno VincenziDaniele SantiniGiuseppe ToniniAnna Maria Frezza}
330,438808.0,Descemet's stripping endothelial keratoplasty: safety and outcomes: a report by the American Academy of Ophthalmology,nan,nan,nan,nan,0.0,0.0,nan,nan,nan
331,352040.0,Usefulness of a Survey on Underage Drinking in a Rural American Indian Community Health Clinic,nan,American Indian and Alaska Native Mental Health Research: The Journal of the National Center,nan,-94325.0,20.0,2.0,1/13/01,nan,{Joel W. GrubeJuan A. LunaDavid A. GilderJennifer RobertsDaniel CalacCindy L. EhlersRoland S. Moore}
332,887131.0,Antidiabetic oral treatment in older people: does frailty matter?,eng,Drugs & aging,Drugs Aging,-94325.0,nan,-1.0,nan,nan,{Angela Marie AbbatecolaAndrea CorsonelloSilvia BustacchiniFabrizia LattanzioGiuseppe Paolisso}
333,182296.0,Body and Illness: Considering Visayan Filipino Children's Perspectives Within Local and Global Relationships of Inequality,nan,nan,nan,nan,25.0,0.0,1/6/01,nan,{Aitken Alderson Anderson Aptekar Backett-Milburn Beazley Becker Bello Berman Billig Bluebond-Langner Borchgrevink Bucholtz Christensen Constantino Cornwall Dell Clark DiCarlo Diprose Douglas Downe Geissler Goodenough Hart James James Jocano Katz Koppitz L AguilarLisa M. Mitchell}
334,49847.0,[Dinggui Oil Capsule in treating irritable bowel syndrome with stagnation of qi and cold: a prospective multi-center randomized placebo-controlled double-blind trial],nan,nan,nan,nan,nan,nan,1/7/01,nan,{M. D. JiangZ. J. FanT. Q. DA  - Jul DP  - NLM ET  - 2007/07/17 LiQ. XiaL. WangZ. YuR. M. ZhangF. X. ZhangX. N. YangH. R. Zhang}
335,524073.0,Evaluation of technical quality of endodontic treatment--reliability of intraoral radiographs.,eng,Endodontics & dental traumatology,Endod Dent Traumatol,-94325.0,13.0,6.0,12/1/97,nan,{M EckerbomT Magnusson}
336,348813.0,nan,eng,Cardiol Young,nan,nan,10.0,5.0,nan,nan,{G VaksmannA VincentelliC FrancartM A CajotG M BrevireF GodartJ M CoulletP DevosC Rey}
337,427933.0,nan,eng,AACN Clinical Issues: Advanced Practice in Acute & Critical Care,nan,-94325.0,nan,nan,1/5/10,nan,{Carmelo GraffagninoDaiWai M Olson}
338,6862.0,Long-term outcome for immune suppression and immune related lymphoproliferative disorder: Prospective data from the United Kingdom Children's Leukaemia and Cancer Group registry 1994-2004,nan,Leukemia and Lymphoma,nan,-94325.0,nan,nan,1/12/01,nan,{A. WotherspoonM.M. TajN. HadzicM. BurkeR. HobsonS.E. HeightM. ViskadurakiC.R. Pinkerton}
339,853676.0,nan,eng,nan,nan,-94325.0,5.0,2.0,1/4/01,nan,{Meletios A DimopoulosNikolaos AnagnostopoulosMarkela P ZorzouAthanasios AnagnostopoulosEleni EfstathiouChristos PoziopoulosGeorge HamilosVassiliki GrigorakiDimitra GikaAthanasios ZomasIrini Xilouri}
340,nan,A controlled trial of anterior spinal fusion and dbridement in the surgical management of tuberculosis of the spine in patients on standard chemotherapy: a study in two centres in South Africa. Seventh Report of the Medical Research Council Working Party on tuberculosis of the spine,nan,nan,nan,nan,59.0,2.0,1/1/78,nan,{NULL}
341,734870.0,nan,ENG,International journal of geriatric psychiatry,nan,nan,1.0,-1.0,9/15/10,nan,{Stephen E GilmanChaoqiang JiangKar Keung ChengC Mary SchoolingTai Hing LamMichael Y NiGabriel M LeungWeisen Zhang}
342,540850.0,Glucocorticosteroid treatment of vasogenic oedema,eng,Acta Neurochir Suppl (Wien),nan,-94325.0,43.0,0.0,1/1/88,nan,nan
343,465756.0,Non-surgical treatments for anal fissure in adults.,nan,nan,nan,nan,0.0,0.0,nan,nan,nan
344,762269.0,Spontaneous pneumomediastinum in a healthy adolescent.,eng,Acta Clin. Croat.,nan,-94325.0,48.0,4.0,1/9/09,nan,{Renata Vrsalovi_Eva VeronaIva Mihatov-Stefanovi_Biserka Cicak}
345,441902.0,Pharmacotherapy for inherited colorectal cancer. [Review] [42 refs],nan,nan,nan,nan,0.0,0.0,nan,nan,{NULL}
346,950233.0,The vascular depression hypothesis: The influence of age on the relationship between cerebrovascular risk factors and depressive symptoms in community dwelling elders,nan,Aging & Mental Health,nan,-94325.0,9.0,2.0,nan,nan,{S. A. MurrellB. T. MastA. R. Azar}
347,621415.0,The link between smoking and impotence: two decades of evidence.,nan,nan,nan,nan,32.0,6.0,nan,nan,nan
348,633877.0,Stapled haemorrhoidopexy for the treatment of haemorrhoids: a systematic review.,nan,Colorectal disease : the official journal of the Association of Coloproctology of Great Britain and Ireland,nan,nan,nan,3.0,1/9/03,nan,nan
349,756208.0,Rapid diagnosis of Mycobacterium tuberculosis infection in children using interferon-gamma release assays (IGRAs).,eng,Allergy and asthma proceedings : the official journal of regional and state allergy societies,nan,-94325.0,33.0,3.0,nan,nan,nan
350,97853.0,L2 spinal nerve-block effects on acute low back pain from osteoporotic vertebral fracture,nan,nan,nan,nan,10.0,8.0,1/9/01,nan,{S. OritaM. TakasoS. OhtoriS. KishidaG. InoueM. SuzukiK. YamauchiN. OchiaiM. YamashitaY. EguchiK. Takahashi}
351,720775.0,Depression treatment preferences among Japanese undergraduates: using conjoint analysis,English,International Journal of Social Psychiatry,nan,-94325.0,58.0,2.0,1/12/01,nan,{S. SakamotoY. Okumura}
352,294439.0,Alcohol-related road traffic injuries in Eldoret Kenya,nan,East African Medical Journal,nan,-94325.0,75.0,12.0,nan,nan,{W Odero}
353,375430.0,nan,nan,nan,nan,nan,30.0,0.0,1/15/01,1444,{M. ThomasE. FairholmeN. NicholsM. George}
354,689666.0,Frequency of CDH1 germline mutations in gastric carcinoma coming from high- and low-risk areas: metanalysis and systematic review of the literature.,eng,nan,nan,nan,12.0,-1.0,nan,8,nan
355,896848.0,nan,eng,Journal Of Anesthesia,J Anesth,-94325.0,29.0,4.0,1/15/08,nan,{Michiko OsudaSatoshi KazumaMichiaki YamakageShunsuke TachibanaTomo Hayase}
356,231182.0,The change in eating disorder symptoms scale: Scale development and psychometric properties,nan,nan,nan,nan,11.0,3.0,1/10/01,nan,{D. L. Spangler}
357,232896.0,Detecting and monitoring the symptoms of Parkinson's disease using smartphones: A pilot study.,ENG,Parkinsonism & related disorders,nan,nan,1.0,-1.0,7/15/03,nan,{S AroraA ZhanS DonohueE R DorseyK M BiglanV VenkataramanM A Little}
358,798716.0,Osteoid osteoma in a 16-year-old boy presenting with atrophy of the left thigh: diagnostic difficulties.,eng,Turk. J. Pediatr.,nan,-94325.0,50.0,4.0,1/8/07,nan,{Akin Uz_mc_gilMeral Top_uM Fani BozkurtSinem Akg_l}
359,704812.0,Systematic review of economic aspects of alternative modes of delivery,nan,nan,nan,nan,108.0,2.0,1/1/01,nan,nan
360,203084.0,Specific collaborative group intervention for patients with medically unexplained symptoms in general practice: A cluster randomized controlled trial,nan,nan,nan,nan,nan,2.0,nan,nan,{Sauer N.Szecsenyi J.Faber R.Guthrie E.Schaefert R.Herzog W.Boelter R.Wild B.Kaufmann C.Schellberg D.}
