ID,id,article_title,article_language,journal_title,jounral_abbreviation,journal_issn,article_jvolumn,article_jissue,article_jcreated_at,article_pagination,author_list
764,259267.0,Intra-operative change of gastric ph during laparotomic cholecystectomy under general anaesthesia: A prospective case-control study,nan,nan,nan,3.566001035214283,56.0,0.0,1/12/01,40-43,{S. DeyP. BhattacharyyaB. K. BiswasB. BhattaraiP. Bhakta}
765,24381.0,The CARE guidelines: consensus-based clinical case reporting guideline development.,3.0917865410548266,Headache,3.004357918601092,nan,53.0,10.0,1/13/11,1541-7,{[Collective Name] CARE GroupJoel J GagnierDavid MoherDouglas G AltmanGunver KienleDavid RileyHarold Sox}
766,827921.0,Effect of a creative-bonding int@@ervention on Taiwanese nursing students' self-transcendence and attitudes toward elders.,3.0917865410548266,Res Nurs He%alth,nan,nan,32.0,2.0,1/9/04,204-16,{Sandra M WalshShiue Chen}
767,461204.0,Fc receptor-like 3 (FCRL3) -169 C/T polymorphism and systemic lupus erythematosus: A meta-analysis.,nan,nan,nan,nan,0.0,0.0,nan,nan,{NULL}
768,482860.0,[Indirect anastomoses for moyamoya disease].,3.0917865410548266,No shinkei geka. Neurological surgery,nan,nan,26.0,9.0,9/1/98,769-86,{Y Matsushima}
769,18298.0,Ulcer Healing After Peripheral Intervention.,3.0917865410548266,Circulation journal : official journal of the Japanese Circulation Society,3.004357918601092,nan,-1.0,-1.0,4/14/0??7,nan,{Daiki UchidaYukihiro SaitoHisashi UchidaAtsuhiro KoyaNobuyoshi Azuma}
770,365654.0,Measuring the bright side of being blue: a new tool for assessing analytical rumination in depression.,3.0917865410548266,PLoS One,3.004357918601092,nan,9.0,11.0,1/14/01,e112077,{Skye P BarbicPaul W AndrewsZachary Durisko}
771,625306.0,[Mammographic density: a valid risk factor for breast cancer?].,3.0917865410548266,Prvention de l'insuffisance rnale induite par les produits de contrnste iodes,nan,nan,89.0,9.0,1/8/09,1140-50,{G Boutet}
772,572343.0,High-dose sequential (HDS) chemotherapy for high-risk non-Hodgkin's lymphoma: long-term analysis and future developments.,3.0917865410548266,Ann. Hematol.,nan,nan,80.0,-1.0,1/1/01,B123-6,{M LadettoD CaraccioloG RossiC MarinoneL BerguiA CutticaA SalomoneM BoccadoroI RiccaC TarellaM PaganoF ZallioP GavarottiA PileriA de Crescenzo}
773,88262.0,Core symptom measures in cancer clinical trials.,3.0917865410548266,Journal of the National Cancer Institute,3.004357918601092,nan,106.0,7.0,1/14/07,nan,{Carolyn Gotay}
774,3155316.9266096307,Human papillomavirus infection and increased risk of HIV acquisition. A systematic review and meta-analysis.,3.0917865410548266,AIDS (London England),3.004357918601092,nan,26.0,17.0,11/13/12,2211-22,{Chunhui WangRichard HayesLouise KuhnStephen ShiboskiJennifer S SmithNatasha L LarkeDeborah Watson-JonesCatherine F HoulihanPatti E GravittKaren K Smith-McCune}
775,718292.0,Prevalence of different morphologic forms of the human tongue in young Finns.,3.0917865410548266,Oral surgery oral medicine and oral pathology,3.004357918601092,nan,53.0,2.0,2/1/82,152-6,{M MikkonenR KotilainenA Kullaa-Mikkonen}
776,245200.0,Osteoporosis in men,3.0917865410548266,Arch Intern Med,3.004357918601092,nan,158.0,2.0,1/1/98,194,{M. Galus}
777,307302.0,Neurolymphatische Bahnen: neue wissenschaftliche Nachweise untermauern die Perrin-Technik,nan,nan,nan,nan,14.0,2.0,1/13/06,15-O#ct,{Raymond N. Perrin}
778,217418.0,Long term follow-up of conservative treatment of severe??ly traumatized maxillary inciso$rs,nan,nan,nan,nan,56.735662068838536,4.0,1/1/97,190-192,{Z. HirschfeldI. BrinA. FuksM. Guelmann}
779,413717.0,Magnetic resonance imaging evaluation of bone marrow changes in obstructive sleep apnoea syndrome in adults,nan,nan,nan,nan,111.0,4.0,1/6/01,572-84,{A. R. AleandriD. ManciniT. CosentiniR. Le DonneN. Colavita}
780,62246.0,Pulpal response to a fluoride-releasing all-in-one resin bonding system.,3.0917865410548266,Operative dentistry,3.004357918601092,nan,27.0,3.0,1/2/05,271-7,{Masayuki OtsukiMakoto ArakawaHidekazu SonodaYasutaka SasafuchiYuichi KitasakoJunji Tagami}
781,945021.0,Impr%ovement of action tremor by chronic cortical stimulation,3.0917865410548266,Mov Disord,3.004357918601092,nan,13.0,1.0,1/1/98,Aug-84,{B. PollinC. GenyJ. P. NguyenP. C??esaroA. ??Feve}
782,649817.0,Validity of Rorschach Inkblot scores for discriminating psychopaths from non-psychopaths in forensic populations: a meta-analysis.,3.0917865410548266,Psychological assessment,3.004357918601092,nan,22.0,2.0,1/10/06,3?%?36-49,{Scott O LilienfeldKeli Holloway AllenHoward N GarbJessica L WildermuthM Teresa NezworskiJames M Wood}
783,934327.0,Use of a Brief Phone Call After ED Discharge,nan,nan,nan,3.246284591011187,0.0,0.0,nan,nan,{NCT01893931 }
784,546484.0,The Effects of Pre-Reading and Sharing Mechanisms on Learning with the Use of Annotations,4.654820177192422,Turkish Online Journal of Educational Technology - TOJET,nan,nan,10.0,8.137554367884995,1/11/04,234-249,{Wu-Yuin HwangGuo-Liang Hsu}
785,917231.0,[Occupational exposure to sevoflurane in pediatric operating rooms: the multi-point sampling method for risk assessment].,3.0917865410548266,Patologie asbesto correlate in congiunti di lavoratori del settore cemento-amianto.,nan,nan,34.0,3.0,1/12/07,266-8,{V CerabonaM WachockaU MoscatoV CamisaM G TucciS ZaffinaV MontaldiA Poscia}
786,3702422.6157770767,Impact of crizotinib on patient-reported symptoms and global quality of life (QoL) compared with chemotherapy in a phase III study of advanced alk-positive non-small cell lung cancer (NSCLC),nan,European Journal of Cancer,nan,nan,49.0,0.0,1%/13/01,,{V. HirshJ.Y. HanF. BlackhallS. IyerD.W. KimA. ShawA. ReismanK. WilnerH. NokiharaB. Besse}
787,724055.0,A systematic review and meta-analysis of trials of treatment of depression from India,nan,Indian Journal of Psychiatry,nan,nan,56.0,0.0,1$/14/01,29-38,{S. SarkarS. Grover}
788,63738.0,[The use of ethonium paste in the treatment of deep dental caries].,3.0917865410548266,Stomatologiia,3.004357918601092,nan,50.0,2.0,3/1/71,79-80,{P K Shestakov}
789,422739.0,Reporting methods in studies developing prognostic models in cancer: a review.,3.0917865410548266,BMC medicine,3.004357918601092,nan,8.0,0.0,1/10/01,20-20,{Patrick RoystonRachel WatersSusan Mallett$Douglas G AltmanSusan Dutton}
790,97795.0,Hospital discharge after ambulatory knee arthroscopy: a comparison of epidural 2-chloroprocaine versus lidocaine,nan,nan,5.213585010706444,5.469122774429658,26.0,1.0,1/1/%#01,35-40,{J. M. NealD. J. KopaczM. A. LewisJ. J. Deck}
791,155127.0,p16(INK4) Expression is not associated with human papillomavirus in oral lichen planus.,3.0917865410548266,Oral surgery oral medicine oral pathology and oral radiology,3.004357918601092,nan,118.0,6.0,1/14/12,#694-@@702,{Lucio MontebugnoliLuca MorandiLuca ScapoliAnnalisa PalmieriDavide B GissiMaria Pia FoschiniIlaria Manelli}
792,100986.0,Association of bleeding mortality and sex in acute corona#ry syndromes: the missing triangle.,3.0917865410548266,Journal of cardiovascular medicine (Hagerstown Md.),3.004357918601092,nan,-1.0,-1.0,9/23/14,nan,{Rossana De PalmaPaolo OrtolaniCaterina CaminitiEmilia SolinasPiera Angelica MerliniDiego ArdissinoGiorgia PaoliMaria Francesca NotarangeloPaolo GuastarobaAntonio MarzocchiLuigi VignaliRoxana MehranAntonio Manari}
793,166179.0,[Severe exposure to environmental lead in a child population in Antofagasta Chile],4.13874348251404,Exposicion severa a plomo ambiental en una poblacion infantil de Antofagasta Chile.,nan,nan,128.0,2.0,1/1/00,221-32,{I. DelgadoJ. Vega}
794,740811.0,Tracheostomy Care and Complications in the Intensive Care Unit,nan,Critical Care Nurse,nan,nan,33.0,5.0,1/13/01,18-31 14p,{Linda L. MorrisAndrea WhitmerErik McIntosh}
795,379577.0,Monitoring of fluid changes in hospitalized Malnourished Guatemalan children using bioelectrical impedance spectroscopy (BIS).,3.0917865410548266,Applied radiation and isotopes : including data instrumentation and methods for use in agriculture industry and medicine,3.004357918601092,nan,49.0,5.0,5/1/98,615-7,{C PithanM MazariegosN W SolomonsP F_rst}
796,658981.0,Preliminary state of development of prediction models for primary care physical therapy: a systematic review.,3.0917865410548266,Journal of clinical epidemiology,3.004357918601092,nan,65.0,12.0,1/12/12,1257-66,{Martijn W HeymansTobias van den BergHan J R AnemaLieke van OortBart W KoesArianne P VerhagenRiekie H C W de Vet}
797,215650.0,Bruxismo em crian_as Bruxism in children,nan,nan,nan,nan,3.0,2.0,nan,Aug-91,{Ronaldo FazziAna Estela HaddadMaria Salete Nahs Pires Corr_a}
798,521132.0,A cadaver model to evaluate the accuracy and reproducibility of plain radiograph step and gap measurements for intra-articular fracture of the distal radius.,3.0917865410548266,J Hand Surg Am,3.004357918601092,nan,29.0,5.0,1$??/4/09,841-7,{Jeff KnightJeffery M SmithThomas E TrumbleWren V McCallister}
799,892609.0,13th IEEE/ACM Symposium on Distributed Simulation and Real-Time Applications DS-RT 2009,nan,nan,nan,nan,0.0,0.0,nan,nan,{NULL}
800,366275.0,A systematic review on the application of cardiovascular risk prediction models in pharmacoeconomics with a focus on primary prevention.,3.0917865410548266,European journal of preventive cardiology,3.004357918601092,nan,19.0,7.596840607242153,1/12/08,42-53,{Maarten J PostmaPetros PechlivanoglouJelena Stevanovic}
801,513630.0,Pan-Canadian study of mammography screening and mortality from breast cancer.,3.0917865410548266,Journal of the National Cancer Institute,3.004357918601092,nan,106.0,11.0,1/14/11,nan,{Jennifer PayneRukshanda AhmadGregory DoyleNorm PhillipsAnna M ChiarelliChristine WilsonKathleen DeckerAndrew ColdmanBin ZhangJacques Brisson}
802,605423.0,Alcohol-related morbidity and mortality.,3.0917865410548266,Alcohol Research & Health,nan,nan,27.0,5.209974353620222,1/3/01,39-51,{J_rgen RehmGerhard GmelMaurizio TrevisanChristopher T Sempos}
803,495319.0,Clinical outcome following ICD removal. The Bilitch Registry Group,nan,nan,nan,nan,52.97133057377637,0.0,1/1/93,186-192,{S. FurmanD. T.?? Kawanishi%S. L. Song}
804,733752.0,Eliciting relative preferences for two methods of colorectal cancer screening,3.0917865410548266,European Journal of Cancer Care,nan,nan,14.0,2.0,1/5/01,124-31,{E. J. FrewJ. L. Wolst??enholmeD. K. Whynes}
805,252118.0,Bilingual speech: Bilateral control?,nan,Brain and Language,nan,nan,15.0,1.0,1/1/82,125-142,{H.M. SussmanP. FranklinT. Simon}
806,903817.0,Tiao-She nursing of traditional Chinese medicine for mild cognitive disorder: An assessment of clinical evidence,nan,Chin. J. Evid.-Based Med.,nan,nan,15.0,9.396120784626843,nan,346-352,{Li X.-H.Li G.-C.Xie Y.-L.Shang H.-C.Chi K.-L.Jin Y.-H.}
807,80799.0,One-pot semisynthesis of exon 1 of the Huntingtin protein: new tools for elucidating the role of posttranslational modifications in the pathogenesis of Huntington's disease.,3.0917865410548266,Angewandte Chemie (International ed. in English),3.004357918601092,nan,53.0,7.0,10/14/02,1928-33,{Annalisa AnsaloniJae Sun JeongFrancesco Si??mone RuggeriGiovanni DietlerZhe-Ming WangHilal A Lashuel}
808,385163.0,Pathophysiology of paradoxical embolism: evaluation of the role of interatrial septum anatomy based on the intracardiac echocardiography assessment of patients with right-to-left shunting.,3.0917865410548266,Cardiology in the young,3.004357918601092,nan,25.0,4.9717413079858,1/??15@@/01,47-55,{Gianluca RigatelliPaolo CardaioliMassimo GiordanAshe%sh BuchLaura OlivaDobrin VassilievAravinda Nan%jiundappaFabio Dell'AvvocataRamesh DaggubatiDario Adami}
809,645061.0,Impact of physical abuse on adulthood depressive symptoms among women.,3.0917865410548266,Issues Ment Health Nurs,nan,nan,29.0,3.0,1/8/03,299-314,{Hanan Al-ModallalAnn PedenDebra Anderson}
810,164721.0,[The microclimate of apartments and its hygienic norms],nan,Das Mikorklima der Wohnungen und seine hygienische Normierung.,nan,nan,13.0,10.0,1/1/67,7%56-6%0,{M. S. Goromossow}
811,730721.0,Prediction Study of Complications After Severe Trauma,nan,nan,nan,nan,0.0,0.0,1$/12/01??,nan,{NCT01713205 }
812,439302.0,American Society of Clinical Oncology clinical practice guideline update on the use of pharmacologic interventions including tamoxifen raloxifene and aromatase inhibition for breast cancer risk reduction.,nan,3.8247001330654684,nan,5.044233609504442,0.0,0.0,nan,nan,{NULL}
813,410748.0,Preliminary validity and reliability of a Thai Berlin questionnaire in stroke patients,nan,nan,nan,nan,7.0,0.0,1/14/01,348,{J. SaengsuwanK. SawanyawisuthN. UngtrakulJ. Saengsuwan}
814,133777.0,Spectrum and frequency of illness presenting to a pediatric emergency department.,3.0917865410548266,Acta clinica Belgica,3.004357918601092,nan,352.78844503011686,15.09937681100011,1/6/07,161-5,{P GrardJ MontesantiP LepageM M Massin}
815,775428.0,Organization of ribosomes and nucleoids in escherichia coli cells during growth and in quiescence,3.0917865410548266,Journal of Biological Chemistry,nan,nan,289.0,16.0,1/14/01,11342-11352,{K. PeiskerB. SinghS. SanyalQ. ChaiX. GeN. MetzendorfS. Dasgupta}
816,497593.0,Ventricular arrhythmias in the North American multidisciplinary study of ARVC: predictors characteristics and treatment,nan,nan,nan,nan,64.0,0.0,1/14/01,119-12%5,{N. A. Mark EstesScott McNittWojciech ZarebaBronislava PolonskyDouglas LaidlawMark S. LinkFrank MarcusKathleen Gear}
817,899060.0,Maxillofacial metastases: a retrospective review of one institution's 15-year experience,nan,Journal of Oral & Maxillofacial Surgery,nan,nan,71.0,3.6147511269795634,1/13/01,178-88,{R. A. OrdA. SalamaR. MovahedS. A. McClure}
818,424254.0,Precocious and delayed sexual development in children,3.0917865410548266,Acta Endocrinologica. Supplementum,3.004357918601092,nan,288.0,0.0,1/1/88,66-76,{B. T. Rudd}
819,161290.0,Premature androgenic alopecia a@@nd insulin resistance. Male equivalent of po$lycystic ovary syndrome?,nan,5.2832778163163425,nan,nan,39.0,0.0,1/5/01,127-31 ST  - Premature androgenic alopecia and insulin resistance. Male equivalent of polycystic ovary syndrome?-,{L. StarkaJ. VrbikovaM. DA  - Dec DP  - Nlm ET  - 2006/03/24 HillM. DuskovaI. Cermakova}
820,4256567.715415545,Pancytopenia : A rare presentation of legionella pneumonia,nan,Crit. Care Med.,nan,nan,41.0,12.0,nan,A326,{Cayetano K.Ghannam D.Rawat N.}
821,191138.0,Mold contamination in a controlled hospital environment: a 3-year surveillance in southern Italy,nan,nan,nan,nan,14.0,0.0,1/14/01,nan,{C. CorettiC. NapoliG. LoveroM. T. MontagnaG. CaggianoG. ScarafileO. de Giglio}
822,743819.0,Effect of (D)-fagomine on excreted Enterobacteria and weight gain in rats fed a high-fat high-sucrose diet.,3.0917865410548266,Obesity (Silver Spring Md.),3.004357918601092,nan,106.03351001240058,4.0,1/14/04,976-9,{Eunice Molinar-ToribioBenjam_n PiaLivia G_mezJara Prez-JimnezMarta CasadoSara Ramos-RomeroPere ClapsJosep Llu_s Torres}
823,193292.0,CSM2004 best platform,nan,nan,nan,nan,4.0,0.0,1/4/01,10-10 ST  - CSM2004 best platform-,{NULL}
824,91852.0,The importance and important limitations of ultrasound imaging for evaluating thyroid nodules.,3.0917865410548266,JAMA internal medicine,3.004357918601092,nan,173.0,19.0,10/28/13,1796-7,{David CooperErik K Alexander}
825,663526.0,Blood 25-hydroxyvitamin D conce#ntration and hypertens$ion: a meta-analysis.,3.0917865410548266,Journal of hyp@@ertension,3.004357918601092,nan,29.0,4.0,1/11/04,636-45,{Susanna C LarssonAnn BurgazAlicja WolkNicola Orsini}
826,382853.0,CT features of pulmonary arterial hypertension and its major subtypes: a systematic CT e??valuation of 292 patients from the ASPIRE Registry.,3.0917865410548266,Thorax,3.004357918601092,nan,70.0,4.0,1/15/04,3%82-7,{R CondliffeJ HurdmanJ M WildD G KielyS RajaramA J SwiftC A ElliotC DaviesC HillI SabroeC Johns}
827,1266.0,Clinical effect observation of fule cream to cure dermatitis eczemal,nan,International Medicine & Health Guidance News [Guo Ji Yi Yao Wei Sheng Dao Bao],nan,nan,14.0,14.0,1/8/01,65-68-,{X. H. LYWXWF Wu}
828,407082.0,A randomized controlled trial of the effects of vitamin D on muscle strength and mobility in older women with vitamin D insufficiency.,3.0917865410548266,Journal of the American Geriatrics Society,3.004357918601092,nan,58.0,11.0,1/10/11,Aug-63,{Amanda DevineNicole AustinRichard L PrinceKun ZhuDavid Bruce}
829,411673.0,Sleep and sleep disorders in the hospital,nan,3.0331685541294418,nan,nan,141.0,5.0,1/12/01,1337-45,{S. B. VenkateshiahN. A. Collop}
830,382297.0,Doppler-derived flow pattern in the descending aorta does not predict systemic to pulmonary arterial collateral flow in patients with single ventricle palliation: a cross-sectional study.,3.0917865410548266,World journal for pediatric & congenital heart surgery,3.004357918601092,nan,6.0,2.0,1/15/04,209-14,{Mark A FogelMichael V Di MariaMatthew A HarrisMeryl S CohenKevin K Whitehead}
831,414396.0,Sleep-disordered breathing associated with long-term opioid therapy,nan,nan,nan,nan,123.0,2.0,1/3/01,632-9,{T. V. ClowardJ. M. WalkerS. RhondeauR. J. Farney}
832,635082.0,Efficacy of allogeneic hematopoietic stem cell transplantation depends on cytogenetic risk for acute myeloid leukemia in first disease remission: a metaanalysis.,3.0917865410548266,CANCER,nan,nan,103.0,8.0,4/15/05,1652-8,{Nobuhiko EmiMasamitsu YanadaTomoki NaoeKeitaro Matsuo}
833,446599.0,[Case management for moderate-need patients and recovery: what can we learn from experimental and quasi-experimental studies?]. [Review] [French],nan,nan,nan,nan,0.0,0.0,nan,4.884338177331462,{NULL}
834,1928618.888751039,Considerations for the diagnosis and treatment of testosterone deficiency in elderly men.,3.0917865410548266,The American journal of medicine,3.004357918601092,nan,120.0,10.0,1/7/10,835-40,{Stephen A GeraciMohammed KaziChristian A Koch}
835,637323.0,A comparison of early gastric and post-pyloric feeding in critically ill patients: a meta-analysis.,3.0917865410548266,Intensive care medicine,3.004357918601092,nan,32.0,5.0,1/6/05,639-49,{Kwok M HoGeoffrey J DobbSteven A R Webb}
836,153797.0,Definitive radiotherapy for T1 glottic squamous cell carcinoma: a 15-year Cruces University Hospital experience,nan,Clinical & Translational Oncology: Official Publication of the Federation of Spanish Oncology Societes & of the National Cancer Institute of Mexico,nan,4.21869279273999,15.0,0.0,1/13/01,925-31,{Martinez-Indart LCacicedo Jdel HoyoGomez-Iturriaga ACasquero FLopez J LBilbao PO }
837,470179.0,Comparison of methods for defining prevalent vertebral deformities: the Study of Osteoporotic Fractures.,3.0917865410548266,Journal of bone and mineral research : the official journal of the American Society for Bone and Mineral Research,3.004357918601092,nan,10.0,6.0,6/1/95,890-902,{M C NevittL PalermoH K GenantR San ValentinD M BlackR EpsteinS R Cummings}
838,9325.0,Children are pharmaco-therapeutic orphans.,3.0917865410548266,Pediatric allergy and immunology : official publication of the European Society of Pediatric Allergy and Immunology,3.004357918601092,nan,21.0,2.0,1/10/03,249-50,{C K NaspitzJ O Warner}
839,294719.0,Prehospital hypertonic saline resuscitation attenuates the activation and promotes apoptosis of neutrophils in patients with severe traumatic brain injury.,3.0917865410548266,Shock (Augusta Ga.),3.004357918601092,nan,40.0,5.0,1/13/11,366-74,{David B HoytSandro B RizoliAndrew J BakerEileen M BulgerWolfgang G JungerJoseph CuschieriShawn G RhindPang N Shek}
840,38130.0,Value of intravenous cholangiography prior to laparoscopic cholecystectomy,nan,nan,nan,nan,23.0,0.0,1/1/99,693-6; discussion 697 ST  - Value of intravenous cholangiography prior to laparoscopic cholecystectomy-,{S. TruongK. H. TreutnerM. JansenC. SchravenV. DA  - Jul DP  - NLM ET  - 1999/07/03 SchumpelickJ. Neuerburg}
841,455697.0,Systematic review of occupational engagement and health outcomes among community-dwelling older adults,3.6967448786448074,nan,nan,nan,0.0,0.0,nan,nan,{NULL}
842,518335.0,Fractional flow reserve for guiding PCI.,3.0917865410548266,The New England journal of medicine,3.004357918601092,nan,360.0,19.0,7/9/05,2024; author reply 2026-7,{Somjot S BrarWilliam A Gray}
843,503528.0,Difference in postural control between patients with functional and mechanical ankle instability,3.0917865410548266,Foot Ankle Int,3.004357918601092,nan,35.0,43.4273751207805,1/14/01,1068-1074,{S% Y ChenH ChenH Y LiJ ZhangY H Hua}
844,503354.0,Early ankle mobilization Part I: The immediate effect on acute lateral ankle sprains (a randomized clinical trial),nan,Military Medicine,5.556623261732577,nan,159.0,1.0,1/1/94,15-20,{J R DettoriB D PearsonC J BasmaniaW M Lednar}
845,176844.0,Importance of Arsenic and pesticides in epidemic chronic kidney diseas@@e in Sri Lanka,nan,nan,nan,3.491721898945338,88.65270957880855,0.0,1/14/01,nan,{C. JayasumanaR. GajanayakeS. Siribaddana}
846,820549.0,Chiropractic vertebral subluxations,nan,Focus on Alternative and Complementary Therapies,nan,nan,15.0,1.0,1/10/01,13-14,{S. Homola}
847,250975.0,Effect ??of infliximab on the healing of intestinal anastomosis. An experi%mental study in rats.,3.0917865410548266,Int J Surg,3.004357918601092,nan,12.0,9.0,1/14/01,969-75,{Konstantinos NastosKonstantinos EvangelouMarilena PapaioannouJohn VlachogiannakosMaria GazouliApostolos PapaloisChristos ZeglinasIoannis PapaconstantinouPanagis LykoudisCharalampos TzathasAnneza Yiallourou}
848,37173.0,How to appraise the effectiveness of treatment,nan,3.9753075388070864,nan,nan,27.0,0.0,1/11/01,525-531 ST  - How to appraise the effectiveness of treatment-,{Suzanne B. StewartPhillip DahmD DB  - rzh DO  - 10.4103/0970-1591.91446 DP  - EBSCOhost}
849,641251.0,Non-steroidal anti-inflammatory drugs and myocardial infarctions: comparative systematic review of evidence from observational studies and randomised controlled trials.,3.0917865410548266,Ann Rheum Dis,3.004357918601092,nan,66.0,10.0,1/7/10,1296-304,{E H ChoyD L ScottP A ScottG H KingsleyC M Smith}
850,302179.0,Using a social communication intervention to improve the social interactions and employment experiences of adolescents with high functioning autism spectrum disorders,nan,nan,nan,nan,0.0,0.0,1/11/01,3224,{Beth Anne Clavenna-Deane}
851,627882.0,Is there evidence that barrier membranes prevent bone resorption in autologous bone grafts during the healing period? A systematic review.,3.0917865410548266,International Journal of Oral &# M@@axillofacial Implants,nan,nan,22.0,11.449696786354352,1/7/05,390-8,{Ruud R M BosGerry M RaghoebarPepijn F M GielkensBoudewijn Stegenga}
852,264151.0,Recognizing naming and measuring a family intensive care unit syndrome,nan,nan,5.588695488040236,nan,11.0,3.0,1/14/01,435-441,{D. R. SullivanG. Netzer}
853,3597043.30314595,Association of diet exercise and smoking modification with risk of early cardiovascular events after acute coronary syndromes.,nan,Cir%culat#ion,3.004357918601092,nan,121.0,6.0,2/16/10,750-758 9p,{Yusuf SFox KAChow CKAnand SSJolly SRao-Melacini P}
854,12554.0,Retrovirus-mediated WASP gene transfer corrects Wiskott-Aldrich syndrome T-cell dysfunction.,3.0917865410548266,Human gene therapy,3.004357918601092,nan,13.0,9.0,10/2/06,1039-46,{G Jayashree JagadeeshDavid L NelsonTaizo WadaFabio Candotti}
855,564924.0,Complication rate of endosonography (endobronchial and endoscopic ultrasound): a systematic review.,3.0917865410548266,Respiration; international review of thoracic diseases,3.004357918601092,nan,87.0,4.0,1/14/01,343-51,{A van BredaM B von BartheldJ T Annema}
856,364080.0,Comparison of serum and renal gentamicin concentrations with fractional urinary excretion tests as indicators of nephrotoxicity,nan,nan,nan,nan,11.0,4.0,1/1/88,330#-@@7,{S. A. BrownF. B. Garry}
857,727134.0,The Antiseptic Efficacy and Tolerability of Lavasept 0.04% on Acute Traumatic Wounds,3.9936394013259826,nan,nan,nan,0.0,0.0,1/10/01,nan,{NCT01153620 }
858,356635.0,Determinants of arterial wall remodeling during lipid-lowering therapy: serial intravascular ultrasound observations from the Reversal of Ath??erosclerosis with Aggressive Lipid Lowerin@@g Therapy (REVERSAL) trial,nan,Circulation,3.004357918601092,nan,113.0,24.0,1/6/01,$$2826-34,{S. LinS. E. NissenK. WolskiI. SipahiE. M. TuzcuS. J. NichollsT. ChurchillP. SchoenhagenT. CroweC. WangA. LoydC. Apperson-HansenW. A. Magyar}
859,1567452.5345629326,Economic evaluation of inhaled nitric oxide in preterm infants undergoing mechanical ventilation,nan,Pediatrics,nan,nan,124.0,5.0,1/9/01,1325-1332,{A. M. HibbsD. M. BlackJ. A. F. ZupancicA. CnaanP. L. BallardS. R. WadlingerL. PalermoW. E. TruogR. A. Ballard}
860,3445941.5910935486,The impact of emotional and social support on the quality of life depression and disability@@ among us adults with chronic obstructive pulmonary d@@isorder (COPD): A propensity score analysis,nan,Value in Health,nan,nan,18.0,11.224217731334903,1/15/01,A176,{R. ArabyatD. W. Raisch}
861,470615.0,Can we improve the follow up of asthmatic patients with asthma educational program (PAMA)? [Abstract],4.755530210033719,European respiratory journal,nan,nan,44.0,0.0,1/14/01,P3??02@@1,{Francitorra MESanchez GSManrique CAVelasco TTCastany A RE$scriche XFFernndez C??SFornell LLlvarez SFernndez EARodriguez MVFSim_ MRMayo EP}
862,71351.0,Differential dendritic cell-mediated activation and functions of invariant NKT-cell subsets in oral cancer.,3.0917865410548266,Oral diseases,3.004357918601092,nan,-1.0,-1.0,3/22/14,nan,{Nk ShuklaSn DasP@@ GaurAk Singh}
863,793299.0,[Use of probiotics and prebiotics in infant formulas].,3.0917865410548266,Prediccion de la masa muscular apendicular esqueletica basado en mediciones antropometricas en Adultos Mayores Chilenos.,nan,nan,31.0,-1.0,1/15/01,Jul-72,{Venancio Mart_nez Surez}
