ID,id,article_title,article_language,journal_title,jounral_abbreviation,journal_issn,article_jvolumn,article_jissue,article_jcreated_at,article_pagination,author_list
1,849855.2109684717,Late repair of injuries of the anal sphincter,3.0917865410548266,Proc R Soc Med,3.004357918601092,nan,64.0,12.0,1/1/71,1187-9@@,{A. G. ParksJ. F. McPartl#in}
2,498345.0,Ebola Virus GP Gene Polyadenylation Versus RNA Editing.,3.0917865410548266,The Journal of infectious diseases,3.004357918601092,nan,-1.0,-1.0,2/15/04,nan,{Valentina A VolchkovaJaroslav VoracPhilip LawrenceLaurie Repiquet-PaireViktor E Volchkov}
3,789958.0,Duane retraction syndrome associated with oculocutaneous albinism: an ocular miswiring.,3.0917865410548266,Indian journal of ophthalmology,3.004357918601092,nan,54.0,4.0,1/6/12,283-4,{Jitendra JethaniShashikant ShettySucheta ParijaP Vijayalakshmi}
4,169865.0,[Noninvasive p@@renatal diagnosis of trisomy 21 18 and 13 using cell-free fetal DNA],nan,nan,nan,nan,84.0,0.0,1/13/01,714-9 ST  - [Noninvasive prenatal diagnosis of trisomy 21 18 and 13 using cell-free fetal DNA]-,{G. JakielK. GorzelnikJ. G. ZimowskiT. CN  - PubMed DA  - Aug DP  - NLM ET  - 2013/11/07 RoszkowskiJ. Bijok}
5,3145986.7390655726,Diagnosis and Management of Cutaneous B-cell Lymphoma.,3.0917865410548266,Der??ma#tologic clinics,3.004357918601092,nan,33.0,4.0,1/$??15/10,835-40,{Lauren C Pinter-Brown}
6,98234.0,Pregabalin celecoxib and their combination for treatment of chronic low-back pain,nan,nan,nan,nan,10.0,4.0,%1/9/01,185-91,{C. L. RomanoG. MineoC. BonoraD. Romano}
7,823730.0,Activation and blockade of beta adrenoceptors in common cardiac disorders,3.0917865410548266,Br Med Bull,3.004357918601092,nan,29.0,2.0,1/1/73,163-7,{B N PrichardJ W Black}
8,729712.0,Long-term effects of spontaneous breathing during ventilatory support in patients with acute lung injury,nan,American journal of respiratory and critical care medicine,nan,nan,164.0,1.0,1/1/07,43-49,{St_ber FMutz NWrigge HPutensen CZinserling JZech SVon Spiegel T}
9,396821.0,Awareness of deficits and on-road driving performance,3.0917865410548266,Clinical Neuropsychologist,nan,nan,25.0,7.0,1/11%/01,1158-78,{L. J. RapportJ. A. GriffenL. A. BieliauskasC. BurtR. C. Bryer}
10,340222.0,A comparative evaluation of two head and neck im??mobilization devices using electronic portal imaging,nan,The British journal of radiology,nan,nan,241.06354834958054,0.0,1/6/01,158-61,{K. FlemingK. DonatoK. Leszczynski}
11,184417.0,Disparities in childhood asthma hospitalizations: A spatial analysis of contextual effects,nan,Transportation Research Part D-Transport and Environment,nan,nan,14.0,5.0,1/9/01,317-325,{J. L. LiP. Newcomb}
12,729686.0,Local anaesthetic wound infiltration used for caesarean section pain relief: a     meta-analysis,3.0917865410548266,International journal of clinical and experimental medicine,3.004357918601092,nan,8.0,6.0,1/15/01,10213-@@10224,{Yang MLi JLi YZhou MYang HShi XLi XYuan H}
13,278396.0,Smoking is accompanied by a suppressed cervical nitric oxide release in women with high-risk human papillomavirus infection,3.0917865410548266,Acta Obstet Gynecol Scand,3.004357918601092,nan,92.0,6.0,1/13/01,711-5,{T. S. MikkolaS. VuorentoO. YlikorkalaM. Vaisanen-TommiskaP. Rahkola-Soisalo}
14,965082.0,Imaging of scar in patients with ventricular arrhythmias of right ventricular origin: Cardiac magnetic resonance versus electroanatomic mapping,nan,Heart #Rhyth$m,nan,nan,8.0,5.0,1/#$11/01,S40$,{C. Hamilton-CraigS. BartolettiM. CasellaF. PernaM. L. NarducciP. SantangeliF. PintusA. NataleA. Dello RussoG. PelargonioG. BencardinoJ. D. BurkhardtF. BellocciL. Di Biase}
15,53321.0,Monoaxial versus polyaxial locking systems: a biomechanical analysis of different locking systems for the fixation of proximal humeral fractures,nan,5.13062755264065,nan,nan,35.0,8.0,1/11/01,1245-50,{T. ToppC. KuhneS. RuchholtzU. LewanA. KrugerT. MullerR. Zettl}
16,13601.0,Latex allergy in atopic children.,3.0917865410548266,British Journal of Dermatology. ,nan,nan,140.0,5.0,5/1/99,919-21,{R S LeverS A Holme}
17,668310.0,A randomized controlled trial of Tai chi for balance sleep quality and cognitive performance in elderly Vietnamese.,3.0917865410548266,Clinical Interventions In Aging,3.004357918601092,nan,7.0,-1.0,1/12/01,185-90,{Andreas KruseManh Hung Nguyen}
18,282987.0,Multisystemic Therapy for social emotional and behavioral problems in youth aged 10-17,3.0917865410548266,Cochrane Database Syst Rev,nan,nan,0.0,4.0,1/5/01,Cd004797,{J. H. LittellM. PopaB. Forsythe}
19,478292.0,Haemodynamic ischaemia in paediatric moyamoya disea%se associated with renovascular hypertension.,3.0917865410548266,Acta Neurochirurgica,nan,nan,139.0,3.0,1/1/97,257-8,{Y TakagiN HashimotoY Goto}
20,43736.0,Effect of pedaling technique on mechanical effectiveness and efficiency in cyclists.,3.0917865410548266,Medicine and science in sports and exercise,3.004357918601092,nan,39.0,6.0,1/7/06,991-5,{James C MartinIan MayhewLee M RomerThomas Korff}
21,82614.0,Lycopene metabolite apo-10'-lycopenoic acid inhibits diethylnitrosamine-initiated high fat diet-promoted hepatic inflammation and tumorigenesis in mice.,3.0917865410548266,Cancer prevention research (Philadelphia Pa.),3.004357918601092,nan,6.0,12.0,1/13/12,1304-16,{L??ynne M AusmanMartin S ObinXiang-Dong WangChun LiuBlanche C IpDonald E SmithKang-Quan Hu}
22,163526.0,A performance improvement process to tackle tachysystole,nan,nan,nan,nan,40.0,0.0,$1/11/01,512-9 ST  - A performance improvement process to tackle tachysystole-,{V. E. CN  - medline DA  - Sep-Oct DB  - MEDLINE DO  - http://dx.doi.org/10.1111/j.1552-6909.2011.01275.x DP  - Ovid Technologies von GruenigenA. M. BurkettJ. DoyleT. H. Kenny}
23,514411.0,Osteoid osteoma treated by percutaneous thermal ablation: when do we fail? A systematic review and guidelines for future reporting.,3.0917865410548266,Cardiovascular a??nd interventional radiology,3.004357918601092,nan,37.0,6.0,1/14/12,1530-9,{Luca Maria SconfienzaEzio LanzaGianpaolo CornalbaDario PorettiCatherine CytevalPierre VialaFrancesco SardanelliYann Thouvenin}
24,569841.0,Effects of chemotherapy in AIDS-associated non-Hodgkin's lymphoma on Kaposi's sarcoma herpesvirus DNA in blood.,3.0917865410548266,Journal of clinical oncology : official journal of the American Society of Clinical Oncology,3.004357918601092,nan,27.0,15.0,5/20/09,2496-502,{Ariela NoyLawrence D KaplanYanxing YuAlexandra M LevineRichard F AmbinderSusan E KrownBruce J DezubeLan LinJeannette Y LeeGary S Hayward}
25,6207.0,Serum MMPs 7-9 and their inhibitors during glucocorticoid and anti-TNF-alpha therapy in pediatric inflammatory bowel disease,nan,Scandinavian Journal of Gastroenterology,nan,nan,47.0,7.0,1/12/01,785-794,{Kaija Leena KolhoHanne RintamakiTaina TervahartialaTimo SorsaLaura Makitalo}
26,21910.0,Examining waiting placement in hospital: utilization and the lived experience.,3.0917865410548266,Global journal of health science,3.004357918601092,nan,6.0,2.0,1/14/03,22-Dec,{Donna M WilsonJessica A HewittRalph MagnusJill VihosKaren PetersonNancy Barnes}
27,378490.0,A prospective observational study of obesity body composition and insulin resistance in 18 women with bipolar disorder and 17 matched control subjects.,3.0917865410548266,The Journal of clinical psychiatry,3.004357918601092,nan,69.0,12.0,1/8/12,1892-900,{Isabella SorecaAndrea FagioliniDavid J KupferBret H GoodpasterSara B Fleet-MichaliszynAmy D OttoJohn M Jakicic}
28,971878.0,Diminished A-cell secretion in the early phase of type I diabetes mellitus,nan,Metabolism: Clinical and Experimental,nan,nan,35.0,11.0,1/1/86,1074-1077,{S. SrikantaO. P. GandaR. E. Gleason}
29,793918.0,Strong stability and host specific bacterial communi$ty in faeces of ponies.,3.0917865410548266,PL??o$S One,3.004357918601092,nan,8.0,29.591603950752624,1/13/01,e75079,{Tina M BlackmoreKirsty DougalHilary J WorganEric PinlocheGemma CurtisC Jamie NewboldNeil R McEwanSusan E GirdwoodPat A HarrisCaroline McG ArgoAlex Dugdale}
30,819166.0,Responses to open peer commentaries on the subjective brain identity and neuroethics,3.0917865410548266,America#n Journal of Bioethics,nan,nan,9.0,9.0,1/9/01,W1-W4,{G.R. Gillett}
31,880881.0,[A case of giant Brunner's gland hyperplasia combined with adenomyomatous hyperplasia].,3.0917865410548266,The Korean journal of gastroenterology = Taehan Sohwagi Hakhoe chi,3.004357918601092,nan,223.95725434515072,6.0,1/8/12,384-8,{Seung Woo ParkJae Bock ChungSang Kyum KimSi Young SongJoo Won ChungHo Keun KimJoo Hee SeoSeungmin Bang}
32,629530.0,Efficacy and safety of the low-molecular weight heparin enoxaparin compared with unfractionated heparin across the acute coronary syndrome spectrum: a meta-analysis.,3.0917865410548266,Eur. Heart J.,nan,nan,128.49823721547992,17.0,1/7/09,2077-86,{Carolyn H McCabeShaun G GoodmanFrans Van de WerfDavid A MorrowElliott M AntmanEugene BraunwaldKenneth W MahaffeyMarc CohenIan B MenownSabina A MurphyCharles Michael Gibson}
33,954388.0,Optimal Starting Age for School Attendance: FY76 Issue Analysis,nan,nan,3.1210255201718633,nan,0.0,0.0,1/1/74,138.42192032780116,{Marilou Madd@@e#n}
34,379737.0,Bone density and body composition in young women with chronic fatigue syndrome.,3.0917865410548266,Neuroprotective Agents,3.8355664073804796,nan,904.0,-1.0,5/1/00,625-7,{F GatesP Clifton-BlighG FulcherL HoskinR Hansen}
35,676042.0,Prognostic value of morning blood pressure surge in clinical events: a meta-ana$lys@@is of longitudinal studies.,3.0917865410548266,Journal of stroke and cerebrovascular diseases : the official journal of National Stroke Association,3.004357918601092,nan,24.0,2.0,1/15/02,362-9,{Yan-Xin ZhaoJun-Chao XieXue-Yuan LiuHan Yan}
36,353972.0,Child sexual abuse as a risk factor for sexual risk behaviours among socially disadvantaged adolescents in Ibadan Nigeria.,nan,Vulnerable Children and Youth Studies,nan,nan,3.0,3.0,1/8??/01@@,243-248,{B O Olley}
37,968125.0,Successful treatment of lung cancer by multimodal endobronchial interventions,3.0917865410548266,Respiration; international review of thoracic diseases,3.004357918601092,nan,88.0,2.0,1/1#4/01,144-147,{T. NakajimaI. YoshinoK. Yasufuku??S. YoshidaY. S@@akairiK. Shibuya}
38,660168.0,Fat and neurosurgery: does obesity affect outcome after intracranial surgery?,3.0917865410548266,Neurosurgery,3.004357918601092,nan,64.0,2.0,1/9/02??,316-26; discussion 326-7,{R Loch MacdonaldFarbod Asgarzadie-GadimYeon Gyoe JangDaniel J CurryRachel N YanowitchKim E SchultheissJocelyn TolentinoJ_rgen L_ders}
39,732534.0,Out of harm's way: curbing violence in the ED,3.0917865410548266,Health Facilities Management,3.004357918601092,nan,8.0,10.0,1/1/95,20-6 ??28,{K. Sandrick}
40,473026.0,The incidence of contrast-induced nephropathy in trauma patients.,3.0917865410548266,European journal of emergency medicine : official journal of the European Society for Emergency Medicine,3.004357918601092,nan,64.92127248605793,3.0,1/8/06,134-9,{Rich SinertShoma DesaiAntonia HippCarmen Lopez}
41,372175.0,Dosimetric analysis of proton pencil beam scanning radiation therapy versus dose painted intensity modulated radiation therapy for squamous cell carcinoma of the anal canal,nan,Int. J. Radiat??. Oncol. Biol. Phys.,4.560625571128496,nan,90.0,1.0,5.482969808043565,S398,{Kooy H.Hong T.S.Symonifka J.Depauw N.Wo J.Y.}
42,110072.0,Brain BDNF levels elevation induced by physical training is reduced after unilateral common carotid artery occlusion in rats.,3.0917865410548266,Journal of cerebral blood flow and metabolism : official journal of the International Society of Cerebral Blood Flow and Metabolism,3.004357918601092,nan,34.0,10.0,1/14/10,1681-7,{Jacques Van HoeckeHayat BanoujaafarChristine MarieClaude M Mossiat}
43,330553.0,Multiresistance of clinically% relevant gram-positi@@ve cocci,nan,Intensivmedizin und Notfal%lmedizin,nan,nan,203.6033080496611,7.0,1/1/97,655-663,{G. PetersK. BeckerC. Von Eiff}
44,23215.0,ColoRectal Cancer Predicted Risk Online (CRC-PRO) calculator using data from the Multi-Ethnic Cohort Study.,3.0917865410548266,Journal of the American Board of Family Medicine : JABFM,3.004357918601092,nan,27.0,1.0,1??/14/01,42-55,{Leila J??acksonBrian J WellsGregory S CooperSiran KoroukianMichael W Kattan}
45,719532.0,Methodology to estimate building energy consumption using EnergyPlus Benchmark Models,nan,Energy and Buildings,nan,nan,42.0,12.0,1/10/01,2331-2337,{R. #Luck??P. MagoN. Fumo}
46,86421.0,Evidence that serum levels of the soluble receptor for advanced glycation end products are inversely associated with pancreatic cancer risk: a prospective study.,3.0917865410548266,Cancer research,3.004357918601092,nan,71.0,10.0,5/15/11,Sep-82,{Stephanie J WeinsteinRachael Z Stolzenberg-SolomonPhilip R TaylorBarry I GraubardJarmo VirtamoDemetrius AlbanesLi Jiao}
47,433667.0,Norton Waterlow and Braden scores: a review of the literature and a comparison b#etween the scores and clinical judgement,nan,nan,nan,4.005573801793784,0.0,0.0,nan,nan,@@{NULL}
48,530323.0,Strategies for partner notification for sexually transmitted infections including HIV.,3.0917865410548266,Cochrane Database Syst. Rev.,nan,nan,10.0,-1.0,1/13/01,CD002843,{Catherine MathewsMoleen ZunzaAdel FerreiraNicola LowTaryn Young}
49,102893.0,A cohort study of the prevalence and impact of comorbid medical conditions in pediatric bipolar disorder.,3.0917865410548266,The Journal of clinical psyc@@hiatry,3.004357918601092,nan,71.0,11.0,1/#10/11,1518-25,{Roger S McIntyreAvnish TripathiJeanette M Jerrell}
50,864817.0,Are tkis still active in patients treated with tki and everolimus? Experience from 36 patients treated in france in the record 1 trial,nan,Annals of Oncology,nan,nan,21.0,0.0,1/10/01,viii2%84,{B. EscudierA. RavaudF. RollandA. BlesiusB. BeuzelinkS. OudardC. Chevreau}
51,1242501.1685315524,Use of alendronate in peri-implant defect regeneration,nan,nan,nan,nan,70.0,2.0,1/1/99,151-#@@158,{P. C. WollanS. J. MerawC. M. Reeve}
52,730822.0,Prevention of phantom pain after major lower limb amputation by epidural infusion of diamorphine clonidine and bupivacaine,3.0917865410548266,Annals of the Royal College of Surgeons of England,3.004357918601092,nan,76.0,5.0,1/1/94,324-326,{Jayatunga APDark CHJahangiri MBradley JWP}
53,659297.0,How assistive technology use by individuals with disabilities impacts their caregivers: a systematic review of the research evidence.,3.0917865410548266,American Journal Of Physical Medicine & Rehabilitation / Association Of Academic Physiatrists,3.004357918601092,nan,91.0,11.0,1/??12/$11,984-98,{James LenkerW Ben MortensonFrank DeRuyterLouise DemersJeffrey W JutaiMarcus J Fuhrer}
54,42247.0,Gender differences in personal social and environmental influences on active travel to and from school for Australian adolescents.,3.0917865410548266,Journal of science and medicine in sport / Sports Medicine Australia,3.004357918601092,nan,13.0,6.0,1/10/11,??5@@97-601,{John W ToumbourouEva LesliePeter KremerJoanne W Williams}
55,302969.0,Adolescent overscheduling: The relationship between levels of participation in scheduled activities and self-reported clinical symptomology,nan,nan,nan,nan,319.51905233997786,3.0,1/7/01,18-30,{Steven G LittleK Angeleque Akin-LittleShari Melman}
56,158672.0,Quantitative Analysis of Robustness of Dynamic Response and Signal Transfer in Insulin mediated PI3K/AKT Pathway.,3.0917865410548266,Computers & chemical engineering,3.004357918601092,nan,71.0,-1.0,4/#??14/12,715-727,{Shibin MathewIpsita Banerjee}
57,2887214.579853577,Does neuraxial anesthesia reduce intraoperative blood loss? A meta-analysis.,3.0917865410548266,Journal of clinical anesthesia,3.004357918601092,nan,18.0,6.0,1/6/09,427-35,{David N MaineGenevieve E CourpasJames F WellerJeffrey M RichmanAndrew J RowlingsonChristopher L Wu}
58,221086.0,Novel genetic linkage of rat Sp6 mutation to Amelogenesis imperfecta,nan,nan,nan,nan,7.0,0.0,1/#12/%01,34,{K. MiyoshiT. NomaT. MutoH. HagitaT. Horiguchi}
59,548616.0,Educating Emergent Bilinguals: Policies Programs and Practices for English Language Learners. Language & Literacy Series,nan,Teachers College Press,nan,nan,0.0,0.0,1/10/10,nan,{Ofelia GarciaJo Anne Kleifgen}
60,669596.0,Similar survival between uncemented and cemented fixation prostheses i@@n total knee arthropla#sty: a meta-analysis and systematic comparative analysis using registers.,3.0917865410548266,Knee surgery sports traumatology arthroscopy : official journal of the ESSKA,3.004357918601092,nan,22.0,12.0,1/14/12,Jul-91,{Junwei JiangHongchuan WangHua LouKai LiuHuiwei Zhang}
61,474288.0,Current palliative chemotherapy trials in the elderly neglect patient-centred outcome measures.,3.0917865410548266,Journal of geriatric oncology,3.004357918601092,nan,6.0,1.0,1/15/01,15-22,{Marlies L van BekkumBarbara C van MunsterMarije E HamakerCarolien H SmorenburgPeter L M Thunnissen}
62,108424.0,Outcome of gastric bypass patients.,3.0917865410548266,Obesity surgery,3.004357918601092,nan,68.23172925808572,2.0,1/2/04,261-4,{Ryan HolzwarthBasir TareenAlicia MajkrzakDarren Huber}
63,4435453.202155118,A Modified Technique for Pulmonary Valve Replacement with a Homograft,nan,J. Card. Surg.,nan,-7977,98.57507826873112,2.0,1/11/01,144-147,{S. K. ChoudharyG. S. GulatiP. SharmaS. TalwarB. AiranS. Mishra}
64,173830.0,Advances in allergic skin disease anaphylaxis and hypersensitivity reactions to foods drugs and insects,nan,Journal of Allergy and Clinical Immunology,nan,nan,116.0,1.0,1/5/01,153-163,{S. H. SichererD. Y. M. Leung}
65,852927.0,Phase II study of epirubicin oxaliplatin and docetaxel combination in metastatic gastric or gastroesophag$eal junction adenocarcinoma.,3.0917865410548266,J. Ex??p. Clin. Cancer Res.%,nan,nan,28.0,-1.0,@#@1/9/01,34,{Laura GiacintiSilvia Ileana FattorusoMaria Grazia ArenaLuigi Di LauroMassimo LopezDomenico SergiDiana Giannarelli}
66,237623.0,Neck pain.,3.0917865410548266,Clinical evidence,3.004357918601092,nan,0.0,1.0,1/8/01,nan,{Allan I Binder}
67,912884.0,A guide to physiotherapy in cerebral palsy,nan,Paediatrics and Child Health,5.470681629393083,nan,18.0,0.0,1/8/01,410-413,{C. E. Barber}
68,318931.0,Community associated methicillin-resi#stant Staphylococcus aureus in HIV-infected patients,nan,AIDS Reviews,nan,nan,12.0,3.0,1/10/01,153-163,{M. PujolP. BarragnJ.M. TiraboschiA. ImazM.. Dom_nguezD. Podzamczer}
69,93659.0,[The anxiety level of the patients who will have ultrasound-guided puncture biopsy: a survey study].,3.0917865410548266,Sheng wu yi xue gong cheng xue za zhi = Journal of biomedical engineering = Shengwu yixue gongchengxue zazhi,3.004357918601092,nan,172.3780991701091,3.0,1/%12/#06,453-5 459,{Rujun ZhengYulan PengShuzhen ZhaoHong HuangIi LiangXiaoli He}
70,349150.0,The relationship between capsulorhexis size and anterior chamber depth relation.,3.0917865410548266,Ophthalmic surgery and lasers,3.004357918601092,nan,134.86025012463972,3.0,3/1/99,185-90,{O Ceki_C Batman}
71,572010.0,A$ pilot study of rituximab in patients with recurrent classic Hodgkin$ disease.,3.0917865410548266,CANCER,nan,nan,98.0,2.0,7/15/03,310-4,{Anas YounesL Jeffrey MedeirosFrederick HagemeisterMaria Alma RodriguezSima JehaPaolo FiumaraLynne V AbruzzoJohn T ManningJorge RomagueraAndre GoyDan JonesPeter McLaughlin}
72,826030.0,A cognitive behavior intervention program in women with unexplained chest pain--a pilot study,3.0917865410548266,European journal of cardiovascular nursing : journal of the Working Group on Cardiovascular Nursing of the European Society of Cardiology,3.004357918601092,nan,11.0,2.0,1/12/01,183-9,{Cecilia Bj_rkelundMargaretha Jerlock}
73,34962.0,Assessing social i??solation in motor neurone disease: a Rasch analysis of the MND Social Withdrawal Scale.,3.0917865410548266,Journal of the neurological sciences,3.004357918601092,nan,334.0,1.0,11/15/13,112-8,{Everard W ThorntonCarolyn A YoungAlan TennantJohn EalingKevin Talbot[Collective Name] UKMND-QoL GroupChris J GibbonsPamela J Shaw}
74,574309.0,Three-year Outcomes in de Novo Liver Transplant Patients     Receiving Everolimus with Reduced Tacrolimus: Follow-Up Results from     a Randomized Multicenter Study,3.0917865410548266,Transplantation,3.004357918601092,nan,99.0,24.234964793165627,1/15/01,1455-1462,{Junge GRauer BDe Simone PFischer LDe Carlis LKaiser GMSaliba FDuvoux CMetselaar HJDong GNevens FFung JJ}
75,200077.0,Plasma cell leukemia--a case report.,3.0917865410548266,Indian Journal of Pathology and Microbiology,nan,nan,46.0,17.613563504075717,1/3/07,484-7,{T K DuttaPampa Ch ToiBhawana A BadheL H GhotekarDebdatta Basu}
76,421512.0,CABG again outshines stenting for some patients with coronary artery blockage,nan,nan,nan,nan,0.0,1.0,1/13/01,17-Aug,{M. Mitka}
77,715052.0,Health-promoting behaviors of low-income cancer survivors,nan,nan,nan,nan,143.6887438364813,3.0,1/11/01,118-124 7p,{Alexa StuifbergenMartha Gene Meraviglia}
78,719241.3281842209,Food allergy in children,nan,Archives De Pediatrie,nan,nan,13.0,10.0,1/6/01,1349-1353,{E. Bidat}
79,140274.0,Here to stay. An interview with Dr. David Satcher Director U.S. Centers for Disease Control and Prevention.,3.0917865410548266,Nepal Medical College journal : NMCJ,nan,nan,1.0,17.0,11/1/96,9-Jun,{J Stilkind}
80,282039.0,The fi%rst case of drug-induced immune hemolytic anemia due to hydrocortisone,nan,Transfusion,nan,nan,48.0,9.0,1/8/01,1925-1929,{M. MartinengoD. F. ArdenghiG. RealiG. Tripodi}
81,835177.0,KRAS mutational status assessment in patients with metastatic colorectal cancer: are the clinical implications so clear?,3.0917865410548266,Eur J Cancer Care (Engl),3.004357918601092,nan,19.0,2.0,1/10/01,167-71,{M. HebbarP. FournierO. Romano}
82,519732.0,Classifying radiographic progression status i%n early rheumatoid arthritis patients using propensity scores to adjust for baseline differences.,3.0917865410548266,S#tatistical methods in medical research,3.004357918601092,nan,16.0,1.0,1/7/02,13-29,{John T SharpWeng Kee WongGrace S ParkHarold E PaulusMyungShin OhRichard H GoldDinesh Khan#na}
83,761104.0,Infusing Tolerance Diversity and Social Personal Curriculum into Inclusive Social Studies Classes Using Family Portraits and Contextual Teaching and Learning,4.215306854415128,TEACHING Exceptional Children Plus,nan,nan,1.0,3.0,1/5/01,nan,{Milagros M. SessionsKevin J. Miller}
84,408062.0,Adherence to fesoterodine in women with overactive bladder in routine clinical practice.,3.0917865410548266,Ac@@tas urologi#cas espanolas,3.004357918601092,nan,39.0,4.0,1/15/05,222-8,{E HuguetO PortaE Mart_nezI MoraM Sim_J PubillJ A OrtegaM T Castillo}
85,889481.0,Chronic pain related to quality of sleep,3.0917865410548266,Einste??in (Sao Paulo),3.004357918601092,nan,12.0,2.0,1/14/01,159-63#,{W. HummigJ. Stechman NetoL. F. Tonial}
86,894596.0,On the role of pre and post-processing in environmental data mining,nan,Proc. iEMSs 4th Biennial Meeting - Int. Congress on Environmenta#l Modelling and Software: Integrating Sciences and Information Technology for Environmental Assessment and Decision Making iEMSs 2008,nan,9790000000000,3.0,0.0,1/8/01,1937-1958,{Miquel S_nchez-MarrGeoff HolmesJoaqu_n IzquierdoJoaquim ComasIoannis AthanasiadisKarina Gibert}
87,604985.0,Cardioactive steroid poisoning: a comparison of plant- and animal-derived compounds.,3.0917865410548266,J Med Toxicol,3.004357918601092,nan,2.0,4.0,1/6/12,152-5,{Robert S HoffmanBrian W CotterBarbara M KirraneFermin BarruetoLewis S Nelson}
88,220950.0,Forensic odontology: A prosthodontic view,nan,nan,nan,nan,4.0,1.0,1/12/01,38-41,{S. GosaviS. Gosavi}
89,770196.0,FIGO staging of gynecologic cancer. 1994-1997 FIGO Committee on Gynecologic Oncology. International Federation of Gynecology and Obstetrics,3.0917865410548266,Int J Gynaecol Obstet,3.004357918601092,nan,64.0,1.0,1/1/99,10-May,{W. T. CreasmanS. PecorelliJ. L. BenedetJ. H. Shepherd}
90,914468.0,Effect of neuromuscular$ electrical stimulation and isotonic exercises in flexor and extensor muscles of knee of hemiplegic patients,nan,Revista de Neurologia,3.004357918601092,nan,46.0,3.0,1/8/01,135-13@@8,{S. Regina-RibeiroC. TortozaR. P. S. LimaS. T. T. de FreitasP. R. LucareliM. O. LimaM. T. PachecoJ. Gomes-LucareliR. A. Lopes-Martins}
91,346326.0,Ventricular fibrillation in acute mitral valve insufficiency caused by chordae tendineae rupture: report of a surgically corrected case.,3.0917865410548266,J Cardiovasc Med (Hagerstown),3.004357918601092,nan,10.0,3.0,1/9/03,261-3,{Giovanni TeodoriMarta LeveroneEraldo OcchettaMiriam BortnikPaolo MarinoMarco Marcolongo}
92,612846.0,[Assessment of prognostic factors of thoracic synovial sarcoma].,3.0917865410548266,Pathologie non allergique et exposition aux moisissures domestiques.,nan,nan,156.66703029700628,5.512790268596932,1/10/01,Jul-93,{B H Mbatchou NgahaneG DevouassouxH BaudrandB GuibertN FreymondY PachecoA Traverse-Glehen}
93,282053.0,Secondary school tobacco policy and prevention curricula in South Carolina,3.0917865410548266,Nicotine Tob Res,3.004357918601092,nan,1.0,4.0,1/1/%99,341-6,{M. W. MartinR. SaundersS. Levin}
94,870257.0,Intimate Partner Violence Survivors' Unmet Social Service Needs,3.0917865410548266,Journal of Social Service Research,nan,nan,37.0,21.706117556734053,1/11/01,481-4$89,{Melissa E. DichterKarin V. Rh%odes}
95,417578.0,Partial fill strategies for oral oncolytics to reduce waste and drive persistency,3.0917865410548266,Am J Manag Care,3.004357918601092,nan,19.0,1.0,1/13/01,SP26-7,{A. A. Kaddis}
96,949067.0,The impact of advancing age on P-glycoprotein expression and activity: current knowledge and future directions,3.0917865410548266,Expert Opin Drug Metab Toxicol,3.004357918601092,nan,3.0,3.0,1/7/01,315-20,{A. A. Mangoni}
