ID,id,article_title,article_language,journal_title,jounral_abbreviation,journal_issn,article_jvolumn,article_jissue,article_jcreated_at,article_pagination,author_list
194,622979.0,Processed meat consumption and stomach cancer risk: a meta-analysis.,3.0917865410548266,Jour??n#al of the National Cancer Institute,3.004357918601092,nan,98.0,15.0,2/6/08,1078-87,{Nicola OrsiniSusanna C LarssonAlicja Wolk}
195,501663.0,The epidemiology of injury for an elite junior Australian Football cohort,nan,Journal of Science & Medicine in Sport,nan,14402440,15.0,3.0,1/12/01,207-212,{John PetkovSteve BaileySamuel ChalmersMichael HeynenEbonie ScaseMary E Magarey}
196,48738.0,Prebiotics immune function infection and inflammat%ion: a review of the evidence,nan,nan,nan,nan,101.0,0.0,1/9/01,633-58 ST  - Prebiotics immune function infection and inflammat??ion: a review of the evidence-,{A. R. LomaxP. C. CN  - Pubmed DA  - Mar DO  - 10.1017/s0007114508055608 DP  - NLM ET  - 2008/09/26 Calder}
197,603610.3729645482,Steroids and antihistamines synergize to inhibit rat's airway smooth muscle contractility.,3.0917865410548266,European archives of oto-rhino-laryngology : official journal of the European Federation of Oto-Rhino-Laryngological Societies (EUFOS) : affiliated with the German Society for Oto-Rhino-Laryngology - Head and Neck Surgery,3.004357918601092,nan,-1.0,-1.0,8/13/14,nan,{Shao-Cheng LiuChi-Chung WuHsing-Won WangChuan-Hsiang KaoYueng-Hsiang Chu}
198,667611.0,Reasons for and against participation in studies of medicinal therapies for women with breast cancer: a debate.,3.0917865410548266,BMC Medical Research Methodology,nan,nan,12.0,-1.0,1/12/01,25,{Marion HabersackIrmina-Anna GerlichGero Luschin}
199,565079.0,The effect of preservation solutions for storage of liver allografts on transplant outcomes: a systematic review and meta-analysis.,3.0917865410548266,Annals Of Surgery,3.004357918601092,nan,260.0,1.0,1/14/07,46-55,{John M O__CallaghanRobert D MorganPeter J MorrisSimon R Knight}
200,348006.0,Ultrasonically enhanced vancomycin activity against Staphylococcus epidermidis biofilms in vivo.,3.0917865410548266,Journal of biomaterials applications,3.004357918601092,nan,18.0,4.0,1/4/04,237-45,{R A RobisonJ L NelsonB L RoederB L BecksteadG B SchaaljeJ C CarmenW G PittC M Runyan}
201,55412.0,Cuneus and fusiform cortices thickness is reduced in trigeminal neuralgia.,3.0917865410548266,The journal of headache and pain,3.004357918601092,nan,15.0,-1.0,1/14/12,17,{Thomas Martin DoringMaud PariseGustavo TukamotoEmerson Leandro GasparettoTadeu Takao Almodovar KuboMaurice Vincent}
202,546048.0,The Impact of Read Right: Semester-Only versus Year-Long Inplementation,nan,ProQuest LLC,nan,nan,0.0,0.0,1/13/0@@1,nan,{John B. Sell}
203,3141302.101699804,Muscle - tendon unit mechanical and morphological properties and sprint performance.,3.0917865410548266,Journal of sports sciences,3.004357918601092,nan,25.0,9.0,1/7/07,1035-@@46,{Savvas StafilidisAdamantios Arampatzis}
204,971456.0,An insulin-like growth factor-I gene polymorphism modifies the risk of microalbuminuria in subjects with an abnormal glucose tolerance,nan,European Journal of Endocrinology,nan,nan,154.0,5.0,1/6/01,715-721,{H. A.$ P. PolsC. M. van DuijinS. W. J. LambertsI. RietveldA. Hofm$anJ. A. M. J. L. Janssen}
205,533193.0,Biofeedback dialysis for hypotension and hypervolemia: a systematic review and meta-analysis.,3.0917865410548266,Nephrology dialysis transplantation : official publication of the European Dialysis and Transplant Association - European Renal Association,3.004357918601092,nan,28.0,1.0,1/13/01,182-91,{Elie A AklGordon GuyattStephen D WalterRita S SuriReem A MustafaGihad E NesrallahRobert M Lindsay}
206,970436.0,Cytokine profiling of young overweight and obese female African American adults with prediabetes,3.0917865410548266,Cytokine,3.004357918601092,nan,64.0,1.0,1/13/01,310-5@@,{J. BhagatwalaW. CaldwellD. H. GuoA. MellorH. ZhuR. CaldwellR. LucasS. J. ParikhY. DongS. SridharY. Dong}
207,437969.0,Review of prasugrel for the secondary prevention of atherothrombosis.,nan,nan,nan,nan,0.0,0.0,nan,nan,{NULL}
208,464335.0,Stereotactic radiosurgery for spinal metastases: a literature review. [Review],nan,5.879400632249656,nan,nan,0.0,0.0,nan,nan,{NULL}
209,417782.0,Pancreatic surgery. A paradigm for progress in the age of the bottom line,3.0917865410548266,Arch Surg,3.004357918601092,nan,130.0,3.0,1/1/95,240-6,{A. L. Warshaw}
210,979059.0,Difference in fascicle behaviors between superficial and deep quadriceps muscles during isometric contractions.,3.0917865410548266,Muscle & nerve,3.004357918601092,nan,-1.0,1.0,10/15/09,nan,{Hiroshi AkimaKazunori NosakaAya TomitaAnthony J BlazevichTakayuki InamiRyosuke AndoKohei Watanabe}
211,661572.0,Losing life and livelihood: a systematic review and meta-analysis of unemployment and all-cause mortality.,3.0917865410548266,Social science & medicine (1982),3.004357918601092,nan,72.0,6.0,1/11/03,840-54,{David J RoelfsJoseph E SchwartzEran ShorKarina W Davidson}
212,132901.0,Evaluation of a ra%pidly $rotating shift system for tolerance of nurses to nightwork.,3.0917865410548266,International archives of occupational and environmental health,3.004357918601092,nan,65.0,5.0,1/1/94,305-11,{D Mino%rsJ WaterhouseG GhirlandaG CostaG Tarondi@@}
213,1070278.4586564722,[Osteoporosis prevention in patients with low energy hip fractures hospitalized in the orthopedic department],3.0917865410548266,Ugeskr Laeger,3.004357918601092,nan,164.0,27.0,1/2/01,Apr-41,{C. B. MogensenI. B. JacobsenL. Wiboe}
214,440401.0,American palm ethnomedicine: a meta-analysis..,nan,nan,nan,nan,0.0,0.0,nan,nan,{NULL}
215,77389.0,Symptoms tell it all: a systematic review of the value of symptom assessment to predict survival in advanced cancer patients.,3.0917865410548266,Critical reviews in oncology/hematology,3.004357918601092,nan,84.0,1.0,1/12/10,130-48,{Emile E VoestSaskia C C M TeunissenAlexander de GraeffMarija Trajkovic-Vidakovic}
216,592817.0,Isolates and antibiotic resistance of culture-proven endophthalmitis cases presented to a referral center in Tehran,nan,nan,nan,nan,64.80441043277597,4.0,1/12/01,361-3,{M. M. ParvareshM. HashemiR. SoodiS. NekoozadehS. A. AlemzadehK. G. FalavarjaniM. Modarres}
217,169270.0,Public health impact of the 1992 Los Angeles civil unrest,nan,Public health reports (Washington D.C. : 1974),3.004357918601092,nan,108.0,3.0,1/1/93,265-72,{NU%L$L}
218,288711.0,Laparoscopic reversal of Hartmann's rectosigmoidectomy,nan,Colorectal disease : the official journal of the Association of Coloproctology of Great Britain and Ireland,3.004357918601092,nan,10.0,5.178704814700002,1/8/01,81-83,{S. SlawikA.?? R. Dixon}
219,184949.0,The situation of Romanian HIV-positive adolescents: Results from the first national representative survey,nan,nan,nan,nan,22.0,0.0,1/10/01,562-569,{D. BuzduceaBuzducea Cohen Johnson Lazar Lazar Lejars Lyon Marin McDowell Mardarescu O'Leary Paxton Wood BergerF. LazarE. I. Mardare}
220,833251.0,Life stress and the long-term treatment course of recurrent depression: III. Nonsevere life events predict recurrence for medicated patients ov??er 3 years,4.803361043291142,Journal of Consulting and Clinical Psychology,nan,3.6925669535579897,74.0,1.0,1/6/01,112#-120,{E. FrankL.D. TorresD. KupferK.L. HarknessJ. GuillaumotJ.E. RobertsS.M. Monroe}
221,1987620.4056389928,Value of spiral CT in hemodynamically stable patients following blunt chest trauma.,3.0917865410548266,Computerized Medical Imaging and Graphics: The Official Journal of the Computerized Medical Imaging Society,3.004357918601092,nan,22.0,33.42596788582355,11/1/98,447-52,{R TelloK KandarpaR F MundenS HootonR Pugatch}
222,315926.0,Preventing injuries through interventions for problem drinking: a systematic review of randomized controlled trials,3.1647390188064115,nan,nan,nan,34.0,4.0,1/1/99,609-21,{I. RobertsE. HeitmanC. DiguiseppiT. Dinh-Zarr}
223,901385.0,Nutrition and obstructed labor,nan,American Journal of Clinical Nutrition,nan,nan,72.0,1.0,nan,291S-297S,{O. A. LadipoJ. C. Konje}
224,787529.0,Rationale design and methods of the HEALTHY study nutrition intervention component,3.0917865410548266,Int J Obes (Lond),3.004357918601092,nan,33.0,0.0,1/9/01,S29-36,{S. McCormickB. GillisA. VirusM. A. StatenC. MobleyS. L. VolpeJ. BridgmanL. El ghormliD. D. StadlerJ. Hartstein}
225,431348.0,Atomoxetine treatment of children and adolescents with ADHD: Clinical questions and answers. (German),nan,nan,nan,nan,0.0,0.0,nan,4.810826204359537,@@{NULL}
226,441393.0,The novel applications of the quantitative analysis of neutrophil cell surface FcgammaRI (CD64) to the diagnosis of infectious and inflammatory diseases.,nan,nan,nan,nan,0.0,0.0,nan,nan,{NULL}
227,481882.0,Inhibition of cisplatin-induced lipid catabolism and weight loss by ghrelin in male mice.,3.0917865410548266,Endocrinology,3.004357918601092,nan,471.57169745431725,9.0,1/13/09,3118-29,{Thomas SchererJose M GarciaVictor PapushaJi-an ChenMark AsnicarJoanna Sm#iechowskaBobby GuilloryChristoph$ BuettnerRoy G SmithAnriada Nassif}
228,572425.0,Primary cutaneous large B-cell lymphoma of the legs: a distinct clinical pathologic entity treated with CD20 monoclonal antibody (rituximab).,3.0917865410548266,American Journal of Clinical Oncology-Cancer Clinical Trials,nan,nan,24.0,3.0,1/1/06,2$37??-40,{D M Aboulafia}
229,1979944.4431923328,Improving Implementation of Classroom Instruction through Teacher-Directed Behavioral Consultation: A Single-Case Demonstration,nan,International Journal of Behavioral Consultation and Therapy,nan,nan,2.0,3.0,1/6/01,432-438,{Marcie W. HandlerJames K. LuiselliJennifer A. Mautone}
230,455406.0,Green tea in dermatology. [Review],nan,3.555387623201737,nan,nan,0.0,0.0,nan,5.316898506144547,{NULL}
231,696362.0,Teaching Calculus and Other Challenging Courses to Nontraditional and At-Risk Students at a Research University.,nan,McNeill Mathematics Program,nan,87567555,54.0,4.0,1/6/01,291-@@2@@97,{C. G. Mendez}
232,504206.0,Tropical infection after a case of total hip arthroplasty.,3.0917865410548266,The Journal of hospital infection,3.004357918601092,nan,87.0,3.0,1/14/07,179-81,{E SennevilleH MelliezV LoviC JosephM DouaudM PradierT BoyerA MeybeckL Fortin-Lebraud}
233,4712516.747854289,Chronic pelvic pain.,3.0917865410548266,Best pract??ice & research. Clinic@@al gastroenterology,3.004357918601092,nan,23.0,4.0,1/9/01,593-610,{Andrew Paul Baranowski}
234,235689.0,Obstetrical anal sphincter laceration and anal incontinence 5-10 years after childbirth,3.0917865410548266,Am J Obstet Gynecol,3.004357918601092,nan,207.0,5.0,1/12/01,425.e1-6,{K. C. McDermottJ. L. BlomquistV. L. HandaE. C. Evers}
235,659896.0,Comparative effectiveness of instructional design features in simulation-based education: systematic review and meta-analysis.,3.0917865410548266,Medical teacher,3.004357918601092,nan,35.0,1.0,1/13/01,e@@867-98,{Benjamin ZendejasStanley J HamstraRose HatalaDavid A CookAmy T WangJason H SzostekPatricia J ErwinRyan Brydges}
236,418015.5853742412,B%ody# mass index and outcome of ASC-H-interpreted cervical smears in postmenopausal women.,3.0917865410548266,Acta cytologica,3.004357918601092,nan,56.0,3.0,1/12/01,259-65,{Jae Jun LeeSang Yong SongSoomin AhnYoung Lyun OhJi-Youn SungChang Ohk SungYoo-Young Lee}
237,326944.0,Plasma concentration of asymmetric dimethylarginine and the risk of coronary heart disease: rationale and design of the multicenter CARDIAC study.,3.0917865410548266,Atherosclerosis. Supplements,3.004357918601092,nan,16.174115744518847,4.0,1/3/12,29-32,{Andreas M_ggeChristoph HanefeldRainer H B_ger[Collective Name] CARDIAC study investigators}
238,922795.0,[Toxicology and clinical significance of base-catalized degradation of sevoflurane to Compound A].,3.0917865410548266,Schlafst_rungen bei kritisch kranken patienten,nan,nan,45.0,-1.0,2/1/96,S10-3,{R M JonesP Conzen}
239,768486.0,Functionality and feedback: a protocol for a realist synthesis of the collation interpretation and utilisation of PROMs data to improve patient care,3.0917865410548266,BMJ Open,nan,nan,4.0,7.0,1/14/01,e005601,{C. MillsS. DalkinJ. GreenhalghC. WoodL. WoodJ. WrightE. GibbonsN. BlackJ. M. ValderasR. PawsonD. Meads}
240,428363.0,Case report. Cutaneous cryptococcosis in a patient with systemic erythematous lupus.,3.0917865410548266,Myc$oses,3.004357918601092,nan,44.0,9.0,1/1/11,419-21,{L RamosS Mathur_nA MateoC L_pezC G_mez}
241,519287.0,A method for determining skeletal lengths from DXA images.,3.0917865410548266,BMC Mus@@culoskelet D??isord,3.004357918601092,nan,8.0,-1.0,1/7/01,113,{Glen M BlakeTim D SpectorIgnac FogelmanUsha Chinappen-Horsley}
242,638918.0,Imaging for target@@ volume delineation in rectal cancer radiotherapy--a systematic review.,3.0917865410548266,Clinical Oncology (Royal College of Radiologists),nan,nan,93.6147683848985,1.0,1/12/02,52-63,{R WebsterE SpeziS MukherjeeR AdamsS GwynneJ StaffurthB Coles}
243,111336.0,The influence of smoking and impaired glucose homoeostasis on the outcome in patients presenting with an acute coronary syndrome: a cross-sectional study.,3.0917865410548266,BMJ Open,nan,nan,4.0,32.030331250818165,1/14/01,e005077,{Anders HallingHkan OdebergHenrik ForssellJacob OdebergMarie-Louise PerssonLennart RstamIvar VaaraUlf LindbladMichael Freitag}
244,747279.0,Systematic review exploring the effect of exercise in pulmonary rehabilitation on depression levels in patients with chronic obstructive pulmonary disease,nan,Physiotherapy,3.004357918601092,nan,97.0,0.0,nan,eS502-eS503,{Patil S.Horobin H.}
245,674696.0,Environmental and genomic factors as well as interventions influencing smoking cessation: a systematic review of reviews and a proposed working model.,3.0917865410548266,Pu$blic health genomic#s,3.004357918601092,nan,16.0,4.0,1/13/01,159-73,{A BrandJ Van der HeydenS de VironH Van OyenN Malats}
246,258108.0,Impact of seasonality on recruitment retention adherence and outcomes in a web-based smoking cessation intervention: randomized controlled trial,nan,nan,nan,nan,78.49519708752428,0.0,1/13/01,e249-,{Mushro ANiaura R SGraham A LCobb N KFang YCha S}
247,59308.0,White matter diffusivity predicts memory in patients with sub??jective and mild cognitive impairment# and normal CSF total tau levels.,3.0917865410548266,Journal of the International Neuropsychological Society : JINS,3.004357918601092,nan,16.0,1.0,1/10/01,58-69,{Ramune GrambaiteAnders M FjellTormod FladbyKristine B WalhovdVidar StensetIvar Reinvang}
248,610641.0,Comparison between open and closed suction systems: a systematic review.,3.0917865410548266,Revista Brasileira de terapia intensiva,3.004357918601092,nan,20.0,4.0,1/8/12,331-338,{Luiz Rogrio de Carvalho OliveiraNilza Aparecida Almei$da de CarvalhoFlvio C L Cavalcanti Ara_joIzabela Menezes PagottoPaulo Chiavone}
249,631704.0,Association between interleukin-10 promoter polymorphisms and endometriosis: a meta-analysis.,3.0917865410548266,Gene,3.004357918601092,nan,515.0,1.0,2/15/13,49-55,{Qiong ChenWei FanQianhong MaZhongying HuangZhun XiaoShangwei Li}
250,846537.0,Overactive bladder: Optimizing quality of care,nan,Am. J. Managed Care,nan,nan,23.28826885473585,2.0,nan,S46-S61,{Lemack G.E.}
251,973076.0,Thyroid-related autoantibodies and celiac disease: a role for a gluten-free diet?,nan,Journal of Clinical Gastroenterology,nan,nan,186.5900415948346,16.169416198511858,1/2/09,245-8,{E. MainardiG. MoscatoA. MontanelliM. DottiR. Nano}
252,931402.0,Providing access to specialty care for severely disabled institutional residents: an academic health center telemedicine model,nan,Journal of Health Care for the Poor & Underserved,nan,nan,20.0,2.0,@@1/9/01,415-422 8p,{A. K. MarceeS. P. RoatenJ. B. MorrowK. J. KowalskeL. E. SnellL. L. Goetz}
253,908690.0,A robust method for diagnosis of morphological arrhythmias based on Hermitian model of higher-order statistics,3.0917865410548266,Biomedical engineering online,3.004357918601092,nan,10.0,0.0,1/11/01,22,{Address CorrespondenceS. KarimifardAddresses Authorahmadian@sina.tums.ac.ir Tehran Medical PhysicsTehran Medical PhysicsDepartment of Biomedical Systems S. KarimifardTums Tehran Iran Email University of Medical SciencesA. AhmadianTums Tehran Iran University of Medical SciencesSystems Department of Biomedical}
254,417373.0,Shared decision making and the future of managed care,nan,Disease Management and Clinical Outcomes,nan,nan,1.0,1.0,1/1/97,15-16,{J. E. Wennberg}
255,759329.0,Specific plasma factors blocking human maternal cell-mediated immune reaction to placental antigens.,3.0917865410548266,Nature: New biology,3.004357918601092,nan,242.0,0.0,3/28/73,110-1,{V YoutananukornP Mantangk??asombut}
256,1809965.1818471253,MicroRNAs: a new piece in the paediatric cardiovascular disease puzzle.,3.0917865410548266,Cardiology in the young,3.004357918601092,nan,23.0,5.0,1/13/10,642-55,{Dalia ElimamKeith A WebsterAhmed OmranFei YinLina A Shehadeh}
257,695010.0,Association of Ureaplasma urealyticum colonization with development of bronchopulmonary dysplasia: a systemic review and meta-analysis.,3.0917865410548266,Journal of Huazhong University of Science and Technology. Medical Sciences,3.004357918601092,nan,34.0,2.0,1/14/04,265-9,{Jia-rui PuDan LiDe-hua YangLi-duan ZhengXiao-dan ZhengHong MeiXuan XiangQiang-song Tong}
258,191908.0,Mortality at older ages and moves in residential and sheltered housing: evidence from the UK,nan,Journal of Epidemiology and Community Health,nan,nan,68.0,18.692083521749662,1/14/01,524-529,{J. FalkinghamM. EvandrouA. VlachantoniJ. Robards}
259,384767.0,A multinational study of thromboprophylaxis practice in critically ill children.,3.0917865410548266,Critical care medicine,3.004357918601092,nan,42.0,5.0,1/14/05,1232-40,{Sarah H O'BrienMarisa TucciAntonio Rodriguez NunezPhilip C SpinellaLi QinEdward Vincent S FaustinoAdrienne G RandolphEdward TruemperSimon LiKimberly MarohnSheila Hanson??Michael Yung[Collective Name] PROphylaxis against ThRombosis prACTice (PROTRACT) Study Investigators of the PALISI BloodNet}
260,855912.0,Asymmetric inheritance of mitochondrial content in aging budding yeast cells,nan,Molecular Biology of the Cell. Conference: Annual Meeting of the American Society for Cell Biology ASCB,nan,nan,115.32614634165155,24.0,1/12/@@01,nan,{E. A. MartinL. F. CostaH. LiY.% ZhangM. P. VianaS. M. RafelskiW$. F. Marshall}
261,710727.0,Physical activity moderates time-of-day differences in older adults' working memory performance.,nan,Experimental Aging Research,nan,nan,32.0,4.0,1/6/10,431-446 16p,{DeLosh ELBugg JMClegg BA}
262,2968164.8937312057,Uses of the electrical skin resistance method in the study of patients with neck and upper extremity pain,3.0917865410548266,Johns Hopkins Medical Journal,nan,nan,137.0,2.0,1/1/75,69-74,{C.P. Richte#rL.H. Riley Jr.}
263,625016.0,[New aspects in hernia surgery].,3.0917865410548266,Urologe A,nan,nan,44.0,7.0,1/5/07,774-9??,{P E GoretzkiB J LammersT Otto}
264,275675.0,An exploration of self-reported negative affect by adolescents as a reason for smoking: implications for tobacco prevention and intervention programs,3.0917865410548266,Prev Med,3.004357918601092,nan,41.0,2.0,1/5/01,589-96,{J. RobinsonD. W. SmithB. ColwellS. L. StevensC. McMillan}
265,967376.0,Diagnosis of peripheral lung cancer with three echoic features via endobronchial ultrasound,nan,Chest,nan,nan,132.0,3.0,1/7/01,922-9,{H. C.# ChenS. M. LinC. L@@. ChouC. T. YuH. P. KuoC. H. Kuo}
266,640230.0,A meta-analysis of labor supply effects of interventions for major depressive disorder.,3.0917865410548266,Psychiatric Services.,5.539815235503461,nan,57.0,2.0,1/6/02,212-8,{Justin W TimbieMarcela Horvitz-LennonSharon-Lise T Nor??mandRichard G Frank}
267,625663.0,Combined pharmacotherapy and psychological treatment for depression: a systematic review.,3.0917865410548266,Archives of General Psychiatry,3.004357918601092,nan,61.0,7.0,1/4/07,714-9,{Paola BolliniGiuseppe TibaldiBruce KupelnickCarmine MunizzaSandro Pampallona}
268,480649.0,Dyspareunia and sexual dysfunction following vaginal delivery in thai primiparous women with second degree perineal tear: A prospective cohort study,nan,$Journal of Sexual Medi@@cine,nan,5.93639080852283,12.0,0.0,1/15/01,192.84117547733342,{A. UngkanungdechaC. ChayachindaJ. VeeragulJ. Jisabai}
269,3582969.0189234377,eComment. EuroSCORE II - corrected in-hospital mortality rate in a modern cohort of patients undergoing cardiac surgery,3.0917865410548266,Interactive $Cardiovascular & Thoracic Surgery,3.004357918601092,nan,19.0,5.0,1/14/01,733,{D. G. Nezic}
270,692358.0,The effect of a cervical lateral glide on the upper limb neurodynamic test: a blinded placebo-controlled investigation,nan,The Chartered Society of Physiotherapy Annual Congress and Exhibition: Defining Practice Friday October 17 to Sunday October 19 2003 International Convention Centre Birmingham.,nan,4.691745412942367,0.0,0.0,1/3/01,10-Oct,{A GreenJ LewisC WorsfoldJ Saranga}
271,836847.0,Thoracic Aortic Aneurysm: Reading the Enemy's Playbook,nan,Curr. ??Probl. Cardiol.,nan,-32698.47974702889,33.0,5.0,nan,203-277,{Elefteriades J.A.}
272,867207.0,Early predicting of blood component quality by Statistical Process Control,nan,Vox Sanguinis,nan,nan,99.0,0.0,1/10/01,227,{H. JungkW. MadlaV. SchottstedtT. Alt}
273,253149.0,Lifetime ris$k of suicide in affective disorders,5.197320681349744,The British Journal of Psychiatry,5.188910370241085,nan,173.0,0.0,1/1/98,185-185,{A. S. LeeS. DaviesP. C. Naik}
274,929971.0,A geographic analysis of chronically homeless adults before and after enrollment in a multi-site supported housing initiative: community characteristics and migration,nan,American Journal of Community Psychology,nan,nan,48.0,3.0,1/11/01,341-51,{R. A. RosenheckJ. TsaiA. S. Mares}
275,470385.0,Fetal cleft lip and palate detection by three-dimensional ultrasonography,nan,Ultrasound Obstet. Gynecol.,nan,-8906,16.0,4.0,nan,314-320,{Lee W.Kirk J.S.Shaheen K.W.Romero R.Hodges A.N.Comstock C.H.}
276,731703.0,Substance Abuse and Trauma in Incarcerated Women,nan,nan,nan,nan,0.0,0.0,1/11/01,nan,{NCT01413984 }
277,113399.0,Use of Job Design to Reduce Mechanical Stress on the Back,nan,nan,3.1679587575510357,nan,0.0,0.0,1/1/89,323-326,{D. W. Bad$ger}
278,4016910.6655479595,Rehabilitation of swallowing by exercise in tube-fed patients with pharyngeal dysphagia secondary to abnormal UES opening.,3.0917865410548266,Annual Abstr%act Supplement,nan,nan,122.0,5.0,1/2/05,1314-21,{Mark KernKaren DikemanBarbara GrandeMarta KazandjianTerilynn NitschkeStephanie DanielsBenson MasseyReza ShakerCaryn Easterling}
279,653325.0,A meta-analysis of two genome-wide association studies identifies 3 new loci for alcohol dependence.,3.0917865410548266,Journal of psyc$h$iatric research,3.004357918601092,nan,45.0,11.0,1/11/11,1419-25,{Min ZengYue PanQunyuan ZhangKe-Sheng WangNagesh AragamXuefeng Liu}
280,893573.0,Crowdsourced Multimedia Enhanced Spatio-temporal Constraint Based on-Demand Social Network for Group Mobility,nan,Proceedings of the 23rd ACM international c%@@onference on Multimedia,nan,nan,0.0,0.0,1/15/01,761-762,{Ahmad QamarMuhammad ShahidMd. Abdur RahmanAhmed LbathAkhlaq AhmadFaizan Ur RehmanAbdullah MuradBilal Sadiq}
281,56272.0,Impaired default network functional connectivity in autosomal dominant Alzheimer disease.,3.0917865410548266,Neurology,3.004357918601092,nan,81.0,8.0,8/20/13,736-44,{Virginia D BucklesAndrew J SaykinEric McDadeStephen P SallowayAaron P SchultzPeter R SchofieldRandall BatemanAdam M BrickmanNick C FoxJohn C MorrisJohn M RingmanChristopher C RowePaul ThompsonClifford JackBeau M AncesAllison M GoateRobert A KoeppeStephen CorreiaJasmeer P ChhatwalCaroline A SullivanAnne M FaganRichard MayeuxDaniel S MarcusTammie L S BenzingerKeith JohnsonReisa A SperlingChengjie Xiong}
282,737786.0,Cranial reconstruction of major traumatic defects in children with osteoinductive and resorbable materials,nan,International Journal of Oral and Maxillofacial Surgery,nan,nan,40.0,0.0,1/11/01,1024-1025,{R. R. M. BosE. W. HovingM. Wagemakers}
283,680306.0,Meta-analysis of the effects of sometribove zinc suspension on the production and health of lactating dairy cows.,3.0917865410548266,Journal of the American Veterinary Medical Association,3.004357918601092,nan,245.0,5.0,1/14/09,550-64,{William W ThatcherNormand R St-PierreDale E BaumanJoseph S HoganK Larry SmithRobert J CollierGeorge A MillikenJan K Shearer}
284,53877.0,Journal of Health Communication : International Perspectives The Effect of an Internet-Based  Stage- Matched Message Intervention on Young Taiwanese Women ' s Physical Activity,nan,nan,nan,nan,0.0,0.0,1/1$4/01,37-41 DO  - 10.1080/10810730902805788,{Sheu-jen HuangMaiga ChangWen-#chi HungJanie Chang}
285,504928.0,Azathioprine for multiple sclerosis,4.727128229140603,nan,3.0690797688349623,nan,0.0,4.0,1/7/01,nan,{Ilaria CasettaGerardo IulianoGraziella Filippini}
286,198650.0,Wound care,nan,nan,3.3294731959926143,nan,7.0,0.0,1/1/92,27-32 ST  - Wound care-,{NULL}
287,3845817.2362421937,Comparison between incidental malignant and benign breast lesions detected by computed tomography: a systematic review.,3.0917865410548266,Journal of medical imaging and radiation oncology,3.004357918601092,nan,57.0,5.0,1/13/10,529-33@@,{Jasmin AbbasCholpan JasaabuuAndreas Gunter BachAlexey SurovDominik SchrammAndreas Wienke}
288,981412.0,Plant Kunitz proteinase inhibitor attenuates inflammation oxidative stress and remodeling induced by elastase in mice,nan,European Respiratory Jour$nal,nan,nan,44.0,0.0,1/14/01,4.9174951142722385,{N. M. PinheiroR. Almeida-ReisL. OlivaM. A. MartinsM. L. V. OlivaO. A. Theodoro-JuniorE. A. LeickI. F. L. C. TibrioC. M. PradoR. F. RighettiB. T. M. Oliveira}
289,785472.0,Streptococcus pneumoniae carriage in the Gaza strip,3.0917865410548266,PLoS One,3.004357918601092,nan,7.0,4.0,1/12/01,e3??506@@1,{G. RahavG. Regev-YochayI. AbullaishA. ElhamdanyR. MalleyM. RazA. GoralY. RoytmanB. ShainbergM. VaronA. Ziv}
